[
  {
    "Post_ID": "MEM-370-13",
    "Posting_Author": "",
    "Congress_Number": null,
    "State_District": "",
    "Location": "",
    "Job_Function": "Press Secretary - Senior Republican",
    "Title_Parsed": "Press Secretary - Senior Republican",
    "Office_Type": "Senior Republican",
    "Responsibilities": [
      "drafting/distributing press releases;",
      "writing weekly newsletters, Op-Eds;",
      "maintaining and updating website content;",
      "preparation of talking points and speeches;",
      "establishing and maintaining strong relations with district and DC media;"
    ],
    "Qualifications": [
      "politically astute",
      "quick-thinking",
      "self-starter",
      "writing skills",
      "new media skills"
    ],
    "Salary_Min": null,
    "Salary_Max": null,
    "Skills_Mentioned": [
      "video, audio and/or photography",
      "video editing",
      "audio editing",
      "social media"
    ],
    "Equal_Opportunity_Information": "",
    "Cleaned_Text": "",
    "DW_NOMINATE": null,
    "LES": null
  },
  {
    "Post_ID": "MEM-356-13",
    "Posting_Author": "unknown",
    "Congress_Number": null,
    "State_District": "Michigan05",
    "Location": "Washington, DC office",
    "Job_Function": "Scheduler/Office Administrator",
    "Title_Parsed": "Scheduler/Office Administrator",
    "Office_Type": "Member",
    "Responsibilities": [
      "structuring and managing the Member's daily schedule",
      "coordinating the Member's travel and logistical details of meetings",
      "handling the Member's personal correspondence",
      "fulfilling various administrative duties including prepare/process office payments, and ethics/disclosure compliance",
      "working closely with other staff members in the district and in DC to facilitate meetings",
      "ensuring smooth overall office operations"
    ],
    "Qualifications": [
      "superior organizational skills",
      "strong oral and written communication skills",
      "strong interpersonal skills",
      "ability to multi-task and thrive in a fast paced environment",
      "poise, patience and a good sense of humor",
      "discrete, politically savvy, self-motivated, and very organized",
      "strategic thinker who can navigate competing demands"
    ],
    "Salary_Min": null,
    "Salary_Max": null,
    "Skills_Mentioned": [
      "organizational skills",
      "oral communication skills",
      "written communication skills",
      "interpersonal skills",
      "multi-tasking",
      "poise, patience and good humor"
    ],
    "Equal_Opportunity_Information": null,
    "Cleaned_Text": "",
    "DW_NOMINATE": null,
    "LES": null
  },
  {
    "Post_ID": "MEM-349-13",
    "Posting_Author": "Florida Leadership House Democrat",
    "Congress_Number": null,
    "State_District": "null",
    "Location": "null",
    "Job_Function": "Communications Director",
    "Title_Parsed": "Communications Director",
    "Office_Type": "=null",
    "Responsibilities": [
      "null",
      "Null"
    ],
    "Qualifications": [
      "strong political instincts"
    ],
    "Salary_Min": null,
    "Salary_Max": null,
    "Skills_Mentioned": [
      "Hill experience",
      "Spanish literacy"
    ],
    "Equal_Opportunity_Information": "Equal opportunity employer",
    "Cleaned_Text": "MEM-349-13 Florida Leadership House Democrat seeks highly motivated and experienced Communications Director to handle press, speech-writing and communications and messaging strategy. Candidates must have excellent writing skills, on-therecord press experience, strong political instincts, and new media experience. Candidates must thrive in a fast-moving, aggressive communications environment; be team-oriented, nimble, creative and strategic; and have a positive, can-do attitude. The Communications Director also develops working relationships with print, electronic and social media press as well as communications teams in other congressional offices and the Executive Branch to coordinate and execute the Member's overall communication efforts. This position provides an opportunity to work for a highly engaged, energetic Member of Congress who has a successful record of improving the lives of women, children, seniors and fighting for the middle-class. Equal opportunity employer. Salary commensurate with experience. Hill experience and Spanish literacy is a positive. Please send resume to DCResumes@mail.house.gov. No emails, phone calls or drop-bys please.",
    "DW_NOMINATE": null,
    "LES": null
  }
]