[
  {
    "Post_ID": "MEM-378-13",
    "Posting_Author": "Moderate Texas Democrat",
    "Congress_Number": null,
    "State_District": "Texas",
    "Location": "A legislative office with a proactive group of staffers",
    "Job_Function": "Legislative Assistant",
    "Title_Parsed": "Legislative Assistant",
    "Office_Type": "Member’s office",
    "Responsibilities": [
      "a quickly learning district priorities",
      "preparing research / analysis for votes",
      "tracking legislation",
      "providing guidance on issues to the communications director and legislative correspondents"
    ],
    "Qualifications": [
      "easy-going",
      "self-starter who will be",
      "fun, relaxed addition",
      "very driven to take initiative",
      "willingness to keep learning on the job"
    ],
    "Salary_Min": null,
    "Salary_Max": null,
    "Skills_Mentioned": [
      "teamwork",
      "initiative",
      "learning"
    ],
    "Equal_Opportunity_Information": "We are an Equal Opportunity Employer.",
    "Cleaned_Text": "Moderate Texas Democrat seeks a Legislative Assistant to handle healthcare, social security, Medicare, education, and other issues. Our office is fast-paced with a proactive group of staffer who place a premium on cooperation and teamwork. A successful candidate is an easy-going, self-starter who will be responsible for quickly learning district priorities, preparing research / analysis for votes, tracking legislation, providing guidance on issues to the communications director and legislative correspondents, and other duties as assigned. We’re looking for a fun, relaxed addition to the team who is very driven to take initiative and also has a willingness to keep learning on the job. Unfortunately, this is not an entry level position. Please submit a cover letter, resume, and writing sample (e.g., one page memo or similar) to TXResume@mail.house.gov. No calls or drop-ins, please.",
    "DW_NOMINATE": null,
    "LES": null
  },
  {
    "Post_ID": "MEM-376-13",
    "Posting_Author": "Dem member seeks press secretary for DC office, Hill",
    "Congress_Number": null,
    "State_District": null,
    "Location": "Hill",
    "Job_Function": "Press secretary -- Dem member seeks press secretary for DC office, Hill",
    "Title_Parsed": "",
    "Office_Type": null,
    "Responsibilities": [],
    "Qualifications": [],
    "Salary_Min": null,
    "Salary_Max": null,
    "Skills_Mentioned": [],
    "Equal_Opportunity_Information": "",
    "Cleaned_Text": "",
    "DW_NOMINATE": null,
    "LES": null
  },
  {
    "Post_ID": "MEM-375-13",
    "Posting_Author": "Congressman Aaron Schock (IL-18)",
    "Congress_Number": null,
    "State_District": "IL-18",
    "Location": null,
    "Job_Function": "Communications Director",
    "Title_Parsed": "Communications Director",
    "Office_Type": null,
    "Responsibilities": [
      "working with the Congressman to help craft talking points, speeches and op-eds; writing press releases and e-newsletters; booking and pitching media outlets nationally and in district; and maintaining and updating the Member’s website"
    ],
    "Qualifications": [
      "demonstrated creative writing and speech writing skills",
      "innovative and proactive in growing district and national media opportunities for the Congressman",
      "ability to work with diverse media outlets",
      "write well under a deadline",
      "experience working in communications"
    ],
    "Salary_Min": null,
    "Salary_Max": null,
    "Skills_Mentioned": [
      "creative writing",
      "speech writing",
      "innovative and proactive in growing district and national media opportunities for the Congressman",
      "ability to work with diverse media outlets",
      "write well under a deadline",
      "experience working in communications"
    ],
    "Equal_Opportunity_Information": null,
    "Cleaned_Text": "Congressman Aaron Schock (IL-18) seeks an experienced Communications Director to manage a fast-paced press operation. Strong speech writing skills are a must as duties include: working with the Congressman to help craft talking points, speeches and op-eds; writing press releases and e-newsletters; booking and pitching media outlets nationally and in district; and maintaining and updating the Member’s website. The ideal candidate has demonstrated creative writing and speech writing skills. In addition, the job requires one to be innovative and proactive in growing district and national media opportunities for the Congressman. Must have the ability to work with diverse media outlets, write well under a deadline, and have experience working in communications. Qualified applicants should send resume and writing sample to IL18resumes@gmail.com.",
    "DW_NOMINATE": null,
    "LES": null
  },
  {
    "Post_ID": "MEM-374-13",
    "Posting_Author": null,
    "Congress_Number": null,
    "State_District": null,
    "Location": "Washington, DC office",
    "Job_Function": null,
    "Title_Parsed": "Legislative Assistant",
    "Office_Type": null,
    "Responsibilities": [
      "prepare and staff the Member for committee hearings and markups",
      "monitor legislative developments within Committees and on the House floor"
    ],
    "Qualifications": [
      "superior organizational skills",
      "strong written and oral communication skills",
      "strong interpersonal skills",
      "poise, patience, and a sense of humor",
      "prior experience in economic development and community/urban planning (strongly preferred)"
    ],
    "Salary_Min": null,
    "Salary_Max": null,
    "Skills_Mentioned": [
      "economic development",
      "community/urban planning"
    ],
    "Equal_Opportunity_Information": null,
    "Cleaned_Text": "Freshman Democratic Member seeks an organized, energetic and savvy Legislative Assistant...",
    "DW_NOMINATE": null,
    "LES": null
  },
  {
    "Post_ID": "MEM-373-13",
    "Posting_Author": "Ohio Republican House Member",
    "Congress_Number": null,
    "State_District": "null",
    "Location": "n/a",
    "Job_Function": "staff",
    "Title_Parsed": null,
    "Office_Type": "House Member",
    "Responsibilities": [
      "managing all new media platforms (Facebook, Twitter, You Tube and Instagram)",
      "updating the web site",
      "writing press releases and columns",
      "creating videos and graphics",
      "taking photos",
      "running telephone town halls"
    ],
    "Qualifications": null,
    "Salary_Min": null,
    "Salary_Max": null,
    "Skills_Mentioned": [
      "new media",
      "HTML",
      "Final Cut Pro",
      "Movie Maker",
      "Photoshop"
    ],
    "Equal_Opportunity_Information": "null",
    "Cleaned_Text": "Ohio Republican House Member seeking press assistant to join staff. Applicants should be self-starting, hard-working and creative. Must have strong writing and verbal skills and be extremely detail oriented. Job responsibilities include:\nmanaging all new media platforms (Facebook, Twitter, You Tube and Instagram),\nupdating the web site,\nwriting press releases and columns,\ncreating videos and graphics,\n taking photos\n\nand running telephone town hallsonline.",
    "DW_NOMINATE": null,
    "LES": null
  },
  {
    "Post_ID": "MEM-370-13",
    "Posting_Author": null,
    "Congress_Number": null,
    "State_District": null,
    "Location": null,
    "Job_Function": "Press Secretary",
    "Title_Parsed": "Senior Republican",
    "Office_Type": "press secretary",
    "Responsibilities": [
      "drafting/distributing press releases",
      "writing weekly newsletters, OpEds",
      "maintaining and updating website content",
      "preparation of talking points and speeches",
      "establishing and maintaining strong relations with district and DC media, executing an aggressive earned local media campaign."
    ],
    "Qualifications": [
      "self-starter",
      "politically astute",
      "quick-thinking",
      "new media skills including knowledge of video, audio and/or photography and editing in those mediums and social media"
    ],
    "Salary_Min": null,
    "Salary_Max": null,
    "Skills_Mentioned": [
      "video",
      "audio",
      "photography",
      "editing",
      "social media"
    ],
    "Equal_Opportunity_Information": "",
    "Cleaned_Text": "Press Secretary - Senior Republican seeking press secretary with superior writing skills who is energetic, creative, strategic, and quick-thinking. The successful candidate is a self-starter who is politically astute and can quickly master a range of issues in time-sensitive situations. Responsibilities include, but limited to: drafting/distributing press releases; writing weekly newsletters, OpEds; maintaining and updating website content; preparation of talking points and speeches; establishing and maintaining strong relations with district and DC media and executing an aggressive earned local media campaign. New media skills are a must, including knowledge of video, audio and/or photography and editing in those mediums as well as social media. No phone calls. Email resumes to PA.Resumes@mail.house.gov.",
    "DW_NOMINATE": null,
    "LES": null
  },
  {
    "Post_ID": "MEM-361-13",
    "Posting_Author": "Rep. Jerry McNerney",
    "Congress_Number": null,
    "State_District": "California (District)",
    "Location": "California",
    "Job_Function": "Communications Director",
    "Title_Parsed": "Communications Director",
    "Office_Type": "Member and Committee Vacancy",
    "Responsibilities": [
      "serving as chief spokesperson",
      "successfully pitching stories and press events to both national and local media entities",
      "responding promptly to media inquiries",
      "effectively messaging policy and other priorities",
      "maintaining an aggressive new media profile",
      "preparing the member for live interviews",
      "writing press releases",
      "producing op-eds, speeches, talking points, and franked mail"
    ],
    "Qualifications": [
      "political communications experience",
      "good writing sample",
      "desire to work collaboratively with a team in a fast-paced environment",
      "non-traditional hours and travel to the District"
    ],
    "Salary_Min": null,
    "Salary_Max": null,
    "Skills_Mentioned": [
      "aggressive new media profile",
      "writing press releases",
      "speaking in TV interviews",
      "desire to work collaboratively with a team in a fast-paced environment"
    ],
    "Equal_Opportunity_Information": null,
    "Cleaned_Text": "MEM-361-13\n\nCOMMUNICATIONS DIRECTOR - California Democrat (Rep. Jerry\nMcNerney) seeks experienced communications director to develop and execute\naggressive long-term media and outreach plan.\nResponsibilities include serving as chief spokesperson, successfully pitching\nstories and press events to both national and local media entities, responding\npromptly to media inquiries, effectively messaging policy and other priorities,\nmaintaining an aggressive new media profile, preparing the member for live\ninterviews, writing press releases, and producing op-eds, speeches, talking points,\nand franked mail.\nExcellent written and oral communication skills, strong editing and proofreading\nergabilities, and the desire to work collaboratively with a team in a fast-paced environmental requiered.\nCandidate must work closely with the Member and staff. Ideal candidate would be politically astute and have a good sense of humor.\nDesired qualities include political communications experience and the ability to respond to challenging situations quickly and strategically. This position requires non-traditional hours and travel to the District.\nCalifornia (District) ties and Capitol Hill experience are a plus. Qualified\napplicants should submit a cover letter, resume and two writing samples to: \nMcNerney.Resumes@mail.house.gov No calls or drop bys, please.",
    "DW_NOMINATE": null,
    "LES": null
  },
  {
    "Post_ID": "MEM-349-13",
    "Posting_Author": "Florida Leadership House Democrat",
    "Congress_Number": null,
    "State_District": "null",
    "Location": "null",
    "Job_Function": "Communications Director",
    "Title_Parsed": "Communications Director",
    "Office_Type": "Member of Congress",
    "Responsibilities": [
      "handle press",
      "speech-writing and communications",
      "and messaging strategy",
      "develops working relationships with print, electronic and social media press"
    ],
    "Qualifications": [
      "excellent writing skills",
      "on-the-record press experience",
      "strong political instincts",
      "new media experience",
      "team-oriented",
      "nimble",
      "creative",
      "strategic",
      "positive can-do attitude"
    ],
    "Salary_Min": null,
    "Salary_Max": null,
    "Skills_Mentioned": [
      "Hill experience",
      "Spanish literacy"
    ],
    "Equal_Opportunity_Information": "equal opportunity employer",
    "Cleaned_Text": "Florida Leadership House Democrat seeks highly motivated and experienced Communications Director to handle press, speech-writing and communications and messaging strategy. Candidates must have excellent writing skills, on-the-record press experience, strong political instincts, and new media experience.",
    "DW_NOMINATE": null,
    "LES": null
  }
]