[
  {
    "Post_ID": "MEM-499-24",
    "Posting_Author": "Congresswoman Sydney Kamlager-Dove (CA-37)",
    "Congress_Number": null,
    "State_District": "CA-37",
    "Location": "Washington, D.C.",
    "Job_Function": "null",
    "Title_Parsed": "null",
    "Office_Type": "null",
    "Responsibilities": [
      "Assist the Communications Director and Press Assistant in drafting social media content and other materials like press releases, website content, and newsletters",
      "Create graphic design posts for social media",
      "Compile daily press clips",
      "Edit video clips",
      "Maintain press lists",
      "Answer phones and assist in correspondence as needed.",
      "Intern Expectations: Candidates should have an interest in the legislative process and civic service; possess excellent writing, research, organization, time management, and communication skills; work well in a team environment; and have a general understanding of the US political system."
    ],
    "Qualifications": [
      "an interest in the legislative process",
      "civic service",
      "excellent writing, research, organization, time management, and communication skills",
      "work well in a team environment",
      "a general understanding of the US political system"
    ],
    "Salary_Min": null,
    "Salary_Max": null,
    "Skills_Mentioned": [
      "social media content",
      "press releases",
      "website content",
      "newsletters",
      "graphic design",
      "video editing",
      "time management",
      "communication skills",
      "teamwork"
    ],
    "Equal_Opportunity_Information": null,
    "Cleaned_Text": "MEM-499-24\nThe O\nc\ngresswoman Sydney Kamlager-Dove (CA-37) is seeking interns for our\nWashington, D.C. o\nc\ng for the Spring 2025 term.\nOur o\nc\ng values open communication, hard work, and creating a collegial environment.\nWe are looking for interns with a can-do attitude who are eager to grow. Interns will have\ngreat opportunities to learn from o\nc\ng sta\ng and network with others to make the most of their time with our o\nc\ng!\nIntern Expectations:\nCandidates should have an interest in the legislative process and civic service; possess\nexcellent writing, research, organization, time management, and communication skills;\nwork well in a team environment; and have a general understanding of the US political\nsystem.\nPress interns can expect to:\n·\nAssist the Communications Director and Press Assistant in drafting social media\ncontent and other materials like press releases, website content, and newsletters\n·\nCreate graphic design posts for social media\n·\nCompile daily press clips\n·\nEdit video clips\n·\nMaintain press lists\n·\nAnswer phones and assist in correspondence as needed.\nIn our DC o\nc\ng, you can apply to be EITHER a Legislative OR Press intern. In our Los An―\nAngeles o\nc\ng, you will be a general o\nc\ngene intern.\nInternship Dates and Details:\nSpring internships are slated to start early January and go until late April/early May, with\nsome Ωlexibility. Interns are expected to work in person in the o=ice, Monday-Friday 9 a.m.–5 p.m. Unfortunately, we cannot accommodate remote or hybrid internships at this time.\nDeadline: Applications must be submitted by 6 p.m. ET on Friday, December 13th\nTo apply: Interested applicants should send their resume, a brief cover letter, a writing sample, and a digital sample (in one document) to:\nCA37.internships@mail.house.gov for DC o\nc\ng internship.\nUse the subject line “First name Last name [press] – Spring 2025 internship”",
    "DW_NOMINATE": -0.5479999780654907,
    "LES": 0.4336842596530914
  },
  {
    "Post_ID": "MEM-496-24",
    "Posting_Author": "Congressman French Hill (AR02)",
    "Congress_Number": null,
    "State_District": "AR02",
    "Location": "Washington, D.C., Arkansas",
    "Job_Function": "Legislative research and writing assistant",
    "Title_Parsed": null,
    "Office_Type": "Congress Member's Office",
    "Responsibilities": [
      "interacting with Arkansans and other visitors",
      "conducting legislative research and writing",
      "drafting communications materials",
      "assisting Arkansans with matters before the federal government"
    ],
    "Qualifications": [
      "working knowledge of current events and policy topics",
      "positive attitude",
      "strong work ethic",
      "excellent written and oral communication skills"
    ],
    "Salary_Min": null,
    "Salary_Max": null,
    "Skills_Mentioned": [
      "social media and other communications experience"
    ],
    "Equal_Opportunity_Information": "Interns from all backgrounds are welcome to apply.",
    "Cleaned_Text": "Congressman French Hill (AR02) seeks interns to serve in his offices in Washington, D.C., and Arkansas.",
    "DW_NOMINATE": null,
    "LES": null
  },
  {
    "Post_ID": "MEM-491-24",
    "Posting_Author": "Committee on House Administration Republican O&ice",
    "Congress_Number": null,
    "State_District": null,
    "Location": "Washington D.C.",
    "Job_Function": "Government and public policy",
    "Title_Parsed": null,
    "Office_Type": "Internship program",
    "Responsibilities": [
      "Administrative tasks",
      "Legislative support"
    ],
    "Qualifications": [
      "Research",
      "Drafting public statements",
      "Performing administrative tasks"
    ],
    "Salary_Min": null,
    "Salary_Max": null,
    "Skills_Mentioned": [
      "Knowledge of government and public policy",
      "Time management skills",
      "Organizational skills"
    ],
    "Equal_Opportunity_Information": "The Committee on House Administration is an Equal Opportunity Employer",
    "Cleaned_Text": "MEM-491-24\n\nThe Committee on House Administration Republican O&ice seeks energetic and selfmotivated individuals with an interest in government and public policy, to apply for its paid, full-time internship program.\n\nThe Committee on House Administration maintains jurisdiction of federal election policy and manages the day-to-day operations of the House\nOf Representatives with oversight of several o&ices within the Capitol Complex, including\nthe Chief Administrative O&icer, Architect of the Capitol, Clerk of the House, House Inspector General, Sergeant at Arms, U.S. Capitol Police, and other legislative branch entities like the Library of Congress, Government Publishing O&ice, and the Smithsonian Institution.\n\nWorking closely with Committee sta&, interns will have the opportunity to gain\nfirst-hand knowledge of the inner-workings of a congressional committee and learn about\nthe day-to-day administrative operations of the House Of Representatives. Interns are\nresponsible for assisting Committee sta& with o&icial proceedings (hearings/markups), oversight, research, assisting with phones, and providing support to all Committee sta&.\n\nResponsibilities:\nInterns are responsible for both administrative and legislative duties. Administrative tasks\ninclude answering phones, greeting visitors, sorting mail, entering data, and drafting\ncorrespondence. Legislative support includes performing research, drafting public\nstatements, prepping materials for hearings, attending hearings and brieﬁngs, reaching out\nto agencies and other congressional o&ices, and a host of various special projects.\n\nPlease send a resume, cover letter, and availability to CHAInternGOP@mail.house.gov.",
    "DW_NOMINATE": null,
    "LES": null
  },
  {
    "Post_ID": "MEM-489-24",
    "Posting_Author": "The Democratic Sta& of the House Energy and Commerce Committee",
    "Congress_Number": null,
    "State_District": null,
    "Location": null,
    "Job_Function": "Press Intern",
    "Title_Parsed": "Press Intern",
    "Office_Type": "Committee",
    "Responsibilities": [
      "Compiling daily press clips",
      "Designing graphics",
      "Editing and captioning videos",
      "Drafting news releases, social media and e-newsletter content",
      "Updating the website",
      "Compiling weekly reports on press and social media results",
      "Taking photos at hearings and events"
    ],
    "Qualifications": [
      "strong writing and social media skills",
      "graphic design experience",
      "a desire to create engaging communications content",
      "Knowledge of video editing software"
    ],
    "Salary_Min": null,
    "Salary_Max": null,
    "Skills_Mentioned": [
      "video editing software"
    ],
    "Equal_Opportunity_Information": "all applicants will be considered without regard to race, color, national origin, religion, sex (including marital or parental status), sexual orientation, gender identity, disability, or age",
    "Cleaned_Text": "null",
    "DW_NOMINATE": null,
    "LES": null
  },
  {
    "Post_ID": "MEM-487-24",
    "Posting_Author": "The House Democratic Caucus",
    "Congress_Number": null,
    "State_District": null,
    "Location": "Washington, DC office",
    "Job_Function": null,
    "Title_Parsed": null,
    "Office_Type": null,
    "Responsibilities": [
      "Drafting press releases and other written materials.",
      "Maintaining press lists.",
      "Assisting with press events and other Caucus events and meetings.",
      "Drafting digital copy for the Caucus official social media channels",
      "Collaborating on creative graphic and video content",
      "Assisting with press conferences and other Caucus events and meetings"
    ],
    "Qualifications": [
      "Detail-oriented",
      "Work efficiently under pressure",
      "Manage multiple projects at one time"
    ],
    "Salary_Min": null,
    "Salary_Max": 2400,
    "Skills_Mentioned": [
      "Livestreaming software",
      "Fluency in Spanish"
    ],
    "Equal_Opportunity_Information": "The House Democratic Caucus is an equal opportunity employer...",
    "Cleaned_Text": "",
    "DW_NOMINATE": null,
    "LES": null
  },
  {
    "Post_ID": "MEM-483-24",
    "Posting_Author": "Pat Fallon",
    "Congress_Number": null,
    "State_District": null,
    "Location": null,
    "Job_Function": null,
    "Title_Parsed": "Intern",
    "Office_Type": "Congressional office",
    "Responsibilities": [
      "answer phones",
      "run errands",
      "research legislation",
      "attend hearings and briefings",
      "answer constituent letters"
    ],
    "Qualifications": [
      "legislative process knowledge",
      "(various) functions of a congressional office"
    ],
    "Salary_Min": null,
    "Salary_Max": null,
    "Skills_Mentioned": null,
    "Equal_Opportunity_Information": "The office is an equal opportunity employer.",
    "Cleaned_Text": "MEM-483-24\nThe Washington DC O&ice of Congressman Pat Fallon is looking for spring 2025 interns.\nIn the Washington, DC o&ice, internships run throughout the fall, spring, or summer semesters for college students. The hours are flexible to accommodate students' hectic course schedules, but generally run 9:00 a.m. to 6:00 p.m. when Congress is in session, and 9:00 a.m. to 5:00 p.m. when not in session.\nIn Washington, DC, interns’ responsibilities will vary. They will be asked to answer phones,\nrun errands,\nresearch legislation for the Member and legislative sta&,\ntend hearings and\nbriefings,\nand answer constituent letters on various issues before the House. As a result,\ninterns learn about the legislative process and the many other functions of a congressional o&ice.\nTo apply, please visit the \\\"Internships\\\" page on Congressman Fallon’s website and\ncomplete the application: https://fallon.house.gov/services/internships.htm",
    "DW_NOMINATE": null,
    "LES": null
  },
  {
    "Post_ID": "MEM-482-24",
    "Posting_Author": "Congresswoman Doris Matsui",
    "Congress_Number": null,
    "State_District": "7th Congressional District of California",
    "Location": "Washington, D.C. office",
    "Job_Function": "Press and Digital Intern",
    "Title_Parsed": null,
    "Office_Type": null,
    "Responsibilities": [
      "help build out the Congresswoman’s digital and social media presence",
      "creating engaging social media content and graphics",
      "answering phones and data entry",
      "researching legislation for the Member and legislative sta&"
    ],
    "Qualifications": [
      "strong writing, editing, and social media skills",
      "basic familiarity with graphic design/video editing software",
      "experience in a press or digital media role (including internships)"
    ],
    "Salary_Min": null,
    "Salary_Max": null,
    "Skills_Mentioned": [
      "graphic design",
      "video editing"
    ],
    "Equal_Opportunity_Information": "This o&ice is an equal opportunity employer and does not discriminate based on race, religion, disability, age, ethnicity, national origin, sex, gender, LGBTQ identiﬁcation, family status, or military status.",
    "Cleaned_Text": "",
    "DW_NOMINATE": null,
    "LES": null
  },
  {
    "Post_ID": "MEM-481-24",
    "Posting_Author": "Congressman Je‖ Van Drew (NJ-02)",
    "Congress_Number": null,
    "State_District": null,
    "Location": "NJ 02",
    "Job_Function": "Internship",
    "Title_Parsed": "Part and full-time interns for the spring internship session",
    "Office_Type": "Legislative Office",
    "Responsibilities": [
      "greeting visitors",
      "answering phones",
      "leading tours of the U.S. Capitol",
      "opening and sorting mail",
      "attending briefings",
      "performing legislative research"
    ],
    "Qualifications": null,
    "Salary_Min": 400,
    "Salary_Max": null,
    "Skills_Mentioned": null,
    "Equal_Opportunity_Information": null,
    "Cleaned_Text": "MEM-481-24\nThe office of Congressman Je‖ Van Drew (NJ-02) is currently accepting applications for part and full-time interns for the spring internship session. The start date would be as early as January 7th (|flexible depending on availability) with a /luxible end date. Each intern will receive up to a $1,000 stipend depending on availability based on a 40-hour workweek.\nThe internship will offer students and young professionals invaluable experience with our nation’s legislative process. Interns contribute to the daily operations of the office and are expected to act in a reliable, professional manner at all times. Duties include (but are not limited to): greeting visitors, answering phones, leading tours of the U.S. Capitol, opening and sorting mail, attending brieings, performing legislative research, and various other tasks to assist sta‖.",
    "DW_NOMINATE": null,
    "LES": null
  },
  {
    "Post_ID": "MEM-477-24",
    "Posting_Author": "Congresswoman Susie Lee",
    "Congress_Number": null,
    "State_District": "Nevada",
    "Location": "Washington, D.C.",
    "Job_Function": "none specified",
    "Title_Parsed": "Spring 2025 DC Internship",
    "Office_Type": "",
    "Responsibilities": [],
    "Qualifications": [],
    "Salary_Min": null,
    "Salary_Max": null,
    "Skills_Mentioned": [],
    "Equal_Opportunity_Information": "",
    "Cleaned_Text": "",
    "DW_NOMINATE": null,
    "LES": null
  },
  {
    "Post_ID": "MEM-472-24",
    "Posting_Author": "Michelle Steel",
    "Congress_Number": null,
    "State_District": "California's 45th district",
    "Location": "Washington, D.C. office",
    "Job_Function": null,
    "Title_Parsed": "Internship",
    "Office_Type": "Congresswoman’s o&ice",
    "Responsibilities": [
      "corresponding with constituents",
      "performing research",
      "giving tours of the Capitol building",
      "attending Congressional hearings"
    ],
    "Qualifications": [
      "strong attention to detail",
      "communications skills",
      "strong interest in learning about the legislative process"
    ],
    "Salary_Min": null,
    "Salary_Max": null,
    "Skills_Mentioned": null,
    "Equal_Opportunity_Information": "Andrew.Weinstock@mail.house.gov",
    "Cleaned_Text": "Winter/spring internships...serve the constituents of California’s 45th district.",
    "DW_NOMINATE": null,
    "LES": null
  },
  {
    "Post_ID": "MEM-466-24",
    "Posting_Author": "Congressman Cory Mills’ (FL-07)",
    "Congress_Number": null,
    "State_District": "(FL-07)",
    "Location": "Washington, D.C. o&ice",
    "Job_Function": null,
    "Title_Parsed": "Spring Internship post",
    "Office_Type": "Congressional o&ice",
    "Responsibilities": [
      "leading Capitol tours",
      "answering phones",
      "greeting constituents",
      "assisting staɦ with legislative projects",
      "attending brieɴings and hearings"
    ],
    "Qualifications": [
      "strong organizational, communication, and writing skills",
      "ability to manage multiple tasks",
      "work well under pressure in a team environment"
    ],
    "Salary_Min": null,
    "Salary_Max": null,
    "Skills_Mentioned": null,
    "Equal_Opportunity_Information": "This is an Equal Opportunity/Disability Employer of Choice",
    "Cleaned_Text": "Spring Internship post Congressman Cory Mills’ (FL-07) Washington, D.C. o&ice is currently seeking qualiﬁed individuals to serve in his Washington, D.C. o&ice for the Spring of 2024. Interns will observe the inner workings of a Congressional office, while gaining ﬁrsthand knowledge of the legislative process. Responsibilities include leading Capitol tours, answering phones, greeting constituents, assisting staɧ with legislative projects and attending brieﬁngs and hearings. Ideal candidates possess strong organizational, communication, and writing skills, as well as the ability to manage multiple tasks and work well under pressure in a team environment. A positive attitude and interest in politics is a must. This is a paid internship. Please send resumes and cover letter to Milka.jurado2@mail.house.gov",
    "DW_NOMINATE": null,
    "LES": null
  },
  {
    "Post_ID": "MEM-464-24",
    "Posting_Author": "Representative Seth Magaziner (RI-02)",
    "Congress_Number": null,
    "State_District": "RI-02",
    "Location": "Warwick, Rhode Island",
    "Job_Function": null,
    "Title_Parsed": null,
    "Office_Type": null,
    "Responsibilities": [
      "Provides a welcoming environment and positive ﬁrst impression of the Member o&ice to constituents, visitors, and other VIPs;",
      "Answers incoming calls with poise, professionalism, and promptness;"
    ],
    "Qualifications": [],
    "Salary_Min": null,
    "Salary_Max": null,
    "Skills_Mentioned": [],
    "Equal_Opportunity_Information": "The office is an equal opportunity employer; we do not discriminate on the basis of race, color, religion, sex, national origin, age, disability, gender identity or expression, or sexual orientation.",
    "Cleaned_Text": "MEM-464-24\nRepresentative Seth Magaziner (RI-02) seeks part-time, paid Spring 2025 interns for his Warwick, Rhode Island o&ice, to start at the beginning of January.\n•\n\nDuties include, but are not limited to:\nProvides a welcoming environment and positive ﬁrst impression of the Member o&ice to constituents, visitors, and other VIPs;\nAnswers incoming calls with poise, professionalism, and promptness;;\n\n\\n\\\n\\n\\\n.sorts and distributes mail;\nAssists Member and key sta&(e.g. sta& assistant, scheduler, District Director) with logistical and administrative duties;\nReceives and logs input from constituents on policy matters for the Member o&ice’s consideration and response;\nConducts research, and drafts correspondence and memoranda;\nAssists with planning and execution of Member’s public outreach at local events;\nAccompanies district sta& to public forums, meetings, and events as a representative to the Member.\n\nApplicants should apply on our website https://magaziner.house.gov/services/internships\n\nConsistent with applicable law, the O&ice requires all interns to be fully vaccinated against COVID-19 as a term and condition of employment.\n\nFemale,¼ minoritÈ, and LGBTQ+¼ candidates are strongly encouraged to apply. The o&ice is an equal opportunity employer; we do not discriminate on the basis of race, color, religion, sex, national origin, age, disability, gender identity or expression, or sexual orientation.\n\n\n--\n\n---",
    "DW_NOMINATE": null,
    "LES": null
  }
]