[
  {
    "Post_ID": "MEM-073-25",
    "Posting_Author": "The Office of Congresswoman Janelle Bynum",
    "Congress_Number": null,
    "State_District": "OR-05",
    "Location": null,
    "Job_Function": null,
    "Title_Parsed": "Intern to join our DC team.",
    "Office_Type": "Paid position",
    "Responsibilities": [
      "Provide a welcoming environment and positive first impression of the Member office..."
    ],
    "Qualifications": [],
    "Salary_Min": 0,
    "Salary_Max": 40,
    "Skills_Mentioned": null,
    "Equal_Opportunity_Information": null,
    "Cleaned_Text": "The Office of Congresswoman Janelle Bynum is seeking an energetic Intern to join our DC team...",
    "DW_NOMINATE": null,
    "LES": null
  },
  {
    "Post_ID": "MEM-070-25",
    "Posting_Author": "Congresswoman Sydney Kamlager-Dove",
    "Congress_Number": null,
    "State_District": "CA-37",
    "Location": "Washington, D.C. office",
    "Job_Function": "Congressional Interns",
    "Title_Parsed": null,
    "Office_Type": null,
    "Responsibilities": [
      "Answer phones and assist in correspondence with constituents",
      "Greet constituents and office visitors",
      "Process tour requests and lead Capitol tours",
      "Handle mail",
      "Perform legislative research and draft memos",
      "Assist the Communications Director and Press Assistant in drafting social media content and other materials like press releases, website content, and newsletters",
      "Compile daily press clips",
      "Edit video clips",
      "Work on other administrative tasks as directed"
    ],
    "Qualifications": [
      "Interest in the legislative process and civic service",
      "Excellent writing, research, organization, time management, and communication skills",
      "Ability to work well in a team environment'",
      "General understanding of the US political system"
    ],
    "Salary_Min": null,
    "Salary_Max": null,
    "Skills_Mentioned": [
      "Legislative process",
      "Civic service",
      "Writing",
      "Research",
      "Organization",
      "Time management",
      "Communication"
    ],
    "Equal_Opportunity_Information": "Congresswoman Sydney Kamlager-Dove's office is an Equal Opportunity Employer.",
    "Cleaned_Text": "The Office of Congresswoman Sydney Kamlager-Dove (CA-37) is seeking Congressional interns for our Washington, D.C. office for the Summer 2025 term.\nOur office values open communication, hard work, and creating a collegial environment.\nWe are looking for interns with a can-do attitude who are eager to grow. Interns will have great opportunities to learn from office staff and network with others to make the most of their time with our office!\nIntern Expectations\nCandidates should have an interest in the legislative process and civic service; possess excellent writing, research, organization, time management, and communication skills;\nwork well in a team environment; and have a general understanding of the US political system.\nInternship Responsibilities\nInterns can expect to:\n• Answer phones and assist in correspondence with constituents\n• Greet constituents and office visitors\n• Process tour requests and lead Capitol tours\n• Handle mail\n• Perform legislative research and draft memos\n• Assist the Communications Director and Press Assistant in drafting social media content and other materials like press releases, website content, and newsletters\n• Compile daily press clips\n• Edit video clips\n• Work on other administrative tasks as directed\nInternship Dates and Details:\nSummer internships are slated to start mid-May 2025 and go until the end of August 2025,\nwith some flexibility based on academic schedule. Interns are expected to work in person\nin the office, Monday-Friday 9 a.m.- 5 p.m. Unfortunately, we cannot accommodate remote or hybrid internships.\nDeadline: Applications must be submitted by 11:59 p.m. ET on Sunday, March 16, 2025.\nTo apply: Interested applicants should send their resume and a brief cover letter detailing weekly available hours IN ONE COMBINED DOCUMENT to:\n• CA37.internships@mail.house.gov for DC office internship.\n• You MUST follow these instructions:\nto\nUse the subject line and title your document “First name Last name [legislative] OR [press] – Summer 2025 internship\"\nPlease reach out our Intern Coordinator, Maite McPherson, with any questions at\nMaite.McPherson@mail.house.gov.",
    "DW_NOMINATE": -0.5479999780654907,
    "LES": 0.4336842596530914
  },
  {
    "Post_ID": "MEM-069-25",
    "Posting_Author": "The Office of Congresswoman Grace Meng (NY-06)",
    "Congress_Number": null,
    "State_District": "NY-06",
    "Location": "Washington D.C.",
    "Job_Function": null,
    "Title_Parsed": null,
    "Office_Type": null,
    "Responsibilities": null,
    "Qualifications": null,
    "Salary_Min": null,
    "Salary_Max": null,
    "Skills_Mentioned": null,
    "Equal_Opportunity_Information": "The Office of Congresswoman Grace Meng (NY-06) is an Equal Opportunity Employer",
    "Cleaned_Text": "MEM-069-25\nThe Office of Congresswoman Grace Meng (NY-06) seeks candidates for paid Summer 2025 internship positions in the Washington D.C. office.\nIntern responsibilities will vary and are designed to give interns insight into the legislative process and a well-rounded experience on Capitol Hill. Some duties include answering phones, running errands, giving Capitol tours, researching legislation for the Member and legislative staff, attending hearings and briefings, and answering constituent letters on various issues before the House.\nThis internship will run from May/June to August. Hours are flexible to accommodate students course schedules, but generally run from Monday to Friday, 9:00am to 5:00pm.\nApplications for the Summer semester will be considered on a rolling basis. Priority will be given to applicants who apply before March 15th. Interested applicants should email a resume, cover letter, writing sample, and their availability\nto ny06_intern_app@mail.house.gov. Please include your name and the semester for which you are applying in the subject line.",
    "DW_NOMINATE": null,
    "LES": null
  },
  {
    "Post_ID": "MEM-068-25",
    "Posting_Author": "The Office of Representative Donald Norcross (NJ-01)",
    "Congress_Number": null,
    "State_District": "NJ-01",
    "Location": null,
    "Job_Function": "Legislative Staff Assistant",
    "Title_Parsed": null,
    "Office_Type": "Representative office",
    "Responsibilities": [
      "Assisting staff with legislative and administrative tasks"
    ],
    "Qualifications": [
      "Strong written and oral communication skills; Organized, detail-oriented, professional"
    ],
    "Salary_Min": null,
    "Salary_Max": null,
    "Skills_Mentioned": [
      "Policy research",
      "Legislative relations",
      "Communication"
    ],
    "Equal_Opportunity_Information": null,
    "Cleaned_Text": "Intern responsibilities will include but are not limited to assisting staff with legislative,administrative,constituent relations,scheduling,and communications activities.Interns will answer phones;sort,distribute,and respond to constituent mail;attend hearings and briefings;assist with legislative research;compile daily clips;and participate in professional development activities.Suitable candidates are organized, detail-oriented, and professional. Strong written and oral communication skills are crucial.",
    "DW_NOMINATE": null,
    "LES": null
  },
  {
    "Post_ID": "MEM-066-25",
    "Posting_Author": "The Office of Representative Chrissy Houlahan",
    "Congress_Number": null,
    "State_District": "PA-06",
    "Location": "West Chester, Reading, and Washington, D.C.",
    "Job_Function": "Legislative Internship",
    "Title_Parsed": null,
    "Office_Type": "Representative Office",
    "Responsibilities": [
      "helping constituents",
      "doing research and drafting memos for our legislative staff",
      "staffing the Congresswoman in hearings or meetings"
    ],
    "Qualifications": [
      "prior volunteer experience",
      "leadership experience",
      "work experience",
      "ties to PA-06"
    ],
    "Salary_Min": null,
    "Salary_Max": null,
    "Skills_Mentioned": [],
    "Equal_Opportunity_Information": "We do not discriminate based on race, religion, disability, age, ethnicity, national origin, sex, gender, LGBTQ identification, family status, or military status.",
    "Cleaned_Text": "MEM-066-25 LEGISLATIVE INTERNSHIP: The Office of Representative Chrissy Houlahan (D-PA-06) is accepting applications for Summer 2025 legislative interns in our West Chester, Reading, and Washington, D.C. offices... Ideal applicants are self-starters who bring a customer service mindset and a passion for community service...",
    "DW_NOMINATE": null,
    "LES": null
  },
  {
    "Post_ID": "MEM-061-25",
    "Posting_Author": "Congressman Salud Carbajal",
    "Congress_Number": null,
    "State_District": "CA-24",
    "Location": "Washington, D.C.",
    "Job_Function": "Digital Intern",
    "Title_Parsed": "Digital Intern",
    "Office_Type": "full-time",
    "Responsibilities": [
      "Compiling daily press clips",
      "Creating engaging graphics and editing photos",
      "Assisting the Digital/Creative Assistant with social media content",
      "Clipping, editing, and captioning videos",
      "Assisting with press releases, op-eds, advisories, and other written materials",
      "Creating and maintaining press lists",
      "Compiling regular comms reports on press and social media results"
    ],
    "Qualifications": [
      "strong writing and editing skills",
      "basic familiarity with graphic design/video editing software"
    ],
    "Salary_Min": null,
    "Salary_Max": null,
    "Skills_Mentioned": [
      "Canva",
      "Photoshop"
    ],
    "Equal_Opportunity_Information": "We encourage candidates from diverse backgrounds to apply.",
    "Cleaned_Text": "The Office of Congressman Salud Carbajal (CA-24) is seeking a highly motivated and creative Digital Intern to assist with a fast-paced communications operation based in his Washington, D.C. office for the Spring 2025 term.",
    "DW_NOMINATE": -0.3230000138282776,
    "LES": 0.5027244687080383
  },
  {
    "Post_ID": "MEM-059-25",
    "Posting_Author": "Office of Representative Joseph D. Morelle",
    "Congress_Number": null,
    "State_District": null,
    "Location": "Washington, D.C.",
    "Job_Function": "Internship Opportunity",
    "Title_Parsed": "Summer 2025 DC Internship Position",
    "Office_Type": "Office of the Representative",
    "Responsibilities": [
      "Greeting guests and assisting with front office operations;",
      "Answering phones, recording constituent opinions, and correctly processing inquiries;",
      "Conducting Capitol tours for constituents and other guests;"
    ],
    "Qualifications": [
      "Excellent written and verbal communications skill.",
      "A strong attention to detail.",
      "The ability to succeed in a fast-paced work environment.",
      "A good sense of humor."
    ],
    "Salary_Min": null,
    "Salary_Max": null,
    "Skills_Mentioned": [
      "Legislative process",
      "Congressional communications"
    ],
    "Equal_Opportunity_Information": "The office is an equal opportunity employer and does not discriminate on the basis of race,color,religion,sex,sexual orientation,gender identity and expression,disability,military status,age,marital status,or parental status.",
    "Cleaned_Text": "MEM-059-25\n\nInternship Opportunity: Office of the Representative Joseph D. Morelle\nThe Washington, D.C.\nOffice of Representative Joe Morelle is now accepting applications\nfor an internship during the 2025 Summer term. Applicants must be based in Washington,\nD.C.\nfor the duration of the summer internship (mid-May to mid-August, subject to change).\nFull-time paid internships run Monday through Friday from 9: 12:00 p.m.\nwhen\nCongress is in session, and 9: 13:00 p.m.\nwhen not in session (refer to the\nHouse Calendar). Part-time internships are scheduled to accommodate students'' course\nschedules, as well as the needs of the office. Part-time interns can expect to receive either\na stipend or academic credit. Interns must be legally eligible to work for the U.S.\nfederal government.\nIn Washington, D.C., interns will be responsible for: Greeting guests and assisting with front office operations; Answering phones, recording constituent opinions, and correctly processing\ninquiries; Conducting Capitol tours for constituents and other guests;ﻯ {\nDay-to-day office work to assist with the functioning of the congressional office and}\nother duties as delegated by members of the staff\nSupporting the Legislative Correspondent with sorting mail and drafting constituent\nletters; Attending hearings and briefings, as requested by senior staff;\nu\nResearching legislation for the Member and legislative team; \nInteracting with members of staff in the D.C. office and virtually with the Rochester\noffice;\nOther administrative tasks as assigned.\nThroughout the semester, interns will learn about the operations of a congressional office,\ncongressional communications, and the legislative process. Ideal candidates should\npossess excellent written and verbal communications skills, a strong attention to detail,\nthel ability to succeed in a fast-paced work environment, and a good sense of humor.\nNew York State ties are preferred but not required.\nInterested applicants should submit the following within the application form listed\nbelow: Resume\nCover letter\nWriting sample (ex. policy memo, short essay, etc.). (max. 2 pages)\nThe office is an equal opportunity employer and does not discriminate on the basis of race,\ncolor, religion, sex, sexual orientation, gender identity and expression, disability,\nmilitary status, age, marital status, or parental status.\nInternships are intended for current\nundergraduate students, current graduate students, and recent college graduates.\nFor more information on the Washington D.C. internship, please visit our website: https://morelle.house.gov/congressional-internships\nTo apply for the Summer 2025 DC Internship, please fill out the google form found here: https://forms.gle/vPks4HTwadRtpDDF6.\nOur office will be accepting applications on a rolling basis until March 15th at 11:59pm EST.\nApplicants are encouraged to submit their application early.",
    "DW_NOMINATE": null,
    "LES": null
  },
  {
    "Post_ID": "MEM-058-25",
    "Posting_Author": "Democratic Staff of the House Energy and Commerce Committee",
    "Congress_Number": null,
    "State_District": null,
    "Location": "",
    "Job_Function": "Legislative Intern",
    "Title_Parsed": "Legislative Intern",
    "Office_Type": " Congressional committee’s role in the legislative process.",
    "Responsibilities": [],
    "Qualifications": [
      "qualified",
      "undergrad students"
    ],
    "Salary_Min": null,
    "Salary_Max": null,
    "Skills_Mentioned": [
      "organizational skills",
      "communication skills"
    ],
    "Equal_Opportunity_Information": "All applicants will be considered without regard to race, color, national origin, religion, sex (including marital or parental status), sexual orientation, gender identity, disability, or age. Women, minority, and veteran candidates are highly encouraged to apply.",
    "Cleaned_Text": "",
    "DW_NOMINATE": null,
    "LES": null
  },
  {
    "Post_ID": "MEM-057-25",
    "Posting_Author": "Democrats staff of House Committee on Ways and Means",
    "Congress_Number": null,
    "State_District": "",
    "Location": null,
    "Job_Function": "Digital Fellow",
    "Title_Parsed": null,
    "Office_Type": "staff",
    "Responsibilities": [
      "Pitch timely, punchy social media content",
      "Produce high-quality graphics and videos in conjunction with the team",
      "Assist the team with managing press lists and website"
    ],
    "Qualifications": [
      "Prior experience in digital communications, including graphic design and video editing"
    ],
    "Salary_Min": null,
    "Salary_Max": null,
    "Skills_Mentioned": [],
    "Equal_Opportunity_Information": "We are an equal opportunity employer and do not discriminate on the basis of race, sex, color, age, religion, national origin, sexual orientation, gender identity, or disability.",
    "Cleaned_Text": "MEM-057-25\nThe Democratic staff of the House Committee on Ways and Means seek a paid Digital Fellow to join a fast-paced, committed team for Summer 2025. The Digital Fellow must have video editing experience, enjoy advancing the Committee’s priorities, and holding Republicans accountable. Scheduling is flexible for candidates with academic commitments.\nEssential Job Functions:\n• Pitch timely, punchy social media content\n• Produce high-quality graphics and videos in conjunction with the team\n• Assist the team with managing press lists and website\nMinimum Qualifications:\n• Prior experience in digital communications, including graphic design and video editing\n\\n\\n\\nAbility to take direction and adapt quickly\nExceptionally Qualified Candidates will have:\nDemonstrated understanding of or familiarity with Ways and Means’ jurisdiction\nPlease send a cover letter, resume, and 2-3 graphic or video samples to dylan.peachey@mail.house.gov with the subject line “DIGITAL FELLOW SUMMER 2025: Last name” by Friday, February 28, 2025. We are an equal opportunity employer and do not discriminate on the basis of race, sex, color, age, religion, national origin, sexual orientation, gender identity, or disability. Diverse applicants encouraged to apply.",
    "DW_NOMINATE": null,
    "LES": null
  },
  {
    "Post_ID": "MEM-055-25",
    "Posting_Author": "Congressman French Hill Internship Program",
    "Congress_Number": null,
    "State_District": "AR02",
    "Location": "Washington, D.C., and Arkansas.",
    "Job_Function": "Seeking interns for his offices",
    "Title_Parsed": null,
    "Office_Type": "Congressman",
    "Responsibilities": [
      "interacting with Arkansans and other visitors",
      "conducting legislative research and writing",
      "drafting communications materials",
      "assisting Arkansans with matters before the federal government"
    ],
    "Qualifications": [
      "positive attitude",
      "strong work ethic",
      "excellent written and oral communication skills",
      "working knowledge of current events and policy topics",
      "willingness to assist with daily office tasks",
      "social media and other communications experience (plus)"
    ],
    "Salary_Min": null,
    "Salary_Max": null,
    "Skills_Mentioned": [
      "daily office tasks"
    ],
    "Equal_Opportunity_Information": "This program is an equal opportunity workplace.",
    "Cleaned_Text": "Internship Program for AR02 Office",
    "DW_NOMINATE": null,
    "LES": null
  },
  {
    "Post_ID": "MEM-044-25",
    "Posting_Author": "U.S. Congressman Jeff Van Drew (R-NJ-02)",
    "Congress_Number": null,
    "State_District": "NJ-02",
    "Location": "The office of the U.S. Congressman ",
    "Job_Function": null,
    "Title_Parsed": "Intern",
    "Office_Type": "Republican office",
    "Responsibilities": [
      "greeting visitors",
      "answering phones",
      "leading tours of the U.S. Capitol",
      "opening and sorting mail",
      "attending briefings",
      "performing legislative research"
    ],
    "Qualifications": [
      "young professionals",
      "valuable experience with our nation's legislative process"
    ],
    "Salary_Min": null,
    "Salary_Max": 1000,
    "Skills_Mentioned": null,
    "Equal_Opportunity_Information": null,
    "Cleaned_Text": "The office of U.S. Congressman Jeff Van Drew (R-NJ-02) is currently accepting applications for part and full-time interns for the summer session...",
    "DW_NOMINATE": null,
    "LES": null
  },
  {
    "Post_ID": "MEM-041-25",
    "Posting_Author": null,
    "Congress_Number": null,
    "State_District": "TN-09",
    "Location": "Washington, D.C.",
    "Job_Function": "Internship",
    "Title_Parsed": null,
    "Office_Type": "Legislative Office",
    "Responsibilities": [
      "Assist with constituent correspondence and draft email blasts and other forms of outreach.",
      "Attend virtual briefings and track virtual hearings.",
      "Conduct weekly legislative assignments."
    ],
    "Qualifications": [
      "Demonstrated interest in politics, policy and/or public service.",
      "Strong communications and writing skills.",
      "Hard-working, dependable, detail-oriented and professional.",
      "Self-motivated",
      "Ties to Tennessee’s 9th District are a bonus, but not required."
    ],
    "Salary_Min": null,
    "Salary_Max": null,
    "Skills_Mentioned": [
      "Politics"
    ],
    "Equal_Opportunity_Information": "The U.S. House of Representatives is an equal opportunity employer committed to diversity and inclusion.",
    "Cleaned_Text": "",
    "DW_NOMINATE": null,
    "LES": null
  },
  {
    "Post_ID": "MEM-039-25",
    "Posting_Author": "Congressman Cory Mills’ (FL-07)",
    "Congress_Number": null,
    "State_District": "FL-07",
    "Location": "Washington, D.C.",
    "Job_Function": null,
    "Title_Parsed": null,
    "Office_Type": null,
    "Responsibilities": [
      "leading Capitol tours",
      "answering phones",
      "greeting constituents",
      "assisting staff with legislative projects",
      "attending briefings and hearings"
    ],
    "Qualifications": [
      "strong organizational skills",
      "communication and writing skills",
      "ability to manage multiple tasks",
      "work well under pressure in a team environment",
      "positive attitude",
      "interest in politics"
    ],
    "Salary_Min": null,
    "Salary_Max": null,
    "Skills_Mentioned": null,
    "Equal_Opportunity_Information": "This is an equal opportunity employer.",
    "Cleaned_Text": "Congressman Cory Mills’ (FL-07) Washington, D.C. office is currently seeking qualified individuals to serve in his Washington, D.C. office for the Spring of 2025.\n\nInterns will observe the inner workings of a Congressional office, while gaining firsthand knowledge of the legislative process.\nResponsibilities include leading Capitol tours, answering phones, greeting constituents, assisting staff with legislative projects and attending briefings and hearings.\nIdeal candidates possess strong organizational, communication, and writing skills, as well as the ability to manage multiple tasks and work well under pressure in a team environment. A positive attitude and interest in politics is a must.\nThis is a paid internship.\nTo start immediately.\n\nPlease send resumes and cover letter to Milka.jurado2@mail.house.gov",
    "DW_NOMINATE": null,
    "LES": null
  },
  {
    "Post_ID": "MEM-018-25",
    "Posting_Author": "Congresswoman Suzan DelBene",
    "Congress_Number": null,
    "State_District": "1st Congressional District of Washington state",
    "Location": "Washington, D.C. and District offices, Kirkland, WA",
    "Job_Function": null,
    "Title_Parsed": "Interns for her Washington, D.C. and District offices",
    "Office_Type": null,
    "Responsibilities": [
      "greeting constituents and handling constituent phone calls",
      "assisting staff with administrative tasks",
      "conducting research",
      "assisting with constituent correspondence"
    ],
    "Qualifications": [
      "exceptional written and oral communication skills",
      "a high degree of professionalism",
      "a strong interest in public service",
      "Washington state ties are a plus but are not required"
    ],
    "Salary_Min": null,
    "Salary_Max": null,
    "Skills_Mentioned": null,
    "Equal_Opportunity_Information": "This office is an equal opportunity employer and does not discriminate based on race, religion, disability, age, ethnicity, national origin, sex, gender, LGBTQ identification, family status, or military status. Women, people of color, and other members of traditionally underrepresented communities are strongly encouraged to apply.",
    "Cleaned_Text": "MEM-018-25\nCongresswoman Suzan DelBene, representing the 1st Congressional District of\nWashington state, seeks interns for her Washington, D.C. and District offices. Interns will\nwork in a fast-paced congressional office, gaining valuable experience and knowledge of\nthe United States Congress.\nIntern responsibilities include greeting constituents and handling constituent phone calls,\nassisting staff with administrative tasks, conducting research, and assisting with\nconstituent correspondence. Kirkland, WA interns will have the opportunity to attend community events and tours with the Congresswoman and staff. Washington, D.C. intern...",
    "DW_NOMINATE": null,
    "LES": null
  }
]