[
  {
    "Post_ID": "MEM-482-24",
    "Posting_Author": "Congresswoman Doris Matsui",
    "Congress_Number": null,
    "State_District": "7th Congressional District of California",
    "Location": "Washington, D.C.",
    "Job_Function": "Press",
    "Title_Parsed": null,
    "Office_Type": "Congressional office",
    "Responsibilities": [
      "help build out the Congresswoman’s digital and social media presence",
      "answer phones",
      "data entry",
      "researching legislation for the Member and legislative staff",
      "attending briefings",
      "hears",
      "markups",
      "answering constituent letters on various issues"
    ],
    "Qualifications": [
      "strong writing skills",
      "editing abilities",
      "social media skills",
      "experience in a press or digital media role",
      "graphical design/video editing software knowledge",
      "basic familiarity with graphic design/video editing"
    ],
    "Salary_Min": null,
    "Salary_Max": null,
    "Skills_Mentioned": [],
    "Equal_Opportunity_Information": "The office is an equal opportunity employer and does not discriminate on the basis of race, religion, disability, age, ethnicity, national origin, sex, gender, sexual orientation, family status or military status.",
    "Cleaned_Text": "",
    "DW_NOMINATE": null,
    "LES": null
  },
  {
    "Post_ID": "MEM-481-24",
    "Posting_Author": "Congressman Jeff Van Drew (NJ-02)",
    "Congress_Number": null,
    "State_District": "NJ-02",
    "Location": null,
    "Job_Function": null,
    "Title_Parsed": "Congressional Internship",
    "Office_Type": "U.S. Capitol Office",
    "Responsibilities": [
      "greeting visitors",
      "answering phones",
      "leading tours of the U.S. Capitol",
      "opening and sorting mail",
      "answering briefings",
      "performing legislative research"
    ],
    "Qualifications": null,
    "Salary_Min": null,
    "Salary_Max": null,
    "Skills_Mentioned": null,
    "Equal_Opportunity_Information": null,
    "Cleaned_Text": "The office of Congressman Jeff Van Drew (NJ-02) is currently accepting applications for part and full-time interns for the spring internship session. Each intern will receive up to a $1,000 stipend... Interns contribute to the daily operations of the office and are expected to act in a reliable, professional manner at all times.",
    "DW_NOMINATE": null,
    "LES": null
  },
  {
    "Post_ID": "MEM-480-24",
    "Posting_Author": null,
    "Congress_Number": null,
    "State_District": null,
    "Location": null,
    "Job_Function": null,
    "Title_Parsed": "Max Kampelman Fellowship program",
    "Office_Type": "Program",
    "Responsibilities": [
      "represent the next generation of American leaders in security policy, human rights, and strategic communications.",
      "work in political and military affairs, economic and environmental matters, or human rights and fundamental freedoms, based on their areas of interest, expertise, and needs of the Commission.",
      "conduct research topics and trends relating to international military, economic, and human rights issues throughout the 57-country OSCE region;",
      "assist staff advisors with hearings, briefings, congressional delegations, legislation, and publications;",
      "attend congressional hearings, panels, and events;",
      "perform administrative duties."
    ],
    "Qualifications": [
      "excellent writing, analysis, research, and oral presentation skills.",
      "knowledge of government, international relations, and human rights.",
      "excellent writing and editing skills.",
      "basic understanding of WordPress",
      "knowledge of social media platforms."
    ],
    "Salary_Min": null,
    "Salary_Max": null,
    "Skills_Mentioned": [
      "photography",
      "$${1,000} per year"
    ],
    "Equal_Opportunity_Information": null,
    "Cleaned_Text": "",
    "DW_NOMINATE": null,
    "LES": null
  },
  {
    "Post_ID": "MEM-479-24",
    "Posting_Author": "my Durham District office or my Washington, DC office!",
    "Congress_Number": null,
    "State_District": "Durham District Office and Washington, D.C. Office",
    "Location": "",
    "Job_Function": "Internships",
    "Title_Parsed": null,
    "Office_Type": "Legislative Office",
    "Responsibilities": [
      "attending hearings and briefings on behalf of legislative staffers",
      "supporting staff members with legislative research and other tasks as assigned",
      "compiling daily press clips for the Congresswoman",
      "sorting constituent correspondence and drafting responses",
      "answering phone calls",
      "greeting visitors to the office"
    ],
    "Qualifications": [
      "valuable work experience"
    ],
    "Salary_Min": null,
    "Salary_Max": null,
    "Skills_Mentioned": [],
    "Equal_Opportunity_Information": null,
    "Cleaned_Text": "This is a paid internship that offers students the opportunity to gain invaluable work experience. Full-time interns must work at least 35-40 hours a week, Monday-Friday. Part-time interns must work at least 10-20 hours a week, Monday-Friday, and hours may be flexible to accommodate students' course schedules.\n\nApplications will be reviewed on a rolling basis and students are encouraged to apply early. The due date for applications is November 22, 2024. Interested applicants should email a resume, cover letter, and at least two references to NC04Resumes@mail.house.gov. Incomplete applications will not be reviewed.",
    "DW_NOMINATE": null,
    "LES": null
  },
  {
    "Post_ID": "MEM-477-24",
    "Posting_Author": "Congresswoman Susie Lee",
    "Congress_Number": null,
    "State_District": "NV",
    "Location": "Washington, D.C. office",
    "Job_Function": null,
    "Title_Parsed": "Internship",
    "Office_Type": null,
    "Responsibilities": [
      "answering phones",
      "managing the front office",
      "assisting legislative staff with research",
      "assisting communications teams with drafting",
      "other tasks as assigned"
    ],
    "Qualifications": [
      "work well under deadlines",
      "organized",
      "hard-working",
      "detail-oriented",
      "excellent customer service skills",
      "team players"
    ],
    "Salary_Min": null,
    "Salary_Max": null,
    "Skills_Mentioned": [
      "Nevada ties"
    ],
    "Equal_Opportunity_Information": null,
    "Cleaned_Text": "The okice of Congresswoman Susie Lee is seeking full-time, Spring 2025 Interns for the Washington, D.C. okice. Responsibilities will include answering phones, managing the front okice, assisting legislative stak with research, assisting the communications teams with drafting, and other tasks as assigned. Successful candidates will work well under deadlines, are organized, hard-working, detail-oriented, have excellent customer service skills, and are team players. Nevada ties are strongly preferred. Interns will be eligible for a monthly stipend.",
    "DW_NOMINATE": null,
    "LES": null
  },
  {
    "Post_ID": "MEM-472-24",
    "Posting_Author": "Congresswoman Michelle Steel’s office",
    "Congress_Number": null,
    "State_District": "California's 45th district",
    "Location": "Washington, D.C.",
    "Job_Function": null,
    "Title_Parsed": "Internship in Congresswoman Michelle Steel’s office",
    "Office_Type": null,
    "Responsibilities": [
      "corresponding with constituents",
      "performing research for the task",
      "giving tours of the Capitol building",
      "attending Congressional hearings",
      "helping prepare for upcoming hearings"
    ],
    "Qualifications": [
      "strong attention to detail and communications skills",
      "a strong interest in learning about the legislative process"
    ],
    "Salary_Min": null,
    "Salary_Max": null,
    "Skills_Mentioned": [
      "policy areas",
      "the Congresswoman’s work on the House Ways and Means Committee",
      "Education and Workforce Committee",
      "AI Task Force",
      "the Select Committee on the Chinese Communist Party"
    ],
    "Equal_Opportunity_Information": null,
    "Cleaned_Text": "",
    "DW_NOMINATE": null,
    "LES": null
  },
  {
    "Post_ID": "MEM-466-24",
    "Posting_Author": "",
    "Congress_Number": null,
    "State_District": "_FL-07_",
    "Location": "Washington, D.C.",
    "Job_Function": null,
    "Title_Parsed": "Staff Assistant Intern",
    "Office_Type": "Congressional okice",
    "Responsibilities": [
      "leading Capitol tours",
      "answering phones",
      "greeting constituents",
      "assisting staff with legislative projects and attending briefings and hearings"
    ],
    "Qualifications": [
      "strong organizational skills",
      "communication and writing skills",
      "ability to manage multiple tasks and work well under pressure in a team environment",
      "positive attitude and interest in politics"
    ],
    "Salary_Min": null,
    "Salary_Max": null,
    "Skills_Mentioned": [
      "none specified, but requires strong organizational, communication, and writing skills."
    ],
    "Equal_Opportunity_Information": "For more information about internship opportunities or this particular position, contact Milka Jurdáo2 at (202) 225-0448 or °mail.house.gov \n Congressional Office",
    "Cleaned_Text": "Internship Duties: The staff assistant/intern will lead Capitol Hill tour groups, answer phones in the legislative office’s Washington D.C. office, meet with congressional constituents and assist lawmakers in conducting their daily duties on a routine basis. This paid internship serves to advance the individual’s education while assisting Congressman Cory Mills and his legislative team.",
    "DW_NOMINATE": null,
    "LES": null
  },
  {
    "Post_ID": "MEM-465-24",
    "Posting_Author": "The Office of Congressman Joaquin Castro (TX-20)",
    "Congress_Number": null,
    "State_District": "TX-20",
    "Location": "Washington, D.C.",
    "Job_Function": "Intern",
    "Title_Parsed": "DC Legislative Intern",
    "Office_Type": "Legislative Office",
    "Responsibilities": [
      "answering phones",
      "researching legislation",
      "attending hearings and briefings",
      "responding to constituent letters"
    ],
    "Qualifications": [
      "interested in public policy",
      "detail-oriented",
      "motivated",
      "organized",
      "willing to learn",
      "good phone etiquette",
      "strong writing skills"
    ],
    "Salary_Min": 15,
    "Salary_Max": null,
    "Skills_Mentioned": [],
    "Equal_Opportunity_Information": "Candidates will be considered without regard to race, color, national origin, religion, sex, gender identity, disability, or age.",
    "Cleaned_Text": "The Office of Congressman Joaquin Castro (TX-20) is looking to hire a motivated and detail-oriented college student or recent college graduate...",
    "DW_NOMINATE": -0.3989999890327454,
    "LES": 0.6002452373504639
  },
  {
    "Post_ID": "MEM-464-24",
    "Posting_Author": "The Okice of Congressman Joaquin Castro",
    "Congress_Number": null,
    "State_District": "TX-20",
    "Location": "Washington, D.C.",
    "Job_Function": null,
    "Title_Parsed": "DC Legislative Intern",
    "Office_Type": "Internship",
    "Responsibilities": [
      "answer phones",
      "research legislation",
      "attend hearings and briefings",
      "respond to constituent letters"
    ],
    "Qualifications": [
      "public policy",
      "detail-oriented",
      "motivated",
      "organized",
      "willing to learn",
      "good phone etiquette",
      "strong writing skills"
    ],
    "Salary_Min": null,
    "Salary_Max": 15,
    "Skills_Mentioned": [],
    "Equal_Opportunity_Information": "All applicants will be considered without regard to race, color, national origin, religion, sex, gender identity, disability, or age.",
    "Cleaned_Text": "The Okice of Congressman Joaquin Castro (TX-20) is looking to hire a motivated and detail-oriented college student or recent college graduate to join our Washington, D.C. office for the upcoming Spring 2025 Semester.",
    "DW_NOMINATE": -0.3989999890327454,
    "LES": 0.6002452373504639
  },
  {
    "Post_ID": "MEM-464-24",
    "Posting_Author": "Representative Seth Magaziner (RI-02)",
    "Congress_Number": null,
    "State_District": "RI-02",
    "Location": "Warwick, Rhode Island office",
    "Job_Function": null,
    "Title_Parsed": null,
    "Office_Type": null,
    "Responsibilities": [
      "Provides a welcoming environment and positive ﬁrst impression of the Member okice to constituents, visitors, and other VIPs;",
      "Answers incoming calls with poise, professionalism, and promptness;",
      "Sorts and distributes mail;",
      "Assists Member and key staff (e.g. staff assistant, scheduler, District Director) with logistical and administrative duties;",
      "Receives and logs input from constituents on policy matters for the Member okice’s consideration and response;",
      "Conducts research, and drafts correspondence and memoranda;",
      "Assists with planning and execution of Member’s public outreach at local events;",
      "Accompanies district staff to public forums, meetings, and events as a representative to the Member."
    ],
    "Qualifications": null,
    "Salary_Min": null,
    "Salary_Max": null,
    "Skills_Mentioned": null,
    "Equal_Opportunity_Information": "The office is an equal opportunity employer; we do not discriminate on the basis of race, color, religion, sex, national origin, age, disability, gender identity or expression, or sexual orientation.",
    "Cleaned_Text": "",
    "DW_NOMINATE": null,
    "LES": null
  },
  {
    "Post_ID": "MEM-463-24",
    "Posting_Author": null,
    "Congress_Number": null,
    "State_District": "DC",
    "Location": "Washington, DC office",
    "Job_Function": "Internship",
    "Title_Parsed": "Paid Spring 2025 Legislative Internship – DC Office of Congresswoman Mary Gay Scanlon",
    "Office_Type": "Congresswoman's office",
    "Responsibilities": [
      "",
      ""
    ],
    "Qualifications": [
      "motivated team players with strong written and oral communication skills",
      "demonstrated interest in government and public service",
      "strong work ethic, the ability to excel in fast-paced environments, and a willingness to assist wherever needed"
    ],
    "Salary_Min": null,
    "Salary_Max": null,
    "Skills_Mentioned": [
      "",
      ""
    ],
    "Equal_Opportunity_Information": "The U.S. House of Representatives is an EEO employer.\n",
    "Cleaned_Text": "Internships are based in Congresswoman Scanlon’s Washington, DC office for college students and recent graduates and will be in person. Hours are flexible to accommodate students’ course schedules, but generally run from 9 a.m. to 5 p.m. The Legislative Internship is paid via monthly stipend.\n\nLegal Responsibilities\n--------------------------------\nResponsibilities include, but are not limited to:\n• Drafting constituent correspondence\n• Researching various legislative issues and writing policy memos for the Congresswoman\n• Attending briefings, hearings, and markups and drafting related memoranda\n• Responding to constituent mail and answering office phones\n\nAbout Our Internship\n----------------------------\nIdeal applicants will be motivated team players with strong written and oral communication skills and have a demonstrated interest in government and public service.\nA strong work ethic, the ability to excel in fast-paced environments, and a willingness to assist wherever needed are must-have qualities. To apply, please submit a resume, cover letter, one short writing sample, and two\nreferences to Madhumita.Gupta@mail.house.gov with the subject line “Spring Legislative Internship, NAME”. Please include availability in the cover letter and compile all application materials into one PDF document.",
    "DW_NOMINATE": null,
    "LES": null
  },
  {
    "Post_ID": "MEM-459-24",
    "Posting_Author": "Rep. Clik Bentz (OR-02)",
    "Congress_Number": null,
    "State_District": "OR-02",
    "Location": "Washington D.C. Okice",
    "Job_Function": "Internship opportunity",
    "Title_Parsed": null,
    "Office_Type": null,
    "Responsibilities": [
      "Answer phones, greet Oregonians, attend policy meetings with other stak",
      "Manage constituent correspondences and administrative operations",
      "Lead tours of the U.S. Capitol and attend committee hearings"
    ],
    "Qualifications": [
      "College students or recent graduates",
      "Outgoing, proactive, hard-working, detail-oriented, enthusiastic, able to multi-task",
      "Customer service experience"
    ],
    "Salary_Min": null,
    "Salary_Max": null,
    "Skills_Mentioned": null,
    "Equal_Opportunity_Information": "We are an equal opportunity employer.",
    "Cleaned_Text": "Congressman Clik Bentz (OR-02) is seeking Spring interns for his Washington D.C. Okice.\n\nCongressman Bentz is a member of the House Judiciary Committee and\nthe House Natural ¡Resources Committee. Ideal candidates will be college students or recent graduates who\nare outgoing, proactive, hard-working, detail-oriented, enthusiastic, able to multi-task,\nand have customer service experience.\n\nInterns will assist with many of the daily activities related to constituent relations and legislative research. Although no two days are the same, an intern may be expected to answer phones, greet Oregonians, attend policy meetings with other stak,\nor assist in managing constituent correspondences and administrative operations. Interns may also lead tours of the U.S. Capitol and attend committee hearings.\n\nInterns will be immersed in the congressional process and their work will provide valuable experience for future endeavors. The internship will generate the opportunity to foster excellent connections, learn about many issues akecting our state and country, gain expertise in any policy areas you might be interested in, and get a detailed look at what makes the United States the most enduring democracy in the world.\n\nDesired Availability:\n\nApplicants should be able to commit to at least 20 hours per week. Okice hours are 9:00AM – 5:00PM weekdays. The internship is in-person and paid.\n\nAll interested applicants are asked to ¿i»ill out the application form found on the\ngovernor’s website: https://bentz.house.gov/services/internships",
    "DW_NOMINATE": null,
    "LES": null
  },
  {
    "Post_ID": "MEM-453-24",
    "Posting_Author": "Congresswoman Stephanie Bice (OK-05)",
    "Congress_Number": null,
    "State_District": "None provided",
    "Location": "Washington, D.C.",
    "Job_Function": "Public Policy Internship",
    "Title_Parsed": null,
    "Office_Type": "Member of Congress",
    "Responsibilities": [
      "Handle and respond to incoming mail and electronic correspondence",
      "Conduct research on legislative topics",
      "Help draft legislative and official correspondence",
      "Lead tours of the Capitol"
    ],
    "Qualifications": [
      "Strong communication skills (verbally and written)",
      "Good time management skills (ability to prioritize)"
    ],
    "Salary_Min": null,
    "Salary_Max": null,
    "Skills_Mentioned": [
      "Detail-oriented",
      "Attention to detail",
      "Time management",
      "Legislative process knowledge, Public Policy understanding",
      "Communication (verbal and written), Collaboration",
      "Administrative and logistical skills"
    ],
    "Equal_Opportunity_Information": null,
    "Cleaned_Text": "MOTIVATED AND DETAILED CANDIDATES",
    "DW_NOMINATE": null,
    "LES": null
  },
  {
    "Post_ID": "MEM-447-24",
    "Posting_Author": "Congresswoman Dina Titus (NV-01)",
    "Congress_Number": null,
    "State_District": "NV-01",
    "Location": "D.C. okice",
    "Job_Function": "Legislative Interns",
    "Title_Parsed": null,
    "Office_Type": "the Congresswoman's office",
    "Responsibilities": [
      "answering constituent phone calls",
      "attending policy brieﬁngs and meetings",
      "providing tours of the United States Capitol",
      "conducting legislative research"
    ],
    "Qualifications": [
      "excellent oral and written communication skills",
      "prioritizes professionalism",
      "dedicated team player",
      "friendly persona.",
      "ties to Nevada's First District are a plus, but not required."
    ],
    "Salary_Min": null,
    "Salary_Max": null,
    "Skills_Mentioned": null,
    "Equal_Opportunity_Information": "the okice of Congresswoman Dina Titus is an equal opportunity employer",
    "Cleaned_Text": "MEM-447-24\ncongresswoman dina titus (nv-01) seeks highly motivated legislative interns in our d.c. office for the spring 2025 semester.\n\ninterns in our d.c. office will have the opportunity to witness the legislative process and the inner workings of capitol hill first-hand. responsibilities include but are not limited to\nanswering constituent phone calls, attending policy brieﬁngs and meetings, providing tours of the united states congress, and conducting legislative research to support the needs of\nthe congresswoman's stake.\n\nthe internship will run from january through may, from 9 am-6 pm when congress is in session and from 9 am-5 pm when congress is not in session.\n\nthe ideal candidate possesses excellent oral and written communication skills, prioritizes professionalism, is a dedicated team player, and has a friendly persona. ties to nevada's first district are a plus, but not required.\n\n\nthe okice of congresswoman dina titus is an equal opportunity employer and does not discriminate on the basis of race, color, religion, sex, sexual orientation, gender identity and expression, national origin, disability, military status, age, marital status, or parental status.\n\ngo to our application form: interested applicants should fill out the form below and include a cover letter, resume, and short (1-2 page) writing sample. applications will be accepted until sunday, december 1, 2024, on a rolling basis.",
    "DW_NOMINATE": null,
    "LES": null
  },
  {
    "Post_ID": "MEM-444-24",
    "Posting_Author": "Congressman Glenn Grothman (WI-06)",
    "Congress_Number": null,
    "State_District": null,
    "Location": "Washington, DC okice",
    "Job_Function": "Spring Congressional Internship",
    "Title_Parsed": null,
    "Office_Type": null,
    "Responsibilities": [
      "Answering constituent phone calls and directing them appropriately",
      "Researching legislation for the Member and legislative stak",
      "Attending congressional hearings and policy brieﬁngs",
      "Answering constituent letters on various issues before the House",
      "Helping the communications/press team",
      "Conducting Capitol tours for constituents and other guests",
      "Other projects as assigned by the stak"
    ],
    "Qualifications": [
      "motivated, detail-oriented, display a strong work ethic, and interact well with constituents",
      "strong interest in the legislative process and the function of Congress"
    ],
    "Salary_Min": null,
    "Salary_Max": null,
    "Skills_Mentioned": [],
    "Equal_Opportunity_Information": null,
    "Cleaned_Text": "MEM-444-24The okice of Congressman Glenn Grothman (WI-06) is now accepting applicants for Spring 2025 Congressional Internships in our Washington, DC okice. Successful applicants will be motivated, detail-oriented, display a strong work ethic, and interact well with constituents. In addition, applicants should have a strong interest in the legislative process and the function of Congress. A monthly stipend will be provided to individuals selected for the internship.\nInternship duties in the Washington, DC okice may include:\n• Answering constituent phone calls and directing them appropriately\n• Researching legislation for the Member and legislative stak\n• Attending congressional hearings and policy brieﬁngs\n• Answering constituent letters on various issues before the House\n• Helping the communications/press team\n• Conducting Capitol tours for constituents and other guests\n• Other projects as assigned by the stak\nTo apply, please email your resume to WisconsinResumes@mail.house.gov. Ties to the state of Wisconsin are preferred, but not required.",
    "DW_NOMINATE": null,
    "LES": null
  },
  {
    "Post_ID": "MEM-440-24",
    "Posting_Author": "Congressman Josh Harder",
    "Congress_Number": null,
    "State_District": "CA-9",
    "Location": "Washington, DC office",
    "Job_Function": "Legislative intern",
    "Title_Parsed": null,
    "Office_Type": "Congresswoman's office",
    "Responsibilities": [
      "Daily operations assisting"
    ],
    "Qualifications": [
      "Strong work ethic, attention to detail, punctuality, excellent writing skills"
    ],
    "Salary_Min": null,
    "Salary_Max": null,
    "Skills_Mentioned": null,
    "Equal_Opportunity_Information": null,
    "Cleaned_Text": "",
    "DW_NOMINATE": -0.3210000097751617,
    "LES": 0.8841311931610107
  },
  {
    "Post_ID": "MEM-414-24",
    "Posting_Author": "Sydney Kamlager-Dove",
    "Congress_Number": null,
    "State_District": "CA-37",
    "Location": "Washington, D.C. and Los Angeles",
    "Job_Function": "Internships",
    "Title_Parsed": null,
    "Office_Type": "okice",
    "Responsibilities": [
      "Answer phones and assist in correspondence with constituents",
      "Greet constituents and okice visitors",
      "Process tour requests and lead Capitol tours",
      "Handle mail",
      "Assist in processing casework",
      "Perform legislative research",
      "Work on other administrative tasks as directed"
    ],
    "Qualifications": [
      "Interest in the legislative process and civic service",
      "Excellent writing, research, organization, time management, and communication skills",
      "Work well in a team environment",
      "General understanding of the US political system"
    ],
    "Salary_Min": null,
    "Salary_Max": null,
    "Skills_Mentioned": null,
    "Equal_Opportunity_Information": "We are an equal opportunity employer committed to diversifying our workforce.",
    "Cleaned_Text": "The Okice of Congresswoman Sydney Kamlager-Dove (CA-37) is seeking interns for our Washington, D.C. and Los Angeles okices for the Spring 2025 term.\nr\nOur okice values open communication, hard work, and creating a collegial environment.\r\n\r\nWe are looking for interns with a can-do attitude who are eager to grow. Interns will have great opportunities to learn from okice stak and network with others to make the most of their time with our okice!\nIntern Expectations\nCandidates should have an interest in the legislative process and civic service; possess excellent writing, research, organization, time management, and communication skills; work well in a team environment; and have a general understanding of the US political system.\n\nInternship Responsibilities\nLegislative interns can expect to:\n· Answer phones and assist in correspondence with constituents\n· Greet constituents and okice visitors\n· Process tour requests and lead Capitol tours\n· Handle mail\n· Assist in processing casework\n· Perform legislative research\n· Work on other administrative tasks as directed\r\nPress interns can expect to:\n· Assist the Communications Director and Press Assistant in drafting social media content and other materials like press releases, website content, and newsletters\n· Create graphic design posts for social media\r\n· Compile daily press clips\r\n· Edit video clips\r\n· Maintain press lists\r\n· Answer phones and assist in correspondence as needed.\nIn our DC okice, you can apply to be EITHER a Legislative OR Press intern. In our Los Angeles okice, you will be a general okice intern.\nInternship Dates and Details:\nSpring internships are slated to start early January and go until late April/early May, with some flexibility. Interns are expected to work in person in the okice, Monday-Friday 9 a.m.5 p.m. Unfortunately, we cannot accommodate remote or hybrid internships at this time.\nDeadline: Applications must be submitted by 6 p.m. ET on Friday, November 22nd .\nTo apply: Interested applicants should send their resume and a brief cover letter (in one document) to:\n· CA37.internships@mail.house.gov for DC okice internship.\nUse the subject line &quot;First name Last name [legislative] OR [press] – Spring 2025 internship&quot;\n· ca37.DOinternships@mail.house.gov for Los Angeles okice internship\nUse the subject line &quot;First name Last name – Spring 2025 Internship&quot; in your email.\nPlease reach out our intern coordinator, Madilyn Brandon, with any questions at Madilyn.Brandon@mail.house.gov.",
    "DW_NOMINATE": -0.5479999780654907,
    "LES": 0.4336842596530914
  },
  {
    "Post_ID": "MEM-396-24",
    "Posting_Author": "Kevin Hern",
    "Congress_Number": null,
    "State_District": "OK-01",
    "Location": "Washington, D.C.",
    "Job_Function": "Intern(s)",
    "Title_Parsed": "",
    "Office_Type": "",
    "Responsibilities": [],
    "Qualifications": [],
    "Salary_Min": null,
    "Salary_Max": null,
    "Skills_Mentioned": [],
    "Equal_Opportunity_Information": "",
    "Cleaned_Text": "",
    "DW_NOMINATE": null,
    "LES": null
  }
]