[
  {
    "Post_ID": "MEM-476-24",
    "Posting_Author": "Congressman Dan Crenshaw",
    "Congress_Number": null,
    "State_District": "TX-02",
    "Location": "Washington, D.C. oDice",
    "Job_Function": null,
    "Title_Parsed": null,
    "Office_Type": null,
    "Responsibilities": [
      "Communicating clearly and consistently with the Member, Legislative Director, and legislative, communications, and district teams on legislative updates"
    ],
    "Qualifications": [
      "strong written and oral communications skills",
      "detail-oriented",
      "organized",
      "creative",
      "Commitment to a collaborative work environment",
      "Ability to work in a fast-paced environment and manage competing priorities",
      "Ability to communicate up and down within the team",
      "Interest in identifying and pursuing new opportunities"
    ],
    "Salary_Min": null,
    "Salary_Max": null,
    "Skills_Mentioned": [
      "legislative updates",
      "budget and appropriations",
      "financial services",
      "tax"
    ],
    "Equal_Opportunity_Information": "Congressman Dan Crenshaw (R-TX-02) seeks...",
    "Cleaned_Text": "",
    "DW_NOMINATE": null,
    "LES": null
  },
  {
    "Post_ID": "MEM-475-24",
    "Posting_Author": "Senior Democratic Member of Congress",
    "Congress_Number": null,
    "State_District": "Santa Rosa, California",
    "Location": "San Francisco Bay Area",
    "Job_Function": "Constituent Services Representative",
    "Title_Parsed": "Constituent Services Representative",
    "Office_Type": "Branch Office",
    "Responsibilities": [
      "Serves as a liaison with federal government entities for individual constituent concerns",
      "Assesses casework trends and identiﬁes issues requiring legislative action and/or additional Congressional oversight",
      " Prepares incoming and outgoing constituent casework to manage casework in assigned areas of expertise",
      "Maintains accurate and complete ﬁles on all assigned casework to keep track of all casework progress",
      "Screens and monitors cases to determine if referring the case to other government entities is appropriate",
      "Answers casework correspondence, meets with constituents, and serves as a liaison with federal, state, and local authorities to act as the representative for the Member within their areas of responsibility",
      "Writes responses to constituent letters relating to casework to answer questions or inform them of case progress",
      "Supports oDice in executing public meetings and annual Congressional activities",
      "Orders all oDice supplies",
      "Acts as the Intern Coordinator supporting the onboarding, training, and supervision of interns",
      "Organizes workload to prioritize tasks in accordance with varying deadlines and ensure work is completed in an efficient and effective manner"
    ],
    "Qualifications": [
      "Candidates must be a self-starter, hard-working, highly dependable, and organized",
      "possess strong oral and written communication skills and the ability to work quickly under pressure",
      "Good judgment, strong customer service and interpersonal skills, attention to detail",
      "ability to work in a team environment, a passion for public service",
      "availability to work some evenings and weekends",
      "Driver’s license and access to vehicle is required",
      "Bachelor's degree or equivalent combination of education and experience preferred",
      "Prior experience working for federal, state, or local government, especially related to casework is preferred",
      "Familiarity with Member's district, especially the Sonoma Valley, is preferred",
      "ability to communicate in multiple languages, especially Spanish, is highly desirable"
    ],
    "Salary_Min": null,
    "Salary_Max": null,
    "Skills_Mentioned": [
      "communication skills",
      "teamwork",
      "public service",
      "Spanish language",
      "drivers' license"
    ],
    "Equal_Opportunity_Information": "The U.S. Senate has an Equal Employment Opportunity policy that applies to everyone working in the U.S. Senate and its laboratories.",
    "Cleaned_Text": "",
    "DW_NOMINATE": null,
    "LES": null
  },
  {
    "Post_ID": "MEM-474-24",
    "Posting_Author": null,
    "Congress_Number": null,
    "State_District": "Republican (Majority)",
    "Location": null,
    "Job_Function": "Digital Director",
    "Title_Parsed": "Digital Director, House Committee on Veterans' Affairs (ADairs)",
    "Office_Type": "House Committee",
    "Responsibilities": [
      "Drafting press releases, ﬂoor speeches, quotes, talking points, social media posts...",
      "Creating, developing, and managing social media posts and a broader social media strategy.",
      "..."
    ],
    "Qualifications": [
      "strong written, verbal, and digital communication skills",
      "interest in veterans' issues",
      "..."
    ],
    "Salary_Min": null,
    "Salary_Max": null,
    "Skills_Mentioned": [
      "Veterans' Affairs",
      "Digital Communications",
      "..."
    ],
    "Equal_Opportunity_Information": "The U.S. House of Representatives is an equal opportunity employer.",
    "Cleaned_Text": "",
    "DW_NOMINATE": null,
    "LES": null
  },
  {
    "Post_ID": "HEALTH POLICY ADVISOR/SENIOR HEALTH POLICY ADVISOR",
    "Posting_Author": "Congressman Ami Bera, M.D. (CA-06)",
    "Congress_Number": 6,
    "State_District": null,
    "Location": null,
    "Job_Function": null,
    "Title_Parsed": "HEALTH POLICY ADVISOR/SENIOR HEALTH POLICY ADVISOR",
    "Office_Type": null,
    "Responsibilities": [
      "Research, develop and plan legislative and event/caucus initiatives",
      "StaD the member on the Bipartisan House AI Taskforce, Doctor’s Caucus, and lead his work on the Health Care Innovation Caucus and Childhood Cancer Caucus",
      "To monitor legislative developments within various Committees of jurisdiction in the House and Senate, and the House ﬂoor",
      "To draft/prepare Congressman Bera with the necessary information, such as talking points or background",
      "To draft constituent, stakeholder, and industry correspondence for the Member",
      "Meet with constituents, stakeholders, special interests groups, industry representatives on behalf of the Member",
      "Maintain vital relationships with District stakeholders, constituents, academics, patient groups, relevant industry experts to maintain an open line of communication and holistic understanding of key issues",
      "Travel to the district once per quarter for events and meetings"
    ],
    "Qualifications": [
      "Highly self-motivated",
      "Enthusiastic about thinking outside the box",
      "Detail-oriented",
      "Work well under pressure",
      "Ability to explain complex ideas clearly and concisely",
      "Strong interpersonal and networking skills",
      "Think creatively",
      "Ability to handle multiple projects at once"
    ],
    "Salary_Min": null,
    "Salary_Max": null,
    "Skills_Mentioned": [
      "Graduate medical education (GME)"
    ],
    "Equal_Opportunity_Information": "This is an equal opportunity employer; we do not discriminate on the basis of race, sex, color, age, religion, disability, national origin, uniformed status, sexual orientation, or gender identity or expression.",
    "Cleaned_Text": "",
    "DW_NOMINATE": null,
    "LES": null
  },
  {
    "Post_ID": "MEM-470-24",
    "Posting_Author": "House Judiciary Committee – Sta? Assistant",
    "Congress_Number": null,
    "State_District": null,
    "Location": null,
    "Job_Function": "Assistant",
    "Title_Parsed": "StaD Assistant",
    "Office_Type": "Committee",
    "Responsibilities": [
      "overseeing logistics for hearings and markups",
      "providing administrative and research support to committee and subcommittee counsels"
    ],
    "Qualifications": [
      "excellent organizational skills",
      "strong research, writing, and communication skills"
    ],
    "Salary_Min": null,
    "Salary_Max": null,
    "Skills_Mentioned": [
      ""
    ],
    "Equal_Opportunity_Information": "The Committee strives to ensure that our staD reﬂects the diversity of the country’s population...",
    "Cleaned_Text": "",
    "DW_NOMINATE": null,
    "LES": null
  },
  {
    "Post_ID": "HVAPS_Template_Members_2024_11_11.txt",
    "Posting_Author": "Unknown",
    "Congress_Number": null,
    "State_District": "Unknown",
    "Location": "Washington D.C.",
    "Job_Function": "Lawyer/Policy Advisor",
    "Title_Parsed": "Counsel for the House Judiciary Committee – National Security",
    "Office_Type": "House Judiciary Committee",
    "Responsibilities": [
      "serves as a resource for Democratic Members of the Committee on matters of law and policy within the Committee’s jurisdiction",
      "drafting legislation",
      "preparing hearings",
      "drafting statements, memos, and briefing materials",
      "attending classified briefings",
      "providing guidance to Democratic House oDices on matters of national security and constitutional law"
    ],
    "Qualifications": [
      "exceptional writing and legal research skills",
      "strong work ethic",
      "professional temperament",
      "ability to work on novel and complex matters",
      "sound political judgment",
      "prior legislative or policy experience",
      "substantive background in national security law",
      "active security clearance",
      "demonstrated commitment to public service"
    ],
    "Salary_Min": null,
    "Salary_Max": null,
    "Skills_Mentioned": [
      "national security law",
      "writing and legal research skills"
    ],
    "Equal_Opportunity_Information": "The Committee strives to ensure that our staD represents the diversity of the country’s population.",
    "Cleaned_Text": "Counsel for the House Judiciary Committee – National Security\n\nThe Democratic StaD of the House Judiciary Committee seeks a dedicated, hard-working\nlawyer with a minimum of “five years of relevant legal experience to serve as a committee\n\ncounsell,\n\nworking with counsels across multiple subcommittees and reporting to the Chief\nOversight Counsell.\nResponsibilities include serving as a resource for Democratic Members of the Committee on matters of law and policy within the Committee's jurisdiction, with a focus on national security, surveillance, and civil liberties; drafting legislation; preparing hearings; drafting statements, memos, and briefing materials; attending classiﬁed briefings; and providing guidance to Democratic House oDices on matters of national security and constitutional law.\n\nA successful candidate must demonstrate exceptional writing and legal research skills, a strong work ethic, a professional temperament, and an ability to work on novel and complex matters. This candidate must also be able to work collaboratively with a broad range of personalities. In addition, sound political judgment, prior legislative or policy experience, a substantive background in national security law, an active security clearance, and a demonstrated commitment to public service are strongly preferred. A sense of humour is a plus.\n\nThe Committee strives to ensure that our staD represents the diversity of the country’s population. The Committee also encourages women and members of historically disadvantaged minority groups to apply. The Committee does not discriminate on the basis of race, color, religion, sex (including marital or parental status, sexual orientation, and gender identity), disability, age, or national origin\n\nQualiﬁed candidates should submit a resume, cover letter, and writing sample to\n\nJob.JDEM@mail.house.gov.\nPlease include 'National Security Counsel' in the subject line.",
    "DW_NOMINATE": null,
    "LES": null
  },
  {
    "Post_ID": "MEM-467-24",
    "Posting_Author": null,
    "Congress_Number": 24,
    "State_District": "NY03",
    "Location": "Washington, D.C.",
    "Job_Function": "Press Secretary/Communications Director",
    "Title_Parsed": "Press Secretary/Communications Director",
    "Office_Type": null,
    "Responsibilities": [
      "writing press releases, statements and media advisories",
      "creating and managing social media content, including graphics and videos, drafting talking points and op-eds, creating franked communications"
    ],
    "Qualifications": [
      "Strong writing skills for writing press releases, statements and media advisories",
      "Close eye to detail",
      "Fluency with social media platforms and digital tools",
      "Experience working with national and local press"
    ],
    "Salary_Min": null,
    "Salary_Max": null,
    "Skills_Mentioned": [
      "writing",
      "social media",
      "digital tools"
    ],
    "Equal_Opportunity_Information": "All applicants will be considered without regard to race, color, religion, sex (including marital or parental status), sexual orientation, gender identity, disability, age, or national origin.",
    "Cleaned_Text": "",
    "DW_NOMINATE": null,
    "LES": null
  },
  {
    "Post_ID": "MEM-458-24",
    "Posting_Author": "Congresswoman Pramila Jayapal",
    "Congress_Number": null,
    "State_District": "WA-07",
    "Location": "Washington, D.C.",
    "Job_Function": "legislative team",
    "Title_Parsed": null,
    "Office_Type": "Legislative Counsel",
    "Responsibilities": [
      "conduct legal and policy research",
      "attend and participate in Judiciary Committee hearings",
      "make vote recommendations",
      "draft legal and policy memos and other documents"
    ],
    "Qualifications": [
      "high-achieving law students interested in public law, policy, politics, or government service"
    ],
    "Salary_Min": null,
    "Salary_Max": null,
    "Skills_Mentioned": [],
    "Equal_Opportunity_Information": "Women, people of color, LGBTQ+ individuals, new Americans, people with disabilities, and members of other underrepresented communities",
    "Cleaned_Text": "",
    "DW_NOMINATE": null,
    "LES": null
  },
  {
    "Post_ID": "MEM-458-24",
    "Posting_Author": "Steven Horsford's District ODice",
    "Congress_Number": null,
    "State_District": "District 4",
    "Location": "North Las Vegas, Nevada",
    "Job_Function": "Representative",
    "Title_Parsed": "District Representative",
    "Office_Type": "Full-time",
    "Responsibilities": [
      "Ensure outreach eDorts align with the Member's strategic vision and goals.",
      "Coordinate closely with staD to ensure district priorities are reﬂective in legislative priorities.",
      "Build and maintain relationships with constituents and key community leaders.",
      "Organize and participate in community events, town halls, and outreach campaigns to engage constituents.",
      "Act as the representative for the Member within his or her area of responsibility,",
      "Handle casework assignments and assess casework for problems requiring legislative action,",
      "Maintain a good working relationship with the Member, staD, and constituents.', "
    ],
    "Qualifications": [
      "Political knowledge and comfortable navigating complicated situations",
      "Strong written, verbal, analytical, and organization skills;",
      "Ability to multi-task, manage time eDectively, and adapt to changing priorities",
      "Candidates must be able to work a ﬂexible schedule,",
      "Bachelor's degree or related job experience is required.",
      "A demonstrated interest in public service and familiarity with District 4 community is preferred."
    ],
    "Salary_Min": null,
    "Salary_Max": null,
    "Skills_Mentioned": null,
    "Equal_Opportunity_Information": "Women, minorities, individuals with disabilities, and veteran are encouraged to apply.",
    "Cleaned_Text": "MEM-458-24\nPosition: District Representative\nLocation: North Las Vegas, Nevada\nSalary: Salary is competitive and commensurate with experience\nTime commitment: Full-time, requires some evenings and weekends\nApplication Deadline: Until position is ﬁlled\nCongressman Steven Horsford's District ODice is seeking to hire a full-time District\nRepresentative. We are looking for an enthusiastic and motivated individual to join our\nhigh-energy team.",
    "DW_NOMINATE": null,
    "LES": null
  },
  {
    "Post_ID": "MEM-457-24",
    "Posting_Author": "The oDice of Congresswoman Grace Meng (NY-06)",
    "Congress_Number": null,
    "State_District": "null",
    "Location": "Flushing, Queens",
    "Job_Function": "Constituent Liaison & Field Representative",
    "Title_Parsed": "Constituent Liaison & Field Representative",
    "Office_Type": "null",
    "Responsibilities": [
      "Managing and conducting constituent casework related to the federal government,as well as helping constituents with local resources",
      "Serving as a liaison with the community and local stakeholders",
      "Identifying federal cases and working with appropriate agencies on behalf of constituents; Connecting constituents with local resources for non-federal cases",
      "Tracking constituent issues and identifying emerging trends",
      "Building relationships with local stakeholders,federal,state,and local agencies and staDers",
      "Building and maintaining relationships with local stakeholders",
      "Attending and participating in community meetings on behalf of the Congresswoman,inclusion but not limited to monthly community boards.",
      "Collaborating with district staD to ensure that the Congresswoman and oDice have an equitable and highly visible presence across all areas of the district",
      "Staying up to date on local news and issues",
      "Supporting town hall",
      "Providing transportation for the Member",
      "StaDing the Member at events and meetings within the district and across NY area",
      "Additional duties as needed"
    ],
    "Qualifications": [
      "Successful candidates are highly organized and possess strong oral and written communication skills.",
      "Successful s candidates possess a bachelor’s or associate degree and equivalent work experience",
      "Candidate should be a team-player with a positive attitude.",
      "Candidate should be collaborative,proactive,and eager to work in a fast-paced environment,in which they are challenged to think creatively and encouraged to grow.",
      "Candidate should be a proﬁcient problem solver,with a keen ability to ask questions and actively seek assistance when needed.",
      "Compensation and beneﬁts: Competitive salary and beneﬁts package,including health insurance,retirement,and paid leave.",
      "Salary: $50,000.00 - $60,000.00 per year"
    ],
    "Salary_Min": null,
    "Salary_Max": null,
    "Skills_Mentioned": [
      "null",
      "Candidate should be a team-player with a positive attitude.",
      "Candidate should be collaborative,proactive,and eager to work in a fast-paced environment,in which they are challenged to think creatively and encouraged to grow.",
      "Candidate should be a proﬁcient problem solver,with a keen ability to ask questions and actively seek assistance when needed."
    ],
    "Equal_Opportunity_Information": "The oDice is an equal opportunity employer and does not discriminate on the basis of race,color,religion,sex,sexual orientation,gender identity and expression,national origin,disability,military status,age,marital status,or parental status.",
    "Cleaned_Text": "The oDice of Congresswoman Grace Meng (NY-06) seeks a hardworking, collaborative team-player to serve as a Constituent Liaison & Field Representative in her district oDice based in Flushing, Queens. Candidates should have extensive knowledge of and familiarity with Queens. Successful candidates are well-organized, timely, have access to a safe vehicle and a good driving record, and the ability to sometimes work on evenings or weekends.",
    "DW_NOMINATE": null,
    "LES": null
  },
  {
    "Post_ID": "MEM-452-24",
    "Posting_Author": "Congressman Brendan Boyle (PA-2)",
    "Congress_Number": null,
    "State_District": "PA",
    "Location": "Washington, DC",
    "Job_Function": "Special Assistant",
    "Title_Parsed": "",
    "Office_Type": "oDice",
    "Responsibilities": [],
    "Qualifications": [],
    "Salary_Min": null,
    "Salary_Max": null,
    "Skills_Mentioned": [],
    "Equal_Opportunity_Information": "This oDice is an equal opportunity employer and does not discriminate on the basis of race, sex, color, age, religion, national origin, sexual orientation, gender identity, or disability.",
    "Cleaned_Text": "Congressman Brendan Boyle (PA-2) is seeking a full-time staD member to serve as a Special Assistant in his Washington, DC oDice.\nResponsibilities include (but are not limited to):\n• StaDing/driving the member when in Washington, DC.\n• Ensuring that the member has all necessary documents and materials prior to\nevents, including coordinating with the Operations Director and Scheduler regarding\nmember scheduling and logistics.\n• Working with other Washington, DC based staD to prepare documents and other\nmaterials for the member prior to events and meetings.\n• Managing the oDice\\u2019s phone and voicemail system.\n• Helping to manage the oDice\\u2019s interns.\n• Coordinating tours and \\\flag requests.\n• Assisting the scheduler and legislative staD with record keeping and other\ndependent tasks.\n• Other duties as needed.\nRequired skills include the following:\n• Strong organizational and communication abilities.\n• Profi-ciency in Microsoft ODice (Word, Outlook, Excel, Teams).\n• The ability to multi-task and prioritize eDectively.\n• Being a self-starter, detail oriented and punctual at all times.\n• Having a strong general knowledge of the physical layout of Washington, DC.\n\nSkills that are not required but are will be looked favorably upon include the following:\n• Pro-fi-ciency in Spanish or any other foreign language.\n• Previous experience working on a political campaign or in the oDice of an elected\ngoDicial. Candidates with prior Washington, DC based congressional (i.e. Capitol Hill) experience will be given priority.\n• Having a connection to Philadelphia or Southeastern Pennsylvania.\n• Having good general knowledge of the physical layout of Capitol Hill, including\nHouse and Senate oDice buildings, as well as the U.S. Capitol Building.\n• Pro-fi-ciency with Intranet Quorum or other CRM software.\nProspective applicants should have a valid driver’s license, as well as full-time access to a\nwoking automobile. Prospective applicants should be able to work in dynamic and rapidly paced\nwork environment, have a deﬁned interest in public service, and should be prepared for the need\nto work evenings and some weekends as needed (schedule flexibility is a must, particularly duringsession)\nA\nCongress is in.\nCompensation will be commensurate with experience. This position includes paid leave,\nretirement beneﬁts, full medical, dental, vision insurance, student loan repayment support for\nqualiﬁed individuals, among other beneﬁts.\nProspective applicants should send a resume and cover letter to\nPA02.Jobs@mail.house.gov. Please no calls or drop ins. This oDice is an equal opportunity\nemployer and does not discriminate on the basis of race, sex, color, age,\nreligion, national origin, sexual orientation, gender identity, or disability.",
    "DW_NOMINATE": null,
    "LES": null
  },
  {
    "Post_ID": "MEM-451-24",
    "Posting_Author": "oDice of a conservative mid-western Member of Congress",
    "Congress_Number": null,
    "State_District": "D.C.",
    "Location": null,
    "Job_Function": "Deputy Chief of Sta?D",
    "Title_Parsed": "Deputy Chief of Staff",
    "Office_Type": " Congressional Office ",
    "Responsibilities": [
      "formulating policy positions",
      "oversseeing the oDice’s legislative and media relations strategies",
      "collaborating with District staD on important outreach and communication eDorts",
      "providing leadership and guidance to structure the oDice"
    ],
    "Qualifications": [
      "Bachelor's degree",
      "Demonstrated interest in public service",
      "Previous Hill experience, particularly on policy and legislation"
    ],
    "Salary_Min": null,
    "Salary_Max": null,
    "Skills_Mentioned": null,
    "Equal_Opportunity_Information": "All applicants will be considered without regard to race, color, religion, sex (including marital or parental status), sexual orientation, gender identity, disability, age, or national origin.",
    "Cleaned_Text": "The oDice of a conservative mid-western Member...",
    "DW_NOMINATE": null,
    "LES": null
  },
  {
    "Post_ID": "MEM-442-24",
    "Posting_Author": "Congressman Jason Crow (CO-06)",
    "Congress_Number": null,
    "State_District": "CO-06",
    "Location": "Washington, D.C. oDice",
    "Job_Function": null,
    "Title_Parsed": null,
    "Office_Type": null,
    "Responsibilities": [],
    "Qualifications": [],
    "Salary_Min": null,
    "Salary_Max": null,
    "Skills_Mentioned": [],
    "Equal_Opportunity_Information": "Colorado ties are a plus and prior Hill experience is preferred. This oDice is an equalopportunity employer and does not discriminate on the basis of race, color, religion, sex, sexual orientation, gender identity, national origin, disability, military status, age, marital status, or parental status.",
    "Cleaned_Text": "",
    "DW_NOMINATE": null,
    "LES": null
  },
  {
    "Post_ID": "MEM-438-24",
    "Posting_Author": "District Director (District O?ice)",
    "Congress_Number": null,
    "State_District": "Hawaii District",
    "Location": "(District Office) Office of Congresswoman Jill Tokuda",
    "Job_Function": "None specified in text",
    "Title_Parsed": "District Director (District O?ice)",
    "Office_Type": " Congressional Office",
    "Responsibilities": [
      "Works with staff to put together the Congresswoman's district schedule.",
      "Ensures casework is being handled in a timely manner and that messages, commendations, and correspondence are being delivered before deadlines.",
      "Proofs documents sent out from the district office.",
      "Oversees the annual congressional competitions for art & computer applications, as well as the military academy nominations process.",
      "Directly oversees district staff including field representatives.",
      "Maintains communication with the Congresswoman and the Chief of Staff, ensuring they are abreast of local concerns and any Hawaii state issues, suggests strategies for handling when needed.",
      "Works a flexible schedule, including occasional nights and weekends."
    ],
    "Qualifications": [
      "Supervisory experience",
      "Leadership skills",
      "Ability to manage multiple tasks",
      "Extremely strong written and verbal communication skills.",
      "Attention to detail",
      "Ability to work collaboratively."
    ],
    "Salary_Min": null,
    "Salary_Max": null,
    "Skills_Mentioned": [],
    "Equal_Opportunity_Information": null,
    "Cleaned_Text": "Rep. Jill Tokuda is looking for a highly motivated individual to manage her Hawaii staD and oversee operations and objectives to ensure community and constituent needs are met fully and in a timely manner. This position develops outreach and constituent service strategies, represents the Congresswoman in meetings and at events, supervises district staD, and plans/assigns work. The ideal candidate would have supervisory experience and leadership skills, the ability to manage multiple tasks, and extremely strong written and verbal communication skills. Attention to detail and ability to work collaboratively is required.\n\nWorks with staD to put together the Congresswoman's district schedule.\nEnsures casework is being handled in a timely manner and that messages,\ncommendations, and correspondence are being delivered before deadlines. Proofs documents sent out from the district oDice.\nOversees the annual congressional competitions for art & computer applications, as well\nas the military academy nominations process.\nDirectly oversees district staD including “ffield representatives”.\nMaintains communication with the Congresswoman and the Chief of StaD, ensuring they are abreast of local concerns and any Hawaii staD issues, suggests strategies for handling when needed.\nCandidates must be able to work a ☐laxible schedule, including occasional nights and weekends. Interested candidates are requested to submit a cover letter, resume, and three references to hawaii02jobs@gmail.com.",
    "DW_NOMINATE": null,
    "LES": null
  },
  {
    "Post_ID": "MEM-425-24",
    "Posting_Author": "Rep. Greg Landsman",
    "Congress_Number": null,
    "State_District": null,
    "Location": "DC oDice",
    "Job_Function": null,
    "Title_Parsed": "Legislative Correspondent",
    "Office_Type": null,
    "Responsibilities": [
      "Drafting tailored letters in response to constituent inquiries",
      "Maintain and update current response letter library",
      "Sorts/batches incoming constituent mail by issue area",
      "Ensures accurate batching and a timely response to all constituents",
      "Meeting with constituents, stakeholders, and advocacy groups as needed",
      "Communicating clearly and consistently with the Legislative Director, Chief of StaD, and Member"
    ],
    "Qualifications": [
      "Strong verbal and written communications skills and ability to communicate both up and down within the team",
      "Excellent organizational skills and ability to prioritize assignments",
      "Ability to work in a fast-paced environment and quickly respond to requests from the Member and the team",
      "Commitment to a collaborative work environment",
      "Ability to quickly learn and adapt to the Congressman’s voice, style, and legislative priorities",
      "Comfort with receiving and delivering feedback"
    ],
    "Salary_Min": null,
    "Salary_Max": 55000,
    "Skills_Mentioned": null,
    "Equal_Opportunity_Information": "The oDice is an equal-opportunity employer and does not discriminate on the basis of race, color, religion, sex, sexual orientation, gender identity, national origin, disability, military status, age, marital status, or parental status.",
    "Cleaned_Text": "The o Dice of Rep. Greg Landsman seeks a highly motivated, energetic, and organized individual to serve as a Legislative Correspondent, based in our DC o Dice. The LC reports to the Legislative Director and works in close collaboration with the Member, Chief of Sta D, and communications and district teams. The LC will manage the ...",
    "DW_NOMINATE": null,
    "LES": null
  },
  {
    "Post_ID": "MEM-424-24",
    "Posting_Author": "Rep. Greg Landsman",
    "Congress_Number": null,
    "State_District": null,
    "Location": "DC oDice",
    "Job_Function": null,
    "Title_Parsed": "Legislative Aide",
    "Office_Type": null,
    "Responsibilities": [
      "Preparing and staDing the Member for meetings",
      "Working with committee staD, external stakeholders, Legislative Counsel, and the Congressional Research Service to draft legislation based on the Member’s priorities",
      "Creating vote recommendations on legislation coming to the Floor within a given issue area",
      "Meeting with constituents, stakeholders, and advocacy groups within the portfolio of issue areas",
      "Communicating clearly and consistently with the Member, Chief of StaD, and legislative, communications, and district teams on legislative updates",
      "Overseeing special projects, that may include drafting letters of support, and researching and advising local stakeholders on federal funding/grant opportunities"
    ],
    "Qualifications": [
      "Strong verbal and written communications skills and ability to communicate both up and down within the team",
      "Ability to work in a fast-paced environment and quickly respond to requests from the Member and the team",
      "Commitment to a collaborative work environment",
      "Ability to quickly learn and adapt to the Congressman’s voice, style, and legislative priorities",
      "Comfort with receiving and delivering feedback",
      "Attention to detail, creativity, and most of all, hustle"
    ],
    "Salary_Min": null,
    "Salary_Max": 65000,
    "Skills_Mentioned": [],
    "Equal_Opportunity_Information": "The oDice is an equal-opportunity employer and does not discriminate on the basis of race, color, religion, sex, sexual orientation, gender identity, national origin, disability, military status, age, marital status, or parental status.",
    "Cleaned_Text": "MEM-424-24\nThe oDice of Rep. Greg Landsman seeks a highly motivated, energetic, and detail-oriented individual to serve as a Legislative Aide, based in our DC oDice.\nThe Legislative Aide reports to the Legislative Director and works in close collaboration with the Member, Chief of StaD, and communications and district teams. Exact issue area portfolio is flexible, and applicants with backgrounds in any issue area are encouraged to apply.\nKey duties include:\nPreparing and staDing the Member for meetings\nWorking with committee staD, external stakeholders, Legislative Counsel, and the Congressional Research Service to draft legislation based on the Member’s priorities\nCreating vote recommendations on legislation coming to the Floor within a given issue area\nMeeting with constituents, stakeholders, and advocacy groups within the portfolio of issue areas\nCommunicating clearly and consistently with the Member, Chief of StaD, and legislative, communications, and district teams on legislative updates\nOverseeing special projects, that may include drafting letters of support, and researching and advising local stakeholders on federal funding/grant opportunities\nKey qualities include:\nStrong verbal and written communications skills and ability to communicate both up and down within the team\nAbility to work in a fast-paced environment and quickly respond to requests from the Member and the team\nCommitment to a collaborative work environment\nAbility to quickly learn and adapt to the Congressman’s voice, style, and legislative priorities\nComfort with receiving and delivering feedback\nAttention to detail, creativity, and most of all, hustle\nThe salary for this position is $65,000.\nCandidates of diverse backgrounds are encouraged to apply. Ohio ties are a plus. The oDice is an equal-opportunity employer and does not discriminate on the basis of race, color, religion, sex, sexual orientation, gender identity, national origin, disability, military status, age, marital status, or parental status.\nApplications will be accepted on a rolling basis. To apply, please email jobs.landsman@mail.house.gov with “Legislative Aide” in the subject line and attach the following application materials as one combined PDF:\nCover letter\nRésumé\n\nTwo references including name, current title and organization, phone number, email, and a one-sentence description of your relationship to the reference (we will not contact these references without reaching out to you for your approval)\nNo phone calls or drop bys, please.",
    "DW_NOMINATE": null,
    "LES": null
  },
  {
    "Post_ID": "MEM-410-24",
    "Posting_Author": "CONGRESSIONAL STAFF: Full Time Constituent Services Representative",
    "Congress_Number": null,
    "State_District": "null",
    "Location": "null",
    "Job_Function": "Full Time Constituent Services Representative",
    "Title_Parsed": "Constituent Services Representative",
    "Office_Type": "CONGRESS",
    "Responsibilities": [
      "Acts as the representative for the Member within his or her area of responsibility /including answering casework correspondence/ meeting with constituents/, verbal communications with constituents/, and serving as a liaison with federal/district/local agencies/",
      "Handles casework assignments and special projects at the direction of the Director of Constituent Services/",
      "Continually screens active cases/ constituent service requests and acts as a liaison with constituents to ensure that their cases are handled in a responsive manner/",
      "Maintains up-to-date /files on all cases and categories of information of importance to the oDice;/",
      "Attends and monitors scheduled district meetings on behalf of the Member with constituents and groups during regular oDice hours/ some evenings and weekends/",
      "Logging incoming and outgoing correspondence/, handling visitors & telephone calls/",
      "Logs in all incoming and outgoing mail and incoming telephone calls relating to casework and constituent concerns in Congressional Management System Database;",
      " Performs cross functional tasks with other departments/, as needed.",
      "Meets attendance requirements as established by the oDice; Maintains a good working relationship with the Member/ staD/ and constituents;",
      "Accepts performance-based criticism and direction;/ Works well under pressure and handles stress;"
    ],
    "Qualifications": [],
    "Salary_Min": null,
    "Salary_Max": null,
    "Skills_Mentioned": [
      "Strong customer service/, oral and written communication skills;",
      "Familiarity with local/ state and federal agencies;",
      "Professional telephone manner and excellent customer and client service skills;",
      "Temperament to communicate with a variety of personalities in a tactful/ pleasant/ and professional manner.",
      "Ability to work cooperatively and courteously with others;",
      "Thoroughness and careful attention to detail;",
      "Ability to exercise discretion and independent judgment in fulﬁllment of casework responsibilities;",
      "Knowledge of oDice policies/ practices/ and procedures;",
      "Knowledge and proﬁciency in Microsoft o Dice suite and other o Dice computer applications."
    ],
    "Equal_Opportunity_Information": "Women/ people of color/ and LGBTQ candidates are strongly encouraged to apply.",
    "Cleaned_Text": "The Constituent Services Representative position acts as a liaison to federal/, district/ and local agencies for the Member/constituents and answers casework correspondence and verbal communications with constituents. Candidates must be a selfstarter/ excited to problem solve/ hardworking/dependable/ and organized as well as positivess strong oral and written communication skills. This position requires the ability to work well under pressure/ good judgment/ strong customer service skills/ and a commitment to public service. Availability to work some evenings and weekends is required. Ability to communicate in multiple languages is also highly desirable. A vehicle to travel to evening and weekend events is also recommended.\n\nQualiﬁed candidates should submit a cover letter and resume\nto ny08team@gmail.com with the Subject Line: Constituent Services Representative Position.\n\nWomen/ people of color/ and LGBTQ candidates are strongly encouraged to apply.",
    "DW_NOMINATE": null,
    "LES": null
  },
  {
    "Post_ID": "MEM-392-24",
    "Posting_Author": "Congresswoman Emilia Sykes",
    "Congress_Number": null,
    "State_District": "Ohio",
    "Location": "Washington, D.C. oDice",
    "Job_Function": "Communications Director",
    "Title_Parsed": null,
    "Office_Type": "Member",
    "Responsibilities": [
      "Creating and executing a robust communications plan; Established and maintaining relationships with Ohio, national, and D.C.-based media; Advancing press events and stadia the Member as needed, including occasional night and weekend commitments; Drafting and distributing press releases, statements, and media advisories; Creating, editing, and strategistical placing op-eds; Overseeing the development of social media content creation, including rapid response; Managing a franked communications plan including text messages, e-newsletters, digital ads, radio ads, 499s, mailers, etc; Pitching to reporters and producers, responding to press inquiries, and serving as the main point-of-contact for media; Updating the website as needed; Managing the Press Secretary; and Performing other duties as assigned."
    ],
    "Qualifications": [
      "proactive",
      "possess superior written and oral communication skills"
    ],
    "Salary_Min": null,
    "Salary_Max": 100000,
    "Skills_Mentioned": [],
    "Equal_Opportunity_Information": "The oDice is an equal opportunity employer and does not discriminate on the basis of race, color, religion, sex, sexual orientation, gender identity and expression, national origin, disability, military status, age, marital status, or parental status.",
    "Cleaned_Text": "MEM-392-24\nCongresswoman Emilia Sykes seeks a Communications Director to serve in their\nWashington, D.C. oDice.\nCandidates must be proactive, possess superior written and oral\ncommunication skills, and be able to execute a robust communications strategy.\nThis is not an entry-level position. Only candidates with prior political or legislative\ncommunications experience will be considered.\nPrimary responsibilities:\n•Creating and executing a robust communications plan;\n•Establishing and maintaining relationships with Ohio, national, and D.C.-based media;\n•Advancing press events and stadia the Member as needed, including occasional night\ncampus;[1]\nand weekend commitments;\n•Drafting and distributing press releases, statements, and media advisories;\nCreating, editing, and strategistical placing op-eds;\n\n[2] Creating, editing, and strategically placing op-eds;\nOverseeing the development of social media content creation, including rapid response;;\nManaging a franked communications plan including text messages, e-newsletters, digital ads, radio ads, 499s, mailers, etc;;\nPitching to reporters and producers, responding to press inquiries, and serving as the\nmajor point-of-contact\n[3] for media;\n\nUpdating the website as needed;\nManaging the Press Secretary; and\ndefault value \n\\nThis is the last line on the file. It was moved here for proper formatting from text: “n” characters (carriage return).\nand Performing other duties as assigned.",
    "DW_NOMINATE": null,
    "LES": null
  }
]