[
  {
    "Post_ID": "MEM-093-25",
    "Posting_Author": "Congressman Darrell Issa",
    "Congress_Number": null,
    "State_District": "CA-48",
    "Location": "Washington, D.C.",
    "Job_Function": "Legal Fellow",
    "Title_Parsed": "Legal Fellow – Congressman Darrell Issa",
    "Office_Type": "Internship",
    "Responsibilities": [
      "Assisting the Congressman's Judiciary team with legislative research",
      "memo drafting",
      "preparing materials for upcoming hearings for the Subcommittee on the Courts, Intellectual Property, Artificial Intelligence, and the Internet",
      "his work on the Antitrust Subcommittee and full Judiciary Committee"
    ],
    "Qualifications": [
      "critical thinking skills",
      "political acumen",
      "discretion",
      "timeliness",
      "strong analytical skills",
      "ability to work in a fast-paced environment",
      "understanding of schooling needs"
    ],
    "Salary_Min": null,
    "Salary_Max": 50000,
    "Skills_Mentioned": null,
    "Equal_Opportunity_Information": "This program is sponsored by an Equal Employment Opportunity employer, and is open to all qualified candidates.",
    "Cleaned_Text": "A Legal Fellow with the Office of Congressman Darrell Issa (CA-48) in Washington, D.C. will assist the Congressman's Judiciary team with legislative research, memo drafting, and preparing materials for upcoming hearings for the Subcommittee on the Courts, Intellectual Property, Artificial Intelligence, and the Internet, as well as his work on the Antitrust Subcommittee and full Judiciary Committee.",
    "DW_NOMINATE": 0.4779999852180481,
    "LES": 3.118403196334839
  },
  {
    "Post_ID": "MEM-092-25",
    "Posting_Author": "The Office of Congresswoman Sydney Kamlager-Dove (CA-37)",
    "Congress_Number": null,
    "State_District": "CA-37",
    "Location": "Washington, D.C.",
    "Job_Function": null,
    "Title_Parsed": null,
    "Office_Type": null,
    "Responsibilities": [
      "support the Congresswoman’s policy work primarily related to her involvement on the House Judiciary Committee",
      "Support the legislative team with policy research and writing",
      "Draft memoranda and briefs",
      "Prepare the Congresswoman and members of staff for meetings and hearings with",
      "Work on other administrative tasks and duties as assigned",
      "Answer phones and assist in correspondence with constituents"
    ],
    "Qualifications": [
      "JD",
      "interest in the legislative process and civic service",
      "excellent writing, research, organization, time management, and communication skills",
      "work well in a fast-paced, team environment",
      "be detail-oriented and self-starters",
      "have a general understanding of the US political system"
    ],
    "Salary_Min": null,
    "Salary_Max": null,
    "Skills_Mentioned": [
      "null"
    ],
    "Equal_Opportunity_Information": "The Office of Congresswoman Sydney Kamlager-Dove (CA-37) is an Equal Opportunity Employer.",
    "Cleaned_Text": "{{",
    "DW_NOMINATE": -0.5479999780654907,
    "LES": 0.4336842596530914
  },
  {
    "Post_ID": "MEM-091-25",
    "Posting_Author": "Congresswoman Susie Lee",
    "Congress_Number": null,
    "State_District": null,
    "Location": "Washington, D.C.",
    "Job_Function": null,
    "Title_Parsed": "Summer 2025 Interns for the Washington, D.C. office",
    "Office_Type": "Full-time",
    "Responsibilities": [
      "answering phones",
      "managing the front office",
      "assisting legislative staff with research",
      "assisting the communications teams"
    ],
    "Qualifications": [
      "successfully working under deadlines",
      "being organized",
      "hard-working",
      "detail-oriented",
      "having excellent customer service skills",
      "being a team player"
    ],
    "Salary_Min": null,
    "Salary_Max": null,
    "Skills_Mentioned": [
      "Nevada ties"
    ],
    "Equal_Opportunity_Information": "None specified",
    "Cleaned_Text": "The office of Congresswoman Susie Lee is seeking full-time, Summer 2025 Interns for the Washington, D.C. office. Responsibilities will include answering phones, managing the front office,\nassisting legislative staff with research, assisting the communications teams\nwith drafting, and other tasks as assigned. Successful candidates work well under\ndeadlines, are organized, hard-working, detail-oriented, have excellent customer service skills, \nadare team players. Nevada ties are strongly preferred. Interns will be eligible for a monthly stipend. Interested candidates should send a resume, cover letter, \nand 2 writing samples to NV03Resumes@gmail.com with“Summer 2025 DC Intern - [Last Name], [First Name]”\ndisplayed successfully.",
    "DW_NOMINATE": null,
    "LES": null
  },
  {
    "Post_ID": "MEM-090-25",
    "Posting_Author": "Representative Diana Harshbarger",
    "Congress_Number": 1,
    "State_District": "TN-01",
    "Location": "Washington, D.C.",
    "Job_Function": "Press/Digital Intern",
    "Title_Parsed": null,
    "Office_Type": "Legislator's Office",
    "Responsibilities": [
      "Assist in drafting press releases, media advisories, talking points, and social media content.",
      "Monitor news coverage and compile daily press clips.",
      "Help manage the Member’s social media accounts, including drafting and scheduling posts.",
      "Track media requests and assist in preparing responses.",
      "Conduct research to support press and communications initiatives.",
      "Assist with the production of digital content, including graphics and videos.",
      "Attend and take notes at press events, briefings, and hearings as needed.",
      "Perform administrative tasks to support the communications team."
    ],
    "Qualifications": [
      "Strong writing, editing, and research skills.",
      "A keen interest in conservative politics, media, and policy issues.",
      "Experience with social media platforms (Twitter/X, Facebook, Instagram) and digital content creation.",
      "Ability to work in a fast-paced environment and handle multiple tasks.",
      "A positive attitude, strong work ethic, and attention to detail."
    ],
    "Salary_Min": null,
    "Salary_Max": null,
    "Skills_Mentioned": [
      "Social Media",
      "Graphics and Video Editing"
    ],
    "Equal_Opportunity_Information": "Congressman Harshbarger’s internship program complies with equal opportunity requirements ofTitle IV of the Civil Rights Act of 1964. All qualified applicants will receive consideration for internships without regard to racial or ethnic content, political views, or any other protected characteristics.",
    "Cleaned_Text": "MEM-090-25Representative Diana Harshbarger (R-TN-01) seeks a highly motivated and detail-oriented Press/Digital Intern to join their Washington, D.C. office...\n\n  This position offers an excellent opportunity for hands-on experience in political communications, media relations, and public messaging on Capitol Hill.\nThis intern will work directly with, and report to the Communications Director.\n\n General hours are 9:00 AM to 6:00 PM when Congress is in session and 9:00 AM to 5:00 PM when it is not.\nInterested applicants must submit a PDF file containing a cover letter and resume to be considered. As a bonus, applicants may submit additional materials with examples of digital work or writing samples. This must all be emailed to sam.somogye@mail.house.gov and holly.lay@mail.house.gov with the subject line, “Press/Digital Internship Application — [Your Name]”",
    "DW_NOMINATE": null,
    "LES": null
  },
  {
    "Post_ID": "MEM-089-25",
    "Posting_Author": "Congresswoman Dina Titus (NV-01)",
    "Congress_Number": null,
    "State_District": "NV-01",
    "Location": null,
    "Job_Function": null,
    "Title_Parsed": "",
    "Office_Type": "D.C.",
    "Responsibilities": null,
    "Qualifications": null,
    "Salary_Min": null,
    "Salary_Max": null,
    "Skills_Mentioned": null,
    "Equal_Opportunity_Information": "equal opportunity employer and does not discriminate on the basis of race, color, religion, sex, sexual orientation, gender identity and expression, national origin, disability, military status, age, marital status, or parental status.",
    "Cleaned_Text": "MEM-089-25Congresswoman Dina Titus (NV-01) seeks highly motivated Legislative Interns in our D.C. office for the Summer 2025 semester.\nInterns in our D.C. office will have the opportunity to witness the legislative process and the inner workings of Capitol Hill first-hand. Responsibilities include but are not limited to\nanswering constituent phone calls, attending policy briefings and meetings, providing\ntours of the United States Capitol, and conducting legislative research to support the\nneeds of the Congresswoman's staff. The internship will run from June through August,\nfrom 9 am-6 pm when Congress is in session and from 9 am-5 pm when Congress is not in\nsession.\nThe ideal candidate possesses excellent oral and written communication skills, prioritizes\nprofessionalism, is a dedicated team player, and has a friendly persona. Ties to Nevada's\nFirst District are a plus, but not required. The office of Congresswoman Dina Titus is an\nequal opportunity employer and does not discriminate on the basis of race, color, religion,\ngender, sex, sexual orientation, gender identity and expression, national origin, disability,\nmilitary status, age, marital status, or parental status.\nHow to Apply:\nInterested applicants should fill out the form below and include a cover letter, resume, and\nshort (1-2 page) writing sample. Applications will be accepted until Friday, April 4th, 2025,\non a rolling basis.\nhttps://airtable.com/app96r3qMaOs2fQgs/shrGFvZ6jej2Q7eDg",
    "DW_NOMINATE": null,
    "LES": null
  },
  {
    "Post_ID": "MEM-075-25",
    "Posting_Author": null,
    "Congress_Number": null,
    "State_District": null,
    "Location": null,
    "Job_Function": null,
    "Title_Parsed": null,
    "Office_Type": null,
    "Responsibilities": [
      "Attending committee hearings and congressional briefings",
      "Conducting policy research and drafting legislative materials",
      "Authoring constituent correspondence on a range of policy issues",
      "Answering phones and processing mail",
      "Leading constituents on tours of the Capitol",
      "Working on other administrative and legislative tasks, as directed"
    ],
    "Qualifications": [
      "high school graduates",
      "undergraduate students",
      "graduate students",
      "recent graduates"
    ],
    "Salary_Min": null,
    "Salary_Max": null,
    "Skills_Mentioned": null,
    "Equal_Opportunity_Information": null,
    "Cleaned_Text": "Congressman Mike Levin (CA-49) seeks Interns for his Washington, D.C., office for the Summer 2025 term.\n\nThese internships provide an opportunity for undergraduate students, graduate students,·\nand recent graduates to learn more about the workings of a Congressional office and the legislative process. Interns should have a general understanding of the U.S. political system, value open communication, be eager to grow, and bring a can-do attitude.\n\nInternships last approximately three to four months and are intended to be an educational experience. Internships are offered for either academic credit or a stipend. Internship applicants must be high school graduates. Current students and recent graduates will be given first priority for the internship program.\n\nLegislative intern responsibilities include:\n• Attending committee hearings and congressional briefings,\n• Conducting policy research and drafting legislative materials,\n• Authoring constituent correspondence on a range of policy issues,\n• Answering phones and processing mail,\n• Leading constituents on tours of the Capitol,\n• Working on other administrative and legislative tasks, as directed.\n\nPress intern responsibilities include:\n• Assisting the Communications Director and Digital Manager/Press Secretary in drafting\nand editing social media content, digital graphics, and other digital materials,\n• Drafting press releases, newsletters, remarks, and talking points,\n• Compiling daily press clips and maintaining press lists,\n• Answering phones and processing mail,\n• Leading constituents on tours of the Capitol,\n• Working on other administrative and communications-related tasks, as directed.\n\nPress interns should have strong social media skills and basic familiarity with graphic design and video editing. Submission of a sample graphic or similar communications work with your application is strongly encouraged.\n\nThis office is an equal opportunity employer; we do not discriminate on the basis of race,\ncolor, religion, sex, national origin, age, disability, gender identity or expression, or sexual\norientation. We deeply value the diversity of our employees and encourage candidates from diverse backgrounds to apply.\n\nTo apply for an internship with Representative Levin, please email a cover letter, resume, three references, and a brief writing sample all in one pdf file, with the file name including internship class, year, last name, and first name (i.e. Summer2025.Doe.Jane.pdf)\nto CA49.DCInternships@mail.house.gov by March 15, 2025. Please specify whether you\nare applying for the press internship or the legislative internship. Applicants with strong ties to the 49th District are given preference.",
    "DW_NOMINATE": null,
    "LES": null
  },
  {
    "Post_ID": "MEM-070-25",
    "Posting_Author": "Sydney Kamlager-Dove",
    "Congress_Number": 37,
    "State_District": "CA",
    "Location": "Washington, D.C.",
    "Job_Function": "Congressional Intern",
    "Title_Parsed": null,
    "Office_Type": "Congresswoman",
    "Responsibilities": [
      "Answer phones and assist in correspondence with constituents",
      "Greet constituents and office visitors",
      "Process tour requests and lead Capitol tours",
      "Handle mail",
      "Perform legislative research and draft memos",
      "Assist the Communications Director and Press Assistant in drafting social media content and other materials like press releases, website content, and newsletters",
      "Compile daily press clips"
    ],
    "Qualifications": [
      "An interest in the legislative process and civic service",
      "Excellent writing, research, organization, time management, and communication skills",
      "Ability to work well in a team environment",
      "General understanding of the US political system",
      "Weekly available hours to dedicate during internship term"
    ],
    "Salary_Min": null,
    "Salary_Max": null,
    "Skills_Mentioned": [],
    "Equal_Opportunity_Information": "We are an equal opportunity employer.",
    "Cleaned_Text": "",
    "DW_NOMINATE": null,
    "LES": null
  },
  {
    "Post_ID": "MEM-069-25",
    "Posting_Author": "The Office of Congresswoman Grace Meng (NY-06)",
    "Congress_Number": null,
    "State_District": "NY-06",
    "Location": "Washington D.C. office",
    "Job_Function": null,
    "Title_Parsed": "Intern",
    "Office_Type": null,
    "Responsibilities": [
      "answering phones",
      "running errands",
      "giving Capitol tours",
      "researching legislation for the Member and legislative staff",
      "attending hearings and briefings",
      "answering constituent letters on various issues before the House"
    ],
    "Qualifications": null,
    "Salary_Min": null,
    "Salary_Max": null,
    "Skills_Mentioned": null,
    "Equal_Opportunity_Information": null,
    "Cleaned_Text": "nThe Office of Congresswoman Grace Meng (NY-06) seeks candidates for paid Summer 2025 internship positions in the Washington D.C. office.\n\nIntern responsibilities will vary and are designed to give interns insight into the legislative process and a well-rounded experience on Capitol Hill. Some duties include answering phones, running errands, giving Capitol tours, researching legislation for the Member and legislative staff, attending hearings and briefings, and answering constituent letters on various issues before the House.\n\nThis internship will run from May/June to August. Hours are flexible to accommodate students' course schedules, but generally run from Monday to Friday, 9:00am to 5:00pm.\n\nApplications for the Summer semester will be considered on a rolling basis. Priority will be given to applicants who apply before March 15th. Interested applicants should email a resume, cover letter, writing sample, and their availability\n\nto ny06_intern_app@mail.house.gov. Please include your name and the semester for which you are applying in the subject line.",
    "DW_NOMINATE": null,
    "LES": null
  },
  {
    "Post_ID": "MEM-068-25",
    "Posting_Author": null,
    "Congress_Number": null,
    "State_District": "NJ-01",
    "Location": null,
    "Job_Function": null,
    "Title_Parsed": null,
    "Office_Type": "The Office of Representative Donald Norcross",
    "Responsibilities": [
      "assisting staff with legislative, administrative, constituent relations, scheduling, and communications activities"
    ],
    "Qualifications": [],
    "Salary_Min": null,
    "Salary_Max": null,
    "Skills_Mentioned": null,
    "Equal_Opportunity_Information": "The U.S. House of Representatives is an Equal Opportunity Employer",
    "Cleaned_Text": "The Office of Representative Donald Norcross (NJ-01) is seeking motivated candidates for the Summer 2025 Internship program.\n\nIntern responsibilities will include but are not limited to assisting staff with legislative, administrative, constituent relations, scheduling, and communications activities. Interns\nwill answer phones; sort, distribute, and respond to constituent mail; attend hearings and briefings; assist with legislative research; compile daily clips; and participate in\nprofessional development activities.\n\nSuccessful candidates will demonstrate that they are organized, detail-oriented, and professional. Strong written and oral communication skills are essential.\n\nInterns receive a stipend.\nPlease send a resume, cover letter, two or three professional references, and a brief\nwriting sample as one combined PDF to internships.norcross@mail.house.gov. No phone calls or drop-ins, please. Incomplete applications will not be reviewed.",
    "DW_NOMINATE": null,
    "LES": null
  },
  {
    "Post_ID": "MEM-066-25",
    "Posting_Author": "The Office of Representative Chrissy Houlahan (D-PA-06)",
    "Congress_Number": null,
    "State_District": "D-PA-06",
    "Location": "West Chester, Reading, and Washington, D.C. offices",
    "Job_Function": "Legislative Internship",
    "Title_Parsed": "LEGISLATIVE INTERNSHIP: The Office of Representative Chrissy Houlahan (D-PA-06) is accepting applications for Summer 2025 legislative interns in our West Chester, Reading, and Washington, D.C. offices.",
    "Office_Type": null,
    "Responsibilities": [
      "helping constituents",
      "doing research and drafting memos for our legislative staff",
      "staffing the Congresswoman in hearings or meetings"
    ],
    "Qualifications": [
      "prior volunteer experience",
      "leadership experience",
      "work experience",
      "ties to PA-06",
      "community service experience"
    ],
    "Salary_Min": null,
    "Salary_Max": null,
    "Skills_Mentioned": [],
    "Equal_Opportunity_Information": "This office is an equal opportunity employer and does not discriminate based on race, religion, disability, age, ethnicity, national origin, sex, gender, LGBTQ identification, family status, or military status.",
    "Cleaned_Text": "MEM-066-25\nLEGISLATIVE INTERNSHIP: The Office of Representative Chrissy Houlahan (D-PA-06) is ´ accepting applications for Summer 2025 legislative interns in our West Chester, Reading, and Washington, D.C. offices.\nThis internship will run from late May through early August.\nBoth full and part time internships are available, and we offer stipends to students who are ´in need.\nOur internship program has returned to in-person work with flexible telework options should interns need to work from home.\nm Ideal applicants are self-starters who bring a customer service mindset and a passion for community service. Applicants must be intellectually curious, willing to spend a lot of time on the phone and write well.\nResponsibilities range from helping constituents, to doing research and drafting memos for our legislative staff, to staffing the Congresswoman in hearings or meetings. We offer\ninterns the opportunity to see Congress up close and from the inside. Prior volunteer, leadership, and work experience are a plus. Ties to PA-06 are also a plus.\nPlease submit applications through the \\u201CLegislative Internship\\u201D form our website, Houlahan.house.gov.\nDue to a high volume of applicants, you will likely only be contacted if you are ´selected for an interview. This office is an equal opportunity employer and does not discriminate based on race, religion, disability, age, ethnicity, national origin, sex, gender, LGBTQ identification, family status, or military status.\nWomen, people of color, and other\nmembers of traditionally underrepresented communities are strongly encouraged to ´apply.\nThe text was further cleaned into: \\u201cThis office is an equal opportunity employer and does not discriminate\\u201d which resulted in a value of \\u201cThis office is an equal opportunity employer and does not discriminate based on race, religion, disability, age, ethnicity, national origin, sex, gender, LGBTQ identification, family status, or military status.”\\n",
    "DW_NOMINATE": null,
    "LES": null
  },
  {
    "Post_ID": "MEM-065-25",
    "Posting_Author": null,
    "Congress_Number": null,
    "State_District": "PA-06",
    "Location": "Washington, D.C., Reading, and West Chester offices",
    "Job_Function": null,
    "Title_Parsed": "Press Intern",
    "Office_Type": "Congress office",
    "Responsibilities": [
      "compiling and distributing press clips",
      "helping draft copy for press and digital materials",
      "developing digital content"
    ],
    "Qualifications": [
      "independent problemsolvers",
      "strong writing skills",
      "experience with graphic design tools or photo editing programs"
    ],
    "Salary_Min": null,
    "Salary_Max": null,
    "Skills_Mentioned": [
      "graphic design tools (Canva, InDesign, Illustrator)",
      "photo editing programs (Photoshop, Lightroom)"
    ],
    "Equal_Opportunity_Information": "This office is an equal opportunity employer and does not discriminate based on race, religion, disability, age, ethnicity, national origin, sex, gender, LGBTQ identification, family status, or military status.",
    "Cleaned_Text": "MEM-065-25 PRESS INTERNSHIP: The Office of Representative Chrissy Houlahan (D-PA-06) is accepting applications for Summer 2025 Press Interns in our Washington, D.C., Reading,...",
    "DW_NOMINATE": null,
    "LES": null
  },
  {
    "Post_ID": "HVAPS_Template_Internships_2025_03_10.txt",
    "Posting_Author": "The Democratic Staff of the House Energy and Commerce Committee",
    "Congress_Number": null,
    "State_District": null,
    "Location": null,
    "Job_Function": "Legislative Intern",
    "Title_Parsed": " Legislators’ Office Intern ",
    "Office_Type": null,
    "Responsibilities": [
      "Answers phones and conducts legislative research.",
      "Answering phones, conducting legislative research, preparing materials for staff and member briefings.",
      "Shadowing the Committee’s staff during Hearings & Markup",
      "Attending Briefings on subjects within the Committee’s broad Jurisdiction",
      "Assisting staff with administrative tasks",
      "Assemblage a thorough understanding of Congressional Committees role to process legislation."
    ],
    "Qualifications": [
      "Organized students.",
      "Recent Grads"
    ],
    "Salary_Min": null,
    "Salary_Max": null,
    "Skills_Mentioned": [],
    "Equal_Opportunity_Information": "All applicants will be considered without regard to race, color, national origin, religion, sex (including marital or parental status), sexual orientation, gender identity, disability, or age.",
    "Cleaned_Text": "",
    "DW_NOMINATE": null,
    "LES": null
  },
  {
    "Post_ID": "MEM-050-25",
    "Posting_Author": "Gwen Moore ( WI-04)",
    "Congress_Number": null,
    "State_District": "WI-04",
    "Location": "The Washington, D.C.",
    "Job_Function": null,
    "Title_Parsed": "Interns for the upcoming Summer 2025 term",
    "Office_Type": "oqice of Congresswoman Gwen Moore",
    "Responsibilities": [
      "answering phones",
      "attending hearings and briefings",
      "drafting and editing constituent correspondence letters",
      "writing memos",
      "conducting research",
      "drafting social media posts",
      "designing graphics",
      "providing support for the day-to-day activities of the oqice"
    ],
    "Qualifications": [
      "resume",
      "cover letter",
      "short writing samples"
    ],
    "Salary_Min": null,
    "Salary_Max": null,
    "Skills_Mentioned": [
      "writing",
      "research",
      "briefings"
    ],
    "Equal_Opportunity_Information": "The Oqice of Congresswoman Moore is an equal opportunity employer. We do not discriminate based on race, ethnicity, gender, sexual orientation, religion, national origin, age, or socioeconomic status.",
    "Cleaned_Text": "MEM-050-25\nThe Washington, D.C.\noffice of Congresswoman Gwen Moore ( WI-04) seeks Interns for the\nupcoming Summer 2025 term.\nResponsibilities include answering phones, attending hearings and briefings,\ndrafting and editing constituent correspondence letters, writing memos, conducting research for the legislative staq, drafting social media posts, designing graphics, and providing support for the day-to-day activities of the office. Interns are paid via a monthly stipend.\nThe O\nc office of Congresswoman Moore is an equal opportunity employer. We do not discriminate based on race, ethnicity, gender, sexual orientation, religion, national origin,\nor socioeconomic status.\nAll are welcome and encouraged to apply.\nInterested applicants should send a resume, cover letter, and two short writing samples to WI04DC.Internships@mail.house.gov. Additionally, applicants should indicate their availability on both an hourly and monthly basis.\nThe deadline to apply is 6:00 PM ET on Friday,\nApril 11\nth,\nor\n2025.",
    "DW_NOMINATE": null,
    "LES": null
  },
  {
    "Post_ID": "MEM-044-25",
    "Posting_Author": "U.S. Congressman Jeff Van Drew (R-NJ-02)",
    "Congress_Number": null,
    "State_District": "NJ-02",
    "Location": "The office of U.S. Congressman Jeff Van Drew's office in Washington D.C.",
    "Job_Function": "/The legislative process/ /Office management/",
    "Title_Parsed": "Intern - Summer Session",
    "Office_Type": "Republican office",
    "Responsibilities": [
      "greeting visitors",
      "answering phones",
      "leading tours of the U.S. Capitol",
      "opening and sorting mail",
      "attending briefings",
      "performing legislative research"
    ],
    "Qualifications": [
      "experience with legislation process",
      "knowledge of Congressional procedures"
    ],
    "Salary_Min": 0,
    "Salary_Max": 1000,
    "Skills_Mentioned": [
      "Legislative research",
      "Office management",
      "Communication"
    ],
    "Equal_Opportunity_Information": null,
    "Cleaned_Text": "MEM-044-25\nThe office of U.S. Congressman Jeff Van Drew (R-NJ-02) is currently accepting applications for part and full-time interns for the summer session. This is a Republican office, and the start date would be as early as May 1st with an end date in early August. This is a paid internship with each intern receiving up to a $1000 stipend depending on availability based on a 40-hour workweek.\nThe internship will offer students and young professionals invaluable experience with our nation’s legislative process. Interns contribute to the daily operations of the office and are\nexpected to act in a reliable, professional manner at all times. Duties include (but are not\nto): greeting visitors, answering phones, leading tours of the U.S. Capitol, opening and sorting mail, attending briefings, performing legislative research, and various other\ntasks to assist staff.\nIf interested, please email a resume and cover letter to nj02internships@mail.house.gov.\nPlease indicate in your cover letter that you’re applying for a fall internship and format the\nfiles as [Full Name_Resume], [Full Name_Cover Letter].",
    "DW_NOMINATE": null,
    "LES": null
  },
  {
    "Post_ID": "MEM-041-25",
    "Posting_Author": "Washington, D.C. Office of Congressman Steve Cohen (D-TN-09)",
    "Congress_Number": null,
    "State_District": null,
    "Location": null,
    "Job_Function": ", government office internships or student fellowships",
    "Title_Parsed": "government office internship",
    "Office_Type": "in-person opportunity",
    "Responsibilities": [
      "Assist with constituent correspondence and draft email blasts and other forms of outreach.",
      "Attend virtual briefings and track virtual hearings.",
      "Conduct weekly legislative assignments.",
      "Conduct legislative research on an as-needed basis."
    ],
    "Qualifications": [
      "Demonstrated interest in politics, policy and/or public service.",
      "Strong communications and writing skills.",
      "Hard-working, dependable, detail-oriented and professional.",
      "Self-motivated",
      "Ties to Tennessee’s 9th District are a bonus, but not required."
    ],
    "Salary_Min": null,
    "Salary_Max": null,
    "Skills_Mentioned": [
      "",
      ""
    ],
    "Equal_Opportunity_Information": "The official website of Congressman Steve Cohen is www.housegovernor.com",
    "Cleaned_Text": "Internships for the summer of 2025; This position offers an opportunity to learn about the U.S. House of Representatives and gain substantive work experience in an exciting and fast-paced office. Full-time availability is preferred; ties to Tennessee’s 9th District are preferred but not required. Interns will assist with constituent correspondence, attend virtual briefings and track virtual hearings, conduct weekly legislative assignments and conduct legislative research as needed.",
    "DW_NOMINATE": null,
    "LES": null
  },
  {
    "Post_ID": "MEM-039-25",
    "Posting_Author": "Congressman Cory Mills’ (FL-07)",
    "Congress_Number": null,
    "State_District": null,
    "Location": "Washington, D.C. office",
    "Job_Function": null,
    "Title_Parsed": "",
    "Office_Type": null,
    "Responsibilities": [
      ""
    ],
    "Qualifications": [
      ""
    ],
    "Salary_Min": null,
    "Salary_Max": null,
    "Skills_Mentioned": [],
    "Equal_Opportunity_Information": null,
    "Cleaned_Text": "",
    "DW_NOMINATE": null,
    "LES": null
  }
]