[
  {
    "Post_ID": "MEM-171-25",
    "Posting_Author": "U.S. Congressman Jeff Van Drew (Republican-NJ-02)",
    "Congress_Number": null,
    "State_District": "NJ-02",
    "Location": "Washington, D.C.",
    "Job_Function": "Internship",
    "Title_Parsed": "full and part-time intern",
    "Office_Type": "Conservative office",
    "Responsibilities": [
      "greeting visitors",
      "answering phones",
      "leading tours of the Capitol",
      "opening and sorting mail",
      "attending briefings",
      "performing legislative research"
    ],
    "Qualifications": [
      "students requesting credit for their internship through their university"
    ],
    "Salary_Min": null,
    "Salary_Max": null,
    "Skills_Mentioned": [],
    "Equal_Opportunity_Information": null,
    "Cleaned_Text": "The office of U.S. Congressman Jeff Van Drew (Republican-NJ-02) is currently accepting applications for his Washington, D.C. office for full and part-time interns for the fall internship session. This is a conservative office, so each intern will be required to express the Congressman's conservative perspective to constituents and people who call into the office. The start date would be as early as August 6th (flexible depending on availability) with a flexible end date. Interns are paid a stipend based on availability and have access to transit benefits. The internship will offer students and young professionals invaluable experience with our nationâ€™s legislative process. Interns contribute to the daily operations of the office and are expected to act in a reliable, professional manner at all times. Duties include (but not to): greeting visitors, answering phones, leading tours of the Capitol, opening and sorting mail, attending briefings, performing legislative research, and various other tasks to assist staff. Congressman Van Drew supports students requesting credit for their internship through their university.",
    "DW_NOMINATE": null,
    "LES": null
  }
]