[
  {
    "Post_ID": "MEM-507-24",
    "Posting_Author": "Congresswoman Eleanor Holmes Norton (DC-00)",
    "Congress_Number": null,
    "State_District": "DC District",
    "Location": null,
    "Job_Function": "District Intern",
    "Title_Parsed": "Internship in DC District Office",
    "Office_Type": "Offices",
    "Responsibilities": [
      "answer phones",
      "conduct research",
      "assist with constituent casework",
      "engage in constituent correspondence",
      "community outreach",
      "assist with special projects"
    ],
    "Qualifications": [
      "current college undergrad student",
      "graduate student",
      "recent graduate",
      "constituent-oriented internship experience"
    ],
    "Salary_Min": null,
    "Salary_Max": null,
    "Skills_Mentioned": [
      "community outreach",
      "research",
      "constituent relations"
    ],
    "Equal_Opportunity_Information": "All applicants will be considered without regard to race, color, national origin, religion, sex, gender identity, disability, or age.",
    "Cleaned_Text": "The O&ice of Congresswoman Eleanor Holmes Norton (DC-00) is seeking to hire a motivated, detail-oriented, current college undergrad student, graduate student, or recent graduate wishing to gain constituent-oriented internship experience in the DC District Office. District Intern responsibilities include answering phones, conducting research, assisting with constituent casework, engaging in constituent correspondence, community outreach, and assisting with special projects at the discretion of the District Director. As a result, the intern will learn about the important functions of our impactful District o&ice. The term of this internship will be from January 7, 2025, to May 22, 2025. The internship is a paid full-time internship, interns must work at least 30 hours a week and will be provided a travel stipend. Typical hours for internships are Monday through Thursday 9:00 am to 5:00 pm, although hours may be flexible to accommodate students' hectic course schedules.",
    "DW_NOMINATE": null,
    "LES": null
  },
  {
    "Post_ID": "MEM-505-24",
    "Posting_Author": "Robert Garcia",
    "Congress_Number": 42,
    "State_District": "CA",
    "Location": "Washington, D.C.",
    "Job_Function": "",
    "Title_Parsed": "Press Intern",
    "Office_Type": "Congressman's office",
    "Responsibilities": [
      "Compiling daily news clips.",
      "Drafting press releases and other written materials.",
      "Copy editing written materials.",
      "Maintaining press lists.",
      "Clipping committee remarks and cable hits."
    ],
    "Qualifications": [
      "previous experience in communications with attention to detail and deadlines."
    ],
    "Salary_Min": null,
    "Salary_Max": null,
    "Skills_Mentioned": null,
    "Equal_Opportunity_Information": "The o&ice is an equal opportunity employer and does not discriminate on the basis of race, color, religion, sex, sexual orientation, gender identity and expression, national origin, disability, military status, age, marital status, or parental status.",
    "Cleaned_Text": "MEM-505-24 The O&amp;vice of Congressman Robert Garcia (CA-42) is currently hiring for a Paid Part-Time Press Intern position (asap - Spring 2025) to work in the Washington, D.C. o&ice. The Press Intern works closely with the communications team.\n\nPrimary educational opportunities and responsibilities will include:\nCompiled daily news clips.\nDrafting press releases and other written materials.\n\nCopied edited written materials.\nMaintaining press lists.\nClipped committee remarks and cable hits.\nThe ideal candidate must be able to work in a fast-paced environment and have previous experience in communications with attention to detail and deadlines.\nAll qualiﬁed applicants, including candidates of diverse backgrounds, are encouraged to apply. The o&ice is an equal opportunity employer and does not discriminate on the basis of race, color, religion, sex, sexual orientation, gender identity and expression, national origin, disability, military status, age, marital status, or parental status.\nInterested applicants should send a one page resume, 1 sample press release, and 2 relevant sample tweets to sara.guerrero@mail.house.gov and emily.kassnermarks@mail.house.gov with “INTERN APP: Full Name” in the subject line.",
    "DW_NOMINATE": null,
    "LES": null
  },
  {
    "Post_ID": "MEM-499-24",
    "Posting_Author": "Congresswoman Sydney Kamlager-Dove (CA-37)",
    "Congress_Number": null,
    "State_District": "CA-37",
    "Location": "Washington, D.C.",
    "Job_Function": null,
    "Title_Parsed": "Interns for Spring 2025 term",
    "Office_Type": "Legislative OR Press",
    "Responsibilities": [
      "Assist the Communications Director and Press Assistant in drafting social media content and other materials like press releases, website content, and newsletters",
      "Create graphic design posts for social media",
      "Compile daily press clips",
      "Edit video clips",
      "Maintain press lists",
      "Answer phones and assist in correspondence as needed."
    ],
    "Qualifications": [
      "interest in the legislative process and civic service; excellent writing, research, organization, time management, and communication skills; work well in a team environment"
    ],
    "Salary_Min": null,
    "Salary_Max": null,
    "Skills_Mentioned": null,
    "Equal_Opportunity_Information": "We are an equal opportunity employer",
    "Cleaned_Text": "The O&ice of Congresswoman Sydney Kamlager-Dove (CA-37) is seeking interns for our Washington, D.C. o&ice for the Spring 2025 term.\nOur o&ice values open communication, hard work, and creating a collegial environment.\nWe are looking for interns with a can-do attitude who are eager to grow. Interns will have\ngreat opportunities to learn from o&ice sta& and network with others to make the most of\ntheir time with our o&ice!\n\nIntern Expectations:\nCandidates should have an interest in the legislative process and civic service; possess\nexcellent writing, research, organization, time management, and communication skills;\nwork well in a team environment; and have a general understanding of the US political\nsystem.\n\nPress interns can expect to:\n\\tAssist the Communications Director and Press Assistant in drafting social media\ncontent and other materials like press releases, website content, and newsletters\n\\tCreate graphic design posts for social media\n\\tCompile daily press clips\n\\tEdit video clips\n\\tMaintain press lists\n\\tAnswer phones and assist in correspondence as needed.\n\nIn our DC o&ice, you can apply to be EITHER a Legislative OR Press intern. In our Los\nAngeles o&ice, you will be a general o&ice intern.\n\nInternship Dates and Details:\nSpring internships are slated to start early January and go until late April/early May, with\nsome \\\flexibility. Interns are expected to work in person in the o>ice, Monday-Friday 9 a.m.- 5 p.m.\nUnfortunately, we cannot accommodate remote or hybrid internships at this time.\n\nDeadline: Applications must be submitted by 6 p.m. ET on Friday, December 13th\nTo apply: Interested applicants should send their resume, a brief cover letter, a writing\nsample, and a digital sample (in one document) to:\nCA37.internships@mail.house.gov for DC o&ice internship.\nUse the subject line “First name Last name [press] – Spring 2025 internship”",
    "DW_NOMINATE": -0.5479999780654907,
    "LES": 0.4336842596530914
  },
  {
    "Post_ID": "MEM-496-24",
    "Posting_Author": "Congressman French Hill",
    "Congress_Number": null,
    "State_District": "AR02",
    "Location": "Washington, D.C., and Arkansas",
    "Job_Function": "interacting with Arkansans and other visitors",
    "Title_Parsed": null,
    "Office_Type": "Congressman's office",
    "Responsibilities": [
      "interacting with Arkansans and other visitors",
      "conducting legislative research and writing",
      "drafting communications materials",
      "assisting Arkansans with matters before the federal government"
    ],
    "Qualifications": [
      "positive attitude",
      "strong work ethic",
      "exccellent written and oral communication skills",
      "working knowledge of current events",
      "willingness to assist with daily office tasks",
      "social media and other communications experience (optional)"
    ],
    "Salary_Min": null,
    "Salary_Max": null,
    "Skills_Mentioned": [
      " Legislatures and policy topics",
      "daily office tasks (e.g. data processing, information management)",
      "Communication (written oralskills)"
    ],
    "Equal_Opportunity_Information": "The House of Representatives is an equal opportunity employer.",
    "Cleaned_Text": "Congressman French Hill is seeking interns to serve in his offices in Washington D.C and Arkansas. ",
    "DW_NOMINATE": null,
    "LES": null
  },
  {
    "Post_ID": "MEM-491-24",
    "Posting_Author": "Republican O&ice",
    "Congress_Number": null,
    "State_District": null,
    "Location": "none listed (office location not available)",
    "Job_Function": "Government and public policy",
    "Title_Parsed": "The Committee on House Administration",
    "Office_Type": "committee",
    "Responsibilities": [
      "Answering phones"
    ],
    "Qualifications": null,
    "Salary_Min": null,
    "Salary_Max": null,
    "Skills_Mentioned": null,
    "Equal_Opportunity_Information": "The Committee on House Administration is an equal opportunity employer.",
    "Cleaned_Text": "MEM-491-24",
    "DW_NOMINATE": null,
    "LES": null
  },
  {
    "Post_ID": "MEM-489-24",
    "Posting_Author": "The Democratic Sta& of the House Energy and Commerce Committee",
    "Congress_Number": null,
    "State_District": null,
    "Location": "DC Office",
    "Job_Function": "Press Intern",
    "Title_Parsed": null,
    "Office_Type": null,
    "Responsibilities": [
      "Compiling daily press clips",
      "Designing graphics",
      "Editing and captioning videos",
      "Drafting news releases, social media and e-newsletter content",
      "Updating the website",
      "Compiling weekly reports on press and social media results",
      "Taking photos at hearings and events"
    ],
    "Qualifications": [
      "Strong writing and social media skills",
      "Graphic design experience",
      "Desire to create engaging communications content",
      "Knowledge of video editing software (plus)"
    ],
    "Salary_Min": null,
    "Salary_Max": null,
    "Skills_Mentioned": [
      "Video editing software",
      "(plus) graphic design experience"
    ],
    "Equal_Opportunity_Information": "Women, minority, and veteran candidates are highly encouraged to apply.",
    "Cleaned_Text": "The Democratic Sta& of the House Energy and Commerce Committee seeks a motivated and creative part-time or full-time Press Intern for Spring 2025. The press intern will work closely and collaboratively with a fast-paced communications team. Qualiﬁed candidates should have strong writing and social media skills, graphic design experience, and a desire to create engaging communications content. Knowledge of video editing software is a plus.\n\nResponsibilities may include:\n• Compiling daily press clips\n• Designing graphics\n• Editing and captioning videos\n• Drafting news releases, social media and e-newsletter content\n• Updating the website\n• Compiling weekly reports on press and social media results\n• Taking photos at hearings and events\n\nThe intern will receive a stipend during the internship, which will ideally run from January to April 2025.\n\nInterested applicants should submit their resume, cover letter, and one writing sample (no longer than two pages) to InternshipResume.EC@mail.house.gov. In your cover letter, please indicate preferred start/end dates for scheduling purposes and whether you are available to work full-time or part-time. Please put ",
    "DW_NOMINATE": null,
    "LES": null
  },
  {
    "Post_ID": "MEM-483-24",
    "Posting_Author": "The Washington DC Oüce of Congressman Pat Fallon",
    "Congress_Number": null,
    "State_District": null,
    "Location": "Washington, DC",
    "Job_Function": "Internship",
    "Title_Parsed": "No Title Parsed Provided",
    "Office_Type": "Congressional office",
    "Responsibilities": [],
    "Qualifications": [],
    "Salary_Min": null,
    "Salary_Max": null,
    "Skills_Mentioned": [],
    "Equal_Opportunity_Information": "No Equal Opportunity Information Provided",
    "Cleaned_Text": "The Washington DC Oüce of Congressman Pat Fallon is looking for spring 2025 interns.",
    "DW_NOMINATE": null,
    "LES": null
  },
  {
    "Post_ID": "MEM-482-24",
    "Posting_Author": "Congresswoman Doris Matsui",
    "Congress_Number": null,
    "State_District": "California's 7th District",
    "Location": "Washington, D.C.",
    "Job_Function": "Press Intern (Digital Media)",
    "Title_Parsed": "Press Intern (Digital Media)",
    "Office_Type": "Congressional Office",
    "Responsibilities": [
      "Answering phones and data entry",
      "Assisting in researching legislation for the Member and legislative sta&.",
      "Attending brieﬁngs, hearings, and markups",
      "Answering constituent letters on various issues"
    ],
    "Qualifications": [
      "Strong writing, editing, and social media skills",
      "Basic familiarity with graphic design/video editing software",
      "Experience in a press or digital media role (including internships) preferred but not required",
      "Ties to California's 7th District preferred but not required"
    ],
    "Salary_Min": null,
    "Salary_Max": null,
    "Skills_Mentioned": [
      "Graphic Design",
      "Video Editing Software"
    ],
    "Equal_Opportunity_Information": "This o&ice is an equal opportunity employer and does not discriminate based on race, religion, disability, age, ethnicity, national origin, sex, gender, LGBTQ identiﬁcation, family status, or military status.",
    "Cleaned_Text": "Congresswoman Doris Matsui seeks interns for her Washington, D.C. o&ice for the Spring 2025 term. Interns will have a unique opportunity to learn about the legislative process ﬁrst-hand and the many functions of a Congressional o&ice. The Press and Digital Intern will help build out the Congresswoman’s digital and social media presence, with heavy emphasis on creating engaging social media content and graphics.",
    "DW_NOMINATE": null,
    "LES": null
  },
  {
    "Post_ID": "MEM-481-24",
    "Posting_Author": "Congressman Je‗ Van Drew",
    "Congress_Number": 2,
    "State_District": "NJ-02",
    "Location": "The oÎﺟice of Congressman Je‗ Van Drew (NJ-02)",
    "Job_Function": "Internship",
    "Title_Parsed": "Interns",
    "Office_Type": "LEGISLATIVE",
    "Responsibilities": [
      "greeting visitors",
      "answering phones",
      "leading tours of the U.S. Capitol",
      "opening and sorting mail",
      "attending brießcngs",
      "performing legislative research"
    ],
    "Qualifications": [],
    "Salary_Min": null,
    "Salary_Max": null,
    "Skills_Mentioned": [
      "nation's legislative process"
    ],
    "Equal_Opportunity_Information": null,
    "Cleaned_Text": "The o office of Congressman Je‗ Van Drew (NJ-02) is currently accepting applications for part and full-time interns for the spring internship session...",
    "DW_NOMINATE": null,
    "LES": null
  },
  {
    "Post_ID": "MEM-472-24",
    "Posting_Author": null,
    "Congress_Number": null,
    "State_District": "California’s 45th district",
    "Location": "the Washington, D.C. o&ice",
    "Job_Function": null,
    "Title_Parsed": null,
    "Office_Type": null,
    "Responsibilities": [
      "corresponding with constituents",
      "performing research for sta&",
      "giving tours of the Capitol building",
      "attending Congressional hearings",
      "helping prepare for upcoming hearings"
    ],
    "Qualifications": [
      "strong attention to detail and communications skills",
      "a strong interest in learning about the legislative process"
    ],
    "Salary_Min": null,
    "Salary_Max": null,
    "Skills_Mentioned": [],
    "Equal_Opportunity_Information": null,
    "Cleaned_Text": "Winter/spring internships in Congresswoman Michelle Steel’s office will be held in person in the Washington, D.C. office. Schedules are flexible to accommodate academic schedules. Interns are paid on an hourly basis. Start dates would be expected in early to mid-January. Interns would have the chance to gain valuable hands-on experience while serving the constituents of California's 45th district. Interns would be exposed to a wide range of policy areas, including the Congresswoman’s work on the House Ways and Means Committee, Education and Workforce Committee, AI Task Force, and the Select Committee on the Chinese Communist Party. Responsibilities would include corresponding with constituents, performing research for staff, giving tours of the Capitol building, attending Congressional hearings, and helping prepare for upcoming hearings. Interested applicants should send a copy of their resume to Andrew.Weinstock@mail.house.gov. Successful interns have strong attention to detail and communications skills, as well as a strong interest in learning about the legislative process.",
    "DW_NOMINATE": null,
    "LES": null
  }
]