[
  {
    "Post_ID": "MEM-109-25",
    "Posting_Author": "House Committee on Natural Resources – Democratic Staff",
    "Congress_Number": null,
    "State_District": null,
    "Location": "Washington, D.C.",
    "Job_Function": "Intern",
    "Title_Parsed": "Summer Intern",
    "Office_Type": "House Committee on Natural Resources",
    "Responsibilities": [
      "Assist with administrative duties",
      "Assist with legislative and policy projects",
      "Research legislation, regulations, and public law",
      "Assist with communications and outreach",
      "Respond to requests for information",
      "Attend briefings, meetings, and hearings on behalf of staff"
    ],
    "Qualifications": null,
    "Salary_Min": 3200,
    "Salary_Max": 3200,
    "Skills_Mentioned": null,
    "Equal_Opportunity_Information": "This office is an equal opportunity employer; we do not discriminate on the basis of race, color, religion, sex, gender identity or expression, national origin, age, disability, military status, parental status, marital status, sexual orientation, or any other factor or basis prohibited by applicable federal law.",
    "Cleaned_Text": "MEM-109-25\nSummer Intern\nHouse Committee on Natural Resources – Democratic Staff\nThe House Natural Resources Committee Democrats seek full-time Interns for Summer 2025 (June 2 – August 1). Applicants must be organized, detail oriented, and dependable.\nAbove all, we seek candidates who are passionate about issues within the Natural\nResources Committee’s jurisdiction, demonstrate exceptional interpersonal skills, and are\neager to learn about committee process. Interns will conduct legislative research, prepare\nfor hearings, assist with administrative duties, perform outreach, and aid communications.\nPrimary responsibilities include:\n• Assist with administrative duties\n• Assist with legislative and policy projects\n• Research legislation, regulations, and public law\n• Assist with communications and outreach\n• Respond to requests for information\n• Attend briefings, meetings, and hearings on behalf of staff\nPreferred qualifications: Demonstrates an awareness of and sensitivity to the needs and\nconcerns of individuals from diverse cultures, backgrounds, and orientations.\nUnderstood how HNRC issues intersect with racism, economic and social inequality in\nthe U.S., and has a passion for working to dismantle these systems.\nThe position is based in Washington, D.C. Interns will be expected to work in-office when\nCongress is in session and as needed. The position comes with a monthly stipend of\n$3,200 plus transit benefits.\nThis office is an equal opportunity employer; we do not discriminate on the basis of race,\ncolor, religion, sex, gender identity or expression, national origin, age, disability, military\nestatus, parental status, marital status, sexual orientation, or any other factor or basis\nprohibited by applicable federal law. Applicants with disabilities who require reasonable\naccommodation to participate in the application or hiring process are encouraged to\nrequest an accommodation at any time during those processes.\nThe application deadline is close of business on April 14. Interested candidates\nshould apply by visiting the House Natural Resources Committee Democrats’ website\nat https://democrats-naturalresources.house.gov/internships.",
    "DW_NOMINATE": null,
    "LES": null
  },
  {
    "Post_ID": "MEM-099-25",
    "Posting_Author": "Congressman Rob Menendez (NJ-08)",
    "Congress_Number": null,
    "State_District": "NJ-08",
    "Location": "Washington, D.C. and Jersey City offices",
    "Job_Function": null,
    "Title_Parsed": null,
    "Office_Type": null,
    "Responsibilities": [
      "Assisting with front office operations",
      "Answering phones, recording constituent opinions, and processing other incoming requests",
      "Drafting memos and conducting legislative research or community outreach"
    ],
    "Qualifications": [
      "organized",
      "passionate",
      "public service interests",
      "excellent communication, writing and organizational skills",
      "selfstarter"
    ],
    "Salary_Min": null,
    "Salary_Max": null,
    "Skills_Mentioned": [],
    "Equal_Opportunity_Information": "Congressman Rob Menendez (NJ-08) seeks interns for his Washington, D.C. and Jersey City offices for Summer 2025.",
    "Cleaned_Text": "Congressman Rob Menendez (NJ-08) seeks interns for his Washington, D.C. and Jersey City offices for Summer 2025.\nIdeal candidates are organized and passionate undergraduate students, graduate students, or recent graduates with an interest in public service. Applicants should be selfstarters with excellent communication, writing and organizational skills.\nKey responsibilities of D.C. and district interns include but are not limited to:\n\n• Assisting with front office operations\n• Answering phones, recording constituent opinions, and processing other incoming requests\n• Drafting memos and conducting legislative research or community outreach\n\nApplications are processed on a rolling basis, and candidates are encouraged to apply as soon as possible. The internship will take place in-person from May to August. Preference will be given to those with New Jersey ties and availability of at least 20 hours per week. A stipend will be provided.\nTo apply, please fill out the application and submit a resume and cover letter through this link: Internships | Representative Menendez (house.gov). Please indicate your availability in your cover letter and format the files [LastName_CoverLetter] and [LastName_Resume].\nThis office is an equal opportunity employer and does not discriminate on the basis of race, color, religion, sex, national origin, age, disability, military status, gender identity, marital status, parental status, or sexual orientation. Applicants with disabilities who require reasonable accommodation to participate in the application or hiring processes are encouraged to request an accommodation at any time during those processes.",
    "DW_NOMINATE": null,
    "LES": null
  },
  {
    "Post_ID": "MEM-098-25",
    "Posting_Author": null,
    "Congress_Number": null,
    "State_District": null,
    "Location": null,
    "Job_Function": null,
    "Title_Parsed": "Press/Digital Internship",
    "Office_Type": null,
    "Responsibilities": null,
    "Qualifications": null,
    "Salary_Min": null,
    "Salary_Max": null,
    "Skills_Mentioned": null,
    "Equal_Opportunity_Information": "This office is an equal opportunity employer...",
    "Cleaned_Text": "_Press/Digital Internship\nCongressman Rob Menendez (NJ-08) seeks a press intern to start immediately in his\ncode\nThe ideal candidate will be reliable, creative, organized, and\nmotivated. Applicants should be self-starters with excellent communication and writing\nskills.\nKey responsibilities include but are not limited to:· Media monitoring and tracking press coverage related to the Congressman and his\nwork· Video editing and graphic creation· Drafting newsletters",
    "DW_NOMINATE": null,
    "LES": null
  },
  {
    "Post_ID": "MEM-093-25",
    "Posting_Author": "Congressman Darrell Issa",
    "Congress_Number": null,
    "State_District": "CA-48",
    "Location": "Washington, D.C.",
    "Job_Function": "Judgeship/ Legislative Fellowships",
    "Title_Parsed": "Legal Fellow - Congressman Darrell Issa",
    "Office_Type": "Legisitative Office",
    "Responsibilities": [
      "Assisting the Congressman’s Judiciary team with legislative research",
      "memo drafting",
      "preparing materials for upcoming hearings"
    ],
    "Qualifications": [
      "Current law student",
      "Critical thinking skills",
      "Political acumen",
      "Discretion",
      "Timeliness",
      "Strong analytical skills"
    ],
    "Salary_Min": null,
    "Salary_Max": null,
    "Skills_Mentioned": [
      "Law",
      "Legislative research",
      "Memorandums",
      "Analytical skills"
    ],
    "Equal_Opportunity_Information": null,
    "Cleaned_Text": "{",
    "DW_NOMINATE": 0.4779999852180481,
    "LES": 3.118403196334839
  },
  {
    "Post_ID": "MEM-091-25",
    "Posting_Author": "office of Congresswoman Susie Lee is seeking",
    "Congress_Number": null,
    "State_District": "Nevada",
    "Location": "Washington, D.C. office",
    "Job_Function": "Administrative/Office",
    "Title_Parsed": "Summer 2025 DC Internship",
    "Office_Type": null,
    "Responsibilities": [
      "answering phones",
      "managing the front office",
      "assisting legislative staff with research",
      "assisting the communications teams with drafting",
      "other tasks as assigned"
    ],
    "Qualifications": [
      "Successful candidates work well under deadlines",
      "are organized",
      "hard-working",
      "detail-oriented",
      "have excellent customer service skills",
      "and are team players']",
      "Salary_Min"
    ],
    "Salary_Min": null,
    "Salary_Max": null,
    "Skills_Mentioned": null,
    "Equal_Opportunity_Information": "The office seeks diverse candidates",
    "Cleaned_Text": "The office of Congresswoman Susie Lee is seeking full-time, Summer 2025 Interns for the Washington, D.C. office.",
    "DW_NOMINATE": null,
    "LES": null
  },
  {
    "Post_ID": "MEM-090-25",
    "Posting_Author": "Representative Diana Harshbarger",
    "Congress_Number": null,
    "State_District": "TN-01",
    "Location": "Washington, D.C.",
    "Job_Function": "Press/Digital Intern",
    "Title_Parsed": null,
    "Office_Type": "Internship",
    "Responsibilities": [
      "Assist in drafting press releases, media advisories, talking points, and social media content.",
      "Monitor news coverage and compile daily press clips.",
      "Help manage the Member’s social media accounts, including drafting and scheduling posts.",
      "Track media requests and assist in preparing responses.",
      "Conduct research to support press and communications initiatives."
    ],
    "Qualifications": [
      "Strong writing, editing, and research skills.",
      "A keen interest in conservative politics, media, and policy issues.",
      "Experience with social media platforms (Twitter/X, Facebook, Instagram) and digital content creation.",
      "Ability to work in a fast-paced environment and handle multiple tasks.",
      "A positive attitude, strong work ethic, and attention to detail."
    ],
    "Salary_Min": null,
    "Salary_Max": null,
    "Skills_Mentioned": [
      "Social media platforms (Twitter/X, Facebook, Instagram) and digital content creation",
      "Graphic design or video editing"
    ],
    "Equal_Opportunity_Information": "The U.S. House of Representatives is an equal opportunity employer.",
    "Cleaned_Text": "<p>MEM-090-25</p><p>Representative Diana Harshbarger (R-TN-01) seeks a highly motivated and detail-oriented Press/Digital Intern to join their Washington, D.C. office. This position offers an excellent opportunity for hands-on experience in political communications, media relations, and public messaging on Capitol Hill.</p><p>This internship is open to undergraduate and graduate students from early May through late August. General hours are 9:00 AM to 6:00 PM when Congress is in session and 9:00 AM to 5:00 PM when it is not.</p><p>Interested applicants must submit a PDF file containing a cover letter and resume to be considered. As a bonus, applicants may submit additional materials with examples of digital work or writing samples. This must all be emailed</p> <p.to sam.somogye@mail.house.gov and holly.lay@mail.house.gov with the subject line, “Press/Digital Internship Application — [Your Name]</p><p>Responsibilities:</p><p>• Assist in drafting press releases, media advisories, talking points, and social media content.</p><p>• Monitor news coverage and compile daily press clips.</p><p>• Help manage the Member’s social media accounts, including drafting and scheduling posts.</p><p>• Track media requests and assist in preparing responses.</p><p>• Conduct research to support press and communications initiatives.</p><p>Assist with the production of digital content, including graphics and videos.</p><p>Attend and take notes at press events, briefings, and hearings as needed.</p><p>Perform administrative tasks to support the communications team.</p><p>Qualifications:</p>\n<p>• Strong writing, editing, and research skills.</p>",
    "DW_NOMINATE": null,
    "LES": null
  },
  {
    "Post_ID": "MEM-050-25",
    "Posting_Author": "Congresswoman Gwen Moore (WI-04)",
    "Congress_Number": null,
    "State_District": "WI-04",
    "Location": "The Washington, D.C.",
    "Job_Function": null,
    "Title_Parsed": null,
    "Office_Type": "orice of Congresswoman",
    "Responsibilities": [
      "answering phones",
      "attending hearings and brieﬁngs ",
      "drafting and editing constituent correspondence letters",
      "writing memos",
      "conducting research for the legislative star",
      "drafting social media posts",
      "designing graphics",
      "providing support for the day-to-day activities of the orice"
    ],
    "Qualifications": [],
    "Salary_Min": null,
    "Salary_Max": null,
    "Skills_Mentioned": [],
    "Equal_Opportunity_Information": "The Orice of Congresswoman Moore is an equal opportunity employer.",
    "Cleaned_Text": "MEM-050-25\n\nThe Washington, D.C. orice of Congresswoman Gwen Moore (WI-04) seeks Interns for the\nupcoming Summer 2025 term.\nResponsibilities include answering phones, attending hearings and brieﬁngs, drafting and editing constituent correspondence letters, writing memos, conducting research for the legislative star, drafting social media posts, designing graphics, and providing support for the day-to-day activities of the orice. Interns are paid via a monthly stipend.\nThe Orice of Congresswoman Moore is an equal opportunity employer. We do not discriminate based on race, ethnicity, gender, sexual orientation, religion, national origin, age, or socioeconomic status.\nAll are welcome and encouraged to apply.\nInterested applicants should send a resume, cover letter, and two short writing samples to WI04DC.Internships@mail.house.gov. Additionally, applicants should indicate their availability on both an hourly and monthly basis.\nThe deadline to apply is 6:00 PM ET on Friday, April 11th, 2025.",
    "DW_NOMINATE": null,
    "LES": null
  }
]