[
  {
    "Post_ID": "MEM-455-24",
    "Posting_Author": null,
    "Congress_Number": null,
    "State_District": null,
    "Location": "Washington D.C.",
    "Job_Function": null,
    "Title_Parsed": null,
    "Office_Type": null,
    "Responsibilities": [
      "Interns will get an in-depth look at the operations and functions of a congressional o&ice, including policy, communications, o&ice operations and constituent services. Interns will get opportunities to attend hearings and brieﬁngs; assist with constituent services; and research legislation."
    ],
    "Qualifications": [
      "Outstanding verbal and written communication skills",
      "Ability to speak courteously with constituents",
      "Ability to work independently and as a part of a team",
      "Attention to detail and eagerness to go above and beyond",
      "Professionalism and demonstrated interest in public service"
    ],
    "Salary_Min": null,
    "Salary_Max": null,
    "Skills_Mentioned": [],
    "Equal_Opportunity_Information": "The O&ice is an equal employment opportunity employer and, consistent with the Congressional Accountability Act (“CAA”) and House Rule XXIII, does not discriminate on the basis of an individual’s race, color, religion, sex, sexual orientation, gender identity, national origin, disability, military status, age, marital status, parental status, or any other factor or basis prohibited by applicable federal law.",
    "Cleaned_Text": "",
    "DW_NOMINATE": null,
    "LES": null
  },
  {
    "Post_ID": "MEM-453-24",
    "Posting_Author": "Congresswoman Stephanie Bice (OK-05)",
    "Congress_Number": null,
    "State_District": "OK-05",
    "Location": null,
    "Job_Function": null,
    "Title_Parsed": "Internship for the Spring 2025 term",
    "Office_Type": "U.S. House of Representatives internship",
    "Responsibilities": [
      "handle, sort and/or log incoming calls, mail, and electronic correspondence",
      "lead tours of the Capitol",
      "conduct research",
      "help draft legislative and official correspondence",
      "assist the D.C. office with work as assigned including administrative and logistical support"
    ],
    "Qualifications": [
      "strong interest in the legislative process and the functioning of Congress",
      "strong and effective communication (both verbal and written)",
      "work well in a highly dynamic fast-paced environment",
      "good time management skills including the ability to prioritize, and track multiple work products",
      "attention to detail, and a willingness to learn new skills and tasks and be flexible"
    ],
    "Salary_Min": null,
    "Salary_Max": null,
    "Skills_Mentioned": [
      "",
      "communication (both verbal and written)",
      "work in a highly dynamic fast-paced environment",
      "time management skills including the ability to prioritize, and track multiple work products",
      "attention to detail, and a willingness to learn new skills and tasks"
    ],
    "Equal_Opportunity_Information": "",
    "Cleaned_Text": "The o&ice of Congresswoman Stephanie Bice (OK-05) is seeking applicants for a paid internship for the Spring 2025 term. Successful applicants will be motivated, detailoriented, display a strong work ethic, and interact well with constituents and others.\n\nFurthermore, applicants should have a strong interest in the legislative process and the functioning of Congress.\n\nThe intern would be expected to handle, sort and/or log incoming calls, mail, and electronic correspondence, lead tours of the Capitol, conduct research, help draft legislative and o&icial correspondence, and assist the D.C. office sta& with work as assigned including administrative and logistical support. Qualiﬁed applicants should possess strong and e&ective communication (both verbal and written), work well in a highly dynamic fast-paced environment, have good time management skills including the ability to prioritize, and track multiple work products, possess attention to detail, and a willingness to learn new skills and tasks and be ﬂexible in supporting the Member and all sta& in various roles,\nboth administrative and legislative.\n\nTo apply, please email ok05internship@mail.house.gov with a copy of your resume.",
    "DW_NOMINATE": null,
    "LES": null
  },
  {
    "Post_ID": "MEM-450-24",
    "Posting_Author": "Representative Kevin Mullin",
    "Congress_Number": null,
    "State_District": "CA-15",
    "Location": "D.C. office",
    "Job_Function": null,
    "Title_Parsed": "Press Intern (part-time)",
    "Office_Type": "Representative's office",
    "Responsibilities": null,
    "Qualifications": [
      "Organized",
      "Creative",
      "Familiar with current events",
      "Detail-oriented",
      "Team-oriented",
      "Strong work ethic",
      "Excellent written and oral communication skills",
      "Relevant communications skills such as graphic design, social media, and video editing experience"
    ],
    "Salary_Min": 15,
    "Salary_Max": null,
    "Skills_Mentioned": [
      "Graphic design",
      "Social media",
      "Video editing"
    ],
    "Equal_Opportunity_Information": "This office is an equal opportunity employer and does not discriminate on the basis of...",
    "Cleaned_Text": "",
    "DW_NOMINATE": -0.4699999988079071,
    "LES": 0.05192196369171143
  },
  {
    "Post_ID": "MEM-449-24",
    "Posting_Author": "The D.C. o&ice of Representative Kevin Mullin (CA-15)",
    "Congress_Number": null,
    "State_District": "CA-15",
    "Location": "Washington D.C.",
    "Job_Function": "legislative affairs and communications",
    "Title_Parsed": null,
    "Office_Type": "Legislator's office",
    "Responsibilities": [
      "answering phones",
      "researching legislative issues",
      "drafting constituent correspondence",
      "attending policy briefings and hearings",
      "recommending legislation to the Representative",
      "other tasks as assigned"
    ],
    "Qualifications": [
      "excellent written and oral communications skills",
      "interest in the legislative process",
      "resourcefulness",
      "willingness to learn",
      "ties to the Bay Area or California preferred but not required"
    ],
    "Salary_Min": 15,
    "Salary_Max": null,
    "Skills_Mentioned": null,
    "Equal_Opportunity_Information": "This office is an equal opportunity employer and does not discriminate on the basis of race, color, religion, sex, sexual orientation, gender identity and expression, national origin, disability, military status, age, marital status, or parental status.",
    "Cleaned_Text": "The D.C. o&ice of Representative Kevin Mullin (CA-15) is accepting applications for paid internships for the spring semester.\nThe ideal candidate will have excellent written and oral communications skills, interest in the legislative process, resourcefulness, and a willingness to learn in a fast-paced environment. Ties to the Bay Area or California are preferred, but not required.\nResponsibilities include answering phones, researching legislative issues, drafting constituent correspondence, attending policy briefings and hearings, recommending legislation to the Representative, and other tasks as assigned.\nThe Spring internship begins January 7, 2025 and will end mid- to late-May, with flexible start and end dates. At least 20 hours of availability per week is preferred. Work is in person and is compensated at $15 per hour.\n\nTo apply, please submit a resume, cover letter, and one page writing sample as one PDF at airtable.com/apprYNgTcbCLqWcnA/pagycLdSOg3lB7jpV/form.\nThe deadline to apply is November 7, 2024. Due to the large volume of applicants, only those selected for an interview will be contacted.\nCandidates from diverse backgrounds are encouraged to apply.",
    "DW_NOMINATE": -0.4699999988079071,
    "LES": 0.05192196369171143
  },
  {
    "Post_ID": "MEM-448-24",
    "Posting_Author": "Congressman Jim Himes",
    "Congress_Number": null,
    "State_District": "Washington",
    "Location": "Washington, D.C. office",
    "Job_Function": "Internship program support staff",
    "Title_Parsed": null,
    "Office_Type": "Government",
    "Responsibilities": [
      "Support with office administration",
      "Communications",
      "Legislative research"
    ],
    "Qualifications": [
      "Precise attention to detail",
      "Strong interpersonal skills",
      "Sense of humor",
      "Scheduling flexibility that allows for 24-40 hours of work a week"
    ],
    "Salary_Min": null,
    "Salary_Max": null,
    "Skills_Mentioned": [
      "Politics",
      "Government studies",
      "History studies",
      "Multitasking and juggling multiple priorities"
    ],
    "Equal_Opportunity_Information": "This office is an equal opportunity employer... ",
    "Cleaned_Text": "MEM-448-24. The Oüce of Congressman Jim Himes is seeking applicants...",
    "DW_NOMINATE": null,
    "LES": null
  },
  {
    "Post_ID": "MEM-447-24",
    "Posting_Author": "Congresswoman Dina Titus (NV-01)",
    "Congress_Number": 1,
    "State_District": "NV-01",
    "Location": "D.C. office",
    "Job_Function": null,
    "Title_Parsed": null,
    "Office_Type": null,
    "Responsibilities": [
      "answering constituent phone calls",
      "attending policy briefing",
      "providing tours of the United States Capitol",
      "conducting legislative research to support the needs of Congresswoman's sta"
    ],
    "Qualifications": [
      " possessing excellent oral and written communication skills",
      "prioritizing professionalism",
      "being a dedicated team player",
      "having a friendly persona",
      "ties to Nevada's First District are a plus but not required"
    ],
    "Salary_Min": null,
    "Salary_Max": null,
    "Skills_Mentioned": [
      "working with Congresswoman Dina Titus"
    ],
    "Equal_Opportunity_Information": "The o&ice of Congresswoman Dina Titus is an equal opportunity employer and does not discriminate on the basis of race, color, religion, sex, sexual orientation, gender identity and expression, national origin, disability, military status, age, marital status, or parental status.",
    "Cleaned_Text": "MEM-447-24\r\nCongresswoman Dina Titus (NV-01) seeks highly motivated Legislative Interns in our D.C.\rñoice for the Spring 2025 semester.\\nInterns in our D.C.\rñoice will have the opportunity to witness the legislative process and the inner workings of Capitol Hill ârst-hand. Responsibilities include but are not limited to answering constituent phone calls, attending policy briefing and meetings, providing tours of the United States Capitol, and conducting legislative research to support the needs of the Congresswoman's sta‑–The internship will run from January through May, from 9 am-6 pm when Congress is in session and from 9 am-5 pm when Congress is not in session.\\n\nThe ideal candidate possesses excellent oral and written communication skills, prioritizing professionalism, being a dedicated team player, and having a friendly persona\\u2006Ties to Nevada's First District are a plus, but not required.\\nThe \rnoice of Congresswoman Dina Titus is\rnu an equal opportunity employer and does not discriminate on the basis of race, color, religion, sex, sexual orientation, gender identity and expression, national origin, disability, military status, age, marital status, or parental status.\\n\nHow to Apply:\\nInterested applicants should fill out the form below and include a cover letter, resume, and short (1-2 page) writing sample. Applications will be accepted until Sunday, December 1, 2024, on a rolling basis.\n\\nApplication Form: airtable.com/appjUVDedFRF8MvRK/shrHMRz57ZvPcdOdy.",
    "DW_NOMINATE": null,
    "LES": null
  },
  {
    "Post_ID": "MEM-446-24",
    "Posting_Author": "The O—ice of Congresswoman Grace Meng (NY-06)",
    "Congress_Number": null,
    "State_District": "NY-06",
    "Location": "Washington D.C. o—ice.",
    "Job_Function": "",
    "Title_Parsed": "",
    "Office_Type": "",
    "Responsibilities": [],
    "Qualifications": [
      "Intern responsibilities will vary and are designed to give interns insight to the legislative process and a well-rounded experience on Capitol Hill.",
      "Some duties include answering phones, running errands, giving Capitol tours, researching legislation for the Member and legislative sta&.",
      "_attending hearings and brieõngs",
      "and answering constituent letters on various issues before the House."
    ],
    "Salary_Min": null,
    "Salary_Max": null,
    "Skills_Mentioned": [],
    "Equal_Opportunity_Information": "This internship will run from January to May.",
    "Cleaned_Text": "",
    "DW_NOMINATE": null,
    "LES": null
  },
  {
    "Post_ID": "MEM-445-24",
    "Posting_Author": "Congressman Balderson\\u2019s Washington, D.C. office",
    "Congress_Number": null,
    "State_District": "Ohio",
    "Location": "Washington, D.C.",
    "Job_Function": "congressional internship",
    "Title_Parsed": "(Intern)",
    "Office_Type": "Legislative Office",
    "Responsibilities": [
      "Research and review current legislation",
      "Help with press-related projects",
      "Directly interact with constituents through phone calls and U.S. Capitol tours"
    ],
    "Qualifications": [
      "Completed at least one full year of collegiate undergraduate coursework",
      "Ohio ties (preferred)"
    ],
    "Salary_Min": null,
    "Salary_Max": null,
    "Skills_Mentioned": [
      "Legislative process",
      "Public speaking",
      "Communication skills"
    ],
    "Equal_Opportunity_Information": "(Congressman Balderson's office is an Equal Opportunity/Affirmative Action employer.)",
    "Cleaned_Text": "Paid internships in Congressman Balderson’s Washington, D.C. o&ice ... Internships are designed primarily for students who have completed at least one full year of collegiate undergraduate coursework and preference is given to students with Ohio ties. Students selected for the internship program will have the opportunity to research and review current legislation, help with press-related projects,",
    "DW_NOMINATE": null,
    "LES": null
  },
  {
    "Post_ID": "MEM-444-24",
    "Posting_Author": null,
    "Congress_Number": null,
    "State_District": "WI-06",
    "Location": "Washington, DC o&ice",
    "Job_Function": "Congressional Internships",
    "Title_Parsed": "Congressional Internship",
    "Office_Type": " Congressional office",
    "Responsibilities": [
      "Answering constituent phone calls and directing them appropriately",
      "Researching legislation for the Member and legislative sta&",
      "Attending congressional hearings and policy brieﬁngs",
      "Answering constituent letters on various issues before the House",
      "Helping the communications/press team",
      "Conducting Capitol tours for constituents and other guests",
      "Other projects as assigned by the sta&"
    ],
    "Qualifications": [
      "motivated, detail-oriented, display a strong work ethic, and interact well with constituents",
      "strong interest in the legislative process and the function of Congress"
    ],
    "Salary_Min": null,
    "Salary_Max": null,
    "Skills_Mentioned": [],
    "Equal_Opportunity_Information": "Ties to the state of Wisconsin are preferred, but not required.",
    "Cleaned_Text": " successful applicants will be motivated, detail-oriented, display a strong work ethic, and interact well with constituents. In addition, applicants should have a strong interest in the legislative process and the function of Congress.",
    "DW_NOMINATE": null,
    "LES": null
  },
  {
    "Post_ID": "MEM-443-24",
    "Posting_Author": null,
    "Congress_Number": null,
    "State_District": null,
    "Location": "Washington, DC o&ice",
    "Job_Function": null,
    "Title_Parsed": null,
    "Office_Type": "Congressman's Office",
    "Responsibilities": [
      "Answering constituent phone calls and directing them appropriately",
      "Researching legislation for the Member and legislative sta&",
      "Attending congressional hearings and policy brieﬁngs",
      "Answering constituent letters on various issues before the House",
      "Helping the communications/press team",
      "Conducting Capitol tours for constituents and other guests",
      "Other projects as assigned by the sta&"
    ],
    "Qualifications": [
      "A strong interest in the legislative process",
      "The function of Congress",
      "Motivated, detail-oriented, display a strong work ethic, and interact well with constituents"
    ],
    "Salary_Min": null,
    "Salary_Max": null,
    "Skills_Mentioned": null,
    "Equal_Opportunity_Information": "The Internship Program is an equal opportunity employer.",
    "Cleaned_Text": "",
    "DW_NOMINATE": null,
    "LES": null
  },
  {
    "Post_ID": "MEM-441-24",
    "Posting_Author": "The O&ice of Congressman Jim Costa",
    "Congress_Number": null,
    "State_District": "CA-21",
    "Location": "Rep. Costa’s Washington, D.C. office",
    "Job_Function": "Digital/Press",
    "Title_Parsed": null,
    "Office_Type": null,
    "Responsibilities": [
      "Assist the Communications Director and Press Assistant with drafting social media content, e-newsletters, targeted mailing, and website content.",
      "Edit photos and create engaging graphics in line with the Congressman’s brand.",
      "Clipping, editing, and compiling videos.",
      "Assist with the creation and maintenance of press lists.",
      "Compile daily press clips and reports about social media analytics.",
      "Other o&ice tasks such as answering phones, drafting correspondence, conducting tours, and other duties as required."
    ],
    "Qualifications": [
      "strong writing, editing, and digital skills",
      "basic familiarity with graphic design/video editing software, such as Adobe, Canva, and Photoshop"
    ],
    "Salary_Min": null,
    "Salary_Max": null,
    "Skills_Mentioned": [
      "graphic design",
      "video editing",
      "Adobe",
      "Canva",
      "Photoshop"
    ],
    "Equal_Opportunity_Information": "The office is an equal opportunity employer committed to building and maintaining an inclusive and diverse work environment.",
    "Cleaned_Text": "null",
    "DW_NOMINATE": -0.1969999969005585,
    "LES": 0.1557658910751343
  },
  {
    "Post_ID": "MEM-440-24",
    "Posting_Author": "",
    "Congress_Number": null,
    "State_District": "",
    "Location": "",
    "Job_Function": "",
    "Title_Parsed": "",
    "Office_Type": "",
    "Responsibilities": null,
    "Qualifications": null,
    "Salary_Min": null,
    "Salary_Max": null,
    "Skills_Mentioned": null,
    "Equal_Opportunity_Information": "",
    "Cleaned_Text": "{",
    "DW_NOMINATE": null,
    "LES": null
  },
  {
    "Post_ID": "MEM-439-24",
    "Posting_Author": "Congresswoman Susan Wild (PA-07)",
    "Congress_Number": null,
    "State_District": "PA-07",
    "Location": "Washington D.C.",
    "Job_Function": null,
    "Title_Parsed": null,
    "Office_Type": "legislative office",
    "Responsibilities": [
      "[No specific details provided]"
    ],
    "Qualifications": [
      "[No specific details provided]",
      "[Strong oral and written communication skills, ability to multitask], [Team-player mentality, good sense of humor]"
    ],
    "Salary_Min": null,
    "Salary_Max": null,
    "Skills_Mentioned": [
      "Pennsylvania ties",
      "[Multitasking, fast-paced environment]"
    ],
    "Equal_Opportunity_Information": "...an equal opportunity employer...",
    "Cleaned_Text": "The O&ice of Congresswoman Susan Wild (PA-07) is seeking full-time interns...",
    "DW_NOMINATE": null,
    "LES": null
  },
  {
    "Post_ID": "MEM-437-24",
    "Posting_Author": "Congressman Jim Costa (CA-21) seeks a highly motivated and creative Digital/Press Intern to join a fast-paced communications operation based in Rep. Costa’s Washington, D.C. o&ice for the Winter/Spring 2025 intern class.",
    "Congress_Number": null,
    "State_District": "California or Central Valley ties are a plus.",
    "Location": "Washington, D.C. o&ice",
    "Job_Function": "Digital/Press Intern",
    "Title_Parsed": "Digital/Press Intern",
    "Office_Type": "Internship",
    "Responsibilities": [
      "Assist the Communications Director and Press Assistant with drafting social media content, e-newsletters, targeted mailing, and website content.",
      "Edit photos and create engaging graphics in line with the Congressman’s brand.",
      "Clipping, editing, and compiling videos.",
      "Assist with the creation and maintenance of press lists."
    ],
    "Qualifications": [
      "strong writing, editing, and digital skills",
      "basic familiarity with graphic design/video editing software, such as Adobe, Canva, and Photoshop"
    ],
    "Salary_Min": null,
    "Salary_Max": null,
    "Skills_Mentioned": [
      "digital media role (including internships)",
      "graphic design/video editing",
      "press or digital media experience"
    ],
    "Equal_Opportunity_Information": "The O&ice of Rep. Jim Costa is an equal opportunity employer committed to building and maintaining an inclusive and diverse work environment.",
    "Cleaned_Text": "MEM-437-24\n\nThe O\textit{and} \textit{of Congressman Jim Costa (CA-21)} seeks a highly motivated and creative Digital/Press Intern to join a fast-paced communications operation based in Rep. Costa’s Washington, D.C. o\textit{ice for the Winter/Spring 2025 intern class.\n\nThis internship program prides itself on its educational aspects. Press interns will immerse \textbf{themselves} in fast-paced press operations and learn the ins and outs of a congressional communications shop. They will have an opportunity to learn and engage on various digital platforms while learning how to connect people to policy.\n\nQuali\textit{fied} candidates should have strong writing, editing, and digital skills to assist with time-sensitive assignments, as well as basic familiarity with graphic design/video editing software, such as Adobe, Canva, and Photoshop. Candidates with experience in a press or digital media role (including internships) are preferred but not required. \textit{California} or \textit{Central Valley} ties are a plus.\n\nThe intern will be under the supervision of the Communications Director and Internship Coordinator.\n\nInternship Responsibilities\nAssist the Communications Director and Press Assistant with drafting social media content, e-newsletters, targeted mailing, and website content.\nEdit photos and create engaging graphics in line with the Congressman’s brand.\nClipping, editing, and compiling videos.\nAssist with the creation and maintenance of press lists.\nCompile daily press clips and reports about social media analytics.\nOther o\textit{ice} tasks such as answering phones, drafting correspondence, conducting tours, and other duties as required.\n\nInternship Dates and Details:Fall internships will start in early December 2024 and go until April 2025, with some \textit{flexibility}. Interns are expected to work in compliance with the o\textit{ice’s} regular hours of operation. Our o\textit{ice} cannot accommodate remote or hybrid internships at this time.\n\nDeadline: Applications must be submitted by 6 p.m. ET on Friday, November 15th.\n\nApply: Interested applicants should fill out the internship application via our website: Internships | Congressman Jim Costa (house.gov), specifying in their application their desire to be a press intern.\nNo phone calls, or walk-ins, please.\nThe O\textit{ice of} Rep. Jim Costa is an equal opportunity employer committed to building and maintaining an inclusive and diverse work environment.\n\nContact:\nPlease reach out to our intern coordinator, Grant Menolascino, with any questions regarding the application process at Grant.menolascino@mail.house.gov.",
    "DW_NOMINATE": null,
    "LES": null
  },
  {
    "Post_ID": "MEM-436-24",
    "Posting_Author": "Congressman Matt Cartwright (PA-08)",
    "Congress_Number": null,
    "State_District": null,
    "Location": "Washington, DC",
    "Job_Function": null,
    "Title_Parsed": "Legislative Interns",
    "Office_Type": null,
    "Responsibilities": [
      "logging constituent concerns",
      "drafting constituent correspondence on a variety of issues",
      "attending legislative brieüngs",
      "greeting constituents and visitors when in the o¼ice",
      "assisting staɏt with research and special projects",
      "tracking media coverage",
      "performing administrative duties"
    ],
    "Qualifications": [
      "strong interpersonal skills",
      "ability to manage multiple tasks",
      "possess strong writing skills",
      "demonstrate a solid work ethic"
    ],
    "Salary_Min": null,
    "Salary_Max": null,
    "Skills_Mentioned": null,
    "Equal_Opportunity_Information": "No phone calls or drop-ins please.",
    "Cleaned_Text": "The O&ice of Congressman Matt Cartwright (PA-08) seeks motivated, detail-oriented, and energetic individuals for legislative internships in Washington, DC for January-May. Please indicate availability in the first sentence of the cover letter.\nQualiﬁed applicants should have strong interpersonal skills, the ability to manage multiple tasks, possess strong writing skills, and demonstrate a solid work ethic.\nResponsibilities include but are not limited to: logging constituent concerns, drafting constituent correspondence on a variety of issues, attending legislative brieﬁngs, greeting constituents and visitors when in the o&ice, assisting sta& with research and special projects, tracking media coverage, and performing administrative duties.\nAs a result, interns learn about the legislative process and the many other functions of a congressional o&ice.\nTo apply for an internship in the O&ice of Congressman Cartwright, please submit an application, including a resume, cover letter, and a short writing sample at the following link: https://cartwright.house.gov/services/internships.htm.\nNo phone calls or drop-ins please.",
    "DW_NOMINATE": null,
    "LES": null
  },
  {
    "Post_ID": "MEM-435-24",
    "Posting_Author": "The Democratic StaK of the House Energy and Commerce Committee",
    "Congress_Number": null,
    "State_District": "StaK",
    "Location": null,
    "Job_Function": "",
    "Title_Parsed": "",
    "Office_Type": "Legislative Internship",
    "Responsibilities": [
      "assist sta& with administrative tasks",
      "conducting legislative research",
      "shadow sta& at hearings and markups"
    ],
    "Qualifications": [
      "organized (and) committed students",
      "eager (and) to join a fast-paced environment",
      "superior writing & communication skills, attention to detail, and a sense of humor"
    ],
    "Salary_Min": null,
    "Salary_Max": null,
    "Skills_Mentioned": null,
    "Equal_Opportunity_Information": "All applicants will be considered without regard to race, color, national origin, religion, sex (including marital or parental status), sexual orientation, gender identity, disability, or age.",
    "Cleaned_Text": "MEM-435-24The Democratic StaK of the House Energy and Commerce Committee seeks qualiﬁed undergrad students ÷ recent graduates for Legislative Interns for the Spring 2025 session.\nAn internship with the Energy and Commerce Democrats is designed to give students a thorough understanding of a Congressional committee’s role in the legislative process.\nThroughout the course of the program, interns will assist sta\u0000 with administrative tasks such as answering phones, conducting legislative research, and preparing materials for sta\u0000 and member brie¥ings. In addition, interns will have the opportunity to shadow sta\u0000 at hearings and markups, as well as attend brie¥ings on subjects within the Committee’s broad jurisdiction.\nOur ideal candidates are organized and committed students eager to join a fast-paced environment and build upon their knowledge of how Congress works—in particular, the role that congressional committees play in the federal legislative process. Superior writing and communication skills, attention to detail, and a sense of humor are required. Full-time availability is preferred, but part-time candidates are eligible as well.\nAll applicants will be considered without regard to race, color, national origin, religion, sex °including marital or parental status° sexual orientation, gender identity, disability, or age.\nWomen, minority, and veteran candidates are highly encouraged to apply. Interns will receive a stipend, and applicants may request the Committee’s assistance to receive credit from their educational institution.\nInterested applicants should submit their resume, cover letter, and one writing sample (two pages max.) to InternshipResume.EC@mail.house.gov. In your cover letter, please indicate preferred start/end dates for scheduling purposes and whether you are available to work full-time or part-time. Please put “Spring 2025 Legislative Intern Application” in the subject line. The deadline for applications is November 15, 2024. Please no phone calls or dropins.",
    "DW_NOMINATE": null,
    "LES": null
  },
  {
    "Post_ID": "MEM-433-24",
    "Posting_Author": "Representative Brad Schneider",
    "Congress_Number": null,
    "State_District": "IL-10",
    "Location": "Washington, D.C.",
    "Job_Function": "Press Intern",
    "Title_Parsed": "Press Internship",
    "Office_Type": "House of Representatives Oüce",
    "Responsibilities": [
      "Collaborate closely with the communications team to create engaging graphics, edit videos, and draft social media content"
    ],
    "Qualifications": [
      "Adaptable, detail-oriented, and thrives in a fast-paced, deadline-driven environment"
    ],
    "Salary_Min": null,
    "Salary_Max": null,
    "Skills_Mentioned": [
      "Graphic design platforms like Canva",
      "Photo and video editing software"
    ],
    "Equal_Opportunity_Information": "This office is an equal-opportunity employer and does not discriminate based on race, religion, disability, age, ethnicity, national origin, sex, gender, LGBTQ identification, family status, or military status.",
    "Cleaned_Text": "",
    "DW_NOMINATE": -0.1940000057220459,
    "LES": 0.4327289462089539
  },
  {
    "Post_ID": "MEM-432-24",
    "Posting_Author": "Representative Brad Schneider",
    "Congress_Number": null,
    "State_District": null,
    "Location": null,
    "Job_Function": null,
    "Title_Parsed": "Legislative Intern",
    "Office_Type": null,
    "Responsibilities": [
      "answering phones",
      "managing errands",
      "researching legislation",
      "attending hearings and brieﬁngs",
      "leading Capitol tours",
      "responding to constituent inquiries"
    ],
    "Qualifications": [
      "experience in a professional environment",
      "knowledge of basic congressional operations",
      "adaptable",
      "detail-oriented",
      "thrives in a fast-paced, deadlinedriven environment",
      "strong writing skills"
    ],
    "Salary_Min": null,
    "Salary_Max": null,
    "Skills_Mentioned": [
      "policy matters"
    ],
    "Equal_Opportunity_Information": "This oﬁce is an equal-opportunity employer and does not discriminate based on race, religion, disability, age, ethnicity, national origin, sex, gender, LGBTQ identiﬁcation, family status, or military status.",
    "Cleaned_Text": "<html><body>This <span style=\"font-style:italic; color black;\">Spring 2025 legislative interns in the Washington, D.C. o切 is now accepting applications for...<br></span> ...</body></html>",
    "DW_NOMINATE": null,
    "LES": null
  },
  {
    "Post_ID": "MEM-430-24",
    "Posting_Author": "The Washington, D.C. Oüce of Congressman Ed Case (HI-01)",
    "Congress_Number": null,
    "State_District": "HI-01",
    "Location": "The Washington, D.C.",
    "Job_Function": null,
    "Title_Parsed": "Internship in the Congressional Office",
    "Office_Type": "internship",
    "Responsibilities": [
      "Answering phones and managing correspondence",
      "Leading constituent tours of the Capitol",
      "Conducting research on legislation for the Member and legislative sta&",
      "Attending hearings and brieﬁngs",
      "Assisting with various o&ice tasks"
    ],
    "Qualifications": [
      "Resume",
      "Cover letter (including interest in the internship, availability, and ties to Hawaii)",
      "Three references (academic and work-related)",
      "Two short writing samples (maximum of 5 pages)"
    ],
    "Salary_Min": null,
    "Salary_Max": null,
    "Skills_Mentioned": null,
    "Equal_Opportunity_Information": "null",
    "Cleaned_Text": "The Washington, D.C. Oüce of Congressman Ed Case (HI-01)",
    "DW_NOMINATE": null,
    "LES": null
  },
  {
    "Post_ID": "MEM-429-24",
    "Posting_Author": "Democratic Sta&",
    "Congress_Number": null,
    "State_District": null,
    "Location": null,
    "Job_Function": null,
    "Title_Parsed": "Digital Media and Traditional Press Intern",
    "Office_Type": null,
    "Responsibilities": [
      "written content creation",
      "graphic design",
      "video editing",
      "performing other press and administrative tasks as necessary"
    ],
    "Qualifications": [],
    "Salary_Min": null,
    "Salary_Max": null,
    "Skills_Mentioned": [
      "Adobe Premiere Pro",
      "Adobe Photoshop",
      "Adobe InDesign",
      "Canva"
    ],
    "Equal_Opportunity_Information": "The House Committee on Oversight and Accountability is an equal opportunity employer.",
    "Cleaned_Text": "The House Committee on Oversight and Accountability Democratic Sta& seeks a motivated and reliable undergraduate or graduate student to ûill a full-time digital media and traditional press intern position this spring. The intern responsibilities include, but are not limited to, written content creation, graphic design, video editing, and performing other press and administrative tasks as necessary.\nSuccessful candidates will possess familiarity with programs such as Adobe Premiere Pro, Adobe Photoshop, Adobe InDesign, Canva, as well as compiling and interpreting social media analytics. Ability to work in a fast-paced, rapid response environment and willingness to learn are a must. This position reports to the Communications Director.\nCandidates with diverse backgrounds and experiences are strongly encouraged to apply. To apply, please send a resume and portfolio to oversightpress@mail.house.gov.",
    "DW_NOMINATE": null,
    "LES": null
  },
  {
    "Post_ID": "MEM-427-24",
    "Posting_Author": "The Democratic Sta& of the U.S. House Judiciary Committee",
    "Congress_Number": null,
    "State_District": "NY-12",
    "Location": "Washington, DC",
    "Job_Function": null,
    "Title_Parsed": "Legal Interns for Spring 2025 internship program",
    "Office_Type": null,
    "Responsibilities": [
      "Researching legal and policy issues under the committee’s jurisdiction/",
      "Tracking relevant legislation, hearings, brieﬁngs, and media/",
      "Drafting internal and external memoranda/",
      "Supporting oversight counsels in transcribed interviews and depositions/",
      "Supporting committee clerks and professional sta& members during hearings and markups/",
      "Providing administrative support, including answering calls, delivering correspondence, and preparing the committee’s hearing room."
    ],
    "Qualifications": [
      "qualiﬁed undergraduate, graduate, and law students"
    ],
    "Salary_Min": null,
    "Salary_Max": null,
    "Skills_Mentioned": [],
    "Equal_Opportunity_Information": "The committee does not discriminate on the basis of race, color, religion, sex (including marital or parental status, sexual orientation, and gender identity), disability, age, or national origin.",
    "Cleaned_Text": "",
    "DW_NOMINATE": -0.5070000290870667,
    "LES": 0.1384585648775101
  },
  {
    "Post_ID": "MEM-426-24",
    "Posting_Author": "The O&ice of Congressman Tim Kennedy (NY-26)",
    "Congress_Number": null,
    "State_District": "NY-26",
    "Location": "Washington, D.C.",
    "Job_Function": "Press Fellow",
    "Title_Parsed": null,
    "Office_Type": "O&ice",
    "Responsibilities": [
      "Draft and edit press releases, statements, op-eds, and other communication materials",
      "Compile press clips and monitor emerging news stories",
      "Maintain and update media contact lists and databases",
      "Prepare press reports for internal distribution",
      "Draft social media and contribute to digital strategy",
      "Edit videos, and design graphics and posters",
      "Support the communications team with administrative tasks and project coordination"
    ],
    "Qualifications": [
      "Excellent written and verbal communication skills",
      "Strong attention to detail and organizational abilities",
      "Ability to multitask and prioritize in a fast-paced environment",
      "Familiarity with social media platforms and digital communication tools",
      "Major in Communications, Journalism, or a related field is a plus",
      "A proactive and collaborative attitude",
      "A sense of humor"
    ],
    "Salary_Min": null,
    "Salary_Max": null,
    "Skills_Mentioned": [
      "Communication skills",
      "Multitasking abilities",
      "Digital communication tools"
    ],
    "Equal_Opportunity_Information": "We do not discriminate based on race, ethnicity, gender, sexual orientation, gender identity, religion, national origin, age, disability, or socioeconomic status. All are welcome and encouraged to apply.",
    "Cleaned_Text": "",
    "DW_NOMINATE": -0.3560000061988831,
    "LES": 0.2579250037670135
  },
  {
    "Post_ID": "MEM-423-24",
    "Posting_Author": "Donald Norcross (NJ-01)",
    "Congress_Number": null,
    "State_District": "NJ-01",
    "Location": "New Jersey",
    "Job_Function": null,
    "Title_Parsed": "Spring 2025 Internship program",
    "Office_Type": null,
    "Responsibilities": [
      " assisting sta& with legislative",
      "administrative",
      "constituent relations",
      "scheduling",
      "communications activities.",
      "answering phones;",
      "sorting, distributing, and responding to constituent mail;",
      "attending hearings and breifings;",
      "assisting with legislative research;",
      "compiling daily clips;",
      "participating in professional development activities."
    ],
    "Qualifications": [
      "organized",
      "detail-oriented",
      "professional.",
      "strong written and oral communication skills"
    ],
    "Salary_Min": null,
    "Salary_Max": null,
    "Skills_Mentioned": null,
    "Equal_Opportunity_Information": null,
    "Cleaned_Text": "The O&ice of Representative Donald Norcross (NJ-01) is seeking motivated candidates for the Spring 2025 Internship program.",
    "DW_NOMINATE": null,
    "LES": null
  },
  {
    "Post_ID": "MEM-421-24",
    "Posting_Author": null,
    "Congress_Number": null,
    "State_District": "Massachusetts",
    "Location": "Washington, D.C.",
    "Job_Function": "Intern",
    "Title_Parsed": "Intern",
    "Office_Type": "Committee",
    "Responsibilities": [
      "prepare materials for Committee meetings",
      "conduct research projects",
      "learn about the Rules of the House and the various procedures for legislation to reach the House Floor",
      "complete a variety of other administrative tasks"
    ],
    "Qualifications": [
      "strong writing skills",
      "good work ethic",
      "interest in learning about House ﬂoor procedures",
      "detailoriented"
    ],
    "Salary_Min": null,
    "Salary_Max": null,
    "Skills_Mentioned": [
      "legislative analysis",
      "political communications",
      "institutional processes"
    ],
    "Equal_Opportunity_Information": "The o&ice is an equal opportunity employer and strongly encourages candidates from diverse backgrounds or with untraditional experience to apply.",
    "Cleaned_Text": "MEM-421-24\n\nThe Democratic Sta뻯 of the Committee on Rules is seeking full-an\nd part-time, energetic\ninterns for the spring (January - May). Our interns work closely with Committee sta뻯 to\nprepare materials for Committee meetings, conduct research projects, learn about the\nRules of the House and the various procedures for legislation to reach the\nHouse Floor, and complete a variety of other administrative tasks. Ideal candidates have strong writing skills, a good work ethic, an interest in learning about House \\ﾬeoor procedures, and are detailoriented. Interns will gain experience in legislative analysis, political communications, and institutional processes.\nA stipend will be available for quali뻯ed candidates. No calls or drop-ins please.\nMassachusetts ties are a plus. All o&ers are conditional on completion of a federal criminal\nbackground check. The o&ice is an equal opportunity employer and strongly encourages\ncandidates from diverse backgrounds or with untraditional experience to apply.\nInterested applicants should email a cover letter and resume with the subject line:\n\"Legislative Intern Spring 2025 – Last Name, First Name\"\nexplaining why you want to join\nthe Democratic sta뻯 of the House Rules Committee\nto\nRulesInternDem.Application@mail.house.gov. Please apply by November 8, 2024.\nNote: Students on quarter systems or with unusual schedules are still encouraged to\npay—please detail your particular situation in your cover letter.",
    "DW_NOMINATE": null,
    "LES": null
  },
  {
    "Post_ID": "MEM-420-24",
    "Posting_Author": "Congresswoman Rosa L. DeLauro (CT-03)",
    "Congress_Number": null,
    "State_District": "CT-03",
    "Location": "Washington, D.C.",
    "Job_Function": null,
    "Title_Parsed": null,
    "Office_Type": null,
    "Responsibilities": [
      "The office of Congresswoman DeLauro runs an internship program intended for current undergraduate students...",
      "Internships in Congresswoman DeLauro's office combine administrative and legislative work",
      "Interns are involved in all aspects of the office including constituent services, correspondence, and legislative research",
      "Providing general sta& support"
    ],
    "Qualifications": [
      "An ability to work in a fast-paced environment",
      "Possess excellent writing skills",
      "An enthusiastic attitude"
    ],
    "Salary_Min": null,
    "Salary_Max": null,
    "Skills_Mentioned": [],
    "Equal_Opportunity_Information": "Applicants and employees shall not be discriminated against with respect to compensation...",
    "Cleaned_Text": "MEM-420-24\nCongresswoman Rosa L. DeLauro (CT-03) is seeking applicants for the Fall 2024 internship program in her Washington, D.C. office.\nResponisbilities: The office of Congresswoman DeLauro runs an internship program intended for current undergraduate students, recent college graduates, and students currently enrolled in graduate school.\nInternships in Congresswoman DeLauro's office combine administrative and legislative work. Interns are involved in all aspects of the office including constituent services, correspondence, and legislative research, in addition to providing general sta& support.\n\n\nclose",
    "DW_NOMINATE": null,
    "LES": null
  },
  {
    "Post_ID": "MEM-418-24",
    "Posting_Author": "Congressman Rob Menendez",
    "Congress_Number": null,
    "State_District": "NJ-08",
    "Location": "Washington, D.C.",
    "Job_Function": null,
    "Title_Parsed": null,
    "Office_Type": null,
    "Responsibilities": [
      "Greeting guests and assisting with front office operations",
      "Answering phones, recording constituent opinions, and correctly processing other inquiries",
      "Legislative work: attending hearings and briefings, writing memos, composing cosponsor recommendations, and drafting letters to be sent to constituents",
      "Organizing incoming mail",
      "Assisting with press clips and communications tasks"
    ],
    "Qualifications": [
      "Self-starters",
      "Excellent writing and organizational skills"
    ],
    "Salary_Min": null,
    "Salary_Max": null,
    "Skills_Mentioned": null,
    "Equal_Opportunity_Information": "Our office is an equal opportunity employer, and we do not discriminate on the basis of race, sex, color, age, religion, disability, national origin, military status, sexual orientation, or gender identity or expression. Special consideration will be given to candidates with New Jersey ties and to those from backgrounds that are traditionally underrepresented in Congress.",
    "Cleaned_Text": "",
    "DW_NOMINATE": null,
    "LES": null
  },
  {
    "Post_ID": "MEM-417-24",
    "Posting_Author": "Rep. Troy Nehls (TX-22)",
    "Congress_Number": null,
    "State_District": "TX-22",
    "Location": "Washington, D.C.",
    "Job_Function": null,
    "Title_Parsed": null,
    "Office_Type": "Congressman's",
    "Responsibilities": [
      "greeting visitors",
      "answering phones",
      "leading tours of the Capitol",
      "attending brieﬁngs and hearings",
      "performing legislative research",
      "assisting both legislative and communications sta&"
    ],
    "Qualifications": [
      "",
      "send their resume and cover letter to jacqueline.camuy@mail.house.gov with 'Spring 2025 Internship' in the subject line."
    ],
    "Salary_Min": null,
    "Salary_Max": null,
    "Skills_Mentioned": [],
    "Equal_Opportunity_Information": "The U.S. House of Representatives is an Equal Opportunity Employer.",
    "Cleaned_Text": "MEM-417-24\nRep. Troy Nehls (TX-22) Seeks full time Legislative and Press Interns for Spring 2025\nCongressman Troy E. Nehls’ (TX-22) Washington, D.C o&ice is currently seeking qualiﬁed individualsothermendependentssupervisornationsexperiencedstudentswhoserveinthehouseofrepresentativesspringof2025internshipprovidessimpleunderstanding ofournation’slegislativeprocess.Internscontributeto the daily operations of the o&ice.Duties includenot(greet visitors,answering phones leading toursofthecapitolattendingbriefingsandhearings performancelegislativerearch assistinglegislawcommunicationsstaff. Thoseinterested should send thereseumandcoverletter tojacqueline.camuy@mail.house.gov with‘Spring 2025 Internship’inthe subjectsline.Applicationsare-reviewedonasrollingbass UntillNovember2nd.Texasties preferred.Hours:Fullempt interns willwork9a.m.top.m. whenoutofsession,8:30a.m.–6p.m.whenin sessionMondaythroughtFridayint order tomeet thefultimestatedInterns will be able to use the Metro and will be reimbursed for their commutes to and from the o&ice.\n",
    "DW_NOMINATE": 0.6110000014305115,
    "LES": 0.4777279794216156
  },
  {
    "Post_ID": "MEM-416-24",
    "Posting_Author": "Congresswoman Summer Lee",
    "Congress_Number": null,
    "State_District": null,
    "Location": "",
    "Job_Function": "",
    "Title_Parsed": "",
    "Office_Type": "",
    "Responsibilities": [],
    "Qualifications": [],
    "Salary_Min": null,
    "Salary_Max": null,
    "Skills_Mentioned": [],
    "Equal_Opportunity_Information": "",
    "Cleaned_Text": "The O‖ice of Congresswoman Summer Lee is committed to investing in the next generation of public leaders and citizen activists. Congressional internships offer a comprehensive learning opportunity to understand better how congressional offices and the legislative process work. Both in the Washington, DC, and District Office, the internship program is designed to be a learning experience in which students are exposed to various areas including constituent services, scheduling, office administration, press and communications, and legislative policy.\nTypical duties will include answering phones, leading Capitol tours (Washington, D.C.based), researching legislation for the Member and legislative staff-, attending hearings and briefings, and answering constituent letters on a variety of issues. The ideal candidate for this paid, part-time internship will be team-oriented and have strong written and verbal communication skills.\nStudents and recent graduates who are interested in the legislative process are highly encouraged to apply. The Congresswoman is on the Oversight and Accountability Committee and the Space, Science, and Technology Committee. Ties to Pennsylvania’s 12th Congressional District are preferred, but not necessary.\n\nAll applicants should apply by November 15, 2024,\nat: https://summerlee.house.gov/internships.",
    "DW_NOMINATE": null,
    "LES": null
  },
  {
    "Post_ID": "MEM-414-24",
    "Posting_Author": "The O",
    "Congress_Number": null,
    "State_District": null,
    "Location": null,
    "Job_Function": "Intern",
    "Title_Parsed": "Office of Congresswoman Sydney Kamlager-Dove",
    "Office_Type": "Legislative",
    "Responsibilities": [
      "Answer phones and assist in correspondence with constituents",
      "Greet constituents and office visitors",
      "Process tour requests and lead Capitol tours",
      "Handle mail",
      "Assist in processing casework",
      "Perform legislative research",
      "Work on other administrative tasks as directed"
    ],
    "Qualifications": [
      "Interest in the legislative process and civic service",
      "Excellent writing, research, organization, time management, and communication skills",
      "Ability to work well in a team environment",
      "General understanding of the US political system"
    ],
    "Salary_Min": null,
    "Salary_Max": null,
    "Skills_Mentioned": [
      "Legislative affairs",
      "Communication",
      "Writing",
      "Research"
    ],
    "Equal_Opportunity_Information": "(none specified)",
    "Cleaned_Text": "The O\ncorporates open communication, hard work, and creating a collegial environment. We are seeking interns with a can-do attitude who are eager to grow.",
    "DW_NOMINATE": null,
    "LES": null
  },
  {
    "Post_ID": "MEM-409-24",
    "Posting_Author": "Congresswoman Suzan DelBene",
    "Congress_Number": null,
    "State_District": "1st Congressional District of Washington state",
    "Location": "Washington, D.C.",
    "Job_Function": null,
    "Title_Parsed": null,
    "Office_Type": null,
    "Responsibilities": [
      "greeting constituents and handling constituent phone calls",
      "assisting sta& with administrative tasks",
      "conducting research",
      "assisting with constituent correspondence"
    ],
    "Qualifications": null,
    "Salary_Min": null,
    "Salary_Max": null,
    "Skills_Mentioned": null,
    "Equal_Opportunity_Information": null,
    "Cleaned_Text": "MEM-409-24\nCongresswoman Suzan DelBene, representing the 1st Congressional District of Washington state, seeks interns for her Washington, D.C. and District (Kirkland) o&ices.\nInterns will work in a fast-paced congressional o&ice, gaining valuable experience and\nknowledge of the United States Congress.\nIntern responsibilities include greeting constituents and handling constituent phone calls,\ness Sta& with administrative tasks, conducting research, and assisting with\nconstituent correspondence. Kirkland, WA interns will have the opportunity to attend community events and tours with the Congresswoman and sta&. Washington, D.C. interns\ntake advantage of leading tours of the U.S. Capitol as well as attending hearings and\nbrieﬁngs for the legislative sta&r.",
    "DW_NOMINATE": null,
    "LES": null
  },
  {
    "Post_ID": "MEM-406-24",
    "Posting_Author": "Congressman Shri Thanedar",
    "Congress_Number": null,
    "State_District": "MI-13",
    "Location": "The Washington, D.C. Office of Congressman Shri Thaneder (MI-13)",
    "Job_Function": "Press and Legislative Intern",
    "Title_Parsed": null,
    "Office_Type": "Congressman's office",
    "Responsibilities": [
      "Answering phone calls",
      "Greeting office visitors",
      "Drafting constituent correspondence",
      "Coordinating tour requests and leading tours of the Capitol",
      "Attending congressional briefings, hearings and other professional development events",
      "Drafting press releases to be posted on the website and social media accounts",
      "Researching legislation and writing cosponsor memos for the legislative team",
      "Assisting operations, communications, and legislative staffers with various tasks"
    ],
    "Qualifications": [
      "an eagerness to learn",
      "customer service skills",
      "strong writing skills"
    ],
    "Salary_Min": null,
    "Salary_Max": null,
    "Skills_Mentioned": [
      "writing",
      "communications",
      "customer service"
    ],
    "Equal_Opportunity_Information": "This office is an Equal Opportunity Employment Office and does not discriminate on the basis of race, color, religion, sex, gender identity, sexual orientation, or age. We strongly encourage BIPOC-identifying individuals and members of other underrepresented communities to apply.",
    "Cleaned_Text": "Spring DC Internship",
    "DW_NOMINATE": -0.3580000102519989,
    "LES": 0.3025133609771729
  },
  {
    "Post_ID": "MEM-404-24",
    "Posting_Author": "FERN HOLLAND INTERNATIONAL AFFAIRS FELLOWSHIP",
    "Congress_Number": null,
    "State_District": null,
    "Location": null,
    "Job_Function": null,
    "Title_Parsed": "full-time, paid foreign policy fellowship",
    "Office_Type": "Washington,D.C.",
    "Responsibilities": [
      "Conducting legislative research.",
      "Taking notes at briefing(s) and hearings.",
      "Organizing research from Members of Congress and outside organizations.",
      "Writing briefings for the Congressman.",
      "Drafting questions for House Armed Services Committee and Select Committee on China hearings."
    ],
    "Qualifications": [
      "Pell Grant-eligible",
      "Current undergraduate students",
      "Current graduate students",
      "Recent college graduates"
    ],
    "Salary_Min": null,
    "Salary_Max": null,
    "Skills_Mentioned": [
      "foreign policy and national security",
      "brieﬁngs and hearings",
      "legislative research",
      "research from Members of Congress and outside organizations",
      "writing briefings"
    ],
    "Equal_Opportunity_Information": "FERN HOLLAND INTERNATIONAL AFFAIRS FELLOWSHIP is an equal opportunity employer. A job posting does not imply a current availability for vacancies.",
    "Cleaned_Text": "MEM-404-24\n\nFERN HOLLAND INTERNATIONAL AFFAIRS FELLOWSHIP\nCongressman Moulton o&ers a full-time, paid foreign policy fellowship in our Washington,\nD.C. o&ice.\nThis opportunity is only open to candidates who are currently Pell Grant-eligible\nor who were Pell Grant-eligible while pursuing their bachelor's degree.\nCurrent\nundergraduate students, current graduate students, and recent college graduates are\nwelcome to apply, though preference is given to graduate students.\nThe fellow will work on\ndassignments on foreign policy and national security,\nin addition to some regularly assigned\nintern responsibilities.\nRESPONSIBILITIES\nConducting legislative research.\nTaking notes at brieﬁngs and hearings.\nOrganizing research from Members of Congress and outside organizations.\nWriting brieﬁngs for the Congressman.\nDrafting questions for House Armed Services Committee and Select Committee on China\nhearings.\nThe full fellowship description can be found here.\nAPPLICATIONS:\nPlease email MA06.Resumes@mail.house.gov with your resume and cover letter using the\nsubject line: FHF: LAST NAME.{/p}•{p}{p}\n•{p}•{p}",
    "DW_NOMINATE": null,
    "LES": null
  },
  {
    "Post_ID": "MEM-400-24",
    "Posting_Author": "The Washington D.C. O&ice of Representative Brad Sherman CA-32",
    "Congress_Number": null,
    "State_District": "CA-32",
    "Location": "Washington D.C.",
    "Job_Function": "Internship",
    "Title_Parsed": null,
    "Office_Type": "Congressional",
    "Responsibilities": [
      "Greeting guests and assisting with front office operations;",
      "Answering phones, recording constituent opinions, and correctly processing other inquiries;",
      "Conducting Capitol tours for constituents and other guests;",
      "Day-to-day office work to assist with the functioning of the congressional office and other duties as delegated by members of the staff;",
      "Supporting the Legislative Correspondent with sorting mail and drafting constituent letters;"
    ],
    "Qualifications": [
      "Self-starter with strong attention to detail",
      "Ability to work in a fast-paced environment",
      "Good sense of humor"
    ],
    "Salary_Min": null,
    "Salary_Max": null,
    "Skills_Mentioned": [
      "Functions of a congressional office",
      "Congressional communications",
      "The legislative process"
    ],
    "Equal_Opportunity_Information": "CA-32 ties are preferred but not required.",
    "Cleaned_Text": "",
    "DW_NOMINATE": -0.3429999947547913,
    "LES": 0.8224154114723206
  },
  {
    "Post_ID": "MEM-397-24",
    "Posting_Author": "Congressman Tim Kennedy's Office",
    "Congress_Number": null,
    "State_District": "Washington, D.C.",
    "Location": "Washington, D.C. The Bu&alo District O&ice",
    "Job_Function": "Internship",
    "Title_Parsed": "Intern",
    "Office_Type": "Congressional office",
    "Responsibilities": [
      "Answering phones",
      "Administrative duties",
      "Legislative research",
      "Attending hearings and meetings",
      "Brieﬁngs",
      "Drafting correspondence, letters, and Congressional Extensions of Remarks",
      "Assisting with media monitoring",
      "Constituent casework",
      "District-based projects"
    ],
    "Qualifications": [
      "Experience working for a member of Congress",
      "Knowledge of the legislative process"
    ],
    "Salary_Min": null,
    "Salary_Max": null,
    "Skills_Mentioned": [],
    "Equal_Opportunity_Information": "We do not discriminate based on race, ethnicity, gender, sexual orientation, religion, national origin, age, or socioeconomic status.",
    "Cleaned_Text": "Internships in the O\ncssion of Congressman Tim Kennedy are available for the f\"ll, spring, and summer sessions for college students and recent graduates. Students will gain\ninvaluable experience working for a member of Congress alongside congressional sta\". Hours can be\nflexible to accommodate academic schedules.\nIn Washington, D.C. and the Bu\ndalo District O\ncssion, intern responsibilities vary, but typically include answering phones, administrative duties, legislative research, attending hearings, meetings, and brie\ngs, drafting correspondence, letters, and Congressional Extensions of Remarks, and assisting with media monitoring. In addition, interns may be assigned to assist in various constituent casework or assist with district-based projects. As a result, interns learn about the legislative process and the many other functions of a congressional оffice.\nTo apply for an internship, please email <ny26internapplication@kennedyny26.com> with the subject line [Name], [DC or District Intern], and [Session (Spring, Summer, Fall)].\nPlease include a resume, cover letter, and three references as attachments. Applications will be reviewed on a rolling basis, and you will be notiﬁed if and when the position has been ﬁlled.\nWe do not discriminate based on race, ethnicity, gender, sexual orientation, religion, national origin, age, or socioeconomic status. All are welcome and encouraged to apply.",
    "DW_NOMINATE": null,
    "LES": null
  },
  {
    "Post_ID": "MEM-396-24",
    "Posting_Author": "Congressman Kevin Hern (OK-01)",
    "Congress_Number": null,
    "State_District": "Oklahoma's 1st Congressional District",
    "Location": "Washington, D.C. office for the 2025 Spring Term (January – April/May)",
    "Job_Function": null,
    "Title_Parsed": null,
    "Office_Type": null,
    "Responsibilities": [
      "answering constituent phone calls",
      "taking notes at briefings and hearings",
      "conducting tours of the Capitol",
      "drafting correspondence letters",
      "assembling press and news clips",
      "assisting with other research and administrative duties"
    ],
    "Qualifications": [
      "strong interest in public policy",
      "demonstrated responsibility",
      "respectable personal conduct",
      "committed to serving constituents"
    ],
    "Salary_Min": null,
    "Salary_Max": null,
    "Skills_Mentioned": null,
    "Equal_Opportunity_Information": "Congressman Hern's office is an equal opportunity employer.",
    "Cleaned_Text": "The o&ice of Congressman Kevin Hern (OK-01) seeks motivated and team-oriented Interns to assist with various o&ice duties based in his Washington, D.C. o&ice for the 2025 Spring Term (January – April/May). Internships are intended to current undergraduate students, recent college graduates, and students currently enrolled in graduate school.\n\nResponsibilities include, but are not limited to, answering constituent phone calls, taking notes at briefings and hearings, conducting tours of the Capitol, drafting correspondence letters, assembling press and news clips, and assisting staff with other research and administrative duties.\nIdeal candidates have a strong interest in public policy, demonstrated responsibility, respectable personal conduct, and are committed to serving the constituents of\nOklahoma’s 1st Congressional District with the utmost diligence.\n\nInterested candidates should visit •·hern.house.gov/services/internship.htm for application instructions.\nApplication Deadline: November 20th by 5pm CST\nStart Date: January",
    "DW_NOMINATE": null,
    "LES": null
  },
  {
    "Post_ID": "MEM-394-24",
    "Posting_Author": "Joseph Morelle",
    "Congress_Number": null,
    "State_District": "NY-25",
    "Location": "Rochester, NY",
    "Job_Function": "The District Office of the Representative in Rochester",
    "Title_Parsed": "NULL (missing key information)",
    "Office_Type": "District",
    "Responsibilities": [],
    "Qualifications": [],
    "Salary_Min": null,
    "Salary_Max": null,
    "Skills_Mentioned": [],
    "Equal_Opportunity_Information": "District Internship ",
    "Cleaned_Text": "MEM-394-24\nThe District O&ice of Representative Joseph Morelle, NY-25 in Rochester, NY, will be\naccepting applications for an in-person internship during the Spring Semester 2025.\nApplications will be accepted September 30th, 2024 – November 1st, 2024.\n•\n•\n•\n•\n•\nInterns will be responsible for:\nCompleting constituent calls\nWriting letters, certiﬁcates, and proclamations\nDay-to-day o&ice work\nInteracting with members of sta& in the Rochester o&ice and virtually in the D.C. o&ice\nOther duties delegated by members of sta& including various constituent case work or\nwork on District-based projects of importance\nAs a result, interns will learn about the functions of a congressional o&ice, congressional\ncommunications, and the legislative process.\nIdeal candidates should possess excellent communication skills, strong attention to detail,\nthe ability to work in a fast-paced environment, and a good sense of humor. New York State\nties are preferred but not required.\n•\n•\n•\n•\n•\nInterested applicants should submit the following in one PDF document:\nResume\nCover letter\nOne-page writing sample\nDates of availability\nApplications should be sent in PDF format to Eric.Gros@mail.house.gov with “NY-25 Spring 2025 District Internship” in the subject line.\nThe deadline for this internship application is November 1st, 2024, but applicants are\nencouraged to submit their application early. Interview requests will be sent out following\nthe November 1st deadline.\nFor more information on the district internship please visit:\nhttps://morelle.house.gov/congressional-internships\n    ---\n     ",
    "DW_NOMINATE": -0.3319999873638153,
    "LES": 0.9010738134384155
  },
  {
    "Post_ID": "MEM-393-24",
    "Posting_Author": "Congresswoman Kim Schrier",
    "Congress_Number": 8,
    "State_District": "Washington's 8th Congressional District",
    "Location": "",
    "Job_Function": "",
    "Title_Parsed": "",
    "Office_Type": "Congressional office",
    "Responsibilities": [
      "greeting constituents",
      "answering constituent phone calls",
      "supporting staff with administrative tasks",
      "conducting legislative research",
      "assisting with constituent correspondence",
      "other miscellaneous tasks as assigned"
    ],
    "Qualifications": [
      "exceptional written and oral communication skills",
      "high degree of professionalism",
      "strong interest in public service",
      "ability to multi-task and work with a team",
      "Washington state ties (plus)",
      "!["
    ],
    "Salary_Min": null,
    "Salary_Max": null,
    "Skills_Mentioned": [
      "legislative process",
      "!["
    ],
    "Equal_Opportunity_Information": "",
    "Cleaned_Text": "The O&ice of Congresswoman Kim Schrier (WA-08) is seeking interns in its Issaquah and Washington, D.C. o&ices for spring 2025.\nApplicants should be eager to learn more about the legislative process and want to be part\nof a hardworking team dedicated to serving Washington’s 8th Congressional District.\nInterns will work in a fast-paced Congressional o&ice, gaining valuable experience and\nknowledge of the United States Congress.\nIn Washington, D.C., intern responsibilities will include greeting constituents, answering\ncstituent phone calls, supporting staff with administrative tasks, conducting legislative\nersearch, assisting with constituent correspondence, and other miscellaneous tasks as\nassigned. Interns in Washington, D.C. also have the opportunity to lead tours of the U.S.\nCapitol, as well as attend brieﬁngs for the legislative sta&.\nIn the District o&ice, interns will assist with a variety of tasks, including day-to-day\no&ice work such as answering phones, writing letters, and assisting with media clips. District\no&ice interns may also help with constituent casework or other District-based projects of\nimportance.\nQualiﬁcations\nIdeal candidates will possess exceptional written and oral communication skills, a high\ndegree of professionalism, and a strong interest in public service. In addition, the ability to\nmulti-task and work with a team are a plus. Washington state ties are a plus, but not\nrequired.\nStarting and ending dates are ﬂexible, although prospective interns should be able to\ncomit at least 20 hours per week during business hours.\nCongressional internships are open to all majors and designed for undergraduate and\ngraduate students, as well as recent graduates with an interest in public service. Stipends\nor academic credit are available.\nPlease apply by November 15, 2024, at 11:59 p.m. ET.\n\nPlease be prepared to submit a cover letter, resume, three references and relevant\ninformation at https://schrier.house.gov/services/internships. If you have issues with this\ngeneric form, please email relevant application materials to\nDistrictInternshipsWA08@mail.house.gov.",
    "DW_NOMINATE": null,
    "LES": null
  },
  {
    "Post_ID": "MEM-391-24",
    "Posting_Author": "Representative Jim Baird (IN-4)",
    "Congress_Number": null,
    "State_District": "IN-4",
    "Location": "Washington, DC o&ice",
    "Job_Function": " Legislative Support & Administration Internship",
    "Title_Parsed": null,
    "Office_Type": "Legislative Office",
    "Responsibilities": [
      "answering phones",
      "greeting o&ice visitors",
      "sorting mail",
      "conducting legislative research",
      "attending hearings and brieﬁngs",
      "giving tours of the U.S. Capitol",
      "assisting communications sta& with press releases and social media",
      "drafting constituent letters"
    ],
    "Qualifications": [
      "strong oral and written communication skills",
      "detail oriented",
      "motivated and flexible",
      "positive attitude",
      "prior constituent or customer service experience (preferred)",
      "demonstrated interest in public service (preferred)",
      "District/Indiana ties (preferred)"
    ],
    "Salary_Min": null,
    "Salary_Max": null,
    "Skills_Mentioned": [
      "legislative research",
      "communications",
      "public policy"
    ],
    "Equal_Opportunity_Information": "The U.S. House of Representatives is an equal opportunity employer.",
    "Cleaned_Text": "{",
    "DW_NOMINATE": 0.4440000057220459,
    "LES": 0.8692197799682617
  },
  {
    "Post_ID": "MEM-390-24",
    "Posting_Author": "Congressman Moulton",
    "Congress_Number": null,
    "State_District": null,
    "Location": "Salem o&ice and Washington D.C. o&ice",
    "Job_Function": null,
    "Title_Parsed": "Internship",
    "Office_Type": null,
    "Responsibilities": [
      "Answering constituent phone calls and greeting constituents at the front desk.",
      "Categorizing and responding to constituent mail.",
      "Drafting form letters and cosponsor requests for the Congressman.",
      "Taking notes at briefings and hearings.",
      "Conducting tours of the Capitol for constituents.",
      "Assembling press and news clips.",
      "Performing a variety of other duties as assigned, such as conducting legislative research.",
      "Answering constituent phone calls and greeting constituents at the front desk.",
      "Assisting the Casework Team on a variety of casework requests involving federal agencies.",
      "Taking notes at briefings and hearings.",
      "Assembling press and news clips.",
      "Performing a variety of other duties as assigned, such as conducting legislative research and attending community events."
    ],
    "Qualifications": [
      "current undergraduate students",
      "current graduate students",
      "recent college graduates"
    ],
    "Salary_Min": null,
    "Salary_Max": null,
    "Skills_Mentioned": null,
    "Equal_Opportunity_Information": "The Moulton internships are open to current undergraduate students, current graduate students, and recent college graduates.",
    "Cleaned_Text": "- Congressmen Moulton seeking hard working indivduals passionate driven and committed to public service for internship in Salem office & Washington DC office Internships intended for current undergraduatue studnets current graduate students & recent colledge graduates Interns receive stipend distributed based on hour worked D C RESPONSIBILITIES •Answering constituent phone calls and greeting constiuents at the front desk•Categorizing and responding to consulate mail•Drafting form letters & cosponsor requests - For Congressman•Taking notes at briefings and hearings•Conducting tours of the Capitol for constituents•Assembling press and news clip•Performing variety othr duties as assigned such as conducting legislation research DISTRICT RESPONSIBILITIES •Answering constituent phone calls and greeting constiuents at front desk•Assisting Casework Team on variety of casework requests involving federal agenies•Taking notes at breifings hearing & Assembling press news clip•Performing variety othr duties as assigned such as conducting legislation researh ad attending community events APPLICATIONS Applicatants can find more information on internship portal at moulton.house.gov under Service tab All applications due on November tohhth 2024 & will be review after applicaiton period closes If you have trubble accesing application form above or have othr questions pleas email Emerson Jacobson (emerson.Jacobson@mail.house.gov) Internship",
    "DW_NOMINATE": null,
    "LES": null
  },
  {
    "Post_ID": "MEM-384-24",
    "Posting_Author": "Steve Cohen",
    "Congress_Number": null,
    "State_District": "TN-09",
    "Location": "Washington, D.C.",
    "Job_Function": null,
    "Title_Parsed": null,
    "Office_Type": "O&ice of Congressman Steve Cohen",
    "Responsibilities": [
      "Assist with constituent correspondence and draft email blasts and other forms of outreach.",
      "Attend virtual brieﬁngs and track virtual hearings.",
      "Conduct weekly legislative assignments.",
      "Conduct legislative research on an as-needed basis."
    ],
    "Qualifications": [
      "Demonstrated interest in politics, policy and/or public service.",
      "Strong communications and writing skills.",
      "Hard-working, dependable, detail-oriented and professional.",
      "Self-motivated (especially given that all work is remote).",
      "Ties to Tennessee’s 9th District are a bonus, but not required."
    ],
    "Salary_Min": null,
    "Salary_Max": null,
    "Skills_Mentioned": null,
    "Equal_Opportunity_Information": "The Equal Employment Opportunity Commission has determined this employment opportunity is exempt from the requirements of the EEOPA.",
    "Cleaned_Text": "MEM-384-24 The Washington, D.C. O&ice of Congressman Steve Cohen (D-TN-09) is seeking interns for the spring of 2025.",
    "DW_NOMINATE": null,
    "LES": null
  }
]