[
  {
    "Post_ID": "MEM-458-24",
    "Posting_Author": "Congressman Steven Horsford’s District Office",
    "Congress_Number": null,
    "State_District": "District 4",
    "Location": "North Las Vegas, Nevada",
    "Job_Function": "",
    "Title_Parsed": "District Representative",
    "Office_Type": "full-time",
    "Responsibilities": [
      "Ensure outreach e2orts align with the Member’s strategic vision and goals.",
      "Coordinate closely with sta2 to ensure district priorities are reﬂective in legislative priorities.",
      "Build and maintain relationships with constituents and key community leaders.",
      "Organize and participate in community events, town halls, and outreach campaigns to engage constituents.",
      "Act as the representative for the Member within his or her area of responsibility, including answering casework correspondence, meeting with constituents, verbal communications with constituents, and serving as a liaison with federal, district, and local agencies.",
      "Handle casework assignments and assess casework for problems requiring legislative action, making recommendations to the District Director and Chief of Sta2.",
      "Monitor scheduled district meetings for the Member with constituents.",
      "Maintain a good working relationship with the Member, sta2, and constituents.",
      "Accept performance-based criticism and directions.",
      "Work well under pressure and handle stress.",
      "Work a ﬂexible schedule including long hours, nights, and weekends."
    ],
    "Qualifications": [
      "Political knowledge and comfortable navigating complicated situations",
      "Strong written, verbal, analytical, and organization skills; impeccable customer service manners; public speaking skills",
      "Ability to multi-task, manage time e2ectively, and adapt to changing priorities",
      "Candidates must be able to work a ﬂexible schedule, including occasional nights, weekends and some holidays."
    ],
    "Salary_Min": null,
    "Salary_Max": null,
    "Skills_Mentioned": null,
    "Equal_Opportunity_Information": "Congressman Steven Horsford’s District Office is an equal opportunity employer",
    "Cleaned_Text": "",
    "DW_NOMINATE": null,
    "LES": null
  },
  {
    "Post_ID": "MEM-457-24",
    "Posting_Author": "Congressman Joaquin Castro",
    "Congress_Number": null,
    "State_District": "San Antonio District O2ice",
    "Location": null,
    "Job_Function": "Staff Assistant",
    "Title_Parsed": "Staff Assistant",
    "Office_Type": "District O2ice",
    "Responsibilities": [
      "Front O2ice",
      "Manage incoming telephone calls.",
      "Assist with processing constituent mail.",
      "Respond to constituent requests for information.",
      "Perform administrative and clerical duties related to managing the front o2ice.",
      "Draft constituent correspondence."
    ],
    "Qualifications": [
      "Bachelor's degree or equivalent combination of education and experience preferred",
      "Prior constituent service or customer relationship management is preferred"
    ],
    "Salary_Min": 50000,
    "Salary_Max": null,
    "Skills_Mentioned": null,
    "Equal_Opportunity_Information": "The O2ice of Congressman Joaquin Castro is an equal opportunity employer.",
    "Cleaned_Text": "Congressman Joaquin Castro seeks an organized, hardworking StaG Assistant for his San Antonio District Office.\nResponsibilities include, but are not limited to:\nFront Office\nWelcome guests and manage incoming telephone calls.\nAssist with processing constituent mail.\nRespond to constituent requests for information.\nPerform administrative and clerical duties related to managing the front office.\nDraft constituent correspondence.\nAdditional Responsibilities:\nWork with DC office staff to facilitate requests.\nManage annual congressional constituent programs.\nAssist with casework for state inquiries, housing, and local referrals, and assist with federal casework as needed.\nPerform other duties as assigned.\n\nThe salary for this position is $50,000 per year. Our office provides a competitive benefits package that includes health insurance, dental, a federal student loan repayment program,\nand a Thrift Savings Plan (TSP) retirement plan.\nPreferred Education:\nBachelor's degree or equivalent combination of education and experience preferred\nPreferred Experience:\nPrior constituent service or customer relationship management is preferred\nTies to the District is preferred\nThe deadline to apply is November 8, 2024 . To apply, please email roseann.maldonado@mail.house.gov with “SA – Name” in the subject line and the following application materials attached as one combined PDF.\nCover Letter\nResume\n1-2 writing samples.\nTwo references, including name, title, organization, phone number, Email, and a onesentence description of your relationship to the reference.",
    "DW_NOMINATE": null,
    "LES": null
  },
  {
    "Post_ID": "MEM-456-24",
    "Posting_Author": "The O2ice of Congressman Jamie Raskin (MD-08)",
    "Congress_Number": null,
    "State_District": "Maryland's Eighth District",
    "Location": "Washington, D.C. office",
    "Job_Function": "Senior Legislative Assistant or Policy Advisor",
    "Title_Parsed": "Senior Legislative Assistant or Policy Advisor",
    "Office_Type": null,
    "Responsibilities": [
      "Identifying and proactively pursuing legislation and other policy initiatives related to the priorities of the Congressman and Maryland’s Eighth District.",
      "Working closely with the Legislative Director and Chief of Sta2 to formulate and execute a coordinated legislative strategy for the Congressman for assigned issue areas, and working with external stakeholders, the Congressional Research Service, Legislative Counsel, committee sta2, and other Congressional o2ices to draft and advance legislation and other policy initiatives.",
      "Tracking legislation and other developments in assigned issue areas in order to provide the Congressman and relevant sta2 with timely legislative updates, generate ideas, and work with communications team on press releases, op-eds, and speeches.",
      "Preparing and sta2ing the Congressman for meetings with constituents, advocacy groups, visitors and others.",
      "Meeting with constituents, stakeholders, and advocacy groups on the Congressman’s behalf.",
      "Drafting and reviewing constituent correspondence."
    ],
    "Qualifications": [
      "At least three years of relevant and substantive professional experience, including legislative experience and experience researching public policy, preparing recommendations and building coalitions.",
      "Subject matter knowledge and expertise in environmental and energy policy.",
      "Willingness to cover a diverse issue portfolio and be responsive to constituents’ varied concerns and perspectives.",
      "Exceptional writing skills, attention to detail, and creativity.",
      "Strong verbal communications skills and ability to communicate e2ectively with the Congressman, colleagues, constituents, and external stakeholders.",
      "Hard work, keen organization, e2ective time management, professional and discreet approach, and ability to work in a fast-paced and collaborative environment and quickly respond to requests from the Congressman, colleagues, and constituents.",
      "Ties to Maryland’s Eighth District, published articles and books, and facility with other languages are a plus."
    ],
    "Salary_Min": null,
    "Salary_Max": null,
    "Skills_Mentioned": null,
    "Equal_Opportunity_Information": "The U.S. House of Representatives is an equal opportunity employer and does not discriminate on the basis of race, color, religion, sex, national origin, age, disability, military status, gender identity and expression, marital status, parental status, or sexual orientation, or any other characteristic protected by applicable law.",
    "Cleaned_Text": "MEM-456-24\nJob Opening: Senior Legislative Assistant or Policy Advisor\nThe O2ice of Congressman Jamie Raskin (MD-08) seeks an energetic and detail-oriented Senior Legislative Assistant or Policy Advisor to advance the Congressman’s priorities related to the environment, energy, transportation, and other policy areas to be assigned. This is a full-time, in-person position in the Washington, D.C. o2ice.\n\nKey responsibilities will include:\n• Identifying and proactively pursuing legislation and other policy initiatives related to the\npriorities of the Congressman and Maryland’s Eighth District.\n• Working closely with the Legislative Director and Chief of Sta2 to formulate and execute a\ncoordinated legislative strategy for the Congressman for assigned issue areas, and working\nwith external stakeholders, the Congressional Research Service, Legislative Counsel,\ncommittee sta2, and other Congressional o2ices to draft and advance legislation and\nother policy initiatives.\n• Tracking legislation and other developments in assigned issue areas in order to provide\nthe Congressman and relevant sta2 with timely legislative updates, generate ideas, and\nwork with communications team on press releases, op-eds, and speeches.\n• Preparing and sta2ing the Congressman for meetings with constituents, advocacy groups,\nvisitors and others.\n• Meeting with constituents, stakeholders, and advocacy groups on the Congressman’s\nbehalf.\n• Drafting and reviewing constituent correspondence.\n\nThis position will report directly to the Legislative Director and work in close collaboration\nwith the Congressman, Chief of Sta2, the District O2ice team, and the communications\nteam. This position may include evening and weekend work as the Congressional schedule\nrequires.\n\nKey qualiﬁcations include:\n• At least three years of relevant and substantive professional experience, including legislative\nexperience and experience researching public policy, preparing recommendations and building\ncoonspiracies. This is not an entry-level position.\n• Subject matter knowledge and expertise in environmental and energy policy.\n• Willingness to cover a diverse issue portfolio and be responsive to constituents’ varied\nconcerns and perspectives.\n• Exceptional writing skills, attention to detail, and creativity.\n• Strong verbal communications skills and ability to communicate e2ectively with the\ngCongressman, colleagues, constituents, and external stakeholders.\n• Hard work, keen organization, e2ective time management, professional and discreet\napproach, and ability to work in a fast-paced and collaborative environment and quickly\nrespond to requests from the Congressman, colleagues, and constituents.\n• Ties to Maryland’s Eighth District, published articles and books, and facility with other\nlanguages are a plus.\n\nCandidates from diverse backgrounds and underrepresented communities are strongly\nencouraged to apply. The U.S. House of Representatives is an equal opportunity employer\nand does not discriminate on the basis of race, color, religion, sex, national origin, age,\ndisability, military status, gender identity and expression, marital status, parental status, or\nsexual orientation, or any other characteristic protected by applicable law, in any of its\nergies or operations. Salary and title will be commensurate with experience.\n\nThe deadline for applications is Friday, November 8 at 5pm. To apply, please send an email\nto MD08.Resumes@mail.house.gov with “Legislative Assistant or Policy Advisor: Last\nName” in the subject line and the following application materials attached as one\ncombed PDF:\no Cover letter (not to exceed two pages) – please customize your letter to this position\no Résumé\no Two writing samples (not to exceed two pages each)\nom Three references – for each reference, please include name, current title/o2ice, phone\nnumber, email, and a one-sentence description of your relationship to the reference",
    "DW_NOMINATE": null,
    "LES": null
  },
  {
    "Post_ID": "MEM-452-24",
    "Posting_Author": "Congressman Brendan Boyle (PA-2)",
    "Congress_Number": null,
    "State_District": null,
    "Location": null,
    "Job_Function": "Special Assistant",
    "Title_Parsed": "Special Assistant in his Washington, DC office",
    "Office_Type": null,
    "Responsibilities": [
      "Sta2ing/driving the member when in Washington, DC.",
      "Ensuring that the member has all necessary documents and materials prior to events, including coordinating with the Operations Director and Scheduler regarding member scheduling and logistics.",
      "Working with other Washington, DC based sta2 to prepare documents and other materials for the member prior to events and meetings.",
      "Managing the office’s phone and voicemail system.",
      "Helping to manage the office’s interns.",
      "Coordinating tours and flag requests.",
      "Assisting the scheduler and legislative sta2 with record keeping and other administrative tasks.",
      "Other duties as needed."
    ],
    "Qualifications": [
      "Strong organizational and communication abilities.",
      "Proﬁciency in Microsoft Office (Word, Outlook, Excel, Teams).",
      "The ability to multi-task and prioritize eﬀectively.",
      "Being a self-starter, detail oriented and punctual at all times.",
      "Having a strong general knowledge of the physical layout of Washington, DC."
    ],
    "Salary_Min": 420100,
    "Salary_Max": null,
    "Skills_Mentioned": [
      "Proﬁciency in Microsoft Office (Word, Outlook, Excel, Teams).",
      "The ability to multi-task and prioritize eﬀectively.",
      "Being a self-starter, detail oriented and punctual at all times.",
      "Having a strong general knowledge of the physical layout of Washington, DC."
    ],
    "Equal_Opportunity_Information": "This office is an equal opportunity employer and does not discriminate on the basis of race, sex, color, age, religion, national origin, sexual orientation, gender identity, or disability.",
    "Cleaned_Text": "MEM-452-24 Congressman Brendan Boyle (PA-2) is seeking a full-time sta2 member to serve as a Special Assistant in his Washington, DC o2ice. Responsibilities include (but are not limited to): Sta2ing/driving the member when in Washington, DC.\n\nEnsuring that the member has all necessary documents and materials prior to events, including coordinating with the Operations Director and Scheduler regarding\nmember scheduling and logistics.\n\nWorking with other Washington, DC based sta2 to prepare documents and other materials for the member prior to events and meetings.\n\nManaging the o2ice’s phone and voicemail system.\n\nHelping to manage the o2ice’s interns.\n\nCoordinating tours and ∟ag requests.\n\nAssisting the scheduler and legislative sta2 with record keeping and other administrative tasks.\n\nOther duties as needed.\n\nRequired skills include the following:\n\n• Strong organizational and communication abilities.\n\n• Proﬁciency in Microsoft O2ice (Word, Outlook, Excel, Teams).\n\n• The ability to multi-task and prioritize e\ffectively.\n\n• Being a self-starter, detail oriented and punctual at all times.\n\n• Having a strong general knowledge of the physical layout of Washington, DC.\n\nSkills that are not required but are will be looked favorably upon include the following:\n\n• Proﬁciency in Spanish or any other foreign language.\n\n     \n\nPrevious experience working on a political campaign or in the o2ice of an elected official. Candidates with prior Washington, DC based congressional (i.e. Capitol Hill) experience will be given priority.\n\nHaving a connection to Philadelphia or Southeastern Pennsylvania.\n\nHaving good general knowledge of the physical layout of Capitol Hill, including House and Senate o2ice buildings, as well as the U.S. Capitol Building.\n\nProﬁciency with Intranet Quorum or other CRM software.",
    "DW_NOMINATE": null,
    "LES": null
  },
  {
    "Post_ID": "MEM-451-24",
    "Posting_Author": "a conservative mid-western Member of Congress",
    "Congress_Number": null,
    "State_District": null,
    "Location": "the D.C. office",
    "Job_Function": null,
    "Title_Parsed": "Deputy Chief of StaG",
    "Office_Type": "based in the D.C. office",
    "Responsibilities": [
      "formulating policy positions",
      "overseeing the o2ice's legislative and media relations strategies",
      "collaborating with District sta2 on important outreach and communication e2orts"
    ],
    "Qualifications": [
      "Bachelor's degree",
      "Demonstrated interest in public service"
    ],
    "Salary_Min": null,
    "Salary_Max": null,
    "Skills_Mentioned": null,
    "Equal_Opportunity_Information": "All applicants will be considered without regard to race, color, religion, sex (including marital or parental status), sexual orientation, gender identity, disability, age, or national origin",
    "Cleaned_Text": "The o2ice of a conservative mid-western Member of Congress seeks to hire a Deputy Chief of StaG based in the D.C. office.",
    "DW_NOMINATE": null,
    "LES": null
  },
  {
    "Post_ID": "MEM-442-24",
    "Posting_Author": "Jason Crow (CO-06)",
    "Congress_Number": null,
    "State_District": null,
    "Location": "Washington, D.C.",
    "Job_Function": null,
    "Title_Parsed": "Legislative Assistant",
    "Office_Type": null,
    "Responsibilities": [
      "Meeting with constituents, stakeholders, and advocacy groups within the portfolio of issue areas",
      "Working with external stakeholders, CRS, Legislative Counsel, and committee sta2 to draft legislation based on the Member’s priorities",
      "Preparing and sta2ing the Member for meetings, and assisting in the drafting of remarks, as needed",
      "Communicating clearly and consistently with the Member, Legislative Director, and legislative, communications, and district teams on legislative updates"
    ],
    "Qualifications": [
      "Strong written and oral communications skills",
      "Detailoriented, organized, and creative",
      "Commitment to a collaborative work environment",
      "Ability to work in a fast-paced environment and manage competing priorities",
      "Ability to communicate up and down within the team",
      "Ability to learn the Congressman’s voice and legislative priorities",
      "Interest in identifying and pursuing new opportunities and the ability to anticipate and adapt to challenges"
    ],
    "Salary_Min": null,
    "Salary_Max": null,
    "Skills_Mentioned": [
      "Myth-19-7",
      "Pur-7-4",
      "Tec-4-WI-E1",
      "Bib-11-CO-RW5-3-2020-6-15"
    ],
    "Equal_Opportunity_Information": " Colorado ties are a plus and prior Hill experience is preferred.",
    "Cleaned_Text": "Legislative Assistant. ",
    "DW_NOMINATE": null,
    "LES": null
  },
  {
    "Post_ID": "MEM-438-24",
    "Posting_Author": "OGice of Congresswoman Jill Tokuda",
    "Congress_Number": null,
    "State_District": "District OGice",
    "Location": null,
    "Job_Function": "District Director",
    "Title_Parsed": "District Director",
    "Office_Type": null,
    "Responsibilities": [],
    "Qualifications": [],
    "Salary_Min": null,
    "Salary_Max": null,
    "Skills_Mentioned": [],
    "Equal_Opportunity_Information": null,
    "Cleaned_Text": "Rep. Jill Tokuda is looking for a highly motivated individual to manage her Hawaii sta2 and oversee operations and objectives to ensure community and constituent needs are met fully and in a timely manner...",
    "DW_NOMINATE": null,
    "LES": null
  },
  {
    "Post_ID": "MEM-431-24",
    "Posting_Author": "Congresswoman Alma Adams",
    "Congress_Number": null,
    "State_District": null,
    "Location": null,
    "Job_Function": null,
    "Title_Parsed": "Legislative Assistant",
    "Office_Type": "member of the House Education and the Workforce Committee",
    "Responsibilities": [
      "Preparing and sta2ing Member for meetings, committee hearings and markups, ﬂoor votes, and related events;",
      "Representing Member in meetings with constituents and both national- and local-level advocacy groups, think thanks, and other groups relevant to policy portfolio;",
      "Tracking legislation and other developments in assigned issue area(s), monitor relevant committee and ﬂoor activity, track developing local/international news events, make recommendations for votes, cosponsor ships and letters for Member to sign;",
      "Building and maintaining positive relationships with congressional sta2, district and national stakeholders, advocacy organizations, Executive Branch o2icials, and other key stakeholders relevant to policy portfolio;",
      "Building support for Member’s policy priorities and developing/implementing ideas for new initiatives (legislation, letters, events, press, etc.)",
      "Drafting legislation, letters, ﬂoor/committee remarks, talking points, press related materials, and other written material related to policy portfolio;",
      "Other duties as assigned by senior sta2."
    ],
    "Qualifications": [
      "knowledge of the legislative process",
      "demonstrate an ability to take initiative",
      "Hill experience is required"
    ],
    "Salary_Min": null,
    "Salary_Max": null,
    "Skills_Mentioned": null,
    "Equal_Opportunity_Information": "The O2ice of Representative Alma Adams is committed to developing an organization that is reﬂective of and attentive to the needs of the diverse community we serve. The o2ice does not discriminate on the basis of race, sex, color, age, religion, national origin, sexual orientation, gender identity, or disability.",
    "Cleaned_Text": "",
    "DW_NOMINATE": null,
    "LES": null
  },
  {
    "Post_ID": "MEM-425-24",
    "Posting_Author": "Rep. Greg Landsman",
    "Congress_Number": null,
    "State_District": null,
    "Location": null,
    "Job_Function": null,
    "Title_Parsed": null,
    "Office_Type": null,
    "Responsibilities": [],
    "Qualifications": [],
    "Salary_Min": null,
    "Salary_Max": 50,
    "Skills_Mentioned": [],
    "Equal_Opportunity_Information": "The office is an equal-opportunity employer and does not discriminate on the basis of race, color, religion, sex, sexual orientation, gender identity, national origin, disability, military status, age, marital status, or parental status.",
    "Cleaned_Text": "The o2ice of Rep. Greg Landsman seeks a highly motivated, energetic, and organized individual to serve as a Legislative Correspondent, based in our DC o2ice.\nThe LC reports to the Legislative Director and works in close collaboration with the Member, Chief of Sta2, and communications and district teams. The LC will manage the Congressperson’s constituent mail program and provide support to the full legislative team.\nKey duties include:\n\nDrafting tailored letters in response to constituent inquiries\nMaintain and update current response letter library\nSorts/batches incoming constituent mail by issue area\nEnsures accurate batching and a timely response to all constituents\nMeeting with constituents, stakeholders, and advocacy groups as needed\nCommunicating clearly and consistently with the Legislative Director, Chief of Sta2, and Member\n\nKey qualities include:\nStrong verbal and written communications skills and ability to communicate both up and down within the team\nExcellent organizational skills and ability to prioritize assignments\nAbility to work in a fast-paced environment and quickly respond to requests from the Member and the team\nCommitment to a collaborative work environment\nAbility to quickly learn and adapt to the Congressman’s voice, style, and legislative priorities\nComfort with receiving and delivering feedback\nAttention to detail, creativity, and most of all, hustle.\nSalary range is $50,000 - $55,000, commensurate with experience. Title commensurate with experience.\nCandidates of diverse backgrounds are encouraged to apply. Ohio ties are a plus. The office is an equal-opportunity employer and does not discriminate on the basis of race, color, religion, sex, sexual orientation, gender identity, national origin, disability, military status, age, marital status, or parental status.\nApplications will be accepted on a rolling basis. To apply, please\nEmail jobs.landsman@mail.house.gov with “Legislative Correspondent” in the subject line and the following application materials attached as one combined PDF:\n\nCover letter\nResume\nBrief writing sample\nTwo references including name, current title and organization, phone number, email, and a one-sentence description of your relationship to the reference (we will not contact these references without reaching out to you for your approval).\nNo phone calls or drop bys, please.",
    "DW_NOMINATE": null,
    "LES": null
  },
  {
    "Post_ID": "MEM-424-24",
    "Posting_Author": "Rep. Greg Landsman",
    "Congress_Number": 24,
    "State_District": null,
    "Location": null,
    "Job_Function": "Legislative Aide",
    "Title_Parsed": "Legislatve Aid",
    "Office_Type": null,
    "Responsibilities": [
      "Preparing and sta2ing the Member for meetings",
      "Working with committee sta2, external stakeholders, Legislative Counsel, and the Congressional Research Service to draft legislation based on the Member’s priorities",
      "Creating vote recommendations on legislation coming to the Floor within a given issue area",
      "Meeting with constituents, stakeholders, and advocacy groups within the portfolio of issue areas",
      "Communicating clearly and consistently with the Member, Chief of Sta2, and legislative, communications, and district teams on legislative updates",
      "Overseeing special projects, that may include drafting letters of support, and researching and advising local stakeholders on federal funding/grant opportunities"
    ],
    "Qualifications": [
      "Strong verbal and written communications skills and ability to communicate both up and down within the team",
      "Ability to work in a fast-paced environment and quickly respond to requests from the Member and the team",
      "Commitment to a collaborative work environment",
      "Ability to quickly learn and adapt to the Congressman’s voice, style, and legislative priorities",
      "Comfort with receiving and delivering feedback",
      "Attention to detail, creativity, and most of all, hustle"
    ],
    "Salary_Min": 65000,
    "Salary_Max": 65000,
    "Skills_Mentioned": null,
    "Equal_Opportunity_Information": "The o2ice is an equal-opportunity employer and does not discriminate on the basis of race, color, religion, sex, sexual orientation, gender identity, national origin, disability, military status, age, marital status, or parental status.",
    "Cleaned_Text": "<removed>\n\n MEM-424-24\n\nThe o2ice of Rep. Greg Landsman seeks a highly motivated, energetic, and detail-oriented individual to serve as a Legislative Aide, based in our DC o2ice.\n\n The Legislative Aide reports to the Legislative Director and works in close collaboration with the Member, Chief of Sta2, and communications and district teams. Exact issue area portfolio is ∯lexible, and applicants with backgrounds in any issue area are encouraged to apply.\n Key duties include:\n Preparing and sta2ing the Member for meetings\n Working with committee sta2, external stakeholders, Legislative Counsel, and the Congressional Research Service to draft legislation based on the Member’s priorities\n Creating vote recommendations on legislation coming to the Floor within a given issue area\n Meeting with constituents, stakeholders, and advocacy groups within the portfolio of issue areas\n Communicating clearly and consistently with the Member, Chief of Sta2, and legislative, communications, and district teams on legislative updates\n Overseeing special projects, that may include drafting letters of support, and researching and advising local stakeholders on federal funding/grant opportunities\n Key qualities include:\n Strong verbal and written communications skills and ability to communicate both up and down within the team\n Ability to work in a fast-paced environment and quickly respond to requests from the Member and the team\n Commitment to a collaborative work environment\n Ability to quickly learn and adapt to the Congressman’s voice, style, and legislative priorities\n Comfort with receiving and delivering feedback\n Attention to detail, creativity, and most of all, hustle\n The salary for this position is $65,000.\n Candidates of diverse backgrounds are encouraged to apply. Ohio ties are a plus. The o2ice is an equal-opportunity employer and does not discriminate on the basis of race, color, religion, sex, sexual orientation, gender identity, national origin, disability, military status, age, marital status, or parental status.\n Applications will be accepted on a rolling basis. To apply, please email\n jobs.landsman@mail.house.gov with “Legislative Aide” in the subject line and attach the following application materials as one combined PDF:\n Cover letter\n Résumé\n Two references including name, current title and organization, phone number, email, and a one-sentence description of your relationship to the reference (we will not contact these references without reaching out to you for your approval)\n \n No phone calls or drop bys, please.\n     ",
    "DW_NOMINATE": null,
    "LES": null
  },
  {
    "Post_ID": "MEM-415-24",
    "Posting_Author": "Rep. Maxine Waters",
    "Congress_Number": null,
    "State_District": "CA-43",
    "Location": "Washington D.C.",
    "Job_Function": "Communications Director",
    "Title_Parsed": "Communications Director",
    "Office_Type": "Member's Office",
    "Responsibilities": [
      "Develop and implement comprehensive communication strategies for the Member.",
      "Oversee media relations, including drafting press releases and managing inquiries.",
      "Coordinate communications e2orts with legislative initiatives.",
      "Craft speeches, op-eds, and other written materials.",
      "Manage social media presence and digital communications.",
      "Work closely with the Chief of Sta2 and Legislative Director to align messaging.",
      "Monitor and analyze media coverage of the Member and relevant issues.",
      "Serve as the primary spokesperson for the Member.",
      "Train and prepare the Member for public appearances and interviews."
    ],
    "Qualifications": [
      "Bachelor’s degree in Communications, Public Relations, or a related ﬁeld.",
      "5+ years of experience in communications, media relations, or public a2airs.",
      "Strong writing and editing skills with attention to detail.",
      "Experience working in a fast-paced political environment.",
      "Familiarity with social media platforms and digital communication strategies.",
      "Ability to manage multiple projects and deadlines e2ectively.",
      "Strong interpersonal and team collaboration skills.",
      "Knowledge of current legislative issues and their impact on constituents.",
      "Familiarity with California and/or District 43 preferred."
    ],
    "Salary_Min": null,
    "Salary_Max": null,
    "Skills_Mentioned": [],
    "Equal_Opportunity_Information": "This o2ice is an equal opportunity employer.",
    "Cleaned_Text": "The O2ice of Rep. Maxine Waters (D-CA-43) seeks a dynamic and experienced Communications Director to lead the development and implementation of communication strategies that promote the Member's priorities and initiatives...",
    "DW_NOMINATE": -0.656000018119812,
    "LES": 1.28559672832489
  },
  {
    "Post_ID": "MEM-411-24",
    "Posting_Author": "Congressman John Garamendi",
    "Congress_Number": null,
    "State_District": null,
    "Location": "The O2ice",
    "Job_Function": "Communications Director",
    "Title_Parsed": null,
    "Office_Type": "Representative",
    "Responsibilities": [
      "design and execute a communications plan to elevate the Representative and better connect him with his constituents",
      "drafting press releases",
      "authoring op-eds",
      "pitching and coordinating earned media",
      "overseeing social media content and strategy",
      "creating direct constituent mail",
      "telephone town halls",
      "directly manage and mentor two other communications sta2 members"
    ],
    "Qualifications": [
      "strong background in communications",
      "management experience",
      "writing skills with a strong prospective",
      "exceptional candidates seeking signiﬁcant earned media experience"
    ],
    "Salary_Min": null,
    "Salary_Max": null,
    "Skills_Mentioned": null,
    "Equal_Opportunity_Information": "Our office is an equal opportunity employer and does not discriminate based on race, religion, disability, age, ethnicity, national origin, sex, gender, LGBTQ+ identiﬁcation, family status, or military status.",
    "Cleaned_Text": "",
    "DW_NOMINATE": null,
    "LES": null
  },
  {
    "Post_ID": "MEM-410-24",
    "Posting_Author": "unknown",
    "Congress_Number": null,
    "State_District": null,
    "Location": null,
    "Job_Function": "constituent services representative",
    "Title_Parsed": "Constituent Services Representative",
    "Office_Type": "full time",
    "Responsibilities": [
      "Acts as the representative for the Member within his or her area of responsibility"
    ],
    "Qualifications": [
      "Possess strong oral and written communication skills"
    ],
    "Salary_Min": null,
    "Salary_Max": null,
    "Skills_Mentioned": [
      "Strong customer service, oral and written communication skills",
      "Familiarity with local, state and federal agencies"
    ],
    "Equal_Opportunity_Information": "Women, people of color, and LGBTQ candidates are strongly encouraged to apply.",
    "Cleaned_Text": "<cleaned_text>",
    "DW_NOMINATE": null,
    "LES": null
  },
  {
    "Post_ID": "MEM-392-24",
    "Posting_Author": "Congresswoman Emilia Sykes",
    "Congress_Number": null,
    "State_District": "Ohio",
    "Location": "Washington, D.C. office",
    "Job_Function": "Communications Director",
    "Title_Parsed": "Communications Director",
    "Office_Type": "Member's office",
    "Responsibilities": [
      "Creating and executing a robust communications plan;",
      "Establishing and maintaining relationships with Ohio, national, and D.C.-based media;",
      "Advancing press events and sta2ing the Member as needed, including occasional night and weekend commitments;"
    ],
    "Qualifications": [
      "prior political or legislative communications experience"
    ],
    "Salary_Min": 90000,
    "Salary_Max": 100000,
    "Skills_Mentioned": null,
    "Equal_Opportunity_Information": "Congresswoman Emilia Sykes' office is an equal opportunity employer and does not discriminate on the basis of race, color, religion, sex, sexual orientation, gender identity and expression, national origin, disability, military status, age, marital status, or parental status.",
    "Cleaned_Text": "MEM-392-24\nCongresswoman Emilia Sykes seeks a Communications Director to serve in their\nWashington, D.C. office. Candidates must be proactive, possess superior written and oral\ncommunication skills, and be able to execute a robust communications strategy.\n(This is not an entry-level position.)\nOnly candidates with prior political or legislative \ncommunications experience will be considered.\nPrimary responsibilities:\n•Creating and executing a robust communications plan;\n•Establishing and maintaining relationships with Ohio, national, and D.C.-based media;\n•Advancing press events and sta2ing the Member as needed, including occasional night\nand weekend commitments;\n•Drafting and distributing press releases, statements, and media advisories;\nCreating, editing, and strategically placing op-eds;\n•Overseeing the development of social media content creation, including rapid response;\n•Managing a franked communications plan including text messages, e-newsletters, digital\n ads, radio ads, 499s, mailers, etc;\n•Pitching to reporters and producers, responding to press inquiries, and serving as the\nmain point-of-contact for media;\n•Updating the website as needed;\n•Managing the Press Secretary; and \n•Performing other duties as assigned.\nCandidates of diverse backgrounds are encouraged to apply. The o2ice is an equalopportunity employer and does not discriminate on the basis of race, color, religion, sex, sexual orientation, gender identity and expression, national origin, disability, military status, age, marital status, or parental status.\nThe salary range for this position is $90,000-$100,000 based on experience.\nTo apply, please send a resume, three references, and two writing samples in one pdf to\nJoinTeamSykes@mail.house.gov with the following subject line: Full Name – Communications Director.",
    "DW_NOMINATE": null,
    "LES": null
  },
  {
    "Post_ID": "MEM-382-24",
    "Posting_Author": "null",
    "Congress_Number": null,
    "State_District": null,
    "Location": "District O2ices of Congressman Max Miller (Medina and Parma, Ohio)",
    "Job_Function": "AGairs Liaison",
    "Title_Parsed": "null",
    "Office_Type": "House",
    "Responsibilities": [
      "Act as the representative for the Member within his or her area of responsibility including answering casework correspondence..."
    ],
    "Qualifications": [
      "Bachelor's degree or equivalent combination of education and experience preferred; Previous o2ice experience is preferred; Previous experience working for a Member of Congress, elected o2icial, or government agency preferred"
    ],
    "Salary_Min": null,
    "Salary_Max": null,
    "Skills_Mentioned": [
      "Meets attendance requirements as established by the o2ice; Accepts performance based criticism and directions; Strong oral and written communication skills..."
    ],
    "Equal_Opportunity_Information": "null",
    "Cleaned_Text": "MEM-382-24\nThe Military and Veterans AGairs Liaison is responsible for maintaining relationships with veterans, military members, military installations and organizations, veterans organizations and o2ices...\nESSENTIAL JOB FUNCTIONS:\nActs as the representative for the Member within his or her area of responsibility including answering casework correspondence, meeting with constituents...",
    "DW_NOMINATE": null,
    "LES": null
  },
  {
    "Post_ID": "MEM-135-24",
    "Posting_Author": "Congresswoman Joyce Beatty (OH-03)",
    "Congress_Number": 3,
    "State_District": "OH-03",
    "Location": "Washington, D.C.",
    "Job_Function": null,
    "Title_Parsed": "Press Secretary",
    "Office_Type": "o2ice",
    "Responsibilities": [
      "Serve as the primary contact for media requests"
    ],
    "Qualifications": null,
    "Salary_Min": 100000,
    "Salary_Max": null,
    "Skills_Mentioned": [],
    "Equal_Opportunity_Information": "An Equal Opportunity Employer who does not discriminate in employment based on race...",
    "Cleaned_Text": "This is a job description for the press secretary position.",
    "DW_NOMINATE": null,
    "LES": null
  }
]