[
  {
    "Post_ID": "MEM-256-25",
    "Posting_Author": "Congresswoman Dina Titus\nt(NV-01)",
    "Congress_Number": null,
    "State_District": "NV-01",
    "Location": null,
    "Job_Function": null,
    "Title_Parsed": null,
    "Office_Type": null,
    "Responsibilities": [
      "answering constituent phone calls",
      "attending policy briefings and meetings",
      "providing tours of the United States Capitol",
      "conducting legislative research to support the needs of the Congresswoman's staff"
    ],
    "Qualifications": [
      "excellent oral and written communication skills",
      "prioritizes professionalism",
      "dedicated team player",
      "friendly persona"
    ],
    "Salary_Min": null,
    "Salary_Max": null,
    "Skills_Mentioned": null,
    "Equal_Opportunity_Information": "an equal opportunity employer and does not discriminate on the basis of race, color, religion, sex, sexual orientation, gender identity and expression, national origin, disability, military status, age, marital status, or parental status",
    "Cleaned_Text": "MEM-256-25\nCongresswoman Dina Titus (NV-01) seeks highly motivated candidates for a paid internship for the Fall 2025 Semester in our D.C. office.\nInterns in our D.C. office will have the opportunity to witness the legislative process and the inner workings of Capitol Hill first-hand. Responsibilities include but are not limited to\nanswering constituent phone calls, attending policy briefings and meetings, providing tours of the United States Capitol, and conducting legislative research to support the needs of the Congresswoman's staff.\nThe internship will run from September through December, from 9 am-6 pm when Congress is in session and from 9 am-5 pm when Congress is not in session.\n\nThe ideal candidate possesses excellent oral and written communication skills, prioritizes professionalism, is a dedicated team player, and has a friendly persona. Ties to Nevada's First District are a plus, but not required.\nThe office of Congresswoman Dina Titus is an equal opportunity employer and does not discriminate on the basis of race, color, religion, sex, sexual orientation, gender identity and expression, national origin, disability, military status, age, marital status, or parental status.\n\nHow to Apply:\nInterested applicants should fill out the form below and include a cover letter, resume, and short (1-2 page) writing sample. Applications will be accepted until Friday, August 8th, on a rolling basis. No calls or drop-ins, please.\nhttps://airtable.com/appvhTtUVUvgCTTsi/shrTW2qpRrf8JhjVp\ndouble bracket double",
    "DW_NOMINATE": null,
    "LES": null
  },
  {
    "Post_ID": "MEM-255-25",
    "Posting_Author": "Congressman Jim Costa",
    "Congress_Number": 21,
    "State_District": "CA",
    "Location": "",
    "Job_Function": "Digital/Press Intern",
    "Title_Parsed": "Press Intern for the Fall 2025 intern class",
    "Office_Type": "Congressional Office",
    "Responsibilities": [
      "Assist the Communications Director and Press Assistant with drafting social media content",
      "Edit photos and create engaging graphics in line with the Congressman’s brand.",
      "Clipping, editing, and compiling videos.",
      "Assist with the creation and maintenance of press lists.",
      "Compile daily press clips and reports about social media analytics."
    ],
    "Qualifications": [
      "Strong writing, editing, and digital skills",
      "Basic familiarity with graphic design/video editing software, such as Adobe, Canva, and Photoshop"
    ],
    "Salary_Min": 17,
    "Salary_Max": null,
    "Skills_Mentioned": [
      "Digital/Press Media Roll (including internships)",
      "Graphic Design",
      "Video Editing"
    ],
    "Equal_Opportunity_Information": "",
    "Cleaned_Text": "",
    "DW_NOMINATE": null,
    "LES": null
  },
  {
    "Post_ID": "MEM-252-25",
    "Posting_Author": "The Office of Congressman Nick Langworthy (NY-23)",
    "Congress_Number": null,
    "State_District": "NY-23",
    "Location": "Washington, D.C. Office",
    "Job_Function": "Intern",
    "Title_Parsed": "Intern",
    "Office_Type": "intern",
    "Responsibilities": [
      "Answering constituent phone calls and directing them appropriately",
      "Researching legislation for the Member and legislative staff",
      "Attending Congressional hearings and policy briefings",
      "Answering constituent letters on various issues before the House",
      "Helping the communications team",
      "Conducting tours of the US Capitol for constituents",
      "Other projects as assigned by staff"
    ],
    "Qualifications": [
      "Motivated",
      "Detail-oriented",
      "Strong work ethic",
      "Interact well with constituents",
      "Strong interest in the legislative process and the function of Congress",
      "New York ties"
    ],
    "Salary_Min": null,
    "Salary_Max": null,
    "Skills_Mentioned": [
      "Communication skills",
      "Policy analysis skills",
      "Legislative affairs"
    ],
    "Equal_Opportunity_Information": "This organization is an equal opportunity employer. ",
    "Cleaned_Text": "Successful applicants will be motivated, detail-oriented, display a strong work ethic, and interact well with constituents. In addition, applicants should have a strong interest in the legislative process and the function of Congress. New York ties are preferred but not required. Internship duties may include:\\u000a\\t\\n\\tAnswering constituent phone calls and directing them appropriately\\n\\u000a\\tResearching legislation for the Member and legislative staff\\n\\u000a\\tAttending Congressional hearings and policy briefings\\n\\u000a\\tAnswering constituent letters on various issues before the House\\n\\u000a\\tHelping the communications team\\n\\u000a\\tConducting tours of the US Capitol for constituents\\n\\u000a\\tOther projects as assigned by staff\\n\\u000ato apply, please send your resume and cover letter to justin.pavonarius@mail.house.gov with the subject line “Fall 2025 Internship Application.” \\n\\n\\n\\nThe Office of Congressman Nick Langworthy (NY-23)\n\n ",
    "DW_NOMINATE": 0.4180000126361847,
    "LES": 1.814272522926331
  },
  {
    "Post_ID": "MEM-241-25",
    "Posting_Author": "MEM-241-25",
    "Congress_Number": null,
    "State_District": null,
    "Location": "Washington D.C.",
    "Job_Function": "Internship support",
    "Title_Parsed": null,
    "Office_Type": null,
    "Responsibilities": [
      "Assisting with front office operations",
      "Answer constituent letters and phone calls",
      "Attend hearings and briefings related to the Congressman's portfolio",
      "Research legislation for the Member and legislative staff"
    ],
    "Qualifications": [],
    "Salary_Min": null,
    "Salary_Max": null,
    "Skills_Mentioned": [],
    "Equal_Opportunity_Information": "",
    "Cleaned_Text": "Ideal candidates will be organized, detail-oriented, and passionate about public service.\nApplicants should have excellent communication and writing skills.\nKey Responsibilities Include:\n- Assisting with front office operations\n- Answer constituent letters and phone calls\n- Attend hearings and briefings related to the Congressman's portfolio\n- Research legislation for the Member and legislative staff\nInternships are in-person, paid, and run from August through December with flexible start\nand end dates.\nTo apply, visit https://messmer.house.gov/forms/internships. Applications will be accepted on a rolling basis.",
    "DW_NOMINATE": null,
    "LES": null
  },
  {
    "Post_ID": "MEM-239-25",
    "Posting_Author": null,
    "Congress_Number": null,
    "State_District": "IL-08",
    "Location": "",
    "Job_Function": null,
    "Title_Parsed": null,
    "Office_Type": null,
    "Responsibilities": [
      "Compiling press clips by 9:30am ET every morning",
      "Social media strategizing for increased growth",
      "Drafting daily social media posts and ideas for Instagram, Twitter, and Facebook",
      "Creating graphics for social media, knowledge of Canva preferred",
      "Drafting speeches",
      "Other duties as needed to support the communications team"
    ],
    "Qualifications": [
      "proactive press intern to assist on an aggressive communications team",
      "available to begin in mid-August",
      "strong and positive work ethic",
      "pay attention to detail",
      "be responsive and punctual",
      "solid writing and editing skills",
      "diligent, communicative, creative, willing to perform and follow through on a wide variety of tasks"
    ],
    "Salary_Min": null,
    "Salary_Max": null,
    "Skills_Mentioned": [
      "Canva"
    ],
    "Equal_Opportunity_Information": "Congressman Raja Krishnamoorthi (IL-08) is seeking",
    "Cleaned_Text": "The Office of Congressman Raja Krishnamoorthi (IL-08) is seeking a highly motivated, proactive press intern to assist on an aggressive communications team. Applicants must be available to begin in mid-August. Qualified candidates will demonstrate a strong and positive work ethic, pay attention to detail, be responsive and punctual, and have solid writing and editing skills. Preferred applicants are diligent, communicative, creative, and willing to perform and follow through on a wide variety of tasks. A monthly stipend is available. Hours = 9am-5pm ET Monday through Friday Position can be in person or hybrid Intern responsibilities include:\n*Compiling press clips by 9:30am ET every morning\n*Social media strategizing for increased growth\n*Drafting daily social media posts and ideas for Instagram, Twitter, and Facebook\n*Creating graphics for social media, knowledge of Canva preferred\n*Drafting speeches\n*Other duties as needed to support the communications team\nInterested applicants should please send a resume, cover letter, writing sample, and graphic sample to KrishnamoorthiPressInternship@gmail.com.",
    "DW_NOMINATE": null,
    "LES": null
  },
  {
    "Post_ID": "MEM-237-25",
    "Posting_Author": "Representative Seth Magaziner (RI-02)",
    "Congress_Number": null,
    "State_District": "RI-02",
    "Location": "Warwick, Rhode Island office",
    "Job_Function": null,
    "Title_Parsed": null,
    "Office_Type": null,
    "Responsibilities": [
      "Provides a welcoming environment and positive first impression of the Member office to constituents, visitors, and other VIPs;",
      "Answers incoming calls with poise, professionalism, and promptness;",
      "Assists Member and key staff (e.g. Staff Assistant, Press Assistant, Constituent Services Team) with logistical and administrative duties;",
      "Receives and logs input from constituents on policy matters for the Member office’s consideration and response;",
      "Conducts research, and drafts correspondence and memoranda;",
      "Assists with planning and execution of Member’s public outreach at local events;",
      "Accompanies district staff to public forums, meetings, and events as a representative to the Member."
    ],
    "Qualifications": null,
    "Salary_Min": null,
    "Salary_Max": null,
    "Skills_Mentioned": null,
    "Equal_Opportunity_Information": "Applicants should apply on our website https://magaziner.house.gov/services/internships.",
    "Cleaned_Text": "",
    "DW_NOMINATE": null,
    "LES": null
  },
  {
    "Post_ID": "MEM-236-25",
    "Posting_Author": "The Democratic Staff of the House Committee on Veterans' Affairs",
    "Congress_Number": null,
    "State_District": null,
    "Location": "Washington, D.C.",
    "Job_Function": null,
    "Title_Parsed": "Law Clerk",
    "Office_Type": null,
    "Responsibilities": [
      "Conducting research,"
    ],
    "Qualifications": [
      "having superior organizational skills, a strong work ethic, ability to pay close attention to detail, as well as excellent research, writing and analytical skills"
    ],
    "Salary_Min": null,
    "Salary_Max": null,
    "Skills_Mentioned": [],
    "Equal_Opportunity_Information": "The Committee strongly encourages veterans, minorities, women, people with disabilities, LGBTQ+ candidates, and HBCU and MSI students to apply.",
    "Cleaned_Text": "",
    "DW_NOMINATE": null,
    "LES": null
  },
  {
    "Post_ID": "MEM-235-25",
    "Posting_Author": "Democratic Staff of the House Committee on Veterans' Affairs",
    "Congress_Number": null,
    "State_District": null,
    "Location": "Washington, D.C.",
    "Job_Function": "press/digital intern",
    "Title_Parsed": null,
    "Office_Type": null,
    "Responsibilities": [
      "Compiling and distributing morning press clips,"
    ],
    "Qualifications": [
      "strong oral and written communications skills,"
    ],
    "Salary_Min": null,
    "Salary_Max": null,
    "Skills_Mentioned": null,
    "Equal_Opportunity_Information": "The Committee strongly encourages veterans, minority, women, people with disabilities, LGBTQ+ candidates, and HBCU and MSI students to apply.",
    "Cleaned_Text": "The Democratic Staff of the House Committee on Veterans' Affairs seeks a press/digital intern for the Fall 2025 semester. Responsibilities include, but are not limited to:\n\nCompiling and distributing morning press clips,\nTracking media hits for Committee members,\nAssisting with video shoots,\nAssisting with creating messaging packets and digital toolkits for the caucus,\nWriting first drafts of remarks, press releases, and video scripts,\nDeveloping social media content, and\nClipping floor and hearing remarks from members.\nA strong work ethic, the ability to excel in fast-past environments, and a willingness to \nassist wherever needed is a must.\nThe ideal candidate will have strong oral and written communications skills, be detailoriented, has a familiarity with social media platforms, and have a desire to help veterans\nand learn about the Committee and the legislative process. The Committee strongly\nencourages veterans, minority, women, people with disabilities, LGBTQ+ candidates, and\nHBCU and MSI students to apply.\nThis paid, full-time or part-time, in-person position is based in Washington, D.C.\nCandidates must submit a cover letter, resume, and writing samples through the online\napplication accessible at –https://democrats-veterans.house.gov/opportunities.\nThe deadline to apply 5 p.m. on Friday, August 1, 2025.",
    "DW_NOMINATE": null,
    "LES": null
  },
  {
    "Post_ID": "MEM-233-25",
    "Posting_Author": null,
    "Congress_Number": null,
    "State_District": "7th District of California",
    "Location": "Washington, D.C.",
    "Job_Function": "Press and Digital Intern",
    "Title_Parsed": "Intern",
    "Office_Type": "Congresswoman's office",
    "Responsibilities": null,
    "Qualifications": null,
    "Salary_Min": null,
    "Salary_Max": null,
    "Skills_Mentioned": null,
    "Equal_Opportunity_Information": null,
    "Cleaned_Text": "MEM-233-25 Congresswoman Doris Matsui seeks interns for 2025 term in Washington, D.C. interested candidates should have written editing and social media skills; preference goes to California natives or alumni of a press digital school.",
    "DW_NOMINATE": null,
    "LES": null
  },
  {
    "Post_ID": "MEM-232-25",
    "Posting_Author": "Congresswoman Doris Matsui",
    "Congress_Number": null,
    "State_District": "7th Congressional District of California",
    "Location": "Washington, D.C. and District (Sacramento)",
    "Job_Function": null,
    "Title_Parsed": null,
    "Office_Type": null,
    "Responsibilities": [
      "answering phones",
      "data entry"
    ],
    "Qualifications": null,
    "Salary_Min": null,
    "Salary_Max": null,
    "Skills_Mentioned": null,
    "Equal_Opportunity_Information": "This office is an equal opportunity employer and does not discriminate based on race, religion, disability, age, ethnicity, national origin, sex, gender, LGBTQ identification, family status, or military status.",
    "Cleaned_Text": "Congresswoman Doris Matsui, representing the 7th Congressional District of California, seeks interns for her Washington, D.C. and District (Sacramento) offices for the Fall 2025 term.\n\nInterns will have a unique opportunity to learn about the legislative process first-hand and the many functions of a Congressional office.\n\nIntern responsibilities will vary but may include answering phones and data entry.\nWashington DC interns may be asked to assist in researching legislation for the Member and legislative staff, attending briefings, hearings, and markups; and answering constituent letters on various issues. Interns based in California may also be asked to assist on a variety of constituent casework or in-district projects, as needed.\n\nTo apply, please visit the “Internships” page of Congresswomen Matsui’s official website and complete the application form: https://matsui.house.gov/services/internships. As part of the application, a cover letter, resume, and 2 writing samples are required. Ties to California's 7th District are preferred, but not required. All applications are considered on a rolling basis. All applications are considered on a rolling basis.\n\nThis office is an equal opportunity employer and does not discriminate based on race, religion, disability, age, ethnicity, national origin, sex, gender, LGBTQ identification, family status, or military status.",
    "DW_NOMINATE": null,
    "LES": null
  },
  {
    "Post_ID": "MEM-231-25",
    "Posting_Author": "Jason Smith (MO-08)",
    "Congress_Number": null,
    "State_District": "MO-08",
    "Location": null,
    "Job_Function": "None specified in the text",
    "Title_Parsed": null,
    "Office_Type": "Not applicable as it is a congressional office.",
    "Responsibilities": [
      "corresponding and communicating with constituents",
      "researching policy",
      "guiding Capitol building tours",
      "assisting staff with administrative tasks"
    ],
    "Qualifications": [
      "positive attitude",
      "strong work ethic",
      "excellent written and oral communication skills"
    ],
    "Salary_Min": null,
    "Salary_Max": null,
    "Skills_Mentioned": null,
    "Equal_Opportunity_Information": "This is a paid position and is competitive with that of other offices. Rate of pay will depend on hours worked and duration of internship.",
    "Cleaned_Text": "Congressman Jason Smith (MO-08) is currently seeking full or part-time interns to work in his Washington, DC office for the Fall 2025 term. Intern responsibilities include corresponding and communicating with constituents, researching policy, legislative analysis, guiding Capitol building tours and assisting staff with administrative tasks. Interns also will have the opportunity to conduct legislative research as well as attend Capitol Hill briefings, congressional hearings, and press events. Ideal candidates have a positive attitude, strong work ethic, and excellent written and oral communication skills. Those interested should send their resume and cover letter to grayson.donnellan@mail.house.gov & brianna.garcia@mail.house.gov. Applications are reviewed on a rolling basis, so there is currently no deadline to apply. Hours are flexible and can be adjusted to accommodate other work/class schedules. This is a paid position and is competitive with that of other offices. Rate of pay will depend on hours worked and duration of internship. State ties preferred but not required.",
    "DW_NOMINATE": null,
    "LES": null
  },
  {
    "Post_ID": "MEM-229-25",
    "Posting_Author": "Congresswoman Gwen Moore (WI-04)",
    "Congress_Number": null,
    "State_District": "WI-04",
    "Location": "Washington, D.C.",
    "Job_Function": "Interns",
    "Title_Parsed": "Office Intern",
    "Office_Type": "Legislative Staff",
    "Responsibilities": [
      "answering phones",
      "attending hearings and briefings",
      "drafting and editing constituent correspondence letters",
      "writing memos",
      "conducting research for the legislative staff",
      "drafting social media posts",
      "designing graphics",
      "providing support for the day-to-day activities of the office"
    ],
    "Qualifications": null,
    "Salary_Min": null,
    "Salary_Max": null,
    "Skills_Mentioned": null,
    "Equal_Opportunity_Information": "The Office of Congresswoman Moore is an equal opportunity employer. We do not discriminate based on race, ethnicity, gender, sexual orientation, religion, national origin, age, or socioeconomic status.",
    "Cleaned_Text": "The Washington, D.C. office of Congresswoman Gwen Moore (WI-04) seeks interns for the upcoming Fall 2025 term.\nResponsibilities include answering phones, attending hearings and briefings, drafting and editing constituent correspondence letters, writing memos, conducting research for the legislative staff, drafting social media posts, designing graphics, and providing support for the day-to-day activities of the office. Interns are paid via a monthly stipend.\nThe Office of Congresswoman Moore is an equal opportunity employer. We do not discriminate based on race, ethnicity, gender, sexual orientation, religion, national origin, age, or socioeconomic status. All are welcome and encouraged to apply.\nInterested applicants should send a resume, cover letter, and two short writing samples to WI04DC.Internships@mail.house.gov. Additionally, applicants should indicate their availability on an hourly, daily, and monthly basis during the Fall term. The deadline to apply is 6:00 PM ET on Friday, August 1st, 2025.\n---",
    "DW_NOMINATE": null,
    "LES": null
  },
  {
    "Post_ID": "MEM-225-25",
    "Posting_Author": "Congresswoman Angie Craig",
    "Congress_Number": null,
    "State_District": "MN-02",
    "Location": "Washington D.C. and Eagan offices",
    "Job_Function": null,
    "Title_Parsed": null,
    "Office_Type": null,
    "Responsibilities": [
      "researching legislation",
      "attending hearings and constituent meetings",
      "answering constituents’ phone calls",
      "logging and drafting constituent correspondence",
      "assisting legislative and communications staff members on various projects"
    ],
    "Qualifications": [
      "passionate about public service",
      "confident and effective communicators",
      "proactive problem-solvers",
      "strong writing skills"
    ],
    "Salary_Min": 20000,
    "Salary_Max": null,
    "Skills_Mentioned": [
      "the legislative process",
      "congressional office functions"
    ],
    "Equal_Opportunity_Information": "Rep. Craig’s office is an equal opportunity employer and does not discriminate on the basis of race, color, religion, sex, sexual orientation, gender identity, national origin, disability, age, or protected veteran status.",
    "Cleaned_Text": "Congresswoman Angie Craig (MN-02) is seeking interns for the Fall 2025 term in her Washington D.C. and Eagan offices.\nThe D.C. internship will run approximately from August 25th, 2025, through December 17th, 2025, with some room for flexibility. The Eagan internship will run approximately from September 29, 2025, through January 27, 2025, with some room for flexibility. All interns are paid a stipend and provided with the necessary technology for their work.\nSchedules are flexible to accommodate course schedules and academic programs; however, a minimum availability of 20-25 hours per week is highly preferred.\nInterns in the Washington, D.C. office will focus on researching legislation, attending hearings and constituent meetings, answering constituents’ phone calls, logging and drafting constituent correspondence, and assisting legislative and communications staff members on various projects. Interns in the Eagan office will focus on constituent casework, answering constituents’ phone calls, community outreach and research, indistrict event planning, and assisting the outreach, casework, and communications staff members on various projects.\nAll interns will have the opportunity to work with staff in both offices over the course of the internship and the program is tailored to fit interns’ policy interests and career goals.\nInterns will learn about the legislative process, learn about all the different functions of a congressional office and gain hands-on professional experience while serving the constituents of Minnesota’s Second Congressional District.\nSuccessful internship candidates are passionate about public service, confident and effective communicators, proactive problem-solvers and possess strong writing skills. They also are comfortable speaking on the phone and working with the general public.\nApplication Instructions:\n\nto apply for an internship in either the MN or DC office, please email a combined PDF of your resume and one-page cover letter to craig.internships@mail.house.gov\nplease format your email subject line as “FirstName.LastName-DistrictOfficeInternship” OR ‘FirstName.LastName-DCOffices Internship’ to specify which office you are applying for.\n– To apply for an internship in either the MN or DC office, please email a combined PDF of your resume and one-page cover letter to craig.internships@mail.house.gov. Please format your email subject line as “FirstName.LastName-DistrictOfficeInternship” OR “FirstName.LastName – DC Office Internship” to specify which office you are applying for.\n– Please include your weekly availability between the hours of 9:00am and 6:00pm in your cover letter and confirm that you will be available for in-person work.\nWe strongly encourage individuals with ties to Minnesota (especially the Second Congressional District) and those from traditionally underrepresented backgrounds to apply. Rep. Craig’s office is an equal opportunity employer and does not discriminate on the basis of race, color, religion, sex, sexual orientation, gender identity, national origin, disability, age, or protected veteran status.\n\nFor Fall\n2025 internships in the D.C. office, applications must be submitted no later than 6pm ET on Wednesday,\nJuly 23rd.\n\nFor\ntempsarnshipsin the Eaganoffice,applicationsmustbesubmittednotlates than10am\nETonMonday,\nAugust25th.\nLate submissions will not be considered nor accepted. If you have any questions regarding the application process, please email craig.internships@mail.house.gov.\n    ",
    "DW_NOMINATE": null,
    "LES": null
  },
  {
    "Post_ID": "MEM-221-25",
    "Posting_Author": "The Committee on House Administration Republican Office",
    "Congress_Number": null,
    "State_District": null,
    "Location": null,
    "Job_Function": "government and public policy",
    "Title_Parsed": "paid, full-time internship program",
    "Office_Type": null,
    "Responsibilities": [
      "Interns are responsible for both administrative and legislative duties. Administrative tasks include answering phones, greeting visitors, sorting mail, entering data, and drafting correspondence.",
      "Legislative support includes performing research, drafting public statements, prepping materials for hearings, attending hearings and briefings, reaching out to agencies and other congressional offices, and a host of various special projects."
    ],
    "Qualifications": null,
    "Salary_Min": null,
    "Salary_Max": null,
    "Skills_Mentioned": null,
    "Equal_Opportunity_Information": "The Committee on House Administration maintains jurisdiction of federal election policy ×and manages the day-to-day operations of the House of Representatives with oversight of several offices within the Capitol Complex, including the Chief Administrative Officer, Architect of the Capitol,¼Lerk of the House, House Inspector General, Sergeant at Arms,»U.S. Capitol Police, and other legislative branch entities like the Library of Congress,\nGovernment Publishing Office, and the Smithsonian Institution.\nThe Committee on House Administration seeks energetic and selfmotivated individuals with an interest in government and public policy, to apply for its paid, full-time internship program.",
    "Cleaned_Text": "MEM-221-25The Committee on House Administration Republican Office seeks energetic and selfmotivated individuals with an interest in government and public policy, to apply for its paid, full-time internship program.\nThe Committee on House Administration maintains jurisdiction of federal election policy  and manages the day-to-day operations of the House of Representatives with oversight of several offices within the Capitol Complex, including the Chief Administrative Officer,\nArchitect of the Capitol,¼Lerk of the House, House Inspector General, Sergeant at Arms,\nU.S. Capitol Police, and other legislative branch entities like the Library of Congress,\nGovernment Publishing Office, and the Smithsonian Institution.\nWorking closely with Committee staff, interns will have the opportunity to gain first-hand knowledge of the inner-workings of a congressional committee and learn about the day-today administrative operations of the House of Representatives. Interns are responsible for assisting Committee staff with official proceedings (hearings/markups), oversight,\norientation,\nresearch,\nassisting with phones, and providing support to all Committee staff.\nResponsibilities:\n  ©nf interns are responsible for both administrative and legislative duties. Administrative tasks\n  include answering phones, greeting visitors, sorting mail, entering data, and drafting correspondence.\n  Legislative support includes performing research, drafting public statements,\n  prepping materials for hearings, attending hearings and briefings, reaching out to agencies and other congressional offices,\n  and a host of various special projects.\n\nPlease send a resume, cover letter, and availability to CHAInternGOP@mail.house.gov´´£¼",
    "DW_NOMINATE": null,
    "LES": null
  },
  {
    "Post_ID": "MEM-219-25",
    "Posting_Author": "Congresswoman Sara Jacobs",
    "Congress_Number": null,
    "State_District": null,
    "Location": "",
    "Job_Function": "",
    "Title_Parsed": null,
    "Office_Type": "",
    "Responsibilities": [
      "Email your resume, cover letter, and a 1 page writing sample to Кarajacobs.DCintern@mail.house.gov"
    ],
    "Qualifications": null,
    "Salary_Min": null,
    "Salary_Max": null,
    "Skills_Mentioned": [
      "DC Office"
    ],
    "Equal_Opportunity_Information": "SaraJacobs.DCintern@mail.house.gov",
    "Cleaned_Text": "MEM-219-25\nCongresswoman Sara Jacobs offers in-person internships in both her San Diego and Washington, D.C. offices.\nThese internships provide young adults with the opportunity to learn more about the inner workings of a congressional office and to experience the legislative process and constituent and community outreach first-hand.\nIf you would like to be considered for an internship in our DC office, please email your resume, cover letter, and a 1 page writing sample to Кarajacobs.DCintern@mail.house.gov\nPlease no direct emails, phone calls, or walk-ins regarding the status of your application.",
    "DW_NOMINATE": null,
    "LES": null
  },
  {
    "Post_ID": "MEM-208-25",
    "Posting_Author": "Fall District Internship with the Office of Congresswoman Janelle Bynum (OR-05)",
    "Congress_Number": null,
    "State_District": "Oregon City, Oregon",
    "Location": "Oregon City, Oregon",
    "Job_Function": "Internship",
    "Title_Parsed": "District Internship with the Office of Congresswoman Bynum",
    "Office_Type": "Part-time",
    "Responsibilities": [
      "Handle incoming calls with poise, professionalism, and promptness.",
      "Assist Member and key staff with logistical and administrative duties.",
      "Receive and log input from constituents on policy matters for the Member office’s consideration and response.",
      "Organize press clips and assist the communications team with social media posts and talking points.",
      "Attend briefings and hearings, conduct research, and draft correspondence and memoranda."
    ],
    "Qualifications": [
      "College student in good academic standing.",
      "Good oral and written communication skills.",
      "The ability to handle difficult situations with courtesy, tact and compassion",
      "Problem-solving skills and the ability to work independently and use good judgement.",
      "Responsible, dependable and willing to learn."
    ],
    "Salary_Min": null,
    "Salary_Max": null,
    "Skills_Mentioned": [],
    "Equal_Opportunity_Information": null,
    "Cleaned_Text": "Fall District Internship with the Office of Congresswoman Janelle Bynum\nThe Office of Congresswoman Janelle Bynum (OR-05) is seeking part-time interns to join our district office in Oregon City, Oregon. Preferred start date beginning in August 2025,\nwith an end date in December 2025. Seeking applicants available to work in-person 12-24 hours per week.\n\nDUTIES:\n• Handle incoming calls with poise, professionalism, and promptness.\n• Assist Member and key staff with logistical and administrative duties.\n• Receive and log input from constituents on policy matters for the Member office’s consideration and response.\n• Organize press clips and assist the communications team with social media posts and talking points.\n• Attend briefings and hearings, conduct research, and draft correspondence and memoranda.\n\nQUALIFICATIONS:\n• College student in good academic standing.\n• Good oral and written communication skills.\n• The ability to handle difficult situations with courtesy, tact and compassion\n• Problem-solving skills and the ability to work independently and use good judgement.\n• Responsible, dependable and willing to learn.\n\nHOW TO APPLY:\nPlease send your resume and cover letter to BynumJobs@mail.house.gov by July 29.",
    "DW_NOMINATE": null,
    "LES": null
  },
  {
    "Post_ID": "MEM-207-25",
    "Posting_Author": "Fall D.C. Internship with the Office of Congresswoman Bynum",
    "Congress_Number": null,
    "State_District": "OR-05",
    "Location": "Washington DC",
    "Job_Function": "Internship",
    "Title_Parsed": "Office of Congresswoman Janelle Bynum Internship",
    "Office_Type": "Part-time",
    "Responsibilities": [
      "Handle incoming correspondence with poise, professionalism, and promptness.",
      "Assist Member and key staff with logistical and administrative duties.",
      "Update the office’s legislative tracker and perform research on legislative measures.",
      "Attend briefings and hearings, conduct research, and draft correspondence and memoranda.",
      "Partner with communications team to create speeches, social media posts, and talking points."
    ],
    "Qualifications": [
      "College student in good academic standing.",
      "Good oral and written communication skills.",
      "The ability to handle difficult situations with courtesy, tact and compassion",
      "Problem-solving skills and the ability to work independently and use good judgement.",
      "Responsible, dependable and willing to learn."
    ],
    "Salary_Min": null,
    "Salary_Max": null,
    "Skills_Mentioned": [],
    "Equal_Opportunity_Information": "All applicants will be considered without regard to race, color, religion, sex (including marital or parental status), sexual orientation, gender identity, disability, age, or national origin.",
    "Cleaned_Text": " MEM-207-25Fall D.C. Internship with the Office of Congresswoman BynumThe Office of Congresswoman Janelle Bynum (OR-05) is seeking part-time interns to join our office in Washington DC. Preferred start date in early September 2025, with an end date in December 2025. Seeking applicants available to work 12-24 hours per week.\n\nDUTIES:\n• Handle incoming correspondence with poise, professionalism, and promptness.\n• Assist Member and key staff with logistical and administrative duties.\n• Update the office’s legislative tracker and perform research on legislative measures.\n• Attend briefings and hearings, conduct research, and draft correspondence and memoranda.\n• Partner with communications team to create speeches, social media posts, and talking points.\n\nQUALIFICATIONS:\n• College student in good academic standing.\n• Good oral and written communication skills.\n• The ability to handle difficult situations with courtesy, tact and compassion \n• Problem-solving skills and the ability to work independently and use good judgement.\n• Responsible, dependable and willing to learn.\n\nHOW TO APPLY:\nPlease send your resume and cover letter to BynumJobs@mail.house.gov by July 29, 2025.\n\nNOTICE:\nAll applicants will be considered without regard to race, color, religion, sex (including marital or parental status), sexual orientation, gender identity, disability, age, or national origin.",
    "DW_NOMINATE": null,
    "LES": null
  }
]