[
  {
    "Post_ID": "MEM-264-25",
    "Posting_Author": "Congressman Mike Kelly (R-PA-16)",
    "Congress_Number": 16,
    "State_District": "PA-16",
    "Location": "Washington, D.C.",
    "Job_Function": "",
    "Title_Parsed": "Intern for the Senate",
    "Office_Type": "full-time and part-time internship office",
    "Responsibilities": [
      "greeting visitors",
      "answering phones",
      "leading tours of the Capitol",
      "attending briefings and hearings",
      "performing legislative research",
      "various other tasks to assist staff"
    ],
    "Qualifications": [],
    "Salary_Min": null,
    "Salary_Max": null,
    "Skills_Mentioned": null,
    "Equal_Opportunity_Information": "",
    "Cleaned_Text": "The office of Congressman Mike Kelly (R-PA-16) is currently accepting applications for his Washington, D.C. office for full and part-time interns for the fall internship session. The start date would be as early as August 18th (flexible depending on availability) with a flexible end date. Interns are paid a stipend based on availability and have access to transit benefits.",
    "DW_NOMINATE": 0.3770000040531158,
    "LES": 0.5356083512306213
  },
  {
    "Post_ID": "MEM-261-25",
    "Posting_Author": "Congressman Greg Murphy",
    "Congress_Number": null,
    "State_District": "NC-03",
    "Location": "DC office",
    "Job_Function": "Legislative staff",
    "Title_Parsed": "Interns with DC Office for Fall Session",
    "Office_Type": "Congressional internship",
    "Responsibilities": null,
    "Qualifications": [
      "Be a current undergraduate or graduate student or have recently graduated.",
      "Demonstrate an interest in politics, policy, and/or public service.",
      "Have strong communications and writing skills.",
      "Be hard-working, dependable, detail-oriented, and professional."
    ],
    "Salary_Min": 0,
    "Salary_Max": null,
    "Skills_Mentioned": null,
    "Equal_Opportunity_Information": "Congressman Greg Murphy is an equal opportunity employer",
    "Cleaned_Text": "MEM-261-25\nThe Office of Congressman Greg Murphy (NC-03) is currently seeking interns with our DC office for the Fall session. The internship would begin mid-August and may last until around December.\nThis is a great opportunity to gain hands-on experience and knowledge over the day-to-day happenings within Congress. Additionally, interns co-currently enrolled in an accredited university will receive a monthly stipend. The internship is an ideal fit for any student that is interested in politics, law, or government – however, any interested student is encouraged to apply! Interns will assist the legislative staff by conducting policy research, answering phones, leading tours, and helping with administrative tasks.\nQualified candidates should:\n•\n•\n•\n•",
    "DW_NOMINATE": null,
    "LES": null
  },
  {
    "Post_ID": "MEM-260-25",
    "Posting_Author": "Congressman Andrew Clyde’s Washington, D.C. office, is looking for fall semester internship candidates.",
    "Congress_Number": null,
    "State_District": null,
    "Location": "Washington, D.C.",
    "Job_Function": null,
    "Title_Parsed": null,
    "Office_Type": null,
    "Responsibilities": [
      "answer phones",
      "run errands",
      "research legislation for the Member and legislative staff",
      "attend hearings and briefings",
      "answer constituent letters on various issues before the House"
    ],
    "Qualifications": [],
    "Salary_Min": null,
    "Salary_Max": null,
    "Skills_Mentioned": null,
    "Equal_Opportunity_Information": null,
    "Cleaned_Text": "MEM-260-25 Congressman Andrew Clyde’s Washington, D.C. office, is looking for fall semester internship candidates. The hours are flexible to accommodate students' hectic course schedules, but generally run 8:30 a.m. to 5:30 p.m. when Congress is in session, and 9:00 a.m. to 5:00 p.m. when not in session.\n\nIn Washington, D.C., interns' responsibilities will vary. They will be asked to answer phones, run errands, research legislation for the Member and legislative staff, attend hearings and briefings, and answer constituent letters on various issues before the House.\n\nAs a result, interns learn about the legislative process and the many other functions of a congressional office.\n\nInterested applicants should send resume to : cole.rogers@mail.house.gov",
    "DW_NOMINATE": null,
    "LES": null
  },
  {
    "Post_ID": "MEM-259-25",
    "Posting_Author": "The Office of Rep. Angie Craig",
    "Congress_Number": null,
    "State_District": "MN-02",
    "Location": "Eagan",
    "Job_Function": "Intern (Press)",
    "Title_Parsed": null,
    "Office_Type": "District office",
    "Responsibilities": [
      "Compiling daily afternoon news clips",
      "Taking photos and filming video content at the Congresswoman’s district events",
      "Assisting with drafting social media posts when the Congresswoman is in the district",
      "Answering phones",
      "Logging constituent voicemails and mail",
      "Fielding casework requests"
    ],
    "Qualifications": [
      "Experience with digital photography, social media, video editing and graphic design"
    ],
    "Salary_Min": null,
    "Salary_Max": null,
    "Skills_Mentioned": [
      "digital photography",
      "social media",
      "video editing",
      "graphic design"
    ],
    "Equal_Opportunity_Information": "The office of Representative Angie Craig is an equal opportunity employer; the office does not discriminate on the basis of race, sex, color, age, religion, national origin, sexual orientation, gender identity, or disability.",
    "Cleaned_Text": "The Office of Rep. Angie Craig (MN-02) is hiring a press intern to work in our Eagan,\nMinnesota office.\n\r\n\n  The press intern will work directly with the communications team and be\n  part of day-to-day communications operations, while also performing administrative tasks\n  in the district office.\n\r\n\n  Primary responsibilities will include:\n\r\n  • Compiling daily afternoon news clips\n  • Taking photos and filming video content at the Congresswoman’s district events\n  • Assisting with drafting social media posts when the Congresswoman is in the district\n  • Answering phones\n  • Logging constituent voicemails and mail\n  • Fielding casework requests\n  • Other assignments as needed\n\r\n\ndefault:·Experience with digital photography, social media, video editing and graphic design are\n  preferred, but not required.\n\r\n\r\nApplicants must also indicate their weekly availability from September 1st through December 30th. Applicants with 20-25 hours/week of availability, spread across the work week are preferred.",
    "DW_NOMINATE": null,
    "LES": null
  },
  {
    "Post_ID": "MEM-258-25",
    "Posting_Author": null,
    "Congress_Number": null,
    "State_District": null,
    "Location": null,
    "Job_Function": "digital media intern",
    "Title_Parsed": "digital media intern",
    "Office_Type": " Democratic Staff",
    "Responsibilities": [
      "content creation",
      "graphic design",
      "video editing",
      "other press and administrative tasks"
    ],
    "Qualifications": [
      "familiarity with programs such as Adobe Premiere Pro, Adobe Photoshop, and Canva",
      "ability to work in a fast-paced, rapid response environment",
      "full-time and part-time Candidates with diverse backgrounds and experiences are strongly encouraged to apply."
    ],
    "Salary_Min": null,
    "Salary_Max": null,
    "Skills_Mentioned": [
      "Adobe Premiere Pro",
      "Adobe Photoshop"
    ],
    "Equal_Opportunity_Information": null,
    "Cleaned_Text": "motivated and reliable digital media intern this fall. Interns will be responsible for content creation, graphic design, video editing, and other press and administrative tasks as assigned. Successful candidates will possess familiarity with programs such as Adobe Premiere Pro, Adobe Photoshop, and Canva. Proficiencies in additional programs are a plus.\nAbility to work in a fast-paced, rapid response environment is a must. Candidates will be expected to work in-person in Washington, DC, with opportunities for remote work during Congressional recesses. Full-time and part-time Candidates with diverse backgrounds and experiences are strongly encouraged to apply. To apply, please send a resume, digital portfolio, and your availability this fall to oversightpress@mail.house.gov.",
    "DW_NOMINATE": null,
    "LES": null
  },
  {
    "Post_ID": "MEM-256-25",
    "Posting_Author": "Congresswoman Dina Titus (NV-01)",
    "Congress_Number": 1,
    "State_District": "NV-01",
    "Location": "D.C. office",
    "Job_Function": "Internship",
    "Title_Parsed": null,
    "Office_Type": "Legislative",
    "Responsibilities": [
      "answering constituent phone calls",
      "attending policy briefings and meetings",
      "providing tours of the United States Capitol",
      "conducting legislative research"
    ],
    "Qualifications": [
      "excellent oral and written communication skills",
      "prioritizes professionalism",
      "dedicated team player",
      "friendly persona",
      "ties to Nevada's First District (optional)",
      "equal opportunity employer"
    ],
    "Salary_Min": null,
    "Salary_Max": null,
    "Skills_Mentioned": [
      ""
    ],
    "Equal_Opportunity_Information": "The office of Congresswoman Dina Titus is an equal opportunity employer and does not discriminate on the basis of race, color, religion, sex, sexual orientation, gender identity and expression, national origin, disability, military status, age, marital status, or parental status.",
    "Cleaned_Text": "<p>MEM-256-25<br>Congresswoman Dina Titus (NV-01) seeks highly motivated candidates for a paid internship for the Fall 2025 Semester in our D.C. office.</p><p>Interns in our D.C. office will have the opportunity to witness the legislative process and the inner workings of Capitol Hill first-hand. Responsibilities include but are not limited to answering constituent phone calls, attending policy briefings and meetings, providing tours of the United States Capitol, and conducting legislative research to support the needs of the Congresswoman’s staff.</p><p>The internship will run from September through December, from 9 am-6 pm when Congress is in session and from 9 am-5 pm when Congress is not in session.<br />(<a href=\"https://airtable.com\">Airtable</a> application link)</p}<p>The ideal candidate possesses excellent oral and written communication skills, prioritizes professionalism, is a dedicated team player, and has a friendly persona. Ties to Nevada’s First District are a plus, but not required.</p><p>The office of Congresswoman Dina Titus is an equal opportunity employer and does not discriminate on the basis of race, color, religion, sex, sexual orientation, gender identity and expression, national origin, disability, military status, age, marital status, or parental status. How to Apply:</p><p>Interested applicants should fill out the form below and include a cover letter, resume, and short (<a href='\\\"1-2 page\\",
    "DW_NOMINATE": null,
    "LES": null
  },
  {
    "Post_ID": "MEM-241-25",
    "Posting_Author": null,
    "Congress_Number": null,
    "State_District": null,
    "Location": null,
    "Job_Function": null,
    "Title_Parsed": "Fall Internship",
    "Office_Type": null,
    "Responsibilities": [
      "Assisting with front office operations",
      "Answer constituent letters and phone calls",
      "Attend hearings and briefings related to the Congressman's portfolio",
      "Research legislation for the Member and legislative staff"
    ],
    "Qualifications": [
      "excellent communication and writing skills"
    ],
    "Salary_Min": null,
    "Salary_Max": null,
    "Skills_Mentioned": null,
    "Equal_Opportunity_Information": null,
    "Cleaned_Text": "Ideal candidates will be organized, detail-oriented, and passionate about public service. Applicants should have excellent communication and writing skills. Key Responsibilities Include: ¿p¯- Assisting with front office operations\n¿i¯- Answer constituent letters and phone calls\n¿i¯- Attend hearings and briefings related to the Congressman's portfolio\n\nInternships are in-person, paid, and run from August through December with flexible start ºnd end dates.\nTo apply, visit https://messmer.house.gov/forms/internships. Applications will be accepted on a rolling basis.",
    "DW_NOMINATE": null,
    "LES": null
  },
  {
    "Post_ID": "MEM-239-25",
    "Posting_Author": "Congressman Raja Krishnamoorthi (IL-08)",
    "Congress_Number": null,
    "State_District": "IL-08",
    "Location": "The Office of Congressman Raja Krishnamoorthi",
    "Job_Function": "press intern",
    "Title_Parsed": "Intern - Press",
    "Office_Type": "Congressman's office",
    "Responsibilities": [
      "Compiling press clips by 9:30am ET every morning",
      "Social media strategizing for increased growth",
      "Drafting daily social media posts and ideas for Instagram, Twitter, and Facebook",
      "Creating graphics for social media, knowledge of Canva preferred",
      "Drafting speeches",
      "Other duties as needed to support the communications team"
    ],
    "Qualifications": [
      "strong work ethic",
      "pay attention to detail",
      "responsive and punctual",
      "solid writing and editing skills",
      "diligent",
      "communicative",
      "creative",
      "willing to perform and follow through on a wide variety of tasks"
    ],
    "Salary_Min": null,
    "Salary_Max": null,
    "Skills_Mentioned": [
      "aggressive",
      "communication",
      "writing",
      "editing",
      "social media",
      "content creation"
    ],
    "Equal_Opportunity_Information": "The Office of Congressman Raja Krishnamoorthi (IL-08) is an equal opportunity employer.",
    "Cleaned_Text": "}\n---\nMEM-239-25\nThe Office of Congressman Raja Krishnamoorthi (IL-08) is seeking a highly motivated,...",
    "DW_NOMINATE": null,
    "LES": null
  },
  {
    "Post_ID": "MEM-237-25",
    "Posting_Author": "Representative Seth Magaziner (RI-02)",
    "Congress_Number": null,
    "State_District": "RI-02",
    "Location": "Warwick, Rhode Island",
    "Job_Function": null,
    "Title_Parsed": "",
    "Office_Type": "Member office",
    "Responsibilities": [
      "Provides a welcoming environment and positive first impression of the Member office to constituents, visitors, and other VIPs;",
      "Answers incoming calls with poise, professionalism, and promptness;",
      "Assists Member and key staff (e.g. Staff Assistant, Press Assistant, Constituent Services Team) with logistical and administrative duties;",
      "Receives and logs input from constituents on policy matters for the Member office’s consideration and response;",
      "Conducts research, and drafts correspondence and memoranda [];",
      "Assists with planning and execution of Member’s public outreach at local events ;",
      "Accompanies district staff to public forums, meetings, and events as a representative to the Member. "
    ],
    "Qualifications": null,
    "Salary_Min": null,
    "Salary_Max": null,
    "Skills_Mentioned": null,
    "Equal_Opportunity_Information": "",
    "Cleaned_Text": "",
    "DW_NOMINATE": null,
    "LES": null
  },
  {
    "Post_ID": "MEM-236-25",
    "Posting_Author": "Democratic Staff of the House Committee on Veterans' Affairs Law Clerk",
    "Congress_Number": null,
    "State_District": null,
    "Location": "Washington, D.C.",
    "Job_Function": null,
    "Title_Parsed": "House Committee on Veterans' Affairs Law Clerk",
    "Office_Type": null,
    "Responsibilities": [
      "Conducting research",
      "Drafting memos, letters, and other written materials",
      "Attending briefings and hearings",
      "Assisting with Committee events",
      "Completing other tasks as assigned"
    ],
    "Qualifications": [
      "Superior organizational skills",
      "A strong work ethic",
      "Ability to pay close attention to detail",
      "Excellent research, writing, and analytical skills",
      "Ability to excel in fast-paced environments",
      "Willingness to assist wherever needed"
    ],
    "Salary_Min": null,
    "Salary_Max": null,
    "Skills_Mentioned": [
      "Research",
      "Writing",
      "Analytical skills",
      "Organizational skills",
      "Time management",
      "Attention to detail",
      "Communication skills"
    ],
    "Equal_Opportunity_Information": "The Committee strongly encourages veterans, minorities, women, people with disabilities, LGBTQ+ candidates, and HBCU and MSI students to apply.",
    "Cleaned_Text": "The Democratic Staff of the House Committee on Veterans' Affairs seeks a law clerk for the fall 2025 semester. The law clerk will work with Democratic staff on various research projects, legislative activities, and oversight efforts.\n\nResponsibilities include, but are not limited to:\nConducting research,\nDrafting memos, letters, and other written materials,\nAttending briefings and hearings,\nAssisting with Committee events, and\nCompleting other tasks as assigned.\n\nQualified candidates will be second- or third-year law students who have a demonstrated interest in public service, Congress, or veterans policy. Candidates for this position must have superior organizational skills, a strong work ethic, ability to pay close attention to detail, as well as excellent research, writing, and analytical skills. Additionally, the ability to excel in fast-paced environments and a willingness to assist wherever needed is a must.\n\nThe Committee strongly encourages veterans, minorities, women, people with disabilities, LGBTQ+ candidates, and HBCU and MSI students to apply.\n\nThis paid, full-time or part-time, in-person position is based in Washington, D.C. \nCandidates should submit their application, including a resume and cover letter through the online application accessible at https://democrats-veterans.house.gov/opportunities. \nThe deadline to apply is 5 p.m. on Wednesday, August 6, 2025. Applications will be reviewed on a rolling basis.",
    "DW_NOMINATE": null,
    "LES": null
  },
  {
    "Post_ID": "MEM-233-25",
    "Posting_Author": "Congresswoman Doris Matsui",
    "Congress_Number": 7,
    "State_District": "California's 7th District",
    "Location": "Washington, D.C.",
    "Job_Function": "Press and Digital Intern",
    "Title_Parsed": null,
    "Office_Type": "Congressional office",
    "Responsibilities": [
      "answer phones",
      "data entry",
      "researching legislation",
      "attending briefings",
      "hearings",
      "markups",
      "answering constituent letters"
    ],
    "Qualifications": [
      "strong writing skills",
      "basic familiarity with graphic design/video editing software",
      "experience in a press or digital media role"
    ],
    "Salary_Min": null,
    "Salary_Max": null,
    "Skills_Mentioned": [
      "social media content creation",
      "graphic design",
      "video editing"
    ],
    "Equal_Opportunity_Information": "This office is an equal opportunity employer and does not discriminate based on race, religion, disability, age, ethnicity, national origin, sex, gender, LGBTQ identification, family status, or military status.",
    "Cleaned_Text": "MEM-233-25\nCongresswoman Doris Matsui, representing the 7th Congressional District of California, seeks interns for her Washington, D.C. office for the Fall 2025 term. Interns will have a unique opportunity to learn about the legislative process first-hand and the many functions of a Congressional office. The Press and Digital Intern will help build out the Congresswoman’s digital and social media presence, with heavy emphasis on creating engaging social media content and graphics.\nQualified candidates should have strong writing, editing, and social media skills to assist with time sensitive assignments, as well as basic familiarity with graphic design/video editing software. Candidates with experience in a press or digital media role (including internships) are preferred but not required. Press Intern responsibilities will vary but may include answering phones and data entry. Washington DC interns may be asked to assist in researching legislation for the Member and legislative staff, attending briefings, hearings, and markups; and answering constituent letters on various issues.\nTo apply, please visit the “services/internships’ page of Congresswomen Matsui’s official website\nand complete the application form: https://matsui.house.gov/services/internships. As part of the application, a cover letter, resume, and 2 writing samples are required.\nTies to California’s 7th District are preferred, but not required.\nAll applications are considered on a rolling basis.\n\nThis office is an equal opportunity employer and does not discriminate based on race, religion, disability, age, ethnicity, national origin, sex, gender, LGBTQ identification, family status, or military status.",
    "DW_NOMINATE": null,
    "LES": null
  },
  {
    "Post_ID": "MEM-232-25",
    "Posting_Author": "Congresswoman Doris Matsui",
    "Congress_Number": null,
    "State_District": "7th Congressional District of California",
    "Location": "Washington, D.C. and Sacramento offices",
    "Job_Function": null,
    "Title_Parsed": null,
    "Office_Type": null,
    "Responsibilities": [
      "answering phones and data entry"
    ],
    "Qualifications": null,
    "Salary_Min": null,
    "Salary_Max": null,
    "Skills_Mentioned": null,
    "Equal_Opportunity_Information": "This office is an equal opportunity employer and does not discriminate based on race, religion, disability, age, ethnicity, national origin, sex, gender, LGBTQ identification, family status, or military status.",
    "Cleaned_Text": "MEM-232-25\nCongresswoman Doris Matsui, representing the 7th Congressional District of California, seeks interns for her Washington, D.C. and District (Sacramento) offices for the Fall 2025 term. Interns will have a unique opportunity to learn about the legislative process first-hand and the many functions of a Congressional office.\n\nIntern responsibilities will vary but may include answering phones and data entry.\nWashington DC interns may be asked to assist in researching legislation for the Member and legislative staff, attending briefings, hearings, and markups; and answering constituent letters on various issues. Interns based in California may also be asked to assist on a variety of constituent casework or in-district projects, as needed.\n\nTo apply, please visit the \\\\",
    "DW_NOMINATE": null,
    "LES": null
  },
  {
    "Post_ID": "MEM-231-25",
    "Posting_Author": "Congressman Jason Smith",
    "Congress_Number": null,
    "State_District": null,
    "Location": null,
    "Job_Function": null,
    "Title_Parsed": "Interns",
    "Office_Type": null,
    "Responsibilities": [
      "corresponding and communicating with constituents",
      "researching policy",
      " legislative analysis",
      " guiding Capitol building tours",
      "assisting staff with administrative tasks"
    ],
    "Qualifications": [
      "positive attitude",
      "strong work ethic",
      "excellent written and oral communication skills"
    ],
    "Salary_Min": null,
    "Salary_Max": null,
    "Skills_Mentioned": [
      "legislative research",
      "Capitol Hill briefings",
      "congressional hearings",
      "press events"
    ],
    "Equal_Opportunity_Information": "",
    "Cleaned_Text": "MEM-231-25Congressman Jason Smith (MO-08) is currently seeking full or part-time interns to work in his Washington, DC office for the Fall 2025 term. Intern responsibilities include corresponding and communicating with constituents, researching policy, legislative analysis, guiding Capitol building tours and assisting staff with administrative tasks. Interns also will have the opportunity to conduct legislative research as well as attend Capitol Hill briefings, congressional hearings, and press events. Ideal candidates have a positive attitude, strong work ethic, and excellent written and oral communication skills. Those interested should send their resume and cover letter to grayson.donnellan@mail.house.gov & brianna.garcia@mail.house.gov. Applications are reviewed on a rolling basis, so there is currently no deadline to apply. Hours are flexible and can be adjusted to accommodate other work/class schedules. This is a paid position and is competitive with that of other offices. Rate of pay will depend on hours worked and duration of internship. State ties preferred but not required.",
    "DW_NOMINATE": null,
    "LES": null
  },
  {
    "Post_ID": "MEM-225-25",
    "Posting_Author": "Congresswoman Angie Craig",
    "Congress_Number": null,
    "State_District": "MN-02",
    "Location": "Washington D.C. and Eagan offices.",
    "Job_Function": null,
    "Title_Parsed": null,
    "Office_Type": null,
    "Responsibilities": [
      "researching legislation",
      "attending hearings",
      "answering constituents’ phone calls",
      "logging and drafting constituent correspondence",
      "assisting legislative and communications staff members on various projects"
    ],
    "Qualifications": [
      "passionate about public service",
      "confident and effective communicators",
      "proactive problem-solvers",
      "strong writing skills"
    ],
    "Salary_Min": null,
    "Salary_Max": null,
    "Skills_Mentioned": null,
    "Equal_Opportunity_Information": "an equal opportunity employer and does not discriminate on the basis of race, color, religion, sex, sexual orientation, gender identity, national origin, disability, age, or protected veteran status.",
    "Cleaned_Text": "",
    "DW_NOMINATE": null,
    "LES": null
  },
  {
    "Post_ID": "MEM-223-25",
    "Posting_Author": "Congressman Pat Harrigan (NC-10)",
    "Congress_Number": null,
    "State_District": "NC-10",
    "Location": "The Office of Congressman Pat Harrigan DC office",
    "Job_Function": null,
    "Title_Parsed": "Intern",
    "Office_Type": "Internship",
    "Responsibilities": [
      "This is a great opportunity to gain hands-on experience and knowledge over the day-to-day happenings within Congress.",
      "Additional Responsibilities May Include:  \n* Conducting research on key legislative issues such as foreign policy, trade, and energy. \n* Assisting with events of varying sizes, from small networking meetings to large public events. \n* Working closely with the office's Communications team to develop materials for social media platforms."
    ],
    "Qualifications": [
      "Be a current undergraduate or graduate student or have recently graduated.",
      "Demonstrate an interest in politics, policy and/or public service.",
      "Have strong communications and writing skills.",
      "Be hard-working, dependable, detail-oriented and professional."
    ],
    "Salary_Min": null,
    "Salary_Max": null,
    "Skills_Mentioned": [
      "Research",
      "Communication",
      "Policy Analysis"
    ],
    "Equal_Opportunity_Information": "Our Office is an Equal Opportunity Employer.",
    "Cleaned_Text": "",
    "DW_NOMINATE": 0.5239999890327454,
    "LES": 3.623960256576538
  },
  {
    "Post_ID": "MEM-221-25",
    "Posting_Author": null,
    "Congress_Number": null,
    "State_District": null,
    "Location": null,
    "Job_Function": null,
    "Title_Parsed": null,
    "Office_Type": null,
    "Responsibilities": [],
    "Qualifications": [],
    "Salary_Min": null,
    "Salary_Max": null,
    "Skills_Mentioned": [],
    "Equal_Opportunity_Information": null,
    "Cleaned_Text": "",
    "DW_NOMINATE": null,
    "LES": null
  },
  {
    "Post_ID": "MEM-219-25",
    "Posting_Author": "Congresswoman Sara Jacobs",
    "Congress_Number": null,
    "State_District": null,
    "Location": "San Diego and Washington, D.C.",
    "Job_Function": null,
    "Title_Parsed": null,
    "Office_Type": null,
    "Responsibilities": null,
    "Qualifications": null,
    "Salary_Min": null,
    "Salary_Max": null,
    "Skills_Mentioned": null,
    "Equal_Opportunity_Information": "None",
    "Cleaned_Text": "MEM-219-25\nCongresswoman Sara Jacobs offers in-person internships in both her San Diego and\nWashington, D.C. offices. These internships provide young adults with the opportunity to\nlearn more about the inner workings of a congressional office and to experience the\nt Legislation, The Legislative process and constituent and community outreach first-hand.\n \fIf you would like to be considered for an internship in our DC office, please email your\nresume, cover letter, and a 1 page writing sample to\nSaraJacobs.DCintern@mail.house.gov\nPlease no direct emails, phone calls, or walk-ins regarding the status of your application.",
    "DW_NOMINATE": null,
    "LES": null
  }
]