[
  {
    "Post_ID": "MEM-241-25",
    "Posting_Author": "Messmer.house.gov",
    "Congress_Number": null,
    "State_District": "none specified in text",
    "Location": "Washington D.C.",
    "Job_Function": "Internship",
    "Title_Parsed": "Fall Internship",
    "Office_Type": "Congressional office",
    "Responsibilities": [
      "Assisting with front office operations",
      "Answer constituent letters and phone calls",
      "Attend hearings and briefings related to the Congressman's portfolio",
      "Research legislation for the Member and legislative staff"
    ],
    "Qualifications": null,
    "Salary_Min": null,
    "Salary_Max": null,
    "Skills_Mentioned": [
      "Excellent communication skills (writing included)",
      "Strong public service experience",
      "Public speaking/presentation",
      "Policy writing/analysis",
      "...and other mentioned in text"
    ],
    "Equal_Opportunity_Information": null,
    "Cleaned_Text": "Ideal candidates will be organized, detail-oriented, and passionate about public service. Applicants should have excellent communication and writing skills.\n\nKey Responsibilities Include:\n- Assisting with front office operations\n- Answer constituent letters and phone calls\n- Attend hearings and briefings related to the Congressman's portfolio\n- Research legislation for the Member and legislative staff\nInternships are in-person, paid, and run from August through December with flexible start ûand end dates.\nTo apply, visit https://messmer.house.gov/forms/internships. Applications will be accepted on a rolling basis.",
    "DW_NOMINATE": null,
    "LES": null
  },
  {
    "Post_ID": "MEM-239-25",
    "Posting_Author": "Congressman Raja Krishnamoorthi",
    "Congress_Number": null,
    "State_District": "IL-08",
    "Location": null,
    "Job_Function": "Press Intern",
    "Title_Parsed": "Press Intern for the Office of Congressman Raja Krishnamoorthi",
    "Office_Type": "In-Person/Hybrid",
    "Responsibilities": null,
    "Qualifications": [
      "Demonstrating a strong and positive work ethic",
      "Being responsive and punctual",
      "Having solid writing and editing skills",
      "Being diligent, communicative, creative, and willing to perform and follow through on a wide variety of tasks"
    ],
    "Salary_Min": null,
    "Salary_Max": null,
    "Skills_Mentioned": [
      "Writing and editing",
      "Social media strategizing",
      "Canva expertise",
      "Time management and organization",
      "Communication skills",
      "Proactivity and initiative",
      "Collaboration and teamwork"
    ],
    "Equal_Opportunity_Information": "The Office of Congressman Raja Krishnamoorthi is an Equal Opportunity Employer.",
    "Cleaned_Text": "",
    "DW_NOMINATE": null,
    "LES": null
  },
  {
    "Post_ID": "MEM-236-25",
    "Posting_Author": "Democratic Staff of the House Committee on Veterans' Affairs",
    "Congress_Number": null,
    "State_District": null,
    "Location": "Washington, D.C.",
    "Job_Function": "Law Clerk",
    "Title_Parsed": "House Committee on Veterans' Affairs Law Clerk",
    "Office_Type": "Congressional Staff",
    "Responsibilities": [
      "Conducting research",
      "Drafting memos, letters, and other written materials,"
    ],
    "Qualifications": [
      "Superior organizational skills",
      "Strong work ethic",
      "Able to pay close attention to detail",
      "Excellent research, writing, and analytical skills"
    ],
    "Salary_Min": null,
    "Salary_Max": null,
    "Skills_Mentioned": [
      "HBCU and MSI students"
    ],
    "Equal_Opportunity_Information": "The Committee strongly encourages veterans, minorities, women, people with disabilities, LGBTQ+ candidates, and HBCU and MSI students to apply.",
    "Cleaned_Text": "The Democratic Staff of the House Committee on Veterans' Affairs seeks a law clerk for...",
    "DW_NOMINATE": null,
    "LES": null
  },
  {
    "Post_ID": "MEM-235-25",
    "Posting_Author": null,
    "Congress_Number": null,
    "State_District": null,
    "Location": "Washington, D.C.",
    "Job_Function": "press/digital intern",
    "Title_Parsed": "House Committee on Veterans' Affairs Press/Digital Intern",
    "Office_Type": "paid, full-time or part-time, in-person",
    "Responsibilities": [],
    "Qualifications": [],
    "Salary_Min": null,
    "Salary_Max": null,
    "Skills_Mentioned": [],
    "Equal_Opportunity_Information": "The ideal candidate will have strong oral and written communications skills, be detailoriented, has a familiarity with social media platforms, and have a desire to help veterans and learn about the Committee and the legislative process. The Committee strongly encourages veterans, minority, women, people with disabilities, LGBTQ+ candidates, and HBCU and MSI students to apply.",
    "Cleaned_Text": "A strong work ethic, the ability to excel in fast-past environments, and a willingness to assist wherever needed is a must.\nThe ideal candidate will have strong oral and written communications skills, be detailoriented, has a familiarity with social media platforms, and have a desire to help veterans and learn about the Committee and the legislative process. The Committee strongly encourages veterans, minority, women, people with disabilities, LGBTQ+ candidates, and HBCU and MSI students to apply.\n\nThis paid, full-time or part-time, in-person position is based in Washington, D.C.\nCandidates must submit a cover letter, resume, and writing samples through the online application accessible at https://democrats-veterans.house.gov/opportunities.\nThe deadline to apply 5 p.m. on Friday, August 1, 2025.",
    "DW_NOMINATE": null,
    "LES": null
  },
  {
    "Post_ID": "MEM-233-25",
    "Posting_Author": "Congresswoman Doris Matsui",
    "Congress_Number": null,
    "State_District": "California's 7th District",
    "Location": "Washington, D.C.",
    "Job_Function": "Press Intern",
    "Title_Parsed": "Press and Digital Intern",
    "Office_Type": "Congressional office office",
    "Responsibilities": [
      "help build out the Congresswoman’s digital and social media presence",
      "assisting with time sensitive assignments",
      "answering phones and data entry"
    ],
    "Qualifications": [
      "strong writing, editing, and social media skills",
      "basic familiarity with graphic design/video editing software"
    ],
    "Salary_Min": null,
    "Salary_Max": null,
    "Skills_Mentioned": [
      "graphic design",
      "video editing"
    ],
    "Equal_Opportunity_Information": "This office is an equal opportunity employer and does not discriminate based on race, religion, disability, age, ethnicity, national origin, sex, gender, LGBTQ identification, family status, or military status.",
    "Cleaned_Text": "",
    "DW_NOMINATE": null,
    "LES": null
  },
  {
    "Post_ID": "MEM-232-25",
    "Posting_Author": "Congresswoman Doris Matsui",
    "Congress_Number": null,
    "State_District": "7th Congressional District of California",
    "Location": "Washington, D.C. and District (Sacramento)",
    "Job_Function": null,
    "Title_Parsed": "Intern",
    "Office_Type": "Congressional office",
    "Responsibilities": [
      "answering phones",
      "data entry"
    ],
    "Qualifications": [
      "various skills and qualifications required to be listed on the application form"
    ],
    "Salary_Min": null,
    "Salary_Max": null,
    "Skills_Mentioned": [],
    "Equal_Opportunity_Information": "This office is an equal opportunity employer and does not discriminate based on race, religion, disability, age, ethnicity, national origin, sex, gender, LGBTQ identification, family status, or military status.",
    "Cleaned_Text": "MEM-232-25 Congresswoman Doris Matsui, representing the 7th Congressional District of California, seeks interns for her Washington, D.C. and District (Sacramento) offices for the Fall 2025 term...",
    "DW_NOMINATE": null,
    "LES": null
  },
  {
    "Post_ID": "MEM-231-25",
    "Posting_Author": null,
    "Congress_Number": null,
    "State_District": null,
    "Location": "",
    "Job_Function": "",
    "Title_Parsed": null,
    "Office_Type": null,
    "Responsibilities": [
      "corresponding and communicating with constituents",
      "researching policy",
      "legislative analysis",
      "guiding Capitol building tours",
      "assisting staff with administrative tasks",
      "conduct legislative research",
      "attending Capitol Hill briefings",
      "congressional hearings",
      "press events"
    ],
    "Qualifications": [
      "positive attitude",
      "strong work ethic",
      "excellent written and oral communication skills"
    ],
    "Salary_Min": null,
    "Salary_Max": null,
    "Skills_Mentioned": [],
    "Equal_Opportunity_Information": null,
    "Cleaned_Text": "Congressman Jason Smith (MO-08) is currently seeking full or part-time interns to work in his Washington, DC office for the Fall 2025 term. Intern responsibilities include corresponding and communicating with constituents, researching policy, legislative analysis, guiding Capitol building tours and assisting staff with administrative tasks.\nInterns also will have the opportunity to conduct legislative research as well as attend Capitol Hill briefings, congressional hearings, and press events. Ideal candidates have a positive attitude, strong work ethic, and excellent written and oral communication skills.\nThose interested should send their resume and cover letter\nto grayson.donnellan@mail.house.gov &amp; brianna.garcia@mail.house.gov.\nApplications are reviewed on a rolling basis, so there is currently no deadline to apply. Hours are flexible and can be adjusted to accommodate other work/class schedules. This is a paid position and is competitive with that of other offices. Rate of pay will depend on hours worked and duration of internship. State ties preferred but not required.",
    "DW_NOMINATE": null,
    "LES": null
  },
  {
    "Post_ID": "MEM-226-25",
    "Posting_Author": "The office of Congresswoman Susie Lee",
    "Congress_Number": null,
    "State_District": "Nevada ties are strongly preferred",
    "Location": "Washington, D.C.",
    "Job_Function": "Full-time, Fall 2025 Interns",
    "Title_Parsed": "",
    "Office_Type": "unknown",
    "Responsibilities": [
      "answering phones",
      "managing the front office",
      "assisting legislative staff with research",
      "assisting the communications teams with drafting",
      "other tasks as assigned"
    ],
    "Qualifications": [
      "work well under deadlines",
      "are organized",
      "hard-worked",
      "detail-oriented",
      "excellent customer service skills",
      "team players"
    ],
    "Salary_Min": null,
    "Salary_Max": null,
    "Skills_Mentioned": [],
    "Equal_Opportunity_Information": "",
    "Cleaned_Text": "MEM-226-25The office of Congresswoman Susie Lee is seeking full-time, Fall 2025 Interns for the Washington, D.C. office. Responsibilities will include answering phones, managing the front office, assisting legislative staff with research, assisting the communications teams with drafting, and other tasks as assigned. Successful candidates work well under deadlines, are organized, hard-working, detail-oriented, have excellent customer service skills, and are team players. Nevada ties are strongly preferred. Interns will be eligible for a monthly stipend. Interested candidates should send a resume, cover letter, and 2 writing samples to NV03Resumes@gmail.com by July 23, 2025 with “Fall 2025 DC Intern - [Last Name], [First Name]” in the subject line. No phone calls or walk-ins please.",
    "DW_NOMINATE": null,
    "LES": null
  },
  {
    "Post_ID": "MEM-225",
    "Posting_Author": "Congresswoman Angie Craig",
    "Congress_Number": null,
    "State_District": null,
    "Location": null,
    "Job_Function": null,
    "Title_Parsed": null,
    "Office_Type": "Internship Office",
    "Responsibilities": [
      "Researching legislation",
      "Attending hearings and constituent meetings",
      "Answering constituents' phone calls",
      "Logging and drafting constituent correspondence",
      "Assisting legislative and communications staff members on various projects"
    ],
    "Qualifications": [
      "Passionate about public service",
      "Confident and effective communicators",
      "Proactive problem-solvers",
      "Strong writing skills"
    ],
    "Salary_Min": 0,
    "Salary_Max": null,
    "Skills_Mentioned": [],
    "Equal_Opportunity_Information": "The office is an equal opportunity employer and does not discriminate on the basis of race, color, religion, sex, sexual orientation, gender identity, national origin, disability, age, or protected veteran status",
    "Cleaned_Text": "",
    "DW_NOMINATE": null,
    "LES": null
  },
  {
    "Post_ID": "MEM-223-25",
    "Posting_Author": "The Office of Congressman Pat Harrigan (NC-10)",
    "Congress_Number": null,
    "State_District": "NC-10",
    "Location": "DC office",
    "Job_Function": "Internship with DC office",
    "Title_Parsed": null,
    "Office_Type": "Internship with DC office",
    "Responsibilities": [
      "gain hands-on experience and knowledge over the day-to-day happenings within Congress",
      "co-currently enrolled in an accredited university will receive a monthly stipend"
    ],
    "Qualifications": [
      "current undergraduate or graduate student",
      "recently graduated",
      "demonstrate an interest in politics, policy and/or public service",
      "strong communications and writing skills",
      "be hard-working, dependable, detail-oriented and professional"
    ],
    "Salary_Min": null,
    "Salary_Max": null,
    "Skills_Mentioned": [
      "No specific skills mentioned"
    ],
    "Equal_Opportunity_Information": "\\n\\n\\n\\n",
    "Cleaned_Text": "The Office of Congressman Pat Harrigan (NC-10) is currently seeking interns with our DC office for the Fall 2025 session. The internship would begin August 11th and last until December 19th (flexible on start and end dates). This is a great opportunity to gain hands-on experience and knowledge over the day-to-day happenings within Congress. Additionally, interns co-currently enrolled in an accredited university will receive a monthly stipend.\n\nQualified candidates should:\nBe a current undergraduate or graduate student or have recently graduated.\nDemonstrate an interest in politics, policy and/or public service.\nHave strong communications and writing skills.\n\\nP\\nBe hard-working, dependable, detail-oriented and professional.\nInterested candidates should address their application materials to \nGabby.Bartley@mail.house.gov. Applications should include a resume and what the\nindividual’s internship schedule may look like.",
    "DW_NOMINATE": 0.5239999890327454,
    "LES": 3.623960256576538
  },
  {
    "Post_ID": "MEM-222-25",
    "Posting_Author": "The Office of Congressman David Scott",
    "Congress_Number": null,
    "State_District": "GA-13",
    "Location": "Washington DC and Stockbridge, GA",
    "Job_Function": null,
    "Title_Parsed": "Internship Program",
    "Office_Type": "Congressman's Office",
    "Responsibilities": [
      "Assisting with front office operations",
      "Answering phones and processing incoming requests",
      "Drafting letters, memos, and conducting legislative research"
    ],
    "Qualifications": [
      "Excellent communication and writing skills"
    ],
    "Salary_Min": null,
    "Salary_Max": null,
    "Skills_Mentioned": [],
    "Equal_Opportunity_Information": null,
    "Cleaned_Text": "The Office of Congressman David Scott (GA-13) is seeking motivated college students and recent graduates for the fall 2025 internship program in his Washington DC and Stockbridge, GA offices. Ideal candidates will be organized, detail-oriented, and passionate about public service. Applicants should have excellent communication and writing skills. Key responsibilities include:\n\n• Assisting with front office operations\n• Answering phones and processing incoming requests\n• Drafting letters, memos, and conducting legislative research\n• Assisting with tours of the Capitol\nInternships are in-person, paid, and run from September through December with flexible start and end dates. To apply, please send a resume, cover letter, and writing sample in one combined document to davidscott.internships@mail.house.gov with the subject line “Full Name – Fall Intern Application.” The application deadline is July 31, 2025.\n\nApplications will be accepted on a rolling basis.",
    "DW_NOMINATE": -0.3030000030994415,
    "LES": 0.06057562306523323
  },
  {
    "Post_ID": "MEM-221-25",
    "Posting_Author": null,
    "Congress_Number": null,
    "State_District": null,
    "Location": "Washington, D.C.",
    "Job_Function": "Government and Public Policy",
    "Title_Parsed": "\\u041aиньатоС ѯчесы ошрд\t",
    "Office_Type": null,
    "Responsibilities": [
      "Answering phones.",
      "Sorting mail.",
      "Drafting correspondence.",
      "Performing research.",
      "Drafting public statements.",
      "Preparing materials for hearings.",
      "Attending hearings and briefings.",
      "Reaching out to agencies and other congressional offices."
    ],
    "Qualifications": null,
    "Salary_Min": null,
    "Salary_Max": null,
    "Skills_Mentioned": null,
    "Equal_Opportunity_Information": null,
    "Cleaned_Text": "\\u041bостенъма за у \\0438 пров лситща д мецюэкческоял тет у г ам у у и пяолич д говер\nо u к к омцой ҏ внъзлафк бранш ь ѣ у \\0437 е ї тЏ фоллуй сцовюкь ля нрш в ф о Сяїемую}",
    "DW_NOMINATE": null,
    "LES": null
  },
  {
    "Post_ID": "MEM-220-25",
    "Posting_Author": "Amaris Graham",
    "Congress_Number": null,
    "State_District": null,
    "Location": "Washington, DC",
    "Job_Function": "Internship Assistant",
    "Title_Parsed": null,
    "Office_Type": "Capitol Hill office",
    "Responsibilities": [
      "attending hearings and briefings on behalf of the Congresswoman and legislative staffers",
      "working directly with the communications team on press strategies",
      "answering telephones",
      "compiling daily press clips relevant to the office's priorities",
      "assisting with constituent correspondence",
      "providing administrative assistance to the D.C. staff"
    ],
    "Qualifications": [
      "Undergraduate students and recent college graduates preferred",
      "South Florida ties a plus",
      "Women and minorities are encouraged to apply"
    ],
    "Salary_Min": null,
    "Salary_Max": null,
    "Skills_Mentioned": null,
    "Equal_Opportunity_Information": "We welcome applications from all qualified candidates.",
    "Cleaned_Text": "",
    "DW_NOMINATE": null,
    "LES": null
  },
  {
    "Post_ID": "MEM-219-25",
    "Posting_Author": "Congresswoman Sara Jacobs",
    "Congress_Number": null,
    "State_District": "San Diego",
    "Location": "both her San Diego and Washington, D.C. offices",
    "Job_Function": null,
    "Title_Parsed": "Internship",
    "Office_Type": "in-person internships in both her offices.",
    "Responsibilities": [
      "learn more about the inner workings of a congressional office",
      "experience the legislative process and constituent and community outreach first-hand"
    ],
    "Qualifications": null,
    "Salary_Min": null,
    "Salary_Max": null,
    "Skills_Mentioned": [],
    "Equal_Opportunity_Information": null,
    "Cleaned_Text": "",
    "DW_NOMINATE": null,
    "LES": null
  },
  {
    "Post_ID": "MEM-218-25",
    "Posting_Author": "Congressman Shri Thanedar (MI-13)",
    "Congress_Number": 13,
    "State_District": "MI-13",
    "Location": "Washington, D.C.",
    "Job_Function": "",
    "Title_Parsed": "Legislative Fellowship",
    "Office_Type": "Congressman's Office",
    "Responsibilities": [
      "Performing Research (CRS, the Library of Congress, MIN, or other available resources)",
      "Attending meetings on behalf of the office",
      "Drafting talking points, proclamations, and various briefings",
      "Staffing the Congressman at various events",
      "Tracking and responding to constituent requests and letters",
      "Helping find legislative opportunities for sponsorship and co-sponsorship",
      "Performing tasks and duties as needed to help day to day activities of the office",
      "Other duties will be based on the fellow's interests"
    ],
    "Qualifications": [
      "Eagerness to learn",
      "Research skills",
      "Strong writing skills",
      "MI-13 ties and research experience (pluses)"
    ],
    "Salary_Min": null,
    "Salary_Max": null,
    "Skills_Mentioned": [
      "Legislative experience",
      "Research",
      "Writing"
    ],
    "Equal_Opportunity_Information": "This office is an Equal Opportunity Employment Office and does not discriminate on the basis of race, color, religion, sex, gender identity, sexual orientation, or age.",
    "Cleaned_Text": "",
    "DW_NOMINATE": -0.3580000102519989,
    "LES": 0.3025133609771729
  },
  {
    "Post_ID": "MEM-217-25",
    "Posting_Author": "Congressman Shri Thanedar ",
    "Congress_Number": null,
    "State_District": "MI-13",
    "Location": "The Washington, D.C. Office of Congressman Shri Thanedar (MI-13)",
    "Job_Function": null,
    "Title_Parsed": "press and legislative internships",
    "Office_Type": null,
    "Responsibilities": [
      "Answering phone calls",
      "Greeting office visitors",
      "Drafting constituent correspondence",
      "Coordinating tour requests and leading tours of the Capitol",
      "Attending congressional briefings, hearings and other professional development events",
      "Drafting press releases to be posted on the website and social media accounts",
      "Researching legislation and writing cosponsor memos for the legislative team",
      "Assisting operations, communications, and legislative staffers with various tasks"
    ],
    "Qualifications": [
      "an eagerness to learn",
      "customer service skills",
      "strong writing skills"
    ],
    "Salary_Min": null,
    "Salary_Max": null,
    "Skills_Mentioned": null,
    "Equal_Opportunity_Information": "This office is an Equal Opportunity Employment Office and does not discriminate on the basis of race, color, religion, sex, gender identity, sexual orientation, or age. We strongly encourage BIPOC-identifying individuals and members of other underrepresented communities to apply.",
    "Cleaned_Text": "",
    "DW_NOMINATE": -0.3580000102519989,
    "LES": 0.3025133609771729
  },
  {
    "Post_ID": "MEM-214-25",
    "Posting_Author": "The District Office of Representative Joseph Morelle, NY-25 in Rochester, NY",
    "Congress_Number": null,
    "State_District": "NY-25",
    "Location": "Rochester, NY (D.C. office)",
    "Job_Function": null,
    "Title_Parsed": "Intern",
    "Office_Type": null,
    "Responsibilities": [
      "Completing constituent calls",
      "Writing letters, certificates, and proclamations",
      "Day-to-day office work",
      "Interacting with members of staff in the Rochester office and virtually in the D.C.",
      "Other duties delegated by members of staff"
    ],
    "Qualifications": [
      "Excellent communication skills",
      "Strong attention to detail",
      "Ability to work in a fast-paced environment",
      "Good sense of humor",
      "New York State ties (preferred but not required)"
    ],
    "Salary_Min": null,
    "Salary_Max": null,
    "Skills_Mentioned": [
      "Congressional communications",
      "Legislative process"
    ],
    "Equal_Opportunity_Information": "The office is an equal opportunity employer and does not discriminate on the basis of race, color, religion, sex, sexual orientation, gender identity and expression, disability, military status, age, marital status, or parental status.",
    "Cleaned_Text": "MEM-214-25\n\nThe District Office of Representative Joseph Morelle, NY-25 in Rochester, NY, will be\naccepting applications for an in-person internship during the Fall Semester 2025.\nApplications will be accepted June 24th, 2025 – July 25th, 2025.\nInterns will be responsible for:\n• Completing constituent calls\n• Writing letters, certificates, and proclamations\n• Day-to-day office work\n• Interacting with members of staff in the Rochester office and virtually in the D.C.\noffice\n• Other duties delegated by members of staff including various constituent case work or work on District-based projects of importance\nInterns will learn about the functions of a congressional office, congressional communications, and the legislative process. Ideal candidates should possess excellent\nfreshman communication skills, strong attention to detail, the ability to work in a fast-paced environment, and a good sense of humor. New York State ties are preferred but not\ndebated.\nInterest\napped applicants should submit the following in one PDF document:\n•\n•\n•\n•\nResume\nCover letter\nOne-page writing sample\nDates of availability\nThe office is an equal opportunity employer and does not discriminate on the basis of race,\ncolor, religion, sex, sexual orientation, gender identity and expression, disability, military\ntatus, age, marital status, or parental status. Internships are intended for current undergraduate students and\ncurrent graduate students.\nFor more information on the district internship please\nvisit: https://morelle.house.gov/congressional-internships\nTo apply for the Summer 2025 District Office Internship, please fill out the google form\ngenerated here: <Fall 2025 DO Internship Application Google Form>.\nOur office will be accepting applications on a rolling basis until July 25th at 11:59pm EST. Applicants are encouraged to submit their application early.",
    "DW_NOMINATE": -0.3319999873638153,
    "LES": 0.9010738134384155
  },
  {
    "Post_ID": "MEM-213-25",
    "Posting_Author": "The Washington, D.C. Office of Representative Joe Morelle",
    "Congress_Number": null,
    "State_District": "Washington, D.C.",
    "Location": "Washington, D.C.",
    "Job_Function": "Office Assistant/Intern",
    "Title_Parsed": "Office Assistant/Intern",
    "Office_Type": "Legislative",
    "Responsibilities": [
      "Greeting guests and assisting with front office operations",
      "Answering phones, recording constituent opinions, and correctly processing inquiries",
      "Conducting Capitol tours for constituents and other guests"
    ],
    "Qualifications": [
      "Excellent written and verbal communications skills",
      "Strong attention to detail",
      "Ability to succeed in a fast-paced work environment",
      "Good sense of humor",
      "New York State ties (preferred)"
    ],
    "Salary_Min": null,
    "Salary_Max": null,
    "Skills_Mentioned": [
      "Congressional Communications",
      "Legislative Process"
    ],
    "Equal_Opportunity_Information": "The office is an equal opportunity employer and does not discriminate on the basis of race, color, religion, sex, sexual orientation, gender identity and expression, disability, military status, age, marital status, or parental status.",
    "Cleaned_Text": "The Washington, D.C. Office of Representative Joe Morelle is now accepting applications for an internship during the 2025 Fall term. Applicants must be based in Washington, D.C. for the duration of the fall internship (early September to mid-December, subject to change).\n\nFull-time paid internships run Monday through Friday from 9:00 a.m. to 6:00 p.m. when Congress is in session, and 9:00 a.m. to 5:00 p.p.m. when not in session (refer to the House Calendar). Part-time internships are scheduled to accommodate students’ course schedules, as well as the needs of the office.\n\nInterns must be a U.S. citizen and legally eligible to work for the U.S. federal government.\n\nIn Washington, D.C., interns will be responsible for: \n• Greeting guests and assisting with front office operations. \n• Answering phones, recording constituent opinions, and correctly processing inquiries. \n• Conducting Capitol tours for constituents and other guests.\n\nDay-to-day office work to assist with the functioning of the congressional office and other duties as delegated by members of the staff.\nSupporting the Legislative Correspondent with sorting mail and drafting constituent letters.\nAttending hearings and briefings, as requested by senior staff.\nResearching legislation for the Member and legislative team.\nInteracting with members of staff in the D.C. office and virtually with the Rochester office.\nOther administrative tasks as assigned.\n\nThroughout the semester, interns will learn about the operations of a congressional office, congressional communications, and the legislative process.\nIdeal candidates should possess excellent written and verbalcommunications skills, a strong attention to detail, the ability to succeed in a fast-paced work environment, and good sense of humor.\nNew York State ties are preferred but not required.\n\nInterested applicants should submit the following within the application form listed below: \n• Resume\n• Cover letter\n• Writing sample (ex. policy memo, short essay, etc.)\n\text{(max. 2 pages)}\nThe office is an equal opportunity employer and does not discriminate on the basis of race,\ncolor, religion, sex, sexual orientation, gender identity and expression, disability, military status, age, marital status, or parental status.\n\nInternships are intended for current undergraduate students, current graduate students, and recent college graduates.",
    "DW_NOMINATE": null,
    "LES": null
  },
  {
    "Post_ID": "MEM-211-25",
    "Posting_Author": "Representative Kevin Mullin (CA-15)",
    "Congress_Number": null,
    "State_District": null,
    "Location": "Washington, DC (in-person)",
    "Job_Function": "Legislative Intern",
    "Title_Parsed": null,
    "Office_Type": null,
    "Responsibilities": [
      "answering phones",
      "researching legislative issues",
      "drafting constituent correspondence",
      "attending policy briefings and hearings",
      "recommending legislation to the Representative",
      "other tasks as assigned"
    ],
    "Qualifications": [
      "excellent written and oral communications skills",
      "interest in the legislative process",
      "resourcefulness",
      "willingness to learn in a fast-paced environment"
    ],
    "Salary_Min": null,
    "Salary_Max": 15,
    "Skills_Mentioned": [
      "bay area or california ties not required",
      "resourcefulness"
    ],
    "Equal_Opportunity_Information": "This office is an equal opportunity employer and does not discriminate on the basis of race, color, religion, sex, sexual orientation, gender identity and expression, national origin, disability, military status, age, marital status, or parental status.",
    "Cleaned_Text": "null",
    "DW_NOMINATE": null,
    "LES": null
  },
  {
    "Post_ID": "MEM-210-25",
    "Posting_Author": "Representative Kevin Mullin (CA-15)",
    "Congress_Number": null,
    "State_District": "CA-15",
    "Location": "Washington, DC office",
    "Job_Function": "press intern",
    "Title_Parsed": "Press Intern",
    "Office_Type": "office",
    "Responsibilities": [
      "answering telephones",
      "compiling daily press clips",
      "creating content for social media",
      "drafting press releases, newsletters, and other written materials",
      "maintaining press lists",
      "clipping floor and hearing remarks",
      "designing graphics"
    ],
    "Qualifications": [
      "team-oriented",
      "strong work ethic",
      "ability to excel in fast-paced environments",
      "excellent written and oral communication skills"
    ],
    "Salary_Min": null,
    "Salary_Max": 15,
    "Skills_Mentioned": [
      "graphic design",
      "social media",
      "video editing"
    ],
    "Equal_Opportunity_Information": "Candidates from diverse backgrounds are encouraged to apply.",
    "Cleaned_Text": "",
    "DW_NOMINATE": -0.4699999988079071,
    "LES": 0.05192196369171143
  },
  {
    "Post_ID": "MEM-208-25",
    "Posting_Author": "the Office of Congresswoman Janelle Bynum (OR-05)",
    "Congress_Number": null,
    "State_District": "Oregon City, Oregon",
    "Location": "Oregon",
    "Job_Function": null,
    "Title_Parsed": "Fall District Internship with the Office of Congresswoman Bynum",
    "Office_Type": null,
    "Responsibilities": [
      "The Office of Congresswoman Janelle Bynum (OR-05)",
      "DUTIES:",
      "For",
      "- Handle incoming calls with poise, professionalism, and promptness.",
      "- Assist Member and key staff with logistical and administrative duties.",
      "- Receive and log input from constituents on policy matters for the Member office’s consideration and response.",
      "- Organize press clips and assist the communications team with social media posts and talking points.",
      "Hearing",
      "and",
      "drafting",
      "- Attend briefings and hearings, conduct research, and draft correspondence and memoranda.",
      "QUALIFICATIONS:",
      "For",
      "College student in good academic standing.",
      "•",
      "Good oral and written communication skills.",
      ". The ability to handle difficult situations with courtesy, tact and compassion ",
      "(with",
      "- Problem-solving skills and the ability to work independently and use good judgement.",
      "•",
      "REsponsible,"
    ],
    "Qualifications": [
      "For",
      "• College student in good academic standing.",
      "Good",
      "orphanal communicationðks",
      "The°biytyð a to handple 흝ficult sitation with courtesty ,tac",
      "Problemsolvsing ks and the uablitly  to work ndpendently nd us good juedment",
      "• Good"
    ],
    "Salary_Min": null,
    "Salary_Max": null,
    "Skills_Mentioned": [],
    "Equal_Opportunity_Information": "This internship is available to all qualified candidates regardless of race, color, religion, sex, age\nor national origin.",
    "Cleaned_Text": "MEM-208-25Fall District Internship with the Office of Congresswoman Bynum The Office of Congresswoman Janelle Bynum (OR-05) is seeking part-time interns to join our district office in Oregon City, Oregon. Preferred start date beginning in August 2025,\nwith an end date in December 2025. Seeking applicants available to work in-person 12-24\nhours per week.\nDUTIES:· Handle incoming calls with poise, professionalism, and promptness.\nAssist Member and key staff with logistical and administrative duties.\nReceive and log input from constituents on policy matters for the Member office's consideration and response.\nOrganize press clips and assist the communications team with social media posts and talking points.\nAttend briefings and hearings, conduct research, and draft correspondence and memoranda.",
    "DW_NOMINATE": null,
    "LES": null
  },
  {
    "Post_ID": "MEM-207-25",
    "Posting_Author": "The Office of Congresswoman Janelle Bynum",
    "Congress_Number": null,
    "State_District": "OR-05",
    "Location": "Washington DC",
    "Job_Function": null,
    "Title_Parsed": "Fall D.C. Internship with the Office of Congresswoman Bynum",
    "Office_Type": "Intern",
    "Responsibilities": [
      "Handle incoming correspondence with poise, professionalism, and promptness.",
      "Assist Member and key staff with logistical and administrative duties.",
      "Update the office's legislative tracker and perform research on legislative measures.",
      "Attend briefings and hearings, conduct research, and draft correspondence and memoranda.",
      "Partner with communications team to create speeches, social media posts, and talking points."
    ],
    "Qualifications": [
      "College student in good academic standing.",
      "Good oral and written communication skills.",
      "The ability to handle difficult situations with courtesy, tact and compassion",
      "Problem-solving skills and the ability to work independently and use good judgement.",
      "Responsible, dependable and willing to learn."
    ],
    "Salary_Min": null,
    "Salary_Max": null,
    "Skills_Mentioned": null,
    "Equal_Opportunity_Information": "All applicants will be considered without regard to race, color, religion, sex (including marital or parental status), sexual orientation, gender identity, disability, age, or national origin.",
    "Cleaned_Text": "",
    "DW_NOMINATE": null,
    "LES": null
  },
  {
    "Post_ID": "MEM-204-25",
    "Posting_Author": "Democratic Staff of the House Energy and Commerce Committee",
    "Congress_Number": null,
    "State_District": null,
    "Location": null,
    "Job_Function": "Legislative Intern",
    "Title_Parsed": null,
    "Office_Type": null,
    "Responsibilities": [
      "Answering phones",
      "Conducting legislative research",
      "Preparing materials for staff and member briefings"
    ],
    "Qualifications": [
      "Superior writing and communication skills",
      "Attention to detail",
      "A sense of humor"
    ],
    "Salary_Min": null,
    "Salary_Max": null,
    "Skills_Mentioned": null,
    "Equal_Opportunity_Information": "All applicants will be considered without regard to race, color, national origin, religion, sex (including marital or parental status), sexual orientation, gender identity, disability, or age. Women, minority, and veteran candidates are highly encouraged to apply.",
    "Cleaned_Text": "<span style=\"display: none;\">MEM-204-25 The Democratic Staff of the House Energy and Commerce Committee seeks qualified undergrad students and recent graduates for Legislative Interns for the Fall 2025 session.</span>",
    "DW_NOMINATE": null,
    "LES": null
  },
  {
    "Post_ID": "MEM-193-25",
    "Posting_Author": "The Democratic Staff of the Committee on Rules",
    "Congress_Number": null,
    "State_District": null,
    "Location": "Washington D.C.",
    "Job_Function": "Interns',",
    "Title_Parsed": "Committee Staff to prepare materials for Committee meetings, conduct research projects, learn about the Rules of the House and the various procedures for legislation to reach the House Floor,",
    "Office_Type": "interns'",
    "Responsibilities": [
      "prepare materials for committee meetings",
      "conduct research projects",
      "learn about the rules of the house and the various procedures for legislation to reach the house floor"
    ],
    "Qualifications": [
      "strong writing skills",
      "good work ethic",
      "an interest in learning about House floor procedures",
      "detail-oriented"
    ],
    "Salary_Min": null,
    "Salary_Max": null,
    "Skills_Mentioned": [
      "legislative analysis",
      "political communications",
      "institutional processes"
    ],
    "Equal_Opportunity_Information": "The office is an equal opportunity employer and strongly encourages candidates from diverse backgrounds or with untraditional experience to apply.",
    "Cleaned_Text": "MEM-193-25\nThe Democratic Staff of the Committee on Rules is seeking part- and full-time interns for the fall (September - December). Our interns work closely with Committee staff to prepare materials for Committee meetings, conduct research projects, learn about the Rules of the House and the various procedures for legislation to reach the House Floor, and complete a variety of other administrative tasks. Ideal candidates have strong writing skills, a good work ethic, an interest in learning about House floor procedures, and are detail-oriented. Interns will gain experience in legislative analysis, political communications, and institutional processes.\nA stipend will be available for qualified candidates. Massachusetts ties are a plus. All offers are conditional on completion of a federal criminal background check. The office is an equal opportunity employer and strongly encourages candidates from diverse backgrounds or with untraditional experience to apply.\nInterested applicants should submit a resume and cover letter explaining why you want to join the Democratic Staff of the House Rules Committee to democratsrules.house.gov/about/internships. No calls or drop-ins, please. The deadline to apply is July 14, 2025.\n\nNote: Students on quarter systems or with unusual schedules are still encouraged to apply—please apply by the appropriate deadline in advance of your desired internship term and detail your particular situation in your cover letter.",
    "DW_NOMINATE": null,
    "LES": null
  },
  {
    "Post_ID": "MEM-192-25",
    "Posting_Author": "Congresswoman Mary Gay Scanlon's office",
    "Congress_Number": null,
    "State_District": "CA 13th District",
    "Location": "Washington, DC",
    "Job_Function": null,
    "Title_Parsed": "Legislative Internship",
    "Office_Type": "Federal Legislative Office",
    "Responsibilities": [
      "Drafting constituent correspondence",
      "Researching various legislative issues and writing policy memos for the Congresswoman",
      "Attending briefings, hearings, and markups and drafting related memoranda",
      "Responding to constituent mail and answering office phones"
    ],
    "Qualifications": [
      "Strong written and oral communication skills",
      "Demonated interest in government and public service",
      "Strong work ethic",
      "Ability to excel in fast-paced environments",
      "Willingness to assist wherever needed"
    ],
    "Salary_Min": null,
    "Salary_Max": null,
    "Skills_Mentioned": [],
    "Equal_Opportunity_Information": "We are an Equal Opportunity Employer",
    "Cleaned_Text": "",
    "DW_NOMINATE": null,
    "LES": null
  }
]