[
  {
    "Post_ID": "MEM-477-24",
    "Posting_Author": "Congresswoman Susie Lee",
    "Congress_Number": null,
    "State_District": null,
    "Location": "Washington, D.C.",
    "Job_Function": null,
    "Title_Parsed": "Spring 2025 DC Internship",
    "Office_Type": null,
    "Responsibilities": [
      "answering phones",
      "managing the front office",
      "assisting legislative staff with research",
      "assisting communications teams with drafting",
      "other tasks as assigned"
    ],
    "Qualifications": [
      "working well under deadlines",
      "being organized",
      "being hard-working",
      "having excellent customer service skills",
      "being a team player"
    ],
    "Salary_Min": null,
    "Salary_Max": null,
    "Skills_Mentioned": [
      "Nevada ties",
      "deadlines",
      "organization",
      "hard work",
      "customer service",
      "teamwork"
    ],
    "Equal_Opportunity_Information": "",
    "Cleaned_Text": "The o&ice of Congresswoman Susie Lee is seeking full-time, Spring 2025 Interns for the Washington, D.C. o&ice.",
    "DW_NOMINATE": null,
    "LES": null
  },
  {
    "Post_ID": "MEM-472-24",
    "Posting_Author": "Congresswoman Michelle Steel’s office",
    "Congress_Number": null,
    "State_District": "California's 45th district",
    "Location": "Washington, D.C. office",
    "Job_Function": null,
    "Title_Parsed": "Internship in Congresswoman Michelle Steel's Office",
    "Office_Type": null,
    "Responsibilities": [
      "corresponding with constituents",
      "performing research for staffing",
      "giving tours of the Capitol building",
      "attending Congressional hearings",
      "helping prepare for upcoming hearings"
    ],
    "Qualifications": [
      "strong attention to detail",
      "communications skills",
      "strong interest in learning about the legislative process"
    ],
    "Salary_Min": null,
    "Salary_Max": null,
    "Skills_Mentioned": null,
    "Equal_Opportunity_Information": "The Congressional House of Representatives is an equal opportunity employer.",
    "Cleaned_Text": "Winter/spring internships in Congresswoman Michelle Steel’s office will be held inperson in the Washington, D.C. office...",
    "DW_NOMINATE": null,
    "LES": null
  },
  {
    "Post_ID": "MEM-466-24",
    "Posting_Author": "Congressman Cory Mills’ (FL-07)",
    "Congress_Number": null,
    "State_District": "FL-07",
    "Location": "Washington, D.C. o&ice",
    "Job_Function": "Internship",
    "Title_Parsed": "Spring Internship post",
    "Office_Type": "Congressional office",
    "Responsibilities": [
      "leading Capitol tours",
      "answering phones",
      "greeting constituents",
      "assist[ing] sta& with legislative projects",
      "attending brie&ings and hearings"
    ],
    "Qualifications": [
      "strong organizational, communication, and writing skills",
      "ability to manage multiple tasks and work well under pressure in a team environment",
      "positive attitude and interest in politics"
    ],
    "Salary_Min": null,
    "Salary_Max": null,
    "Skills_Mentioned": [],
    "Equal_Opportunity_Information": null,
    "Cleaned_Text": "MEM-466-24\nSpring Internship post\nCongressman Cory Mills’ (FL-07) Washington, D.C. o&ice is currently seeking qualiﬁed individuals to serve in his Washington...",
    "DW_NOMINATE": null,
    "LES": null
  },
  {
    "Post_ID": "MEM-464-24",
    "Posting_Author": "The O‗office of Congressman Joaquin Castro (TX-20)",
    "Congress_Number": null,
    "State_District": "TX-20",
    "Location": "Washington, D.C.",
    "Job_Function": "Intern",
    "Title_Parsed": "Intern",
    "Office_Type": "Legislateive o‗ice",
    "Responsibilities": [
      "answering phones ",
      "researching legislation",
      "attending hearings and brieüing\ns",
      "responding to constituent letters on the various issues that come before the House"
    ],
    "Qualifications": [
      "interested in public policy",
      "detail-oriented",
      "motivated, organized, willing to learn",
      "have good phone etiquette",
      "strong writing skills"
    ],
    "Salary_Min": null,
    "Salary_Max": 15,
    "Skills_Mentioned": [
      "legislation",
      "hearaings and brieifngs",
      "public policy"
    ],
    "Equal_Opportunity_Information": "All applicants will be considered without regard to race, color, national origin, religion, sex, gender identity, disability, or age.",
    "Cleaned_Text": "",
    "DW_NOMINATE": -0.3989999890327454,
    "LES": 0.6002452373504639
  },
  {
    "Post_ID": "MEM-463-24",
    "Posting_Author": "Congresswoman Mary Gay Scanlon",
    "Congress_Number": null,
    "State_District": null,
    "Location": "Washington, DC office for college students and recent graduates",
    "Job_Function": null,
    "Title_Parsed": "Paid Spring 2025 Legislative Internship – DC O&ice of Congresswoman Mary Gay Scanlon",
    "Office_Type": "o&ice",
    "Responsibilities": [
      "Drafting constituent correspondence",
      "Researching various legislative issues and writing policy memos for the Congresswoman"
    ],
    "Qualifications": [],
    "Salary_Min": null,
    "Salary_Max": null,
    "Skills_Mentioned": [],
    "Equal_Opportunity_Information": "Madhumita.Gupta@mail.house.gov with the subject line ‘Spring Legislative Internship, NAME’",
    "Cleaned_Text": "Paid Spring 2025 Legislative Internship – DC O&ice of Congresswoman Mary Gay Scanlon\nInternships are based in Congresswoman Scanlon’s Washington, DC o&ice for college students and recent graduates and will be in person. Hours are flexible to accommodate students’ course schedules, but generally run from 9 a.m. to 5 p.m. The Legislative Internship is paid via monthly stipend.\n\nLegislative Internship\nResponsibilities include, but are not limited to:\nDrafting constituent correspondence\n• Researching various legislative issues and writing policy memos for the Congresswoman\n• Attending brieﬁngs, hearings, and markups and drafting related memoranda\n• Responding to constituent mail and answering o&ice phones\n\nIdeal applicants will be motivated team players with strong written and oral communication skills and have a demonstrated interest in government and public service.\nA strong work ethic, the ability to excel in fast-past environments, and a willingness to assist wherever needed are must-have qualities.\nTo apply, please submit a resume, cover letter, one short writing sample, and two references to Madhumita.Gupta@mail.house.gov with the subject line “Spring Legislative Internship, NAME”. Please include availability in the cover letter and compile all application materials into one PDF document.",
    "DW_NOMINATE": null,
    "LES": null
  },
  {
    "Post_ID": "MEM-461-24",
    "Posting_Author": "Congresswoman Gwen Moore",
    "Congress_Number": null,
    "State_District": "WI-04",
    "Location": "Washington, D.C.",
    "Job_Function": "Office Support",
    "Title_Parsed": "",
    "Office_Type": "Legislative Office",
    "Responsibilities": [
      "answering phones",
      "attending hearings and briefings",
      "drafting and editing constituent correspondence letters",
      "writing memos",
      "conducting research for the legislative staff",
      "drafting social media posts",
      "designing graphics",
      "provided support for the day-to-day activities of the office"
    ],
    "Qualifications": [
      "research skills",
      "communication skills",
      "ability to work in a fast-paced environment",
      "analytical skills"
    ],
    "Salary_Min": 0,
    "Salary_Max": null,
    "Skills_Mentioned": [
      "phone etiquette",
      "legislative knowledge",
      "social media management",
      "graphic design software"
    ],
    "Equal_Opportunity_Information": "The O&ice of Congresswoman Moore is an equal opportunity employer.",
    "Cleaned_Text": "",
    "DW_NOMINATE": null,
    "LES": null
  },
  {
    "Post_ID": "MEM-459-24",
    "Posting_Author": "Rep. Cli& Bentz (OR-02)",
    "Congress_Number": null,
    "State_District": "OR-02",
    "Location": null,
    "Job_Function": null,
    "Title_Parsed": null,
    "Office_Type": null,
    "Responsibilities": [
      "answer phones",
      "greet Oregonians",
      "attend policy meetings with other sta&",
      "assist in managing constituent correspondences and administrative operations"
    ],
    "Qualifications": [
      "college students or recent graduates",
      "outgoing, proactive, hard-working, detail-oriented, enthusiastic, able to multi-task, and have customer service experience"
    ],
    "Salary_Min": null,
    "Salary_Max": null,
    "Skills_Mentioned": null,
    "Equal_Opportunity_Information": null,
    "Cleaned_Text": "Congressman Cli& Bentz (OR-02) is seeking Spring interns for his Washington D.C. O&ice. Congressman Cli& Bentz is a member of the House Judiciary Committee and the House Natural Resources Committee.",
    "DW_NOMINATE": null,
    "LES": null
  },
  {
    "Post_ID": "MEM-455-24",
    "Posting_Author": "Andrea Salinas",
    "Congress_Number": null,
    "State_District": "OR-06",
    "Location": "Washington D.C.",
    "Job_Function": null,
    "Title_Parsed": "Intern",
    "Office_Type": null,
    "Responsibilities": [
      "Outstanding verbal and written communication skills",
      "Ability to speak courteously with constituents",
      "Ability to work independently and as a part of a team",
      "Attention to detail and eagerness to go above and beyond",
      "Professionalism and demonstrated interest in public service"
    ],
    "Qualifications": [
      "OR-06 ties preferred, but not required"
    ],
    "Salary_Min": null,
    "Salary_Max": null,
    "Skills_Mentioned": [],
    "Equal_Opportunity_Information": "Congressional Accountability Act and House Rule XXIII",
    "Cleaned_Text": "O&ice of Congresswoman Andrea Salinas (D-OR-06) is seeking candidates for a fulltime internship in our Washington D.C. o&ice... ",
    "DW_NOMINATE": null,
    "LES": null
  },
  {
    "Post_ID": "MEM-453-24",
    "Posting_Author": null,
    "Congress_Number": null,
    "State_District": null,
    "Location": null,
    "Job_Function": null,
    "Title_Parsed": null,
    "Office_Type": null,
    "Responsibilities": [],
    "Qualifications": [],
    "Salary_Min": null,
    "Salary_Max": null,
    "Skills_Mentioned": [],
    "Equal_Opportunity_Information": null,
    "Cleaned_Text": "The o&ice of Congresswoman Stephanie Bice (OK-05) is seeking applicants for a paid internship for the Spring 2025 term. Successful applicants will be motivated, detailoriented, display a strong work ethic, and interact well with constituents and others.\n\nFurthermore, applicants should have a strong interest in the legislative process and the functioning of Congress.\n\nThe intern would be expected to handle, sort and/or log incoming calls, mail, and electronic correspondence, lead tours of the Capitol, conduct research, help draft legislative and o&icial correspondence, and assist the D.C. o&ice sta& with work as assigned including administrative and logistical support. Qualiﬁed applicants should possess strong and e&ective communication (both verbal and written), work well in a highly dynamic fastpaced environment, have good time management skills including the ability to prioritize, and track multiple work products, possess attention to detail, and a willingness to learn new skills and tasks and be ﬂexible in supporting the Member and all sta& in various roles, both administrative and legislative.\n\nTo apply, please email ok05internship@mail.house.gov with a copy of your resume.",
    "DW_NOMINATE": null,
    "LES": null
  },
  {
    "Post_ID": "MEM-447-24",
    "Posting_Author": "Congresswoman Dina Titus (NV-01)",
    "Congress_Number": null,
    "State_District": "NV-01",
    "Location": "D.C. office",
    "Job_Function": "Legislative Intern",
    "Title_Parsed": "Legislative Intern",
    "Office_Type": "Congresswoman's office",
    "Responsibilities": [
      "answering constituent phone calls",
      "attending policy brieﬁngs and meetings",
      "providing tours of the United States Capitol",
      "conducting legislative research"
    ],
    "Qualifications": [
      "excellent oral and written communication skills",
      "prioritizes professionalism",
      "dedicated team player",
      "friendly persona"
    ],
    "Salary_Min": null,
    "Salary_Max": null,
    "Skills_Mentioned": [],
    "Equal_Opportunity_Information": "Congresswoman Dina Titus is an equal opportunity employer and does not discriminate on the basis of race, color, religion, sex, sexual orientation, gender identity and expression, national origin, disability, military status, age, marital status, or parental status.",
    "Cleaned_Text": "",
    "DW_NOMINATE": null,
    "LES": null
  },
  {
    "Post_ID": "MEM-444-24",
    "Posting_Author": "Congressman Glenn Grothman",
    "Congress_Number": null,
    "State_District": "",
    "Location": "Washington, DC",
    "Job_Function": "Legislative Process and Congress",
    "Title_Parsed": null,
    "Office_Type": "Constituent Service",
    "Responsibilities": [
      "Answering constituent phone calls and directing them appropriately",
      "Researching legislation for the Member and legislative sta&",
      "Attending congressional hearings and policy brieﬁngs",
      "Answering constituent letters on various issues before the House",
      "Helping the communications/press team",
      "Conducting Capitol tours for constituents and other guests"
    ],
    "Qualifications": [],
    "Salary_Min": 0,
    "Salary_Max": null,
    "Skills_Mentioned": [
      "Detail-oriented work habits",
      "Strong communication skills",
      "Legislative process knowledge",
      "Constituent relationship-building"
    ],
    "Equal_Opportunity_Information": "",
    "Cleaned_Text": "",
    "DW_NOMINATE": null,
    "LES": null
  },
  {
    "Post_ID": "MEM-443-24",
    "Posting_Author": "Congressman Glenn Grothman (WI-06)",
    "Congress_Number": null,
    "State_District": "WI-06",
    "Location": "Washington, DC Office",
    "Job_Function": null,
    "Title_Parsed": "Spring 2025 Congressional Internship",
    "Office_Type": "Legislative Internship",
    "Responsibilities": [
      "Answering constituent phone calls and directing them appropriately",
      "Researching legislation for the Member and legislative sta&",
      "Attending congressional hearings and policy brieﬁngs",
      "Answering constituent letters on various issues before the House",
      "Helping the communications/press team",
      "Conducting Capitol tours for constituents and other guests",
      "Other projects as assigned by the sta&"
    ],
    "Qualifications": [
      "motivated",
      "detail-oriented",
      "display a strong work ethic",
      "interact well with constituents",
      "strong interest in the legislative process and the function of Congress"
    ],
    "Salary_Min": null,
    "Salary_Max": null,
    "Skills_Mentioned": null,
    "Equal_Opportunity_Information": "The Office of Congressman Glenn Grothman is an Equal Opportunity Employer.",
    "Cleaned_Text": "The o&ice of Congressman Glenn Grothman (WI-06) is now accepting applicants for Spring 2025 Congressional Internships in our Washington, DC o&ice. Successful applicants will be motivated, detail-oriented, display a strong work ethic, and interact well with constituents. In addition, applicants should have a strong interest in the legislative process and the function of Congress. A monthly stipend will be provided to individuals selected for the internship.\n\nInternship duties in the Washington, DC o&ice may include:\n• Answering constituent phone calls and directing them appropriately\n• Researching legislation for the Member and legislative sta&\n• Attending congressional hearings and policy brieﬁngs\n• Answering constituent letters on various issues before the House\n• Helping the communications/press team\n• Conducting Capitol tours for constituents and other guests\n• Other projects as assigned by the sta&\n\nTo apply, please email your resume to WisconsinResumes@mail.house.gov. Ties to the state of Wisconsin are preferred, but not required.",
    "DW_NOMINATE": null,
    "LES": null
  },
  {
    "Post_ID": "MEM-441-24",
    "Posting_Author": "Congressman Jim Costa (CA-21)",
    "Congress_Number": null,
    "State_District": "California",
    "Location": "Washington, D.C.",
    "Job_Function": "Digital/Press Intern",
    "Title_Parsed": "Press Intern",
    "Office_Type": "Congressional Communications Office",
    "Responsibilities": [
      "Assist the Communications Director and Press Assistant with drafting social media content, e-newsletters, targeted mailing, and website content.\nEdit photos and create engaging graphics in line with the Congressman’s brand.\nClipping, editing, and compiling videos.\nAssist with the creation and maintenance of press lists."
    ],
    "Qualifications": [
      "Strong writing, editing, and digital skills to assist with time-sensitive assignments",
      "Basic familiarity with graphic design/video editing software, such as Adobe, Canva, and Photoshop"
    ],
    "Salary_Min": null,
    "Salary_Max": null,
    "Skills_Mentioned": [
      "digital media roles",
      "graphic design",
      "video editing"
    ],
    "Equal_Opportunity_Information": "The O&ice of Rep. Jim Costa is an equal opportunity employer committed to building and maintaining an inclusive and diverse work environment.",
    "Cleaned_Text": "MEM-441-24\nThe O&amp;ice of Congressman Jim Costa (CA-21) seeks a highly motivated and creative Digital/Press Intern to join a fast-paced communications operation based in Rep. Costa’s\nWashington, D.C. o&amp;ice for the Winter/Spring 2025 intern class.\nThis internship program prides itself on its educational aspects. Press interns will immerse\nthemselves in fast-paced press operations and learn the ins and outs of a congressional\ncommunications shop. They will have an opportunity to learn and engage on various digital\nplatforms while learning how to connect people to policy.\nQualiﬁed candidates should have strong writing, editing, and digital skills to assist with\ntime-sensitive assignments, as well as basic familiarity with graphic design/video editing\nsuite, such as Adobe, Canva, and Photoshop. Candidates with experience in a press or\ndigital media role (including internships) are preferred but not required. California or\nCentral Valley ties are a plus. The intern will be under the supervision of the\nCommunications Director and Internship Coordinator.\n•\n•\n•\nInternship Responsibilities\nAssist the Communications Director and Press Assistant with drafting social media\ncontent, e-newsletters, targeted mailing, and website content.\nEdit photos and create engaging graphics in line with the Congressman’s brand.\nClipping, editing, and compiling videos.\nAssist with the creation and maintenance of press lists.",
    "DW_NOMINATE": null,
    "LES": null
  },
  {
    "Post_ID": "MEM-440-24",
    "Posting_Author": "Congressman Josh Harder (CA-9)",
    "Congress_Number": null,
    "State_District": "CA-9",
    "Location": "Washington, DC o&ice",
    "Job_Function": null,
    "Title_Parsed": "legislative intern",
    "Office_Type": null,
    "Responsibilities": [
      "assisting with congressional hearings",
      "writing memos",
      "answering phones",
      "sorting mail",
      "supporting sta&"
    ],
    "Qualifications": [
      "strong work ethic",
      "attention to detail",
      "punctuality",
      "excellent writing skills"
    ],
    "Salary_Min": null,
    "Salary_Max": null,
    "Skills_Mentioned": null,
    "Equal_Opportunity_Information": null,
    "Cleaned_Text": "Congressman Josh Harder (CA-9) is seeking motivated legislative interns for the Spring Session in his Washington, DC o&amp;ice. Interns will participate in the daily operations, assisting with congressional hearings, writing memos, answering phones, sorting mail, and supporting sta\". Candidates should exhibit strong work ethic, attention to detail, punctuality, and excellent writing skills. District ties are preferred but not required. This paid internship provides valuable experience in government and politics. To apply, send your resume, cover letter, and a 1-2 page writing sample as a PDF to Eli.Aguayo@mail.house.gov by COB on November 22nd, 2024.",
    "DW_NOMINATE": -0.3210000097751617,
    "LES": 0.8841311931610107
  },
  {
    "Post_ID": "MEM-437-24",
    "Posting_Author": "Congressman Jim Costa (CA-21)",
    "Congress_Number": null,
    "State_District": "CA-21",
    "Location": "Washington, D.C. office",
    "Job_Function": "Digital/Press Intern",
    "Title_Parsed": "Digital/Press Intern",
    "Office_Type": "Rep.",
    "Responsibilities": [
      "Assist the Communications Director and Press Assistant with drafting social media content...",
      "Edit photos and create engaging graphics in line with the Congressman's brand.",
      "Clipping, editing, and compiling videos."
    ],
    "Qualifications": [
      "Strong writing",
      "editing",
      "and digital skills",
      "basic familiarity with graphic design/video editing software",
      "such as Adobe, Canva, and Photoshop.",
      "Candidates with experience in a press or digital media role (including internships) are preferred but not required.",
      "California or Central Valley ties are a plus."
    ],
    "Salary_Min": null,
    "Salary_Max": null,
    "Skills_Mentioned": [
      "Adobe",
      "Canva",
      "Photoshop"
    ],
    "Equal_Opportunity_Information": "The O&ice of Rep. Jim Costa is an equal opportunity employer committed to building and maintaining an inclusive and diverse work environment.",
    "Cleaned_Text": "MEM-437-24 The OÎffice of » Congressman Jim Costa (Ê-21) seeks a highly motivated and creative Digital/Press Intern to join a fast-paced communications operation based in Rep. Costa’s Washington, D.C. office for the Winter/Spring 2025 intern class.\n\nThis internship program prides itself on its educational aspects. Press interns will immerse themselves in fast-paced press operations and learn the ins and outs of a congressional communications shop.\n\nThey will have an opportunity to learn and engage on various digital platform while learning how to connect people to policy.",
    "DW_NOMINATE": -0.1969999969005585,
    "LES": 0.1557658910751343
  },
  {
    "Post_ID": "MEM-435-24",
    "Posting_Author": "The Democratic StaG of the House Energy and Commerce Committee",
    "Congress_Number": null,
    "State_District": null,
    "Location": "not specified from provided text but likely related to Democratic StaG}",
    "Job_Function": "Legislative Intern",
    "Title_Parsed": null,
    "Office_Type": "Committee",
    "Responsibilities": [
      "assist with administrative tasks such as answering phones and preparing materials for sta& and member briefings",
      "shadow sta& at hearings and markups",
      "attend briefings on subjects within the Committee's broad jurisdiction"
    ],
    "Qualifications": [
      "organized and committed students eager to join a fast-paced environment",
      "superior writing and communication skills, attention to detail, and a sense of humor"
    ],
    "Salary_Min": null,
    "Salary_Max": null,
    "Skills_Mentioned": [],
    "Equal_Opportunity_Information": "All applicants will be considered without regard to race, color, national origin, religion, sex (including marital or parental status), sexual orientation, gender identity, disability, or age.",
    "Cleaned_Text": "",
    "DW_NOMINATE": null,
    "LES": null
  },
  {
    "Post_ID": "MEM-433-24",
    "Posting_Author": "O&ice of Representative Brad Schneider",
    "Congress_Number": null,
    "State_District": "IL-10",
    "Location": "Washington, D.C.",
    "Job_Function": "press interns",
    "Title_Parsed": "Press Interns",
    "Office_Type": "Congressman's office",
    "Responsibilities": [
      "collaborate closely with the communications team to create engaging graphics,"
    ],
    "Qualifications": [
      "experience with graphic design platforms like Canva, photo and video editing software"
    ],
    "Salary_Min": null,
    "Salary_Max": null,
    "Skills_Mentioned": null,
    "Equal_Opportunity_Information": "This office is an equal-opportunity employer and does not discriminate based on race, religion, disability, age, ethnicity, national origin, sex, gender, LGBTQ identification, family status, or military status.",
    "Cleaned_Text": "",
    "DW_NOMINATE": -0.1940000057220459,
    "LES": 0.4327289462089539
  },
  {
    "Post_ID": "MEM-429-24",
    "Posting_Author": "Democratic Sta&",
    "Congress_Number": null,
    "State_District": null,
    "Location": "The House Committee on Oversight and Accountability",
    "Job_Function": null,
    "Title_Parsed": null,
    "Office_Type": "Democratic",
    "Responsibilities": null,
    "Qualifications": null,
    "Salary_Min": null,
    "Salary_Max": null,
    "Skills_Mentioned": [],
    "Equal_Opportunity_Information": "Democratic Sta& seeks a motivated and reliable undergraduate or graduate student to fill a full-time digital media and traditional press intern position this spring.",
    "Cleaned_Text": "The House Committee on Oversight and Accountability Democratic Sta& seeks a motivated and reliable undergraduate or graduate student to fill a full-time digital media and traditional press intern position this spring. The intern responsibilities include, but are not limited to, written content creation, graphic design, video editing, and performing other press and administrative tasks as necessary.\nSuccessful candidates will possess familiarity with programs such as Adobe Premiere Pro, Adobe Photoshop, Adobe InDesign, Canva, as well as compiling and interpreting social media analytics. Ability to work in a fast-paced, rapid response environment and willingness to learn are a must. This position reports to the Communications Director.\nCandidates with diverse backgrounds and experiences are strongly encouraged to apply. To apply, please send a resume and portfolio to oversightpress@mail.house.gov.",
    "DW_NOMINATE": null,
    "LES": null
  },
  {
    "Post_ID": "MEM-428-24",
    "Posting_Author": "Congresswoman Doris Matsui",
    "Congress_Number": null,
    "State_District": "California",
    "Location": "Washington, D.C. and District (Sacramento)",
    "Job_Function": "Internship",
    "Title_Parsed": null,
    "Office_Type": " Congressional office ",
    "Responsibilities": [
      "answering phones",
      "data entry"
    ],
    "Qualifications": null,
    "Salary_Min": null,
    "Salary_Max": null,
    "Skills_Mentioned": null,
    "Equal_Opportunity_Information": "Congresswomen Matsui's o&icial website https://matsui.house.gov/services/internships.",
    "Cleaned_Text": "",
    "DW_NOMINATE": null,
    "LES": null
  },
  {
    "Post_ID": "MEM-423-24",
    "Posting_Author": "The O\\'ice of Representative Donald Norcross (NJ-01)",
    "Congress_Number": null,
    "State_District": "NJ-01",
    "Location": "not specified",
    "Job_Function": null,
    "Title_Parsed": null,
    "Office_Type": null,
    "Responsibilities": [
      " assisting sta with legislative, administrative, constituent relations, scheduling, and communications activities"
    ],
    "Qualifications": [
      "organized, detail-oriented, professional. Strong written and oral communication skills are essential."
    ],
    "Salary_Min": null,
    "Salary_Max": null,
    "Skills_Mentioned": null,
    "Equal_Opportunity_Information": "The U.S. House of Representatives is an equal opportunity employer.",
    "Cleaned_Text": "the Spring 2025 Internship program",
    "DW_NOMINATE": null,
    "LES": null
  },
  {
    "Post_ID": "MEM-420-24",
    "Posting_Author": "Congresswoman Rosa L. DeLauro",
    "Congress_Number": 3,
    "State_District": "CT-03",
    "Location": "Washington, D.C.",
    "Job_Function": null,
    "Title_Parsed": null,
    "Office_Type": null,
    "Responsibilities": [
      "The o&ice of Congresswoman DeLauro runs an internship program...",
      "Interns are involved in all aspects of the o&ice including...",
      "providing general sta& support."
    ],
    "Qualifications": [
      "have an ability to work in a fast-paced environment",
      "possess excellent writing skills",
      "an enthusiastic attitude"
    ],
    "Salary_Min": null,
    "Salary_Max": null,
    "Skills_Mentioned": [
      "fast-paced environment",
      "writing skills",
      "enthusiastic attitude"
    ],
    "Equal_Opportunity_Information": "Applicants and employees shall not be discriminated against with respect to...",
    "Cleaned_Text": "",
    "DW_NOMINATE": null,
    "LES": null
  },
  {
    "Post_ID": "MEM-418-24",
    "Posting_Author": "Congressman Rob Menendez (NJ-08)",
    "Congress_Number": null,
    "State_District": "NJ-08",
    "Location": "Washington, D.C. o&ice",
    "Job_Function": "Intern",
    "Title_Parsed": "Interns for Spring 2024",
    "Office_Type": "Legislator's",
    "Responsibilities": [
      "Greeting guests and assisting with front o&ice operations",
      "Answering phones, recording constituent opinions, and correctly processing other inquiries",
      "Legislative work: attending hearing and brieﬁngs, writing memos, composing cosponsor recommendations, and drafting letters to be sent to constituents",
      "Organizing incoming mail",
      "Assisting with press clips and communications tasks"
    ],
    "Qualifications": [
      "organized and passionate undergraduate students, graduate students, or recent graduates with an interest in public service. They should be self-starters with excellent writing and organizational skills.",
      "New Jersey ties and those from backgrounds that are traditionally underrepresented in Congress."
    ],
    "Salary_Min": null,
    "Salary_Max": null,
    "Skills_Mentioned": [
      "writing",
      "organizational",
      "legislative"
    ],
    "Equal_Opportunity_Information": "An equal opportunity employer, does not discriminate on the basis of race, sex, color, age, religion, disability, national origin, military status, sexual orientation, or gender identity or expression.",
    "Cleaned_Text": "MEM-418-24 Congressman Rob Menendez (NJ-08) seeks interns for his Washington, D.C. o&ice for Spring 2024.\nIdeal candidates are organized and passionate undergraduate students, graduate students, or recent graduates with an interest in public service. They should be self-starters with excellent writing and organizational skills.\nOur o&ice is an equal opportunity employer, and we do not discriminate on the basis of race, sex, color, age, religion, disability, national origin, military status, sexual orientation,\nor gender identity or expression. Special consideration will be given to candidates with New Jersey ties and to those from backgrounds that are traditionally underrepresented in Congress.\nKey responsibilities of D.C. interns include:\n• Greeting guests and assisting with front o&ice operations\n• Answering phones, recording constituent opinions, and correctly processing other inquiries\n• Legislative work: attending hearing and brieﬁngs, writing memos, composing cosponsor recommendations, and drafting letters to be sent to constituents\n• Organizing incoming mail\n• Assisting with press clips and communications tasks\nApplications are processed on a rolling basis, and candidates are encouraged to apply as soon as possible. The internship will take place in-person from January to May. Preference will be given to those with availability of at least 20 hours per week, and a stipend will be provided.\nTo apply, please ûll out the application and submit a resume and cover letter through this link: menendez.house.gov/services/internships. Please indicate your availability in your cover letter and format the files [LastName_CoverLetter] and [LastName_Resume].",
    "DW_NOMINATE": null,
    "LES": null
  },
  {
    "Post_ID": "MEM-416-24",
    "Posting_Author": "Congresswoman Summer Lee",
    "Congress_Number": null,
    "State_District": "Pennsylvania's 12th Congressional District",
    "Location": "Washington, D.C. and District Office",
    "Job_Function": null,
    "Title_Parsed": "Congressional Internship",
    "Office_Type": "O&ice",
    "Responsibilities": [
      "Answering phones",
      "Leading Capitol tours (Washington, D.C.based)",
      "Researching legislation for the Member and legislative sta&",
      "Attending hearings and brieﬁngs",
      "Answering constituent letters on a variety of issues"
    ],
    "Qualifications": [
      "Team-oriented",
      "Strong written and verbal communication skills"
    ],
    "Salary_Min": null,
    "Salary_Max": null,
    "Skills_Mentioned": [],
    "Equal_Opportunity_Information": "",
    "Cleaned_Text": "The O&ice of Congresswoman Summer Lee is committed to investing in the next generation of public leaders and citizen activists. Congressional internships offer a comprehensive learning opportunity to understand better how congressional offices and the legislative process work. Both in the Washington, D.C., and District Office, the internship program is designed to be a learning experience in which students are exposed to various areas including constituent services, scheduling, office administration, press and communications, and legislative policy.\n\nTypical duties will include answering phones, leading Capitol tours (Washington, D.C.based), researching legislation for the Member and legislative staff &, attending hearings and briefings, and answering constituent letters on a variety of issues. The ideal candidate for this paid, part-time internship will be team-oriented and have strong written and verbal communication skills.\n\nStudents and recent graduates who are interested in the legislative process are highly encouraged to apply. The Congresswoman is on the Oversight and Accountability Committee and the Space, Science, and Technology Committee. Ties to Pennsylvania’s 12th Congressional District are preferred, but not necessary.\n\nAll applicants should apply by November 15, 2024,\nat: https://summerlee.house.gov/internships.",
    "DW_NOMINATE": null,
    "LES": null
  },
  {
    "Post_ID": "MEM-414-24",
    "Posting_Author": "Congresswoman Sydney Kamlager-Dove (CA-37)",
    "Congress_Number": null,
    "State_District": "CA-37",
    "Location": "Washington, D.C. and Los Angeles",
    "Job_Function": null,
    "Title_Parsed": "Internship",
    "Office_Type": null,
    "Responsibilities": [
      "Answer phones and assist in correspondence with constituents",
      "Greet constituents and office visitors",
      "Process tour requests and lead Capitol tours",
      "Handle mail",
      "Assist in processing casework",
      "Perform legislative research"
    ],
    "Qualifications": [
      "Interest in the legislative process and civic service",
      "Excellent writing, research, organization, time management, and communication skills"
    ],
    "Salary_Min": null,
    "Salary_Max": null,
    "Skills_Mentioned": null,
    "Equal_Opportunity_Information": "O&ice values open communication, hard work, and creating a collegial environment.",
    "Cleaned_Text": "The O&ice of Congresswoman Sydney Kamlager-Dove (CA-37) is seeking interns...",
    "DW_NOMINATE": -0.5479999780654907,
    "LES": 0.4336842596530914
  },
  {
    "Post_ID": "MEM-407-24",
    "Posting_Author": "Congressman Shri Thanedar",
    "Congress_Number": null,
    "State_District": "MI-13",
    "Location": "The Washington, D.C. Office of Congressman Shri Thanedar (MI-13)",
    "Job_Function": null,
    "Title_Parsed": "Spring DC Fellowship",
    "Office_Type": "Congressman's Office",
    "Responsibilities": [
      "Performing Research (CRS, the Library of Congress, MIN, or other available resources)"
    ],
    "Qualifications": [
      "an eagerness to learn",
      "research skills",
      "strong writing skills"
    ],
    "Salary_Min": null,
    "Salary_Max": null,
    "Skills_Mentioned": [
      "legislative experience",
      "research skills",
      "writing skills"
    ],
    "Equal_Opportunity_Information": "This office is an Equal Opportunity Employment Office and does not discriminate on the basis of race, color, religion, sex, gender identity, sexual orientation, or age.",
    "Cleaned_Text": "Other duties will be based on the fellow's interests.\n\nWe are looking for candidates with an eagerness to learn, research skills, and strong writing skills. Start and end dates are flexible. MI-13 ties and research experience are pluses. Must be in a program that sponsors your fellowship.",
    "DW_NOMINATE": -0.3580000102519989,
    "LES": 0.3025133609771729
  },
  {
    "Post_ID": "MEM-406-24",
    "Posting_Author": "Congressman Shri Thanedar",
    "Congress_Number": null,
    "State_District": "MI-13",
    "Location": "The Washington, D.C. Office of Congressman Shri Thanedar (MI-13)",
    "Job_Function": "press and legislative internships",
    "Title_Parsed": "Spring DC Internship",
    "Office_Type": null,
    "Responsibilities": [
      "Answering phone calls",
      "Greeting office visitors",
      "Drafting constituent correspondence",
      "Coordinating tour requests and leading tours of the Capitol",
      "Attending congressional briefings, hearings and other professional development events",
      "Drafting press releases to be posted on the website and social media accounts",
      "Researching legislation and writing cosponsor memos for the legislative team",
      "Assisting operations, communications, and legislative staffers with various tasks"
    ],
    "Qualifications": [
      "eagerness to learn",
      "customer service skills",
      "strong writing skills"
    ],
    "Salary_Min": null,
    "Salary_Max": null,
    "Skills_Mentioned": null,
    "Equal_Opportunity_Information": "This office is an Equal Opportunity Employment Office and does not discriminate on the basis of race, color, religion, sex, gender identity, sexual orientation, or age.",
    "Cleaned_Text": "",
    "DW_NOMINATE": -0.3580000102519989,
    "LES": 0.3025133609771729
  },
  {
    "Post_ID": "MEM-396-24",
    "Posting_Author": "Congressman Kevin Hern (OK-01)",
    "Congress_Number": null,
    "State_District": "Oklahoma's 1st Congressional District",
    "Location": "Washington, D.C.",
    "Job_Function": null,
    "Title_Parsed": "Internship",
    "Office_Type": null,
    "Responsibilities": [
      "answering constituent phone calls",
      "taking notes at briefings and hearings",
      "conducting tours of the Capitol",
      "drafting correspondence letters",
      "assembling press and news clips",
      "assisting staff with other research and administrative duties"
    ],
    "Qualifications": [
      "strong interest in public policy",
      "demonstrated responsibility",
      "respectable personal conduct",
      "committed to serving constituents with utmost diligence"
    ],
    "Salary_Min": null,
    "Salary_Max": null,
    "Skills_Mentioned": [
      "public policy",
      "research"
    ],
    "Equal_Opportunity_Information": "We are an Equal Opportunity Employer.",
    "Cleaned_Text": "",
    "DW_NOMINATE": null,
    "LES": null
  },
  {
    "Post_ID": "MEM-393-24",
    "Posting_Author": "Congresswoman Kim Schrier (WA-08)",
    "Congress_Number": null,
    "State_District": "WA-08",
    "Location": "Issaquah and Washington, D.C.",
    "Job_Function": "Miscellaneous",
    "Title_Parsed": "Washington’s 8th Congressional District Internships for Spring 2025",
    "Office_Type": "Congessional Office",
    "Responsibilities": [
      "greeting constituents",
      "answering constituent phone calls",
      "supporting sta& with administrative tasks",
      "conducing legislative research",
      "assisting with constituent correspondence",
      "other miscellaneous tasks as assigned"
    ],
    "Qualifications": [
      "exceptional written and oral communication skills",
      "a high degree of professionalism",
      "strong interest in public service",
      "ability to multi-task and work with a team",
      "Washington state ties are a plus, but not required"
    ],
    "Salary_Min": null,
    "Salary_Max": null,
    "Skills_Mentioned": null,
    "Equal_Opportunity_Information": "Congresswoman Schrier's office is an equal opportunity employer.",
    "Cleaned_Text": "The O&ice of Congresswoman Kim Schrier (WA-08) is seeking interns in its Issaquah and Washington, D.C. o&ices for spring 2025.\nApplicants should be eager to learn more about the legislative process and want to be part\nof a hardworking team dedicated to serving Washington’s 8th Congressional District.\nInterns will work in a fast-paced Congressional o&ice, gaining valuable experience and\nknowledge of the United States Congress.\nIn Washington, D.C., intern responsibilities will include greeting constituents, answering\nconstituent phone calls, supporting sta& with administrative tasks, conducting legislative\nresearch, assisting with constituent correspondence, and other miscellaneous tasks as\nassigned. Interns in Washington, D.C. also have the opportunity to lead tours of the U.S.\nCapitol, as well as attend brieﬁngs for the legislative sta&.\nIn the District o&ice, interns will assist with a variety of tasks, including day-to-day o&ice\nwk such as answering phones, writing letters, and assisting with media clips. District\no&ice interns may also help with constituent casework or other District-based projects of\nimportance.\nQualiﬁcations\nIdeal candidates will possess exceptional written and oral communication skills, a high\ndegree of professionalism, and a strong interest in public service. In addition, the ability to\ntrio-task and work with a team are a plus. Washington state ties are a plus, but not\nerquired.\nStarting and ending dates are ﬂexible, although prospective interns should be able to\ncomeit at least 20 hours per week during business hours.\nCongressional internships are open to all majors and designed for undergraduate and\ngraduate students, as well as recent graduates with an interest in public service. Stipends or academic credit are available.",
    "DW_NOMINATE": null,
    "LES": null
  }
]