[
  {
    "Post_ID": "MEM-512-24",
    "Posting_Author": "The O5ice of Congresswoman Sara Jacobs (CA-51)",
    "Congress_Number": null,
    "State_District": "CA-51",
    "Location": "Washington, D.C.",
    "Job_Function": "Executive Assistant/Scheduler",
    "Title_Parsed": "Executive Assistant/Scheduler",
    "Office_Type": "Washington, D.C. office of Congresswoman Sara Jacobs",
    "Responsibilities": [
      "Driving and standing the Congresswoman while she is in Washington, D.C",
      "Overseeing the member’s daily and long-term schedule, in coordination with the Deputy Chief of Staff and the district-based Executive Assistant/Scheduler",
      "Compiling the daily briefing book and ensuring the member is prepared ahead of engagements",
      "Managing member travel, logistics, and records",
      "Liaising between all staff and the member to effectively communicate needs",
      "Assisting the Deputy Chief of Staff with office operations, events, and project management, as needed",
      "Maintaining setup and presentation of the Member Office and upkeep of official vehicle",
      "Aiding in front office management during non-session weeks"
    ],
    "Qualifications": [
      "Good judgment",
      "An eye for detail",
      "Ability to work in a fast-paced, collaborative environment",
      "Anticipate the needs of the Congresswoman",
      "Problem-solve on their feet",
      "Advance, sales, or service industry skills (preferred)",
      "Valid driver’s license and good driving record (required)"
    ],
    "Salary_Min": null,
    "Salary_Max": null,
    "Skills_Mentioned": [
      "Driver’s licenses"
    ],
    "Equal_Opportunity_Information": "Our office is an equal opportunity employer",
    "Cleaned_Text": "",
    "DW_NOMINATE": -0.3950000107288361,
    "LES": 0.3077055811882019
  },
  {
    "Post_ID": "MEM-510-24",
    "Posting_Author": "Congresswoman Angie Craig",
    "Congress_Number": 102,
    "State_District": "MN-02",
    "Location": "Washington, DC office",
    "Job_Function": "Communications Director",
    "Title_Parsed": null,
    "Office_Type": null,
    "Responsibilities": [
      "Managing communications portfolio",
      "Oversight of comms team",
      "Earned media strategy",
      "Digital media presence",
      "Franked communications program"
    ],
    "Qualifications": [
      "Several years of demonstration experience",
      "Working with reporters",
      "Strategic thinker and dynamic writer",
      "Strong interpersonal skills",
      "Solid political instincts",
      "Good sense of humor",
      "Attention to detail"
    ],
    "Salary_Min": 85000,
    "Salary_Max": 95000,
    "Skills_Mentioned": null,
    "Equal_Opportunity_Information": "Not an equal opportunity employer for this position",
    "Cleaned_Text": "MEM-510-24\nCOMMUNICATIONS DIRECTOR\nCongresswoman Angie Craig (MN-02) is in search of a highly-motivated Communications Director in her Washington, DC office.\nThis position reports to the Chief of Staff.\nThe Communications Director will manage all aspects of the Congresswoman’s communications portfolio – including her earned media strategy, digital media presence,\nand robust franked communications program – and will oversee a comms team that spans both the DC and District offices.\n\nThe ideal candidate should have several years of demonstrated communications experience – including experience working with reporters. The candidate should be a strategic thinker and dynamic writer with strong interpersonal skills, solid political instincts, a good sense of humor, and a keen attention to detail.\n\nThe position is full time with federal benefits, including student loan repayment program (if eligible), transit or parking benefits, and an annual salary of between $85,000 and $95,000 commensurate with experience.\n\nThis position is part of the Congresswoman’s senior staff – this is not an entry level position.\n\nTo Apply:\nAll interested candidates are encouraged to submit a resume and two writing samples to repcraigresumebank@gmail.com with the subject line “Communications Director – [applicant’s full name].”\nOur office is an equal opportunity employer and does not discriminate on the basis of race, color, religion, sex (including marital or parental status), national origin, age, disability, gender identity, or sexual orientation. Our office encourages candidates of diverse backgrounds to apply.\n    ---",
    "DW_NOMINATE": null,
    "LES": null
  },
  {
    "Post_ID": "MEM-511-24",
    "Posting_Author": null,
    "Congress_Number": null,
    "State_District": null,
    "Location": "Washington, DC",
    "Job_Function": "Research Assistant",
    "Title_Parsed": null,
    "Office_Type": null,
    "Responsibilities": [
      "Provide administrative assistance including answering the phone and responding to phone and email inquiries, reviewing incoming correspondence and documents,",
      "Assisting with oversight including organizing and participating in meetings, drafting memos, reading documents, summarizing documents and meetings orally and in writing,",
      "Conducting research to support oversight and legislative activities by searching for and compiling documents and information.",
      "Assisting with legislation in a limited capacity including reading and tracking pending and enacted legislation.",
      "Representing the Committee in a limited capacity including meeting with other congressional staff, veteran service organizations, and external stakeholders.",
      "Perform other duties as assigned by the Subcommittee Sta5 Director, Committee Sta5 Director, or Committee Deputy Sta5 Director."
    ],
    "Qualifications": [
      "Undergraduate degree",
      "Veterans are strongly encouraged to apply",
      "Graduate-level writing skills",
      "Excellent oral communication skills",
      "Thoroughness and attention to detail",
      "Problem solving skills",
      "Ability to work long hours, under pressure, while remaining cooperative and courteous",
      "Work independently as well as in teams"
    ],
    "Salary_Min": null,
    "Salary_Max": null,
    "Skills_Mentioned": [
      "Research"
    ],
    "Equal_Opportunity_Information": null,
    "Cleaned_Text": "",
    "DW_NOMINATE": null,
    "LES": null
  },
  {
    "Post_ID": "MEM-504-24",
    "Posting_Author": "House Committee on Veterans’ A5airs, Subcommittee on Technology Modernization",
    "Congress_Number": null,
    "State_District": null,
    "Location": "Washington, DC",
    "Job_Function": "Legislative Assistant",
    "Title_Parsed": "Legislative Assistant",
    "Office_Type": null,
    "Responsibilities": [
      "Under the supervision of the Subcommittee Sta5 Director, conduct oversight of the Department of Veterans A5airs (VA) enterprise technology programs and projects as well as its information technology operations.",
      "Organizing and participating in meetings, preparing for subcommittee hearings, drafting memos, reading documents, summarizing documents and meetings orally and in writing, limited domestic travel, and other oversight duties as assigned.",
      "Collect technical information and translate it into brieﬁngs, memoranda, hearing materials, and policy recommendations for a general audience.",
      "Assisting with legislation in a limited capacity including drafting bills as well as reading and tracking pending and enacted legislation.",
      "Representing the Committee in a limited capacity including meeting with other congressional sta5, veteran service organizations, technical organizations, and external stakeholders.",
      "Perform other duties as assigned by the Subcommittee Sta5 Director, Committee Sta5 Director, and Committee Deputy Sta5 Director."
    ],
    "Qualifications": [
      "Undergraduate degree",
      "At least three years of relevant work experience, prior congressional or federal agency experience is preferred but not required",
      "Some level of subject matter expertise in information technology and federal agency administrative or management issues",
      "Veterans are strongly encouraged to apply",
      "Excellent writing, editing, and proofreading skills",
      "Excellent oral communication skills",
      "Thoroughness and attention to detail",
      "Discretion and sound judgment in formulating and recommending policy positions",
      "Knowledge of current issues and events relevant to the Committee and VA",
      "Ability to work long hours, under pressure, while remaining cooperative and courteous",
      "Work independently as well as in teams"
    ],
    "Salary_Min": null,
    "Salary_Max": null,
    "Skills_Mentioned": [
      "information technology",
      "federal agency administrative or management issues"
    ],
    "Equal_Opportunity_Information": "The U.S. House of Representatives is an equal opportunity employer. All applicants will be considered without regard to race, color, national origin, religion, sex (including marital or parental status), disability, or age.",
    "Cleaned_Text": "",
    "DW_NOMINATE": null,
    "LES": null
  },
  {
    "Post_ID": "MEM-503-24",
    "Posting_Author": null,
    "Congress_Number": null,
    "State_District": null,
    "Location": null,
    "Job_Function": null,
    "Title_Parsed": null,
    "Office_Type": null,
    "Responsibilities": [],
    "Qualifications": [
      "Excellent writing, verbal and organizational skills are essential along with the ability to be a self-starter while working in a fast paced environment.",
      "Experience with healthcare policy is required."
    ],
    "Salary_Min": null,
    "Salary_Max": null,
    "Skills_Mentioned": [],
    "Equal_Opportunity_Information": "This oﬁce is an equal opportunity employer; we do not discriminate on the basis of race, color, religion, sex, national origin, age, disability, military status, gender identity and expression, marital status, parental status, or sexual orientation.",
    "Cleaned_Text": "LEGISLATIVE ASSISTANT– Congresswoman Emilia Sykes (OH-13) is seeking an experienced and enthusiastic Legislative Assistant to manage healthcare and other issues as assigned. Ideal candidates will have 2+ years of Hill experience, a good understanding of House procedures, an understanding of developing and tracking legislative initiatives, and political awareness. Experience with healthcare policy is required. This is not an entry level position.\n\nExcellent writing, verbal and organizational skills are essential along with the ability to be a self-starter while working in a fast paced environment. Job responsibilities will include meeting with constituent groups and stakeholders, preparing and sta5ing the\nCongresswoman, drafting legislation, advancing the Congresswoman’s legislative agenda, providing vote recommendations, drafting legislative memos and brieﬁng materials, and reviewing constituent correspondence, in addition to other duties as assigned.\n\nQualiﬁed candidates should submit a resume and two writing samples\n\\\\\\ftable { \\\n  ",
    "DW_NOMINATE": null,
    "LES": null
  },
  {
    "Post_ID": "MEM-502-24",
    "Posting_Author": "Congressman Steven Horsford (NV-04)",
    "Congress_Number": null,
    "State_District": "NV-04",
    "Location": "Washington D.C.",
    "Job_Function": "Communications Director",
    "Title_Parsed": "Communications Director",
    "Office_Type": "Member's office",
    "Responsibilities": [
      "maintaining relationships with both national and local reporters",
      "organizing and replying to inquiries",
      "proactively pitching stories",
      "drafting and editing press releases",
      "developing media strategies to roll out legislative wins",
      "spearheading communications components of district outreach and events",
      "overseeing an aggressive and responsive social media program",
      "creating targeted audience messaging and media strategies",
      "writing op-eds, talking points, newsletters, mailers, letters, and speeches",
      "managing and coaching the communications team",
      "working collaboratively with District O5ice and legislative sta5 to amplify the o5ice's work",
      "overseeing franked communications and a robust 499 program"
    ],
    "Qualifications": [
      "minimum of 5-7 years of political communications experience",
      "strong history of drafting all forms of communications materials",
      "experience managing a team",
      "track record of successfully pitching national and local media outlets",
      "collaborative, creative, detail-oriented, able to multitask, politically astute"
    ],
    "Salary_Min": null,
    "Salary_Max": null,
    "Skills_Mentioned": [
      "management",
      "team leading",
      "media relations",
      "communications strategy"
    ],
    "Equal_Opportunity_Information": "The O5ice of Congressman Horsford is an equal opportunity employer and encourages applicants from all backgrounds to apply.",
    "Cleaned_Text": "Congressman Steven Horsford (NV-04) seeks an experienced Communications Director\nto lead and execute an aggressive and strategic integrated communications strategy. In close collaboration with the Member, Chief of Sta5, and legislative and district teams, the Communications Director will oversee the Member’s communications agenda and manage a fast-paced communications team. This position reports to the Chief of Sta5 and is not an entry level position.\nResponsibilities include maintaining relationships with both national and local reporters,\norganizing and replying to inquiries, and proactively pitching stories; drafting and editing press releases; developing media strategies to roll out legislative wins creating relatable content for constituents from complex policy; spearheading communications components of district outreach and events; overseeing an aggressive and responsive social media program; creating targeted audience messaging and media strategies; writing op-eds,\ntalking points, newsletters, mailers, letters, and speeches; managing and coaching the communications team; and working collaboratively with District O5ice and legislative sta5 to amplify the o5ice’s work. The Communications Director will also oversee franked communications and a robust 499 program.\nCandidates should have a minimum of 5-7 years of political communications experience, a\nstrong history of drafting all forms of communications materials, sharp attention to detail,\nexperience managing a team, and a track record of successfully pitching national and local\nmedia outlets. The ideal candidate is collaborative, creative, detail-oriented, able to multitask,\npolitically astute, and willing to work long hours in a fast-paced and demanding setting.\nNevada ties are a plus. Prior Hill experience is preferred.\nPlease submit a resume, cover letter, and any relevant examples of digital content you have\ncreated (links to social media accounts, video work, written content, etc.) to Yvanna\nCancela at Yvanna.Cancela@mail.house.gov.\nApplications will be reviewed on a rolling basis until the position is \nfilled. The position will be lled quickly,\nsplease apply soon if interested.",
    "DW_NOMINATE": null,
    "LES": null
  },
  {
    "Post_ID": "MEM-501-24",
    "Posting_Author": "House GOP Member Seeks National Security Advisor",
    "Congress_Number": null,
    "State_District": null,
    "Location": "CORE RESPONSIBILITIES:1. to develop and plan legislative initiatives related to a national security, cyber security, foreign a5airs, and armed services portfolio.2. to monitor legislative developments within Committees and on the House floor;3. to meet with constituents and advocacy groups on behalf of the Member.",
    "Job_Function": null,
    "Title_Parsed": "National Security Advisor",
    "Office_Type": "Legislative",
    "Responsibilities": [
      "1. to develop and plan legislative initiatives related to a national security, cyber security, foreign a5airs, and armed services portfolio.",
      "2. to monitor legislative developments within Committees and on the House floor;",
      "3. to meet with constituents and advocacy groups on behalf of the Member."
    ],
    "Qualifications": [
      "at least 1 year of legislative experience in a full-time, paid position or legislative fellowship\",\"excellent oral and written communication skills\n\",\"thorough knowledge of the legislative process\"\",",
      ".",
      "ability to work cooperatively and courteously with others.",
      "ability to work well under pressure.",
      "thoroughness and careful attention to detail"
    ],
    "Salary_Min": null,
    "Salary_Max": null,
    "Skills_Mentioned": [
      "National Security",
      "Cybersecurity",
      "Foreign Affairs",
      "Legislative Experience",
      "Communication Skills",
      "Thorough Knowledge of Legislative Process"
    ],
    "Equal_Opportunity_Information": null,
    "Cleaned_Text": "House GOP Member Seeks National Security Advisor To apply, please send resumes to housegopemployment@gmail.com with position noted in subject line.",
    "DW_NOMINATE": null,
    "LES": null
  },
  {
    "Post_ID": "MEM-500-24",
    "Posting_Author": "Republican Office Staff",
    "Congress_Number": null,
    "State_District": "DC",
    "Location": "Washington, DC",
    "Job_Function": "Legislative Assistant",
    "Title_Parsed": "Legislative Assistant, U.S. House Committee on Veterans’ ASairs, Republican",
    "Office_Type": "Subcommittee",
    "Responsibilities": [
      "Conduct oversight of Subcommittee issue areas, including Department implementation of laws, regulations, and programs",
      "Review evidence and data to analyze, develop, and provide detailed written and oral reports of findings",
      "Assist the Subcommittee Director in advising the Full Committee leadership and Subcommittee leadership on legislative initiatives",
      "Draft hearing, markup, and floor statements for the Full Committee leadership and Subcommittee leadership"
    ],
    "Qualifications": [
      "Bachelor of Arts or Science",
      "Knowledge of the legislative drafting process",
      "Excellent writing, editing, and proofreading skills",
      "Ability to exercise discretion and independent judgment in policy positions"
    ],
    "Salary_Min": null,
    "Salary_Max": null,
    "Skills_Mentioned": [
      "Knowledge of current issues and events",
      "Strong research skills"
    ],
    "Equal_Opportunity_Information": "U.S. House of Representatives employment is at-will. The U.S. House of Representatives is an equal opportunity employer.",
    "Cleaned_Text": "MEM-500-24 Title: Legislative Assistant, U.S. House Committee on Veterans ASairs, Republican StaS REPORTS TO: StaS Director, Subcommittee on Oversight and Investigations Core Responsibilities Conduct oversight of Subcommittee issue areas, including Department implementation of laws, regulations, and programs Review evidence and data to analyze, develop, and provide detailed written and oral reports of findings Assist the Subcommittee Sta5 Director in advising the Full Committee leadership and Subcommittee leadership on legislative initiatives Draft hearing, markup, and floor statements for the Full Committee leadership and Subcommittee leadership \\ Draft trip reports, requests to agencies for information, letters to agencies, hearing recaps, and other work product relevant to the Subcommittee''s jurisdiction Assist in determining Full Committee and Subcommittee hearing topics and preparing for hearings Coordinate with Member o5ice sta5 on logistics, including Subcommittee Member attendance for Subcommittee activities Meet with congressional sta5 and internal/external organizations on the Subcommittee''s behalf Analyze current law and proposed legislation; assist with drafting legislation; and draft policy memoranda as assigned Assist with developing policy recommendations and serve as a resource for Members both on and o5 Committee Organize and maintain Subcommittee electronic records Engage with whistleblowers Travel and conduct oversight visits at agency facilities Perform other duties as assigned by the Subcomittee Sta5 Director, Full Committee Deputy Sta5 Director, and Full Committee Sta5 Director \\ This is a full-time, onsite, position in Washington, DC Minimum Qualiﬁcations Bachelor of Arts or Science Required Skills Knowledge of the legislative drafting process Excellent writing, editing, and proofreading skills Excellent oral communications skills Thoroughness and careful attention to detail Strong Microsoft Office proficiency, including expertise in Word and ability to use \\ Excel Demonstrate the ability to exercise discretion and independent judgment in policy positions Knowledge of current issues and events in which the Full Committee leadership is involved Ability to work long hours under pressure and be cooperative and courteous with others Ability to manage fluctuating workloads \\ Strong research skills Potential to work independently Beneﬁts Employees may be eligible for the following beneﬁts: Sick and annual leave \\ Metro beneﬁts or parking Student Loan Repayment Program \\ Federal Employee Health Beneﬁts Program Thrift Savings Plan \\ Federal Employees’ Group Life Insurance Program \\ Flexible Spending Accounts \\ FSAFEDS Dental · Vision Insurance Program \\ (FEDVIP) Other Information U.S. House of Representatives employment is at-will. The U.S. House of Representatives is an equal opportunity employer. All applicants will be considered without regard to race, color, national origin, religion, sex \\ including marital or parental status, disability, or age. Applicants must pay for all transportation and all related travel expenses associated with the interview and hiring process. How to Apply Interested candidates should send their cover letter, resume, and writing sample to VAR.Resumes.Mail.house.gov with “O´'I Republican Legislative Assistant” in the subject line.\nWhat to Expect Your resume and cover letter will be reviewed to determine if you are among the top \\ candidates. If you are one of the top candidates, you will be contacted for an interview.",
    "DW_NOMINATE": null,
    "LES": null
  },
  {
    "Post_ID": "MEM-498-24",
    "Posting_Author": "n/a",
    "Congress_Number": null,
    "State_District": null,
    "Location": null,
    "Job_Function": null,
    "Title_Parsed": "Legislative Assistant to the Subcommittee on Disability Assistance and Memorial Affairs",
    "Office_Type": null,
    "Responsibilities": [
      "Maintain Subcommittee archives of activities, including identifying and tracking pending legislation.",
      "Travel and conduct oversight visits at agency locations.",
      "Draft trip reports, requests to agencies for information (including tracking deadlines), hearing recaps, and other work product relevant to the Subcommittee’s jurisdiction.",
      "Subcommittee casework as assigned.",
      "Answer telephone and respond to caller inquiries.",
      "Keep abreast of emails, including Member inquiries and agency notiﬁcations, and schedule meetings with parties as appropriate.",
      "Organize and maintain Subcommittee electronic records, including meeting notes, agency reports, other documents.",
      "Analyze current law and proposed legislation; assist with the drafting of legislation within the Majority agenda as assigned; participate in sta5-level discussions with knowledge of background information on legislation being considered; draft policy memoranda as assigned.",
      "Assist with due diligence being performed as part of the Subcommittee’s oversight duties, including requesting information from agencies on matters within the Subcommittee jurisdiction.",
      "Assist with hearing preparation and coordination of hearings, including developing recommendations of hearing topics, brieﬁng of Subcommittee Members, drafting memoranda and remarks for Chairman, and development of questions.",
      "Coordinate with Member o5ice sta5 on logistics, including Subcommittee Member attendance, for Subcommittee activities, including hearings.",
      "Attend meetings with agencies, veteran service organizations, and other parties, and maintain notes on such meetings.",
      "Draft memoranda for the full Committee and Subcommittee Chairman on matters within the jurisdiction of the Subcommittee.",
      "Review the Congressional Record, Federal Register, House Calendar, and other publications for matters of interest to Subcommittee Members and sta5.",
      "Assist with developing policy recommendations and serve as a resource for Members both on and o5 Committee.",
      "Responsible for all other duties assigned by the full Committee Chairman, Subcommittee Chairman, full Committee Sta5 Director or Deputy Sta5 Director, and Subcommittee Sta5 Director, and assisting other Committee sta5, as needed."
    ],
    "Qualifications": [
      "Bachelor of Arts or Science",
      "Strong writing and editing skills, including for work product of di5erent types with di5erent audiences.",
      "Strong Microsoft O5ice proﬁciency, including expertise in Word and the ability to use Excel.",
      "Strong organizational skills.",
      "S-trong verbal communication, including with di5erent audiences.",
      "Excellent attention to detail.",
      "Excellent listening skills.",
      "Strong ability to manage ﬂuctuating workloads and juggle and prioritize tasks, including managing short-, medium-, and long-term tasks.",
      "Team oriented.",
      "Excellent ability to work well under pressure and time constraints.",
      "Strong research skills. Legal research skills (e.g., LexisNexis) is a plus.",
      "Problem solving and analytical skills are a plus."
    ],
    "Salary_Min": null,
    "Salary_Max": null,
    "Skills_Mentioned": [
      "Strong writing and editing skills",
      "Microsoft O5ice proficiency",
      "Organizational skills",
      "Verbal communication",
      "Attention to detail",
      "Listening skills",
      "Workload management",
      "Teamwork",
      "Pressure and time management",
      "Research skills",
      "Legal research skills"
    ],
    "Equal_Opportunity_Information": null,
    "Cleaned_Text": "<html>...</html>",
    "DW_NOMINATE": null,
    "LES": null
  },
  {
    "Post_ID": "MEM-497-24",
    "Posting_Author": "n/a",
    "Congress_Number": null,
    "State_District": "Illinois' 6th Congressional District",
    "Location": "Washington, D.C.",
    "Job_Function": null,
    "Title_Parsed": "Scheduler",
    "Office_Type": "Member’s o5ice",
    "Responsibilities": [
      "Maintaining the Member’s day-to-day schedule, sharing appropriate event details..."
    ],
    "Qualifications": [
      "Strong organizational skills and attention to detail..."
    ],
    "Salary_Min": null,
    "Salary_Max": null,
    "Skills_Mentioned": [
      "Multitasking in a very fastpaced environment",
      "Relevant experience"
    ],
    "Equal_Opportunity_Information": "None specified",
    "Cleaned_Text": "MEM-497-24 Midwest Republican seeks a Scheduler...",
    "DW_NOMINATE": null,
    "LES": null
  },
  {
    "Post_ID": "MEM-495-24",
    "Posting_Author": "Representative-elect Eugene Vindman (VA-07)",
    "Congress_Number": null,
    "State_District": "Virginia's Seventh Congressional District",
    "Location": "Washington, DC office and Virginia's Seventh Congressional District",
    "Job_Function": "Scheduler",
    "Title_Parsed": "Scheduler",
    "Office_Type": "e5lite",
    "Responsibilities": [
      "managing the Representative’s daily and long-term schedule; keeping track of and responding to invi­ta­tions and meeting requests; working with the District, Communications, and Legislative teams to prioritize among competing events and to proactively schedule and build out events in the district and in Washington, DC"
    ],
    "Qualifications": [
      "exceptional attention to detail",
      "excellent customer service skills",
      "high level of responsiveness",
      "excellent communication skills",
      "ability to work outside of normal business hours (particularly when Congress is in session)",
      "ability to juggle competing priorities in a fast-paced environment"
    ],
    "Salary_Min": null,
    "Salary_Max": null,
    "Skills_Mentioned": [
      "managing the Representative’s daily and long-term schedule; keeping track of and responding to invi­ta­tions and meeting requests; working with the District, Communications, and Legislative teams to prioritize among competing events and to proactively schedule and build out events in the district and in Washington, DC"
    ],
    "Equal_Opportunity_Information": "e5lite",
    "Cleaned_Text": "Scheduler\n\nRepresentative-elect Eugene Vindman (VA-07) seeks a Scheduler to manage his schedule\nin both Washington, DC and Virginia’s Seventh Congressional District. The position will be\nbased in his Washington, DC office.\nThe Scheduler will be responsible for managing the Representative’s daily and long-term schedule;\nkeeping track of and responding to invi­ta­tions and meeting requests; working with the District, Communications,\nand Legislative teams to prioritize among competing events and to proactively schedule and\nbuild out events in the district and in Washington, DC; compiling brie­ﬁng materials;\nmanaging logistics and travel for the Representative; and assisting with office operations and administration.\nThe position requires exceptional attention to detail, excellent customer service skills, a high level of responsiveness,\nexcellent communication skills, the ability to work outside of normal business hours (particularly when Congress is in session),\nand the ability to juggle competing priorities in a fast-paced environment. Note: for more experienced candidates, this could become a Director of Operations role that would cover scheduling as well as additional responsibilities.\n\nTo apply, please send a cover letter, resume, two writing samples, and contact information for three references to vindmanjobsva@gmail.com with the subject line “Scheduler – [Your Name].”\n\nThe oﬁce is an equal-opportunity employer and does not discriminate on the basis of race,\ncolor, religion, sex, sexual orientation, gender identity and expression, national origin,\ndisability, military status, age, marital status, or parental status. Qualiﬁed people of color and people from underrepresented groups are strongly encouraged to apply.",
    "DW_NOMINATE": null,
    "LES": null
  },
  {
    "Post_ID": "MEM-494-24",
    "Posting_Author": "Representative-elect Eugene Vindman (VA-07)",
    "Congress_Number": null,
    "State_District": "Virginia's Seventh District",
    "Location": "Prince William County district office",
    "Job_Function": "District Director",
    "Title_Parsed": "District Director",
    "Office_Type": "Equal opportunity employer",
    "Responsibilities": [
      "managing constituent services and district outreach operation",
      "hiring, training, and managing the district team",
      "ensuring constituent casework is done efficiently and effectively",
      "developing and executing an outreach strategy",
      "planning district events for the Representative during district work periods",
      "developing and maintaining relationships with local government officials, businesses, nonproﬁts, and other stakeholders",
      "opening additional district offices as necessary",
      "maintaining strong channels of communication with the DC office"
    ],
    "Qualifications": [
      "exceptional customer service skills",
      "strong management skills",
      "attention to detail",
      "proactivity",
      "longterm planning",
      "ability to work outside of normal business hours to attend community events",
      "in-depth understanding of various communities in Virginias’s Seventh District"
    ],
    "Salary_Min": null,
    "Salary_Max": null,
    "Skills_Mentioned": [
      "customer service skills",
      "management skills",
      "attention to detail",
      "proactivity",
      "longterm planning",
      "ability to work outside of normal business hours",
      "community engagement"
    ],
    "Equal_Opportunity_Information": "an equal-opportunity employer that does not discriminate on the basis of race, color, religion, sex, sexual orientation, gender identity and expression, national origin, disability, military status, age, marital status, or parental status. Qualified people of color and people from underrepresented groups are strongly encouraged to apply.",
    "Cleaned_Text": "",
    "DW_NOMINATE": null,
    "LES": null
  },
  {
    "Post_ID": "MEM-492-24",
    "Posting_Author": "Representative-elect Eugene Vindman",
    "Congress_Number": null,
    "State_District": "VA-07",
    "Location": "Washington, DC",
    "Job_Function": "Legislative Director",
    "Title_Parsed": "Legislative Director",
    "Office_Type": "House office",
    "Responsibilities": [
      "training and managing the legislative team",
      "providing vote recommendations",
      "supervising committee work",
      "tracking legislative accomplishments",
      "introducing original legislation",
      "meeting with constituent groups",
      "recommending legislation to cosponsor",
      "developing and executing on a long-term legislative agenda"
    ],
    "Qualifications": [
      "several years of experience working on Capitol Hill",
      "an understanding of how to get things done on Capitol Hill",
      "deep policy expertise",
      "strong management skills",
      "excellent writing and communication skills"
    ],
    "Salary_Min": null,
    "Salary_Max": null,
    "Skills_Mentioned": [
      "Virginia ties (a plus)",
      "experience working on Capitol Hill",
      "policy expertise",
      "management skills",
      "writing and communication skills"
    ],
    "Equal_Opportunity_Information": "The o5ice is an equal-opportunity employer and does not discriminate on the basis of race, color, religion, sex, sexual orientation, gender identity and expression, national origin, disability, military status, age, marital status, or parental status. Qualified people of color and people from underrepresented groups are strongly encouraged to apply.",
    "Cleaned_Text": "",
    "DW_NOMINATE": null,
    "LES": null
  },
  {
    "Post_ID": "MEM-484-24",
    "Posting_Author": "Congressman Gabe Amo (RI-01)",
    "Congress_Number": null,
    "State_District": "RI-01",
    "Location": "Rhode Island.",
    "Job_Function": "Caseworker",
    "Title_Parsed": "null",
    "Office_Type": "District office",
    "Responsibilities": [
      "Liason to other government entities on behalf of the Congressman to serve constituents",
      "Exercise discretion and judgment in resolving casework",
      "Maintain accurate and complete ÷iles on all assigned casework matters",
      "Manage competing tasks and projects",
      "Respond to constituent request for information"
    ],
    "Qualifications": [
      "Exceptional written and verbal communication skills",
      "Organized",
      "Pay attention to detail",
      "Strong ability to exercise discretion and judgment in resolving casework",
      "Experience working in a fast-paced office (desired)"
    ],
    "Salary_Min": null,
    "Salary_Max": null,
    "Skills_Mentioned": [
      "Liason skills",
      "Discretion and judgment in resolving casework",
      "Organizational management",
      "Time management",
      "Communication skills"
    ],
    "Equal_Opportunity_Information": "The o5ice does not discriminate on the basis of race, color, religion, sex (including marital or parental status, sexual orientation, and gender identity), disability, age, or national origin.",
    "Cleaned_Text": "Casework or other relevant experience is strongly preferred. This is not an entry-level position. Rhode Island ties are a plus. Candidates of diverse backgrounds are encouraged to apply.",
    "DW_NOMINATE": null,
    "LES": null
  },
  {
    "Post_ID": "MEM-478-24",
    "Posting_Author": "Congressman Gabe Amo (RI-01)",
    "Congress_Number": null,
    "State_District": "RI-01",
    "Location": "Pawtucket, RI",
    "Job_Function": "Field Representative",
    "Title_Parsed": "",
    "Office_Type": "",
    "Responsibilities": [
      "Meeting with local groups and constituents.",
      "Proactively seeking opportunities to develop community outreach relationships.",
      "Working closely with the District Director and Washington D.C. o5ice to implement planned outreach events and to suggest new innovative ideas.",
      "Representing or speaking on behalf of the Congressman at events and local meetings.",
      "Staying abreast of local news and issues a5ecting Rhode Islanders.",
      "Monitoring and updating the Congressman and sta5 on district and local issues.",
      "Responding to casework and federal funding inquiries from constituents.",
      "Performing other duties as assigned."
    ],
    "Qualifications": [
      "Detail oriented",
      "Positive attitude",
      "The genuine desire to serve constituents in Rhode Island’s First Congressional District",
      "Congressional or other relevant grant writing and managing experience (strONGLyl preferrred)",
      "Rhode Island ties a plus.",
      "Candidates of diverse backgrounds are encouraged to apply.",
      "The o5ice does not discriminate on the basis of race, color, religion, sex (including marital or parental status, sexual orientation, and gender identity), disability, age, or national origin."
    ],
    "Salary_Min": null,
    "Salary_Max": null,
    "Skills_Mentioned": [],
    "Equal_Opportunity_Information": "The o5ice does not discriminate on the basis of race, color, religion, sex (including marital or parental status, sexual orientation, and gender identity), disability, age, or national origin.",
    "Cleaned_Text": "Congressman Gabe Amo (RI-01) seeks a Field Representative to join his district o5ice in Pawtucket, RI. Candidates must have exceptional communications skills, be detail oriented, proactive, a strong understanding of Rhode Island, and able to work in a fastpaced, collaborative environment. Candidates are expected to serve as a liaison with federal, state, and/or local agencies and constituent groups, communicate and meet with constituents with and on behalf of the Congressman, sta5 the Congressman and represent the o5ice at district events, manage grant and federal funding support requests from constituents and local stakeholders, and answer casework correspondence, and other duties as assigned. Some key functions of the position include:• Meeting with local groups and constituents.• Proactively seeking opportunities to develop community outreach relationships.• Working closely with the District Director and Washington D.C. o5ice to implement planned outreach events and to suggest new innovative ideas.• Representing or speaking on behalf of the Congressman at events and local meetings.• Staying abreast of local news and issues a5ecting Rhode Islanders.• Monitoring and updating the Congressman and sta5 on district and local issues.• Responding to casework and federal funding inquiries from constituents.• Performing other duties as assigned. Successful applicants must be detail oriented, have a positive attitude, and the genuine desire to serve constituents in Rhode Island’s First Congressional District. Congressional or other relevant grant writing and managing experience is strongly preferred. Rhode Island ties are a plus. Candidates of diverse backgrounds are encouraged to apply. The o5ice does not discriminate on the basis of race, color, religion, sex (including marital or parental status, sexual orientation, and gender identity), disability, age, or national origin. To apply, send in a single PDF with a resume, a cover letter, and three references (including name, current title and organization, phone number, email, and relationship to the reference) to RI01JobsAmo@gmail.com, with the following subject line: “Full Name – Field Representative.”",
    "DW_NOMINATE": null,
    "LES": null
  },
  {
    "Post_ID": "MEM-476-24",
    "Posting_Author": "Congressman Dan Crenshaw",
    "Congress_Number": null,
    "State_District": null,
    "Location": "Washington, D.C.",
    "Job_Function": null,
    "Title_Parsed": "Legislative Assistant (LA)",
    "Office_Type": null,
    "Responsibilities": [
      "Communicating clearly and consistently with the Member, Legislative Director, and legislative, communications, and district teams on legislative updates",
      "Preparing and sta5ing the Member for meetings, and assisting in the drafting of remarks, as needed",
      "Meeting with constituents, stakeholders, and advocacy groups within the portfolio of issue areas",
      "Working with external stakeholders, Congressional Research Service (CRS), Legislative Counsel, and committee sta5 to draft legislation based on the Member’s priorities"
    ],
    "Qualifications": [
      "strong written and oral communications skills",
      "detailoriented, organized, and creative",
      "ability to quickly learn the member’s voice and think in a proactive, communications-focused manner",
      "commitment to a collaborative work environment",
      "ability to work in a fast-paced environment and manage competing priorities",
      "ability to communicate up and down within the team",
      "interest in identifying and pursuing new opportunities and the ability to anticipate and adapt to challenges"
    ],
    "Salary_Min": null,
    "Salary_Max": null,
    "Skills_Mentioned": [
      "Legislative Assistant skills",
      "written and oral communications",
      "leadership and communication"
    ],
    "Equal_Opportunity_Information": null,
    "Cleaned_Text": "Congressman Dan Crenshaw (R-TX-02) seeks a highly motivated, hard-working Legislative...",
    "DW_NOMINATE": null,
    "LES": null
  },
  {
    "Post_ID": "MEM-474-24",
    "Posting_Author": null,
    "Congress_Number": null,
    "State_District": null,
    "Location": null,
    "Job_Function": null,
    "Title_Parsed": "Digital Director",
    "Office_Type": "House Committee on Veterans’ A5airs",
    "Responsibilities": [
      "Drafting press releases",
      "Creating social media posts and a broader social media strategy.",
      "Managing external communications.",
      "Managing the Committee website.",
      "Managing internal and external press lists!",
      "Managing hearing livestreams.",
      "Clipping and posting Committee Members' hearing remarks in real-time.",
      "Photographing hearings, events, and meetings.",
      "Compiling daily press clips."
    ],
    "Qualifications": [
      "Strong written, verbal, and digital communication skills",
      "Interest in veterans’ issues",
      "Ability to work in a fast-paced environment",
      "Professionalism",
      "Good sense of humor"
    ],
    "Salary_Min": null,
    "Salary_Max": null,
    "Skills_Mentioned": null,
    "Equal_Opportunity_Information": "@U.S. House of Representatives is an equal opportunity employer.",
    "Cleaned_Text": "<p>MEM-474-24</p> <p>Title: Digital Director, House Committee on Veterans’ A5airs, Republican Sta5</p>",
    "DW_NOMINATE": null,
    "LES": null
  },
  {
    "Post_ID": "MEM-473-24",
    "Posting_Author": "Republican Sta5",
    "Congress_Number": null,
    "State_District": "null",
    "Location": "null",
    "Job_Function": null,
    "Title_Parsed": "StaS Assistant, House Committee on Veterans’ A5airs, Republican Sta5",
    "Office_Type": "House Committee",
    "Responsibilities": [
      "",
      "",
      "",
      "",
      "",
      "",
      "",
      "",
      "",
      "",
      "",
      "",
      "",
      "",
      "",
      "",
      "",
      ""
    ],
    "Qualifications": [
      "",
      "",
      "",
      "",
      "",
      "",
      "",
      "",
      "",
      "",
      "",
      "",
      "",
      "",
      "",
      "",
      "",
      ""
    ],
    "Salary_Min": null,
    "Salary_Max": null,
    "Skills_Mentioned": [
      "",
      "",
      "",
      "",
      "",
      "",
      "",
      "",
      "",
      "",
      "",
      "",
      "",
      "",
      "",
      "",
      "",
      ""
    ],
    "Equal_Opportunity_Information": "The U.S. House of Representatives is an equal opportunity employer.",
    "Cleaned_Text": "<html><body>This text has been cleaned</body></html>",
    "DW_NOMINATE": null,
    "LES": null
  },
  {
    "Post_ID": "MEM-410-24",
    "Posting_Author": "CONGRESSIONAL STAFF",
    "Congress_Number": null,
    "State_District": null,
    "Location": "The Constituent Services Representative position acts as a liaison to federal, district, and local agencies for the Member/constituents",
    "Job_Function": "FULL TIME CONSTITUENT SERVICES REPRESENTATIVE",
    "Title_Parsed": "The Constituent Services Representative position acts as a liaison to federal, district, and local agencies for the Member/constituents",
    "Office_Type": null,
    "Responsibilities": [
      "Acts as the representative for the Member within his or her area of responsibility",
      "Handles casework assignments and special projects at the direction of the Director of Constituent Services",
      "Continually screens active cases/ constituent service requests and acts as a liaison with constituents to ensure that their cases are handled in a responsive manner"
    ],
    "Qualifications": [
      "Strong oral and written communication skills",
      "Familiarity with local, state and federal agencies",
      "Knowledge of issues and events in the district in which the Member is involved"
    ],
    "Salary_Min": null,
    "Salary_Max": null,
    "Skills_Mentioned": [],
    "Equal_Opportunity_Information": "Women, people of color, and LGBTQ candidates are strongly encouraged to apply.",
    "Cleaned_Text": "The Constituent Services Representative position acts as a liaison to federal, district, and local agencies for the Member/constituents Candidates must be a selfstarter, excited to problem solve, hardworking, dependable, and organized as well as possess strong oral and written communication skills. This position requires the ability to work well under pressure, good judgment, strong customer service skills, and a commitment to public service. Availability to work some evenings and weekends is required. Ability to communicate in multiple languages is also highly desirable. A vehicle to travel to evening and weekend events is also recommended.\nQualiﬁed candidates should submit a cover letter and resume\nto ny08team@gmail.com with the Subject Line: Constituent Services Representative\nPosition.\n\nESSENTIAL JOB FUNCTIONS REQUIRED:\n• Acts as the representative for the Member within his or her area of responsibility\nincluding answering casework correspondence, meeting with constituents, verbal communications with constituents,\nand serving as a liaison with federal, district, and local agencies;\n• Handles casework assignments and special projects at the direction of the Director of Constituent Services;\n• Continually screens active cases/ constituent service requests and acts as a liaison with constituents to ensure that\ntheir cases are handled in a responsive manner;\n• Maintains up-to-date ˁles on all cases and categories of information of importance to the θice;\n• Attends and monitors scheduled district meetings on behalf of the Member with constituents and groups during regular\nθice hours, some evenings and weekends;\n• Logging incoming and outgoing correspondence, handling visitors & telephone calls;\n• Logs in all incoming and outgoing mail and incoming telephone calls relating to casework and constituent concerns\nin Congressional Management System Database;\n• Performs cross functional tasks with other departments, as needed.\n• Meets attendance requirements as established by the θice; Maintains a good working relationship with the Member,\nsta5, and constituents;\n\n• Accepts performance-based criticism and direction;\n• Works well under pressure and handles stress;\nSKILLS AND KNOWLEDGE REQUIRED:\n• Strong customer service, oral and written communication skills;\n• Familiarity with local, state and federal agencies; Strong knowledge of issues and events in the district\nin which the Member is involved;\n• Professional telephone manner and excellent customer and client service skills;\n• Temperament to communicate with a variety of personalities in a tactful, pleasant,\nand professional manner.\n• Ability to work cooperatively and courteously with others;\n• Thoroughness and careful attention to detail;\n• Ability to exercise discretion and independent judgment in fulﬁllment of casework\nresponsibilities;\n• Knowledge of θice policies, practices, and procedures;\n• Knowledge and proﬁciency in Microsoft ωice suite and other πice computer applications.",
    "DW_NOMINATE": null,
    "LES": null
  },
  {
    "Post_ID": "MEM-135-24",
    "Posting_Author": "O5ice of Congresswoman Joyce Beatty (OH-03)",
    "Congress_Number": null,
    "State_District": "None specified",
    "Location": "Washington, D.C.",
    "Job_Function": null,
    "Title_Parsed": "Press Secretary",
    "Office_Type": "Senior Member of Congress",
    "Responsibilities": [
      "Serve as the primary contact for media requests...",
      "Advance press events and sta5 the Member as needed..."
    ],
    "Qualifications": null,
    "Salary_Min": null,
    "Salary_Max": null,
    "Skills_Mentioned": null,
    "Equal_Opportunity_Information": "The O5ICE of Congresswoman Beatty is an Equal Opportunity Employer who does not discriminate in employment based on...",
    "Cleaned_Text": "The role reports to the Communications Director. Candidates with established, active relationships with top-tier national media outlets and on-the-record experience will receive preferred consideration. Ohio ties are preferred, but not required.",
    "DW_NOMINATE": null,
    "LES": null
  },
  {
    "Post_ID": "MEM-451-23",
    "Posting_Author": "the Rep. Maxine Waters (D-CA-43)",
    "Congress_Number": null,
    "State_District": "44",
    "Location": "CA 43 House Office",
    "Job_Function": null,
    "Title_Parsed": "Legislative Director/Counsel",
    "Office_Type": "Member's Legislative Director/Counsel",
    "Responsibilities": [
      "Ensures legislative sta5 focuses on Member’s policy goals.",
      "Proposes policy positions and formulate legislative solutions.",
      "Recommends strategies and tactics on advancing Member’s legislative priorities.",
      "Handles short-term and long-term legislative planning for the Member.",
      "Manages direction of legislative team.",
      "Monitors and reports ﬂoor action to the Member and the Chief of Sta5.",
      "Writes and reviews legislative memos.",
      "Works with legislative team to develop vote recommendations.",
      "Coordinates responses to legislative mail.",
      "Communicates and strategizes with the District Director and/or district o5ice sta5 on policy initiatives targeted towards constituents.",
      "Maintains up-to-date status reports on all legislation a5ecting the district, legislation sponsored by the Member, legislation on which the Member is an original, lead cosponsor, and legislation on which the Member is a cosponent.",
      "Oversees activities in the o5ice in the absence of the Chief of Sta5.",
      "Performs other duties as assigned."
    ],
    "Qualifications": [
      "Juris Doctor degree required.",
      "Ability to work in face-paced environment with high-proﬁle Member.",
      "Prior experience as a Legislative Director or Senior Legislative Assistant strongly preferred.",
      "3 – 6 years of Capitol Hill experience strongly preferred.",
      "At least 2 years of management experience.",
      "Thorough understanding of the legislative process",
      "Expertise and/or experience in judiciary related issues, e.g., civil rights, women’s rights, gun policy, constitutional law, etc., and foreign a5airs strongly preferred.",
      "Strong leadership and organizational skills.",
      "Strong time management skills.",
      "Excellent oral and written communication skills.",
      "Managing complex, multi-stakeholder initiatives and driving collaborative processes.",
      "Availability to work long hours.",
      "Flexible and adaptable to a variety of personalities and situations.",
      "Familiarity with California and/or district 43 preferred but not required."
    ],
    "Salary_Min": null,
    "Salary_Max": null,
    "Skills_Mentioned": [
      "Civil Rights",
      "Judiciary related issues (e.g., civil rights)",
      "Women's Rights",
      "Gun Policy",
      "Constitutional Law",
      "Foreign Affairs"
    ],
    "Equal_Opportunity_Information": "This o5ice is an equal opportunity employer and will consider all applicants without regard to race, color, religion, sex, marital or parental status, sexual orientation, gender identity, national origin, disability.",
    "Cleaned_Text": "The O5ice of the Rep. Maxine Waters (D-CA-43) the Ranking Member of the House Committee on Financial Services (FSC), has an immediate need for an experienced policy professional and manager to be the Member’s Legislative Director/Counsel. The Legislative Director will focus on the Member’s non-FSC policy priorities including civil rights issues.\n\nThe ideal candidate...",
    "DW_NOMINATE": null,
    "LES": null
  }
]