[
  {
    "Post_ID": "MEM-054-25",
    "Posting_Author": "Congresswoman Melanie Stansbury",
    "Congress_Number": null,
    "State_District": null,
    "Location": "Washington, D.C.",
    "Job_Function": "strategic Communications Advisor",
    "Title_Parsed": "Communications Advisor",
    "Office_Type": "Congressional",
    "Responsibilities": [
      "Strategic planning",
      "Drafting speeches and written remarks",
      "Writing press statements",
      "Other (not specified)"
    ],
    "Qualifications": [
      "Previous experience on Capitol Hill",
      "High-level political communications experience",
      "Solid understanding of Congress and the legislative process",
      "New Mexico ties preferred"
    ],
    "Salary_Min": null,
    "Salary_Max": null,
    "Skills_Mentioned": [],
    "Equal_Opportunity_Information": null,
    "Cleaned_Text": "",
    "DW_NOMINATE": null,
    "LES": null
  },
  {
    "Post_ID": "MEM-053-25",
    "Posting_Author": null,
    "Congress_Number": null,
    "State_District": null,
    "Location": "Washington D.C.",
    "Job_Function": "Counsel (Subcommittee on Capital Markets)",
    "Title_Parsed": null,
    "Office_Type": null,
    "Responsibilities": [
      "Conduct comprehensive legal research and analysis to support the Subcommittee's initiatives",
      "Draft and review legislation within the Subcommittee's jurisdiction",
      "Represent the Subcommittee in meetings with Members of Congress, interest groups, government agencies, and other stakeholders",
      "Analyze complex documents, legislation, and regulatory materials to prepare briefing materials for Committee members and sta.",
      "Provide legal counsel to the Chairman",
      "Develop briefing papers and policy documents",
      "Prepare and support Committee hearings and markups",
      "Contribute to additional projects based on expertise and interests"
    ],
    "Qualifications": [
      "Juris Doctor (JD) degree from an accredited law school",
      "Active membership in good standing with a state bar",
      "Minimum 5 years of experience",
      "Strong understanding of federal securities laws and regulations",
      "Excellent analytical, research, and writing skills",
      "Outstanding interpersonal and communication abilities",
      "Demonstrated ability to manage multiple complex projects simultaneously",
      "Experience in analyzing and drafting legislation"
    ],
    "Salary_Min": null,
    "Salary_Max": null,
    "Skills_Mentioned": [
      "",
      "",
      "#1"
    ],
    "Equal_Opportunity_Information": null,
    "Cleaned_Text": "The Counsel will play a vital role in advancing the Subcommittee's work on capital formation and SEC institutional reforms, among other issue areas. The Counsel will work closely with Committee leadership and sta. to develop legislation and policy initiatives.",
    "DW_NOMINATE": null,
    "LES": null
  },
  {
    "Post_ID": "MEM-051-25",
    "Posting_Author": "The O.ice of U.S. Representative Greg Landsman (OH-01)",
    "Congress_Number": null,
    "State_District": "OH-1",
    "Location": "Cincinnati and Lebanon, OH",
    "Job_Function": "Communications Staff Assistant",
    "Title_Parsed": "Staff Assistant in Communications & Logistics",
    "Office_Type": "District Office",
    "Responsibilities": [
      "Driving Congressman to and from the airport on fly-in and fly-out days",
      "Capturing photos; videos; writing copy for Congressmen's social media and public communications",
      "Supporting district o.ice operations by managing equipment, shipping supplies, essential IT support, etc."
    ],
    "Qualifications": [
      "Graphic design",
      "Video production",
      "Photography",
      "Social media management"
    ],
    "Salary_Min": 45000,
    "Salary_Max": 55000,
    "Skills_Mentioned": [
      "Driving",
      "Visual content creation",
      "IT support",
      "Time management and organization"
    ],
    "Equal_Opportunity_Information": "The O.ice is an equal opportunity employer; no discriminatory practices will be tolerated.",
    "Cleaned_Text": "Staff Assistant in Communications & Logistics",
    "DW_NOMINATE": -0.2169999927282333,
    "LES": 0.3731086552143097
  },
  {
    "Post_ID": "MEM-048-25",
    "Posting_Author": " Democratic Staff of the House Committee on Oversight and Government Reform",
    "Congress_Number": null,
    "State_District": null,
    "Location": "Washington, D.C.",
    "Job_Function": null,
    "Title_Parsed": "",
    "Office_Type": null,
    "Responsibilities": [],
    "Qualifications": [],
    "Salary_Min": null,
    "Salary_Max": 70000,
    "Skills_Mentioned": [],
    "Equal_Opportunity_Information": "",
    "Cleaned_Text": "",
    "DW_NOMINATE": null,
    "LES": null
  },
  {
    "Post_ID": "MEM-047-25",
    "Posting_Author": "Congressman Brad Sherman (CA-32)",
    "Congress_Number": null,
    "State_District": null,
    "Location": "(Sherman Oaks) district office.",
    "Job_Function": null,
    "Title_Parsed": null,
    "Office_Type": "entry-level",
    "Responsibilities": [
      "Interact with constituents via phone, email and in-person meetings;",
      "Assist senior staff with administrative responsibilities;",
      "Input, file, and review constituent inquiries;",
      "Contact federal agencies on behalf of constituents."
    ],
    "Qualifications": [
      "Organization",
      "Professionalism",
      "Motivation",
      "Writing/Typing/Interpersonal Skills",
      "Fast-paced Environment",
      "Microsoft Office and Database Software (Preferred)",
      "Bachelor's Degree from Accredited 4 Year College/University",
      "Relevant Social Work or Government Experience (Preferred)"
    ],
    "Salary_Min": 45000,
    "Salary_Max": null,
    "Skills_Mentioned": [
      "Writing/Typing",
      "Interpersonal Skills",
      "Microsoft Office and Database Software",
      "Fast-paced Environment",
      "Social Work/Government Experience"
    ],
    "Equal_Opportunity_Information": "Scott Abrams to scott.abrams@mail.house.gov. No calls please.",
    "Cleaned_Text": "",
    "DW_NOMINATE": null,
    "LES": null
  },
  {
    "Post_ID": "MEM-046-25",
    "Posting_Author": "House Committee on Homeland Security",
    "Congress_Number": null,
    "State_District": "Republican Sta.",
    "Location": "null",
    "Job_Function": "Counsel (JD or Professional Sta) Member",
    "Title_Parsed": "C Counsel (JD or PSM)",
    "Office_Type": "null",
    "Responsibilities": [
      "sta.ing Subcommittee and some Full Committee congressional hearings",
      "draftingt Subcommittee and some Full Committee correspondence as well as with outside organizations,",
      "conducting depositions-transcribed interviews",
      "reviewing document productions, legislation, research",
      "managing external sources of information",
      "interacting with various congressional committee and personal offices"
    ],
    "Qualifications": [
      "at least two years of experience.",
      "background or strong interest in congressional oversight and investigations",
      "experience in homeland security issues is a plus. ",
      "strong work ethic",
      "superior attention to detail",
      "self-motivated",
      "excellent written and oral communication skills.",
      "ability to work both independently and as part of a team are critical.",
      "prior Hill experience preferred."
    ],
    "Salary_Min": null,
    "Salary_Max": null,
    "Skills_Mentioned": [
      "homeland security issues",
      "strong work ethic",
      "superior attention to detail"
    ],
    "Equal_Opportunity_Information": "null",
    "Cleaned_Text": "MEM-046-25\nThe House Committee on Homeland Security Republican Sta. is hiring for a Counsel (JD ·required) or Professional Sta낱Member supporting the Director of Investigations and the Subcommittee on Oversight, Investigations, and Accountability.\n...\n\nCandidates must possess a strong work ethic, superior attention to detail, be self-motivated, work well under pressure, and possess excellent written and oral  \nncommunication skills. \nThe ability to work both independently and as part of a team are critical. Prior Hill experience preferred. Interested candidates should send a resume and \n\ncover letter to Resumes.CHS Mail.Â house.gov with the subject line “ OIA Counsel <Applicant First and Last Name> - OIA Counsel” \nor “ OIA PSM<–Applicant First Name>-.n,”.",
    "DW_NOMINATE": null,
    "LES": null
  },
  {
    "Post_ID": "MEM-045-25",
    "Posting_Author": "Congressman Glenn Ivey (MD-04)",
    "Congress_Number": null,
    "State_District": "MD-04",
    "Location": "Washington D.C.",
    "Job_Function": "Temporary Correspondence Fellow",
    "Title_Parsed": "Correspondence Fellow: Your Last Name",
    "Office_Type": "Legislative office",
    "Responsibilities": [
      "Drafting replies to constituent letters, including any necessary research; proofreading mail; providing administrative assistance as required; and other duties as assigned."
    ],
    "Qualifications": [
      "Motivated team player with exceptional writing skills. Scrupulous attention to detail. Strong organizational abilities. Effective time management. Professional demeanor."
    ],
    "Salary_Min": null,
    "Salary_Max": null,
    "Skills_Mentioned": [],
    "Equal_Opportunity_Information": "The U.S. House of Representatives is an equal opportunity employer and does not discriminate based on race, color, religion, sex, national origin, age, disability, military status, gender identity and expression, marital status, parental status, or sexual orientation, or any other characteristic protected by applicable law, in any of its activities or operations.",
    "Cleaned_Text": "The O.ice of Congressman Glenn Ivey (MD-04) seeks an excellent writer to join our team as a part-time, temporary Correspondence Fellow. This is a 180-day, twenty hours per week position in the Washington D.C. o.ice.\nThis position is responsible for assisting the Legislative Assistant and legislative team with the o.ice’s busy constituent mail program, primarily by drafting accurate, lively, and timely responses to constituent mail. Responsibilities include but are not limited to:\ndrafting replies to constituent letters, including any necessary research; proofreading\nmail; providing administrative assistance as required; and other duties as assigned.\nThe successful candidate must be a motivated team player with exceptional writing skills, scrupulous attention to detail, strong organizational abilities, effective time management, and a professional demeanor. Strong applicants would include college and graduate students, and early career candidates with a passion for writing and who are interested in learning how Members of Congress communicate with their constituents.\nCandidates from diverse backgrounds and underrepresented communities are strongly encouraged to apply. Ties to Maryland and/or Maryland’s Fourth District are a plus. The U.S. House of Representatives is an equal opportunity employer and does not discriminate based on race, color, religion, sex, national origin, age, disability, military status, gender identity and expression, marital status, parental status, or sexual orientation, or any other characteristic protected by applicable law, in any of its activities or operations.\nTo apply, please send an email to md04resumes@gmail.com with “Correspondence Fellow: Your Last Name” in the subject line and the following application materials attached as one combined PDF:\n-\nCover letter (not to exceed one page) – please customize your letter to this position\nResume\nTwo writing samples (not to exceed one page each)\nTwo references (not to exceed one page) – for each reference, please include name, current title/o.ice, phone number, email, and a one-sentence description of your relationship to the reference.\n\nThe deadline to apply is 5:00 p.m. on Friday, February 21st, 2025",
    "DW_NOMINATE": null,
    "LES": null
  },
  {
    "Post_ID": "MEM-043-25",
    "Posting_Author": "Unknown",
    "Congress_Number": null,
    "State_District": null,
    "Location": null,
    "Job_Function": "Legal",
    "Title_Parsed": "Associate General Counsel/Assistant General Counsel",
    "Office_Type": "General Counsel",
    "Responsibilities": [
      "drafting district court pleadings and appellate briefs",
      "appearing in court in litigation matters in which the House or individual Members, officers, or employees have an official interest",
      "analyzing legal problems presented by House Members, committees, officers, and employees, and formulating recommended solutions",
      "advising and counseling House Members, committees, officers, and employees on a wide range of legal issues",
      "gathering facts necessary to permit OGC to provide sound legal advice",
      "interacting with House leadership, committees, and other House offices",
      "representing witnesses in connection with investigative proceedings",
      "performing legal research on issues of constitutional, statutory, and common law",
      "working closely with other OGC attorneys and support staff in performing these functions"
    ],
    "Qualifications": [
      "excellent academic credentials",
      "at least three years' experience as a practicing attorney, including any judicial clerkships",
      "excellent writing, analytical, and people skills",
      "excellent judgment",
      "ability to work with, and to provide high quality legal advice and representation to, House Members, committees, officers, and employees, without regard to political affiliation",
      "appreciation of—or at least the desire to learn about and understand—the role and functioning of the Legislative Branch"
    ],
    "Salary_Min": null,
    "Salary_Max": null,
    "Skills_Mentioned": null,
    "Equal_Opportunity_Information": null,
    "Cleaned_Text": "Positions Available: Associate General Counsel/Assistant General Counsel\r\nSalary Level/Range: $176,000-$204,500\r\nThe Office of General Counsel (“OGC”), which provides legal advice and representation to Members, committees, officers, and employees of the House on matters related to their official duties without regard to political affiliation, is accepting applications for the position of Associate General Counsel/Assistant General Counsel.\r\nCore responsibilities include: drafting district court pleadings and appellate briefs;\r\nappearing in court in litigation matters in which the House or individual Members, officers,\r\nor employees have an official interest; analyzing legal problems presented by House Members, committees, officers, and employees, and formulating recommended solutions;\r\nadvising and counseling House Members, committees, officers, and employees on a wide range of legal issues; gathering facts necessary to permit OGC to provide sound legal advice; interacting with House leadership, committees, and other House offices;\r\ninteracting with opposing counsel (both government and private); representing witnesses in connection with investigative proceedings; performing legal research on issues of constitutional, statutory, and common law; and working closely with other OGC attorneys and support staff in performing these functions.\r\nQualifications:\r\nMinimum Requirements: (1) excellent academic credentials;\r\n(2) at least three years’ experience as a practicing attorney, including any judicial clerkships;\r\n(3) excellent writing, analytical, and people skills; (4) excellent judgment; (5) ability to work with, and to provide high quality legal advice and representation to, House Members, committees, officers, and employees, without regard to political affiliation; and (6) appreciation of—or at least the desire to learn about and understand—the role and functioning of the Legislative Branch.\r\nPreferred Qualifications: (1) judicial clerkship or other government experience; (2)\r\nexperience drafting dispositive motions in federal district courts and/or briefs in federal courts of appeals; and (3) understanding of structure and operations of the Federal Government, particularly the House of Representatives and the Department of Justice.\r\nInformation about OGC is available at https://ogc.house.gov\r\nPlease email your application consisting of: cover letter, resume, law school transcript, list of references, and writing sample to OGC.Employment@mail.house.gov. Application deadline, Wednesday, February 26, 2025.\r\nApplications will be considered on a rolling basis between now and the deadline. Please include in the email subject line “Associate General Counsel/Assistant General Counsel Vacancy.”",
    "DW_NOMINATE": null,
    "LES": null
  },
  {
    "Post_ID": "MEM-040-25",
    "Posting_Author": "Congressman Rob Wittman",
    "Congress_Number": null,
    "State_District": "VA01",
    "Location": "Washington, D.C.",
    "Job_Function": "Legislative Director",
    "Title_Parsed": "Natural Resources Committee assignment",
    "Office_Type": "Congressional office",
    "Responsibilities": [
      "Develop and implement a comprehensive legislative strategy aligned with the Congressman’s priorities and constituents' needs.",
      "Manage and mentor a legislative team, provide guidance, and foster collaboration among sta. members.",
      "Build and maintain relationships with other lawmakers, committee sta., advocacy groups, and stakeholders to advance the Congressman’s legislative goals.",
      "Engage with district stakeholders, including local leaders, businesses, and community organizations, to understand their needs and incorporate their perspectives into legislative e.orts.",
      "Understand the political landscape and anticipate the implications of legislative actions as it relates to VA-01.",
      "Draft legislation, amendments, and policy papers, ensuring clarity and adherence to congressional procedures.",
      "Maintains up-to-date tracking reports on all legislative items including Sponsored and Cosponsored legislation and letters, provisions in larger bills, and district wins.",
      "Review responses to all constituent mail, and review content produced by the communications team.",
      "Represent the Congressman in meetings with constituents, interest groups, and other legislative o.ices.",
      "Monitor legislative developments and provide timely updates to the Congressman and his sta."
    ],
    "Qualifications": [
      "Minimum of 5 years of experience in legislative a.airs, public policy, or a related field, preferably in a congressional office.",
      "Strong understanding of the legislative process and federal government operations."
    ],
    "Salary_Min": null,
    "Salary_Max": null,
    "Skills_Mentioned": [
      "Excellent writing",
      "research",
      "communication skills"
    ],
    "Equal_Opportunity_Information": "Congressman Wittman is an Equal Opportunity Employer",
    "Cleaned_Text": "Congressman Rob Wittman is seeking a highly motivated and experienced Legislative Director to lead his legislative agenda and coordinate policy initiatives in his Washington, D.C. office. The Legislative Director would handle the Congressman’s Natural Resources Committee assignment, as well as Energy, Environment and Chesapeake Bay, Tax, Telecom/Broadband, Transportation & Infrastructure, Appropriations and the Budget, Immigration, Labor/Workforce/Federal Employees.",
    "DW_NOMINATE": null,
    "LES": null
  },
  {
    "Post_ID": "MEM-038-25",
    "Posting_Author": "Congresswoman Jahana Hayes",
    "Congress_Number": null,
    "State_District": "CT-05",
    "Location": "Washington, D.C. office.",
    "Job_Function": "Communications Director",
    "Title_Parsed": null,
    "Office_Type": null,
    "Responsibilities": [
      "Lead strategy development and implementation of the Member’s communications objectives in consultation with senior sta.;",
      "Oversee day-to-day press activities, including responding to media inquiries, booking interviews, and pitching to media outlets;",
      "Produce press releases, speeches, op-eds, talking points, and statements;",
      "Develop and execute press conferences and public events centered around core messaging areas;",
      "Advance and sta. the Member at media events and other commitments, including nights and weekends;",
      "Develop social media content creation, including rapid response;",
      "Produce franked communications, including 499s and mailers;",
      "Stay up to date on current events and legislation relevant to the Member and the priorities of the district;",
      "Assist the Member and senior sta. in other projects and duties as assigned."
    ],
    "Qualifications": [
      "Capitol Hill or political experience or a demonstrated knowledge of Congress and the legislative process;",
      "3-4 years of experience, with on the record experience as a press secretary or other communications role;",
      "Superior writing, editing, and oral communications skills;",
      "Creative thinker with innovative approaches and an understanding of traditional communications and digital media;",
      "Ability to work collaboratively and courteously with others;",
      "Ability to work in a fast-paced environment, prioritize tasks, and adapt quickly and easily for rapid response;",
      "Careful attention to detail;",
      "Availability to work non-traditional hours;",
      "Experience working with stakeholders on messaging opportunities and priorities."
    ],
    "Salary_Min": null,
    "Salary_Max": null,
    "Skills_Mentioned": null,
    "Equal_Opportunity_Information": "Women, minorities and candidates with Connecticut ties are strongly encouraged to apply.",
    "Cleaned_Text": "",
    "DW_NOMINATE": null,
    "LES": null
  },
  {
    "Post_ID": "MEM-036-25",
    "Posting_Author": "ConservativeRep@mail.house.gov",
    "Congress_Number": null,
    "State_District": null,
    "Location": "Washington, D.C. o.ice.",
    "Job_Function": "Legislative Director",
    "Title_Parsed": "Legislative Director",
    "Office_Type": null,
    "Responsibilities": [
      "This Legislative Director plays an essential leadership role in the o.ice."
    ],
    "Qualifications": [
      "Prior Legislative Director Experience",
      "Proﬁcient at moving legislation",
      "Capitol Hill experience"
    ],
    "Salary_Min": null,
    "Salary_Max": null,
    "Skills_Mentioned": [
      "Microsoft suite",
      "Detail oriented",
      "Multitasker",
      "Great writer"
    ],
    "Equal_Opportunity_Information": null,
    "Cleaned_Text": "",
    "DW_NOMINATE": null,
    "LES": null
  },
  {
    "Post_ID": "MEM-035-25",
    "Posting_Author": "",
    "Congress_Number": null,
    "State_District": "DC",
    "Location": "Washington, DC",
    "Job_Function": "Professional Member",
    "Title_Parsed": "Sta. Member for the Subcommittee on Health",
    "Office_Type": "Subcommittee",
    "Responsibilities": [
      "Leading oversight including organizing and participating in meetings, drafting memos,"
    ],
    "Qualifications": [
      "Undergraduate degree",
      "Veterans are strongly encouraged to apply",
      "Post-graduate-level writing skills"
    ],
    "Salary_Min": null,
    "Salary_Max": null,
    "Skills_Mentioned": null,
    "Equal_Opportunity_Information": "The U.S. House of Representatives is an equal opportunity employer.",
    "Cleaned_Text": "",
    "DW_NOMINATE": null,
    "LES": null
  },
  {
    "Post_ID": "MEM-029-25",
    "Posting_Author": "Hakeem Je.ries",
    "Congress_Number": null,
    "State_District": null,
    "Location": null,
    "Job_Function": "Speechwriter",
    "Title_Parsed": "The O.ice of Democratic Leader Hakeem Je.ries",
    "Office_Type": null,
    "Responsibilities": [
      "drafting written remarks",
      "talking points",
      "press statements",
      "more"
    ],
    "Qualifications": [],
    "Salary_Min": null,
    "Salary_Max": null,
    "Skills_Mentioned": [
      "flawless public-facing remarks",
      "statements for a principal"
    ],
    "Equal_Opportunity_Information": "This o.ice is an equal opportunity employer committed to a diverse and inclusive workforce and does not discriminate on the basis of race, sex, color, age, religion, national origin, sexual orientation, gender identity or disability.",
    "Cleaned_Text": "The O.ice of Democratic Leader Hakeem Je.ries seeks an exceptional writer and researcher to support all aspects of a fast-paced communications operation.",
    "DW_NOMINATE": null,
    "LES": null
  },
  {
    "Post_ID": "MEM-028-25",
    "Posting_Author": "The House Democratic Policy and Communications Committee",
    "Congress_Number": null,
    "State_District": null,
    "Location": "Content Partnership Manager",
    "Job_Function": "Content Partnership Manager",
    "Title_Parsed": "Content Partnership Manager",
    "Office_Type": null,
    "Responsibilities": [
      "Identify, cultivate, and manage relationships with creators, streamers, and podcasters.",
      "Secure opportunities for Members of Congress to appear on local and national digital platforms.",
      "Support Members and sta. with best practices on engaging with digital media on their own."
    ],
    "Qualifications": [
      "A minimum of 3-5 years of experience in digital communications, political communications, public relations, or a related field",
      "A proven track record of managing partnerships or relationships with digital creators or inﬂuencers.",
      "Strong understanding of social media platforms, trends, and digital audience engagement."
    ],
    "Salary_Min": null,
    "Salary_Max": null,
    "Skills_Mentioned": [
      "Digital communications",
      "Political communications",
      "Public relations",
      "Social media platforms, trends, and digital audience engagement"
    ],
    "Equal_Opportunity_Information": "This office is an equal opportunity employer committed to a diverse and inclusive workforce and does not discriminate on the basis of race, sex, color, age, religion, national origin, sexual orientation, gender identity or disability.",
    "Cleaned_Text": "Content Partnership Manager",
    "DW_NOMINATE": null,
    "LES": null
  },
  {
    "Post_ID": "MEM-034-25",
    "Posting_Author": null,
    "Congress_Number": 25,
    "State_District": null,
    "Location": "Washington, DC",
    "Job_Function": "Contracts Investigator",
    "Title_Parsed": "House Committee on Veterans' Affairs (Majority) Contracts Investigator",
    "Office_Type": " Congressional Office",
    "Responsibilities": [
      "Core Responsibilities: • • • • Under the supervision of the General Counsel for the Committee, the individual will conduct oversight and develop policies relating to Department of Veterans A.airs procurement, contracting, and acquisition.",
      "The responsibilities encompass the entire VA, which includes the Veterans Beneﬁts Administration, Veterans Health Administration, National Cemetery Administration,"
    ],
    "Qualifications": [
      "Undergraduate degree",
      "",
      "",
      "Work experience in procurement operations, preferably as a contract specialist or contracting o.icer in a federal agency\nCommand of the Federal Acquisition Regulation and familiarity with major procurement laws"
    ],
    "Salary_Min": null,
    "Salary_Max": null,
    "Skills_Mentioned": [
      "procurement operations",
      "government contracting",
      "procurement law",
      "",
      "writing, editing, and proofreading skills",
      "oral communication skills",
      "discretion, sound judgment",
      "ability to work long hours under pressure",
      "",
      "teamwork"
    ],
    "Equal_Opportunity_Information": "The U.S. House of Representatives is an equal opportunity employer. All applicants will be considered without regard to race, color, national origin, religion, sex (including marital or parental status), disability, or age.",
    "Cleaned_Text": " House Committee on Veterans’ A)airs (Majority) Contracts Investigator\nThe House Committee on Veterans’ A.airs Majority sta. seeks a subject matter expert on government procurement, contracting, and acquisition.\nCore Responsibilities:\n• \n• \n•\nThe House Committee on Veterans’ A.airs Majority sta. seeks a subject matter expert on government procurement, contracting,...",
    "DW_NOMINATE": null,
    "LES": null
  },
  {
    "Post_ID": "MEM-033-25",
    "Posting_Author": "Congresswoman Alma S. Adams",
    "Congress_Number": null,
    "State_District": "NC12",
    "Location": "Washington, DC",
    "Job_Function": "Scheduler",
    "Title_Parsed": "Scheduler for Honorable Congresswoman Alma S. Adams",
    "Office_Type": "Chief of Staff/District Director",
    "Responsibilities": [
      "Manage and maintain the Congresswoman's daily and long-term schedule, ensuring all appointments, meetings, events, and travel are accounted for.",
      "Receive, prioritize, and organize incoming scheduling requests from internal and external stakeholders.",
      "Communicate with external organizations, constituents, and other congressional offices to coordinate scheduling requests, events, and meetings.",
      "Maintain flexibility to accommodate changes to the schedule throughout the day and ensure the Congresswoman is briefed on updates in real time.",
      "Ensure that all meetings, events, and activities are properly logged and tracked.",
      "Coordinate all travel arrangements for the Congresswoman, including transportation, lodging, and related logistics.",
      "Work with the Chief of Staff and Deputy Chief of Staff to coordinate travel schedules and ensure seamless transitions between office duties and travel commitments.",
      "Manage travel-related expenses, including collecting receipts and submitting for reconciliation with the financial administrator.",
      "Work with the Member and relevant staff to prepare daily briefing materials, including key meeting objectives, background information, and travel logistics.",
      "Provide daily and weekly briefings to the Congresswoman on upcoming events, meetings, and other scheduling matters.",
      "Serve as the primary point of contact for coordinating scheduling with key stakeholders, including Members of Congress, Congressional staff, government officials, donors, advocates, and other influential partners.",
      "Ensure timely and professional communication with constituents, including responding to scheduling inquiries and arranging meetings or office visits as appropriate.",
      "Collaborate with other congressional offices, leadership staff, and external organizations to ensure seamless scheduling and minimize conflicts."
    ],
    "Qualifications": [
      "Must possess exceptional time management skills, the ability to prioritize and manage competing demands, and the capacity to perform well under pressure in a fast-paced environment."
    ],
    "Salary_Min": null,
    "Salary_Max": null,
    "Skills_Mentioned": [
      "Exceptional time management skills",
      "Ability to prioritize and manage competing demands",
      "Capacity to perform well under pressure in a fast-paced environment"
    ],
    "Equal_Opportunity_Information": null,
    "Cleaned_Text": "",
    "DW_NOMINATE": null,
    "LES": null
  },
  {
    "Post_ID": "MEM-032-25",
    "Posting_Author": "Congresswoman Janelle Bynum (OR-5)",
    "Congress_Number": null,
    "State_District": "OR-5",
    "Location": "Washington, D.C.",
    "Job_Function": null,
    "Title_Parsed": "Legislative Assistant",
    "Office_Type": null,
    "Responsibilities": [
      "Develop legislative initiatives and collaborate closely with the legislative and communications teams to advance the Congresswoman's priorities.",
      "Monitor legislative developments in Congress and the Administration and provide vote recommendations.",
      "Meet with constituents and advocacy groups, draft briefing materials, and prepare talking points.",
      "Staff the Congresswoman at relevant meetings and events.",
      "Other tasks as assigned"
    ],
    "Qualifications": [
      "Previous relevant policy and/or Capitol Hill experience",
      "Oregon-ties (a plus)"
    ],
    "Salary_Min": null,
    "Salary_Max": null,
    "Skills_Mentioned": null,
    "Equal_Opportunity_Information": "We encourage candidates from diverse backgrounds to apply. Our office is committed to diversity and does not discriminate based on race, color, religion, sex, sexual orientation, gender identity, disability, age, or national origin.",
    "Cleaned_Text": "<remove>…</remove>",
    "DW_NOMINATE": 0.1669999957084656,
    "LES": 1.452904462814331
  },
  {
    "Post_ID": "MEM-030-25",
    "Posting_Author": "Representative Jill Tokuda (D-HI-02)",
    "Congress_Number": null,
    "State_District": "HI-02",
    "Location": "Washington, DC office",
    "Job_Function": "Legislative Assistant / senior LA / policy advisor",
    "Title_Parsed": null,
    "Office_Type": "Representative's Office",
    "Responsibilities": [
      "Starting the Representative",
      "monitoring committee and floor activities",
      "developing and advancing legislative initiatives",
      "reviewing constituent correspondence",
      "coordinating with the communications team and District office",
      "representing the member and the office at events and meetings"
    ],
    "Qualifications": [
      "Strong communication skills",
      "relevant policy experience",
      "positive and can-do attitude",
      "willingness to work in a fast-paced, collaborative environment"
    ],
    "Salary_Min": null,
    "Salary_Max": null,
    "Skills_Mentioned": null,
    "Equal_Opportunity_Information": "The office is an equal opportunity employer and does not discriminate on the basis of race, color, religion, sex, national origin, age, disability, gender identity or expression, or sexual orientation. Diverse candidates are strongly encouraged to apply.",
    "Cleaned_Text": "MEM-030-25\nRepresentative Jill Tokuda (D-HI-02) seeks an experienced candidate for a Legislative Assistant / senior LA / policy advisor to lead her work on the House Agriculture Committee. This portfolio will consist of other topics that may include energy, the environment, financial services, and other economic issues.\n\nThe ideal candidate will have at least two years of substantive policy experience and work on the Hill. Responsibilities include starting the Representative, monitoring committee and Floor activities, developing and advancing legislative initiatives, reviewing constituent correspondence, coordinating with the communications team and District Office., and representing the member and the office at events and meetings.\n\nQualified candidates will have strong communication skills, relevant policy experience, a positive and can-do attitude, and a willingness to work in a fast-paced, collaborative environment.\n\nThis is not an entry-level position and will report to the legislative director.\nPlease send a cover letter, resume, two writing samples, and a list of three references in a single PDF to hawaii02jobs@gmail.com with 'Agriculture Legislative Sta.er - [Last Name, First Name]' in the subject line.\n\nThe office is an equal opportunity employer and does not discriminate on the basis of race, color, religion, sex, national origin, age, disability, gender identity or expression, or sexual orientation. Diverse candidates are strongly encouraged to apply. Salary and title will be commensurate with experience and qualifications. Please mention any Hawai‘i ties in your cover letter. This position is based in Representative Tokuda’s Washington, DC office. The office will conduct interviews with the most qualified candidates on a rolling basis. No calls or drop-ins, please.",
    "DW_NOMINATE": null,
    "LES": null
  },
  {
    "Post_ID": "MEM-026-25",
    "Posting_Author": "Congressman Greg Steube",
    "Congress_Number": null,
    "State_District": null,
    "Location": "",
    "Job_Function": "Communications Director",
    "Title_Parsed": null,
    "Office_Type": null,
    "Responsibilities": [
      "Pitch and book local and national media regularly to ensure strong and consistent coverage.",
      "Develop and maintain strong relationships with local and national press to amplify the Congressman's message.",
      "Create daily social media content (including graphic design) and write compelling statements, press releases, media advisories, op-eds, radio ad scripts, and the weekly newsletter.",
      "Draft talking points, speeches, and key messaging for public appearances and interviews.",
      "Oversee and manage a large communications budget, covering areas such as mass mailers, digital ads, radio ads, text messages, surveys, and email campaigns.",
      "Produce, edit, and clip video content for use on social media and other platforms."
    ],
    "Qualifications": [
      "Proven experience in strategic communications, public relations, and/or media relations—ideally in a political, public affairs, or government context.",
      "Strong writing, editing, and verbal communication skills, with the ability to craft concise, persuasive messaging under tight deadlines.",
      "Solid understanding of social media platforms, digital advertising, and video content creation.",
      "Strong organizational, time-management, and project management skills with the ability to juggle multiple priorities simultaneously.",
      "Experience managing budgets and working with vendors, including for advertising and media buys.",
      "A self-starter who can work independently and as part of a dynamic team."
    ],
    "Salary_Min": null,
    "Salary_Max": null,
    "Skills_Mentioned": [],
    "Equal_Opportunity_Information": "",
    "Cleaned_Text": "MEM-026-25\nCOMMUNICATIONS DIRECTOR\nCongressman Greg Steube is seeking an experienced, highly motivated Communications Director to spearhead the office’s strategic communications efforts.\nThis individual will manage all aspects of media relations, content creation, and digital strategy. The ideal candidate will be an exceptional writer, a strong strategic thinker, and a skilled manager who thrives in a fast-paced environment.\nKey Responsibilities:· Pitch and book local and national media regularly to ensure strong and consistent coverage.· Develop and maintain strong relationships with local and national press to amplify the Congressman’s message.· Create daily social media content (including graphic design) and write compelling statements, press releases, media advisories, op-eds, radio ad scripts, and the weekly newsletter.· Draft talking points, speeches, and key messaging for public appearances and interviews.· Oversee and manage a large communications budget, covering areas such as mass mailers, digital ads, radio ads, text messages, surveys, and email campaigns.· Produce, edit, and clip video content for use on social media and other platforms.\nThe Communications Director will also manage a Deputy Communications Director to help execute these tasks and ensure smooth operations across all communications initiatives.\nQualifications & Skills:· Proven experience in strategic communications, public relations, and/or media relations—ideally in a political, public affairs, or government context.· Strong writing, editing, and verbal communication skills, with the ability to craft concise, persuasive messaging under tight deadlines.· Solid understanding of social media platforms, digital advertising, and video content creation.· Strong organizational, time-management, and project management skills with the ability to juggle multiple priorities simultaneously.· Experience managing budgets and working with vendors, including for advertising and media buys.· A self-starter who can work independently and as part of a dynamic team.\n\n\tPreferred Qualifications:\tu00b7 Experience working in a Congressional office or political campaign.\tu00b7 Familiarity with video production tools (Adobe Premiere, Final Cut Pro, etc.).\tu00b7 Knowledge of local and national political landscape, with a particular understanding of Congressman Steube’s policy priorities and messaging.\nInterested applicants should send resume and cover letter to:´Floridarepublicanjob@gmail.com",
    "DW_NOMINATE": null,
    "LES": null
  },
  {
    "Post_ID": "MEM-022-25",
    "Posting_Author": "Congresswoman Madeleine Dean (PA-04)",
    "Congress_Number": null,
    "State_District": "PA-04",
    "Location": "Glenside, PA",
    "Job_Function": "Caseworker (Social Security and Medicare)",
    "Title_Parsed": "Caseworker (Social Security and Medicare)",
    "Office_Type": "District",
    "Responsibilities": [
      "Acts as the representa9ve for the Member in the realm of Social Security and Medicare...",
      "Informs the Member and District Director of all happenings in his or her assigned issue areas.",
      "Handles and priori9zes casework assignments...",
      "..."
    ],
    "Qualifications": [
      "Strong oral and wriYen communica9on skills.",
      "Knowledge of legisla9ve process and of House organiza9on and procedures.",
      "Knowledge of local, state, and federal agencies and departments—especially regarding Social Security and Medicare programming."
    ],
    "Salary_Min": null,
    "Salary_Max": null,
    "Skills_Mentioned": [
      "Strong oral and wriYen communica9on skills.",
      "Professional telephone manner",
      "Strong organiza9on and follow-up skills",
      "Temperament to communicate with a variety of personali9es in a tacHul, pleasant, and professional manner.",
      "Ability to work coopera9vely and courteously with others.",
      "Thoroughness and careful aYen9on to detail.",
      "Ability to exercise discre9on and independent judgment in fulﬁllment of casework responsibili9es.",
      "Knowledge of oﬃce policies, prac9ces, and procedures.",
      "Proﬁciency in word processing as well as with oﬃce equipment: scanner, copier, printer, desktop computer."
    ],
    "Equal_Opportunity_Information": "The oﬃce is an equal opportunity employer; we do not discriminate on the basis of race, color, religion, sex, sexual orienta<on, gender iden<ty and expression, na<ional origin, disability, military status, age, marital status, or parental status.",
    "Cleaned_Text": "MEM-022-25 \nDistrict Caseworker (Social Security and Medicare) \n\n👊 Congresswoman Madeleine Dean (PA-04) seeks a motivated and organized individual to join her team as a Congressional Caseworker based in Glenside, PA. This position serves as a liaison to federal, district, and local agencies on behalf of the Member and her constituents.ണThe Caseworker will handle a portfolio of issue areas while serving as the lead on all Social Security and Medicare concerns through casework correspondence and verbal communication with constituents.\n\nESSENTIAL JOB FUNCTIONS REQUIRED:\nActs as the representa9ve for the Member in the realm of Social Security and Medicare including answering casework correspondence, mee9ng with cons9tuents, verbal communcations with cons9tuents ണand serving as a liaison with other federal, district ണand local agencies.\n\nInforms the Member and District Director of all happenings in his or her assigned issue areas.\n\nHandles and priori9zes casework assignments while assis9ng with general intake, cons9tuent services requests ണand communication in an oﬃce environment.\n\nAssesses casework inquiries for problems requiring legisla9ve action and makes recommendations to the District Director and Chief of Staff.\n\nScreens and refers cases, when appropriate, to other district offices.\n\nLogs all incoming and outgoing mail and telephone calls rela9ng to casework in Customer Rela9onship Management (CRM) system.ണ\n\nPrepares periodic reports for the Casework Manager on pending cases and district ac9vi9es in his or her assigned issue areas.\n\nCon9nually screens ac9ve cases and acts as liaison with cons9tuents to ensure that their cases are handled in a responsive manner.\n\nMaintains up-to-date ﬁles on all cases and issues of importance to the oﬃce.ണ\n\nMaintains a good working rela9onship with the Member, staﬀ, ണand cons9tuents.\n\nAccepts performance-based cri9cism and direc9ons.\n\nWorks well under pressure and handles stress.\n\nPerforms other du9es as assigned.ണ\n\nWorks Monday – Friday 8:30am – 4:30pm, with occasional nights and weekends for town hall mee9ngs and other special events.\n\nSKILLS AND KNOWEDGE REQUIRED:\nStrong oral and wriYen communica9on skills.\nKnowledge of legisla9ve process and of House organiza9on and procedures.\nKnowledge of local, state, and federal agencies and departments—especially regarding Social Security and Medicare programming.\n\nProfessional telephone manner.\nStrong organiza9on and follow-up skills.\nTemperament to communicate with a variety of personali9es in a tacHul ണpleasant, and professional manner.ണ\n\nAbility to work coopera9vely and courteously with others.\nThoroughness and careful aYen9on to detail.\nAbility to exercise discre9on and independent judgment in fuﬁllment of casework responsibili9es.\n\nKnowledge of oﬃce policies, prac9ces ണand procedures.\nProﬁciency in word processing as well as with oﬃce equipment: scanner, copier ണprinter, desktop computer.\n\nTO APPLY:\nAll interested candidates should email a resume and cover LeYer directly to mdeanhiring@gmail.com with the subject line \"Caseworker – [Applicant’s Last Name]\".",
    "DW_NOMINATE": null,
    "LES": null
  },
  {
    "Post_ID": "MEM-021-25",
    "Posting_Author": "HOUSE COMMITTEE ON VETERANS’ AFFAIRS",
    "Congress_Number": null,
    "State_District": null,
    "Location": "Democratic Sta.",
    "Job_Function": "Communications Director",
    "Title_Parsed": "Communications Director, House Committee on Veterans' A.airs Democratic Sta.",
    "Office_Type": "House Committee",
    "Responsibilities": [
      "Serve as primary communications advisor for the Ranking Member and Democratic Committee Sta.",
      "Manage the execution of the communications strategy",
      "..."
    ],
    "Qualifications": [
      "Superior writing, editing, and oral communications skills",
      "Creative thinker with innovative approaches and an understanding of digital media",
      "..."
    ],
    "Salary_Min": null,
    "Salary_Max": 110000,
    "Skills_Mentioned": [
      "digital media"
    ],
    "Equal_Opportunity_Information": "veterans, minorities, women, people with disabilities, and LGBTQ+",
    "Cleaned_Text": "The Democratic Sta. of the House Committee on Veterans’ A.airs seeks a Communications Director to implement the Ranking Member’s Committee communications strategy.",
    "DW_NOMINATE": null,
    "LES": null
  },
  {
    "Post_ID": "MEM-019-25",
    "Posting_Author": "The Energy and Commerce Committee Democratic Sta.",
    "Congress_Number": null,
    "State_District": "Sta.",
    "Location": "null",
    "Job_Function": "Press Assistant",
    "Title_Parsed": "Press Assistant",
    "Office_Type": "Committee",
    "Responsibilities": [
      "Drafting press releases, social media posts, talking points, and the committee newsletter;",
      "Designing graphics for both social media and web content;",
      "Producing and editing videos and photos;",
      "Monitoring social media;",
      "Maintaining and updating press lists;",
      "Compiling daily press clips."
    ],
    "Qualifications": [
      "Excellent written and oral communication skills",
      "Proven ability to perform under pressure while juggling multiple tasks and sound political judgment.",
      "Prior Hill or campaign communications experience, as well as professional social media and digital experience (including graphic design and photo and video editing)."
    ],
    "Salary_Min": null,
    "Salary_Max": 65000,
    "Skills_Mentioned": [],
    "Equal_Opportunity_Information": "Our o.ice deeply values the diversity of our employees and encourages candidates from diverse backgrounds to apply.",
    "Cleaned_Text": "MEM-019-25\nPress Assistant\nThe Energy and Commerce Committee Democratic Sta. seeks a motivated and\nhardworking communications professional to join fast-paced communications team as a\nPress Assistant.\nResponsibilities include:§ Drafting press releases, social media posts, talking points, and the committee\nnewsletter;§ Designing graphics for both social media and web content;§ Producing and editing videos and photos;§ Monitoring social media;§ Maintaining and updating press lists; and\n§ Compiling daily press clips.\nQualiﬁed candidates must have excellent written and oral communication skills, a proven\nability to perform under pressure while juggling multiple tasks and sound political\njudgment.\nPrior Hill or campaign communications experience, as well as professional social media\nand digital experience (including graphic design and photo and video editing), is preferred.\nOur o.ice deeply values the diversity of our employees and encourages candidates from\ndiverse backgrounds to apply.\nSalary: $65,000\nQualiﬁed candidates should submit a cover letter, resume, one writing sample, and two\ndigital samples to ecdjobs@mail.house.gov. Please no walk ins or phone calls.",
    "DW_NOMINATE": null,
    "LES": null
  },
  {
    "Post_ID": "MEM-016-25",
    "Posting_Author": "Congresswoman Pramila Jayapal",
    "Congress_Number": 7,
    "State_District": "WA-07",
    "Location": "Washington, DC",
    "Job_Function": "",
    "Title_Parsed": ", Senior Legislative Assistant",
    "Office_Type": "O.ice of Congresswoman Pramila Jayapal",
    "Responsibilities": [
      "Driving current and new legislative initiatives...",
      "Representing the Congresswoman's priorities with external stakeholders...",
      "Building and maintaining relationships..."
    ],
    "Qualifications": [
      "4 -6 years of relevant experience including policy development and analysis;",
      "Passionate about public service and committed to progressive values;",
      "Excellent writing and time management skills;"
    ],
    "Salary_Min": null,
    "Salary_Max": null,
    "Skills_Mentioned": [],
    "Equal_Opportunity_Information": "The Office of Congresswoman Pramila Jayapal is an equal opportunity employer.",
    "Cleaned_Text": "...",
    "DW_NOMINATE": null,
    "LES": null
  },
  {
    "Post_ID": "MEM-013-25",
    "Posting_Author": "Congresswoman Sarah McBride",
    "Congress_Number": null,
    "State_District": "DE-AL",
    "Location": "Washington, D.C.",
    "Job_Function": "Legislative Assistant",
    "Title_Parsed": "Legislative Assistant",
    "Office_Type": "Congressional office",
    "Responsibilities": [
      "[ Collaborate with the Congresswoman, Legislative Director, additional sta., other hill o.ices, and stakeholders to develop and advance legislative initiatives within the assigned diverse legislative portfolio. ]",
      "[ Sta. the Congresswoman for her work on the Science, Space, and Technology Committee, including writing remarks, managing relationships, and advancing legislation. ]",
      "[ Research and track legislation, coordinate bill co-sponsorships, and monitor relevant committee and ûloor activities. ]",
      "[ Draft policy memos and brieüing materials for the Congresswoman and senior sta.. ]",
      "[ Brief the Congresswoman on legislative matters and assist in preparing her for hearings, markups, and meetings. ]",
      "[ Represent the Congresswoman in meetings with constituents, advocacy organizations, and industry stakeholders. ]",
      "[ Support state o.ice sta. by providing relevant legislative updates and assisting with local initiatives. ]",
      "[ Perform additional responsibilities as assigned. ]"
    ],
    "Qualifications": [
      "[ Legislative experience in a congressional office.]",
      "[ Strong written and verbal communication skills.]",
      "[ Ability to exercise sound judgment, make decisions under pressure, and navigate challenging situations. ]",
      "[ Excellent organizational and time management skills to manage multiple projects simultaneously. ]"
    ],
    "Salary_Min": null,
    "Salary_Max": null,
    "Skills_Mentioned": null,
    "Equal_Opportunity_Information": "The office of Congresswoman Sarah McBride is an equal opportunity employer... ",
    "Cleaned_Text": "",
    "DW_NOMINATE": null,
    "LES": null
  },
  {
    "Post_ID": "MEM-012-25",
    "Posting_Author": "Congresswoman Shontel M. Brown (OH-11)",
    "Congress_Number": null,
    "State_District": "OH-11",
    "Location": "Washington, D.C.",
    "Job_Function": "Operations Assistant/Legislative Correspondent",
    "Title_Parsed": "Operations Assistant/Legislative Correspondent",
    "Office_Type": null,
    "Responsibilities": [
      ""
    ],
    "Qualifications": [
      ""
    ],
    "Salary_Min": null,
    "Salary_Max": null,
    "Skills_Mentioned": [
      ""
    ],
    "Equal_Opportunity_Information": "Ohio ties and the ability to work independently are a plus.",
    "Cleaned_Text": "",
    "DW_NOMINATE": -0.4449999928474426,
    "LES": 0.08653660118579865
  },
  {
    "Post_ID": "MEM-008-25",
    "Posting_Author": "Congressman Mike Flood",
    "Congress_Number": null,
    "State_District": null,
    "Location": "Norfolk, NE or willingness to relocate",
    "Job_Function": "District Special Assistant",
    "Title_Parsed": "Special Assistant (DC) - Congressman Mike Flood",
    "Office_Type": "Full-time House Staff",
    "Responsibilities": [
      "Transportation of the Member for their official duties.",
      "Deliver and pickup materials for the office, including letters, packages, and documents from other government agencies.",
      "Working with the Scheduler to be aware of the Member's schedule.",
      "Running errands and assisting the District Director with supplies and other misc. administrative matters.",
      "Assisting in sorting and delivering mail.",
      "Serving as a personal aide to the Member, tending to various needs as they arise while he is in the district."
    ],
    "Qualifications": [
      "Located in Norfolk, NE or willingness to relocate",
      "Regular, predictable and punctual attendance at assigned locations required for performance of duties.",
      "Ability to communicate effectively with the Member and office staff, Members and representatives from other offices, outside organizations, and others.",
      "Ability to work most weekends as the Member's schedule dictates, with less work expected on weekdays when the Member is in DC.",
      "Ability to handle difficult and sometimes tense interactions with members of the public, including constituents, with tact while also prioritizing the well-being of the Member."
    ],
    "Salary_Min": null,
    "Salary_Max": null,
    "Skills_Mentioned": [
      "Driving",
      "Administration",
      "Public Relations"
    ],
    "Equal_Opportunity_Information": "",
    "Cleaned_Text": "District Special Assistant - Congressman Mike Flood (NE-01) The primary responsibility of the District Special Assistant is to transport the Member and other sta. members to meetings and appointments as necessary, deliver and pickup materials for the o.ice, sta. the Member at various Meetings and events. When the Member is in DC, the Special Assistant will assist the district sta. with •ield rep duties and casework.",
    "DW_NOMINATE": null,
    "LES": null
  },
  {
    "Post_ID": "MEM-530-24",
    "Posting_Author": null,
    "Congress_Number": null,
    "State_District": null,
    "Location": "Washington, DC",
    "Job_Function": null,
    "Title_Parsed": "Research Assistant, Subcommittee on Disability Assistance and Memorial A.airs,House Committee on Veterans’re A.airs, Majority Sta.",
    "Office_Type": null,
    "Responsibilities": [
      "Provide administrative and research support to Subcommittee sta.and assists withduties as assigned.",
      "Maintain Subcommittee archives of activities,includemember and stakeholderengagements.",
      "Travel and conduct oversight visits at agency locations.",
      "Draft trip reports,requests to agencies for information(including tracking deadlines),hearing recaps,and other work product relevant to the Subcommittee’s jurisdiction.",
      "Subcommittee casework as assigned.",
      "Answer telephone and respond to caller inquiries.",
      "Keep abreast of emails,includemember inquiries and agencynotifications.",
      "Organize and maintain Subcommittee electronic records,including meeting notes,agency reports,other documents.",
      "Participate in sta.-level discussions on legislation being considered;draft policy memoranda as assigned.",
      "Assist with due diligence being performed as part of the Subcommittee’s oversight duties,includerequesting information from agencies on matters within the Subcommittee jurisdiction.",
      "Assist with hearing preparation and coordination of hearings,includeds drafting memoranda and remarks for Chairman.",
      "Attend meetings with agencies,veteran service organizations,and other parties,and maintain notes on such meetings.",
      "Assist with the drafting of memoranda for the full Committee and Subcommittee Chairman on matters within the jurisdiction of the Subcommittee.",
      "Review the Congressional Record,Federal Register,House Calendar,and otherpublications for matters of interest to Subcommittee Members and sta.",
      "Assist with developing policy recommendations and serve as a resource for Membersboth on and o. Committee.",
      "Respondable forevery other duty assigned by the full Committee Chairman,Subcommittee Chairman,full Committee Sta Director or Deputy Sta Director,and Subcommittee Sta Director,and assisting other Committee sta,as needed."
    ],
    "Qualifications": [
      "Bachelor of Arts or Science.",
      "Strong research skills.",
      "Strong writing and editing skills.",
      "Strong Microsoft Office proficiency,includingskillsexpertise in Wordand the ability to useExcel.",
      "Strong organizational skills.",
      "Strong verbal communication.",
      "Excellent attention to detail.",
      "Excellent listening skills.",
      "Strong ability to manage fluctuating workloads and juggle and prioritize tasks,includemangingshort-,medium-,"
    ],
    "Salary_Min": null,
    "Salary_Max": null,
    "Skills_Mentioned": [],
    "Equal_Opportunity_Information": null,
    "Cleaned_Text": "Research Assistant, Subcommittee on Disability Assistance and Memorial A.airs,\nHouse Committee on Veterans’ A.airs, Majority Sta.\n\nReports to: Majority Sta. Director, Subcommittee on Disability Assistance and Memorial\nA.airs\n\nCore Responsibilities:\n•\nProvide administrative and research support to Subcommittee sta. and assists with duties as assigned.\nDuties:\n•\nMaintain Subcommittee archives of activities, including Member and stakeholder engagements.\n•\nTravel and conduct oversight visits at agency locations.\n\ndraft trip reports, requests to agencies for information (including tracking deadlines), hearing recaps, and other work product relevant to the Subcommittee’s jurisdiction.\n\ncSubcommittee casework as assigned.\n•\nanswer telephone and respond to caller inquiries.\n•\nKeep abreast of emails, including Member inquiries and agency notifications.\n•\nOrganize and maintain Subcommittee electronic records, including meeting notes, agency reports, other documents.\n•\nparticipate in sta.-level discussions on legislation being considered; draft policy memoranda as assigned.\n•\nasist with due diligence being performed as part of the Subcommittee’s oversight duties, including requesting information from agencies on matters within the Subcommittee jurisdiction.\n•\nasist with hearing preparation and coordination of hearings, including drafting memoranda and remarks for Chairman.\n•\ntend meetings with agencies, veteran service organizations, and other parties, and maintain notes on such meetings.\n•\nasistant with the drafting of memoranda for the full Committee and Subcommittee Chairman on matters within the jurisdiction of the Subcommittee.\n•\nreview the Congressional Record, Federal Register, House Calendar, and other publications for matters of interest to Subcommittee Members and sta.\n•\nasist with developing policy recommendations and serve as a resource for Members both on and o. Committee.\n•\nrespondable forevery other duty assigned by the full Committee Chairman, Subcommittee Chairman, full Committee Sta Director or Deputy Sta Director,and Subcommittee Sta Director,and assisting other Committee sta,as needed.\n\nMINIMUM QUALIFICATIONS:\n\n\nBENEFITS:\nEmployees may be eligible for the following beneﬁts:\nSickAndAnnualLeave\nStudentLoanRepaymentProgram\nFederalEmployeesHealthBenefitsProgram\nThriftSavingsPlan\nFederalEmployees’GroupLifeInsuranceProgram\n FederalLong-TermCare(LTC)Insurance\nFlexibleSpendingAccounts(FSAFEDS)\nDental&VisionInsuranc.Program(FEDVIP)\nMetroorParkingBeneﬁts\nManyothersupportiveservicesandbeneﬁts offeredbytheU.S.HouseofRepresentatives\n\nOtherInformation: Employmentwith the U.S. House of Representatives is at-will. The U.S.\nHouse of Representativesis an equall opportunity employer. All applicantswill be consideredwithout regardto race,color,nationalorigin,religion,sex(including maritalorparentalstatus),disability, or age.",
    "DW_NOMINATE": null,
    "LES": null
  },
  {
    "Post_ID": "MEM-523-24",
    "Posting_Author": "Democratic Staff of the House Budget Committee and Ranking Member Brendan F. Boyle (PA-02)",
    "Congress_Number": null,
    "State_District": null,
    "Location": "Washington D.C.",
    "Job_Function": "Digital Assistant",
    "Title_Parsed": "Digital Assistant",
    "Office_Type": null,
    "Responsibilities": [],
    "Qualifications": [
      "1-3 years of experience in digital communications",
      "proficiency with design and editing tools (e.g., Adobe Creative Suite, Canva)",
      "strong writing and editing skills"
    ],
    "Salary_Min": 60000,
    "Salary_Max": 80000,
    "Skills_Mentioned": null,
    "Equal_Opportunity_Information": "The office is an equal opportunity employer with a team that highly values mentorship and professional development; we do not discriminate on the basis of race, color, religion, national origin or citizenship status, sex, gender identity or expression, pregnancy, sexual orientation, age, disability, or military status.",
    "Cleaned_Text": "MEM-523-24\nThe Democratic Staff of the House Budget Committee and Ranking Member Brendan F. Boyle (PA-02) seek a creative and detail-oriented Digital Assistant to support digital communications and public engagement efforts.",
    "DW_NOMINATE": null,
    "LES": null
  },
  {
    "Post_ID": "MEM-517-24",
    "Posting_Author": "Congresswoman Susie Lee (D-NV)",
    "Congress_Number": null,
    "State_District": "NV",
    "Location": "Washington, DC",
    "Job_Function": "DC Scheduler",
    "Title_Parsed": "DC Scheduler",
    "Office_Type": "Chief of Staff office",
    "Responsibilities": [
      "develop, coordinate, and manage all aspects of the Member’s daily and long-term schedule and logistics in DC.",
      "report to the Chief of Staff and work closely with the Member, DC staff, and District staff, including a District-based scheduler responsible for in-district scheduling."
    ],
    "Qualifications": [
      "prior scheduling experience is preferred"
    ],
    "Salary_Min": null,
    "Salary_Max": null,
    "Skills_Mentioned": [
      "creative problem solvers",
      "excellent attention to detail",
      "communicate succinctly and effectively",
      "thrive in a fast-paced work environment"
    ],
    "Equal_Opportunity_Information": "Candidates of diverse backgrounds are encouraged to apply. The office is an equal opportunity employer and does not discriminate on the basis of race, color, religion, sex,... sexual orientation, gender identity and expression, national origin, disability, military status, age, marital status, or parental status.",
    "Cleaned_Text": "MEM-517-24\nCongresswoman Susie Lee (D-NV) seeks a highly organized, good-humored, hard-working DC Scheduler to develop, coordinate, and manage all aspects of the Member’s daily and long-term schedule and logistics in DC. The DC Scheduler will report to the Chief of Staff and work closely with the Member, DC staff, and District staff, including a District-based scheduler responsible for in-district scheduling. This is not an entry-level role; prior scheduling experience is preferred, and salary will be commensurate with experience.\nResponsibilities also include tracking, evaluating, and responding to all invitations and scheduling requests, coordinating travel for the Member, compiling the Congresswoman’s nightly briefing materials, and managing office operations, including but not limited to facilitating Member meetings and calls, coordinating internal and external events, assisting with onboarding and training for staff and interns, and other administrative duties. Responsibilities will also include providing staffing support, including driving the Congresswoman as needed. Strong candidates will be creative problem solvers, have excellent attention to detail, communicate succinctly and effectively, and thrive in a fast-paced work environment. The position requires the ability to multi-task, work well under pressure, and the flexibility to be responsive to urgent scheduling needs on nights and weekends.\nCandidates of diverse backgrounds are encouraged to apply. The office is an equal opportunity employer and does not discriminate on the basis of race, color, religion, sex,... sexual orientation, gender identity and expression, national origin, disability, military status, age, marital status, or parental status.\nCandidates should submit in PDF format a resume, cover letter, and three references (including name, title and organization, phone number, email, and relationship to the candidate) to nv03resumes@gmail.com with the following subject line: ‘Full Name – DC Scheduler.’",
    "DW_NOMINATE": null,
    "LES": null
  },
  {
    "Post_ID": "MEM-476-24",
    "Posting_Author": "Congressman Dan Crenshaw (R-TX-02)",
    "Congress_Number": 2,
    "State_District": "TX-02",
    "Location": "Washington, D.C. office.",
    "Job_Function": "",
    "Title_Parsed": "Legislative Assistant (LA),",
    "Office_Type": "Legislative O.",
    "Responsibilities": [
      "Communicating clearly and consistently with the Member, Legislative Director, and legislative, communications, and district teams on legislative updates"
    ],
    "Qualifications": [
      "strong written and oral communications skills",
      "detailoriented, organized, and creative"
    ],
    "Salary_Min": null,
    "Salary_Max": null,
    "Skills_Mentioned": [],
    "Equal_Opportunity_Information": "",
    "Cleaned_Text": "",
    "DW_NOMINATE": null,
    "LES": null
  }
]