[
    {
        "Post_ID": "MEM-076-25",
        "Posting_Author": "Congressman Mike Flood",
        "Congress_Number": null,
        "1 if Democrat": null,
        "1 if woman": null,
        "DW-NOMINATE": null,
        "LES": null,
        "Date_Posted": "2025-02-24",
        "State_District": "NE-01",
        "Job_Function": "Special",
        "Title_Parsed": "Assistant",
        "Office_Type": "Member",
        "Committee_Affiliation": null,
        "Spanish_Language": null,
        "Salary_Min": null,
        "Salary_Max": null,
        "Years_Experience": null,
        "Skills_Mentioned": [
            "driving",
            "communication",
            "customer service",
            "errands",
            "administrative",
            "lifting",
            "prioritization",
            "computer",
            "email",
            "telephone",
            "smartphone",
            "photocopier",
            "fax machine"
        ],
        "Cleaned_Text": "Congressman Mike Flood (NE-01) seeks a Special Assistant for his Washington, D.C.\nOffice.\nThe primary responsibility of the Special Assistant is to transport the Member and other\nstaff members to meetings and appointments as necessary, deliver and pickup materials\nfor the office, staff the Member at various meetings, plan for and cater to various\nconstituents and VIPs in DC, and serve as a personal aide to the Member when he is in\nWashington, DC. When the Member is in the district, the Special Assistant will assist the\nOperations Team with special projects and other misc. tasks. Typical responsibilities may\ninclude, but are not limited to:\n•\n•\n•\n•\n•\n•\n•\n•\n•\nDriving the Member and other staO members as required for their oOicial duties,\nsometimes before or after typical business hours.\nDriving the Member to and from the airport, sometimes before or after typical\nbusiness hours.\nDeliver and pickup materials for the oOice, including letters, packages, and\ndocuments from other government agencies.\nWorking with the Operations Director to be aware of the Member’s schedule in order\nto prepare the Member for his events/meetings.\nRunning errands and assisting the Operations Team with supplies and other misc.\nadministrative matters.\nAssisting in sorting and delivering mail.\nStaOing the Member at various meetings and events.\nCatering to constituents and VIPs who happen to be in Washington, DC.\nServing as a personal aide to the Member, tending to various needs as they arise\nwhile he is in Washington, DC.\nThe requirements for this position are:\n•\n•\nLocated in Washington, DC.\nRegular, predictable and punctual attendance at assigned locations required for\nperformance of duties.\n\n•\n•\n•\n•\n•\n•\n•\n•\nAbility to communicate eOectively with the Member and oOice staO, Members and\nrepresentatives from other oOices, outside organizations, and others.\nAbility to work outside of traditional business hours as the Member’s schedule\ndictates.\nAbility to handle diOicult and sometimes tense interactions with members of the\npublic, including constituents, with tact while also prioritizing the well-being of the\nMember.\nWork is public-facing and requires frequent interaction with members of the public,\nincluding constituents, in a courteous and tactful manner. Work requires extended\nand unscheduled hours as dictated by the Member’s schedule and oOice needs.\nMust possess a valid driver’s license and have a good driving record. A personal\nvehicle used to drive the Member is not necessarily required.\nRegularly lifts and moves luggage, books, ﬁles, documents, and other oOice\nmaterials.\nMust be able to prioritize and perform duties under pressure in a fast-paced\nenvironment.\nRegularly use typical oOice equipment, software programs, and methods of\ncommunication, including, for example, a computer, email, telephone, smartphone,\nphotocopier, fax machine, etc.\nNebraska ties are preferred but not required for application. Interested applicants may\nsubmit their resume and cover letter to FloodHiring@mail.house.gov. "
    },
    {
        "Post_ID": "MEM-074-25",
        "Posting_Author": "Congressman Jonathan L. Jackson",
        "Congress_Number": null,
        "1 if Democrat": null,
        "1 if woman": null,
        "DW-NOMINATE": null,
        "LES": null,
        "Date_Posted": "2025-02-24",
        "State_District": null,
        "Job_Function": "Press/Digital",
        "Title_Parsed": "Assistant",
        "Office_Type": "Member",
        "Committee_Affiliation": null,
        "Spanish_Language": null,
        "Salary_Min": null,
        "Salary_Max": null,
        "Years_Experience": null,
        "Skills_Mentioned": [
            "social media",
            "graphics",
            "videos",
            "newsletter",
            "press releases",
            "statements",
            "talking points",
            "speeches",
            "graphic design",
            "video editing",
            "writing"
        ],
        "Cleaned_Text": "Press/Digital Assistant—Congressman Jonathan L. Jackson seeks a full-time\nPress/Digital Assistant to work in his Washington, D.C. office. This position reports to the\nCommunications Director.\nResponsibilities:\n• Create and manage content for the Member’s social media platforms, including copy,\ngraphics, and videos\n• Assist with drafting and circulating the Member’s newsletter, press releases, statements,\ntalking points, and speeches\n• Work with the Communications Director to develop content and graphics for franked\ncommunications\n• Monitor news outlets and social media and compile press clips that mention the Member\n• Maintain Chicago and D.C. press lists\n• Handle photography and videography at D.C.-based events\n• Assist with updating the website\nQualifications:\n• Heart for public service and helping others\n• Exceptional attention to detail\n• Strong writing and creative skills\n• Experience in graphic design and video editing\n• An ability to work collaboratively in a fast-paced, team environment\n• Temperament to communicate with a variety of personalities in a friendly and\nprofessional manner\n• Chicago ties and experience in competitive districts are preferred but not required.\n• Experience in Congressional offices of political campaigns preferred but not required.\nThe office is an equal opportunity employer. Please submit a resume and brief cover letter\nto Robert.patillo@mail.house.gov with “LAST NAME - Press/Digital Assistant Application”\nin the subject line. Please do not call or drop by the office."
    },
    {
        "Post_ID": "MEM-072-25",
        "Posting_Author": "Congressman Rob Wittman",
        "Congress_Number": null,
        "1 if Democrat": null,
        "1 if woman": null,
        "DW-NOMINATE": null,
        "LES": null,
        "Date_Posted": "2025-02-24",
        "State_District": "VA-01",
        "Job_Function": "Communications",
        "Title_Parsed": "Press Assistant",
        "Office_Type": "Member",
        "Committee_Affiliation": null,
        "Spanish_Language": null,
        "Salary_Min": null,
        "Salary_Max": null,
        "Years_Experience": null,
        "Skills_Mentioned": [
            "press releases",
            "talking points",
            "email newsletters",
            "website management",
            "graphic design",
            "video editing",
            "social media",
            "photography",
            "writing",
            "organizational skills"
        ],
        "Cleaned_Text": "MEM-072-25\nPress Assistant - The Office of Congressman Rob Wittman (VA-01) is seeking a Press\nAssistant to help execute the congressman’s communications strategy and plan.\nPrimary responsibilities include: drafting press releases and talking points, writing email\nnewsletters for targeted constituent coalitions, promoting the congressman’s district\nevents and engagements, maintaining the communications content calendar, overseeing\nwebsite management and updates, branding through graphic design and video/audio\nediting, managing social media accounts and analyzing their performance metrics, and\nmaintaining the congressman’s photo and video database. They will work with the\ncommunications director to find new ways to grow the congressman’s following, increase\nhis name ID in the district, and maintain synergy across communications materials.\nA strong candidate will be a creative, proactive communicator familiar with social media,\nthe legislative process, website maintenance, as well as photography, graphic design, and\nvideo editing. Excellent writing and organizational skills are required. An ability to multitask\nand work under tight deadlines is necessary. Strong candidates will have previous\ncongressional or political communications experience; ties to Virginia are helpful but not\nrequired. Interested applicants should email a resume, cover letter, and two writing\nsamples to Julianne.Heberlein@mail.house.gov with “Press Assistant” in the subject line."
    },
    {
        "Post_ID": "MEM-071-25",
        "Posting_Author": "Congresswoman Kristen McDonald Rivet",
        "Congress_Number": null,
        "1 if Democrat": 1,
        "1 if woman": 1,
        "DW-NOMINATE": null,
        "LES": null,
        "Date_Posted": "2025-02-24",
        "State_District": "MI-08",
        "Job_Function": "Press/Digital",
        "Title_Parsed": "Assistant",
        "Office_Type": "Member",
        "Committee_Affiliation": null,
        "Spanish_Language": null,
        "Salary_Min": 55000,
        "Salary_Max": 55000,
        "Years_Experience": null,
        "Skills_Mentioned": [
            "social media",
            "graphics",
            "videos",
            "newsletter",
            "press releases",
            "statements",
            "talking points",
            "speeches",
            "graphic design",
            "video editing",
            "writing"
        ],
        "Cleaned_Text": "MEM-071-25\nPress/Digital Assistant - Congresswoman Kristen McDonald Rivet (MI-08) seeks a fulltime Press/Digital Assistant, based in her Washington D.C. office. This position reports to\nthe Communications Director.\n\nResponsibilities:\n• Create and manage content for the Member’s social media platforms, including\ncopy, graphics, and videos\n• Assist with drafting and circulating the Member’s newsletter, press releases,\nstatements, talking points, and speeches\n• Work with Communications Director to develop content and graphics for franked\ncommunications\n• Monitor mentions of the Congresswoman across news outlets and social media,\nand compile press clips\n• Maintain Michigan and D.C. press lists\n• Handle photography and videography at D.C.-based events\n• Assist with updating the website\nQualifications:\n• Heart for public service and helping others\n• Exceptional attention to detail\n• Strong writing and creative skills\n• Experience in graphic design and video editing\n• An ability to work collaboratively in a fast-paced, team environment\n• Temperament to communicate with a variety of personalities in a friendly and\nprofessional manner\n• Michigan ties and experience in competitive districts are preferred but not required\n• Experience in Congressional offices of political campaigns preferred but not\nrequired\nSalary: $55,000 per year\nThe oOice is an equal-opportunity employer. Please submit a resume and brief cover\nletter to tom.grandon@mail.house.gov with “LAST NAME - Press/Digital Assistant\nApplication” in the subject line. Please do not call or drop-by the oOice. $"
    },
    {
        "Post_ID": "MEM-064-25",
        "Posting_Author": "Democratic StaO",
        "Congress_Number": null,
        "1 if Democrat": null,
        "1 if woman": null,
        "DW-NOMINATE": null,
        "LES": null,
        "Date_Posted": "2025-02-24",
        "State_District": null,
        "Job_Function": "Oversight and Investigations",
        "Title_Parsed": "Law Clerk",
        "Office_Type": "Committee",
        "Committee_Affiliation": "Energy and Commerce",
        "Spanish_Language": null,
        "Salary_Min": null,
        "Salary_Max": null,
        "Years_Experience": null,
        "Skills_Mentioned": [
            "research",
            "writing",
            "communication",
            "legal research"
        ],
        "Cleaned_Text": "oversight investigations law clerk the house committee on energy commerce subcommittee oversight investigations democratic stao seeking law clerk summer 2025 assist conducting oversight investigations issues within committee broad jurisdiction law clerks work closely subcommittee counsel professional stao wide range issues related environment energy health care consumer protection sectors paid position responsibilities include assisting preparation congressional hearings contributing management investigations governmental private entities conducting research document review analysis drafting letters memoranda investigative reports coordinating subcommittees full committee ideal candidate least second year law school recent law school graduate detailoriented proactive problemsolver strong communication legal research writing skills women people color veterans lgbtq candidates strongly encouraged apply ooice equal opportunity employer discriminate basis race color religion sex sexual orientation gender identity expression national origin disability military status age marital status parental status law clerks receive stipend applicants may request committee assistance receive credit educational institution apply please submit resume cover letter short writing sample internshipresumeecmailhousegov subject line e c o i law clerk applications due march 21 2025"
    },
    {
        "Post_ID": "MEM-063-25",
        "Posting_Author": "Congresswoman Maxine Dexter, M.D.",
        "Congress_Number": null,
        "1 if Democrat": 1,
        "1 if woman": 1,
        "DW-NOMINATE": null,
        "LES": null,
        "Date_Posted": "2025-02-24",
        "State_District": "OR-03",
        "Job_Function": "Digital/Press",
        "Title_Parsed": "Assistant",
        "Office_Type": "DC",
        "Committee_Affiliation": null,
        "Spanish_Language": null,
        "Salary_Min": 60000,
        "Salary_Max": 70000,
        "Years_Experience": null,
        "Skills_Mentioned": [
            "social media",
            "writing",
            "photography",
            "graphic design",
            "video editing",
            "newsletters",
            "press releases",
            "talking points",
            "scripts",
            "opeds",
            "website content"
        ],
        "Cleaned_Text": "MEM-063-25\nCongresswoman Maxine Dexter, M.D. (OR-03) seeks a creative, proactive Digital/Press\nAssistant in her Washington, D.C. oOice. This is a full-time position.\nThe Digital/Press Assistant reports to the Communications Director and will play a crucial\nrole in executing the oOice’s strategic communications plan, speciﬁcally in executing the\noOice’s social media and digital communications.\nThis position requires a comprehensive understanding of social media trends, superior\nwriting skills, considerable experience with photography, graphic design, and video editing,\nand the ability to work collaboratively in a fast-paced, team environment. Oregon ties are a\nplus but not required.\nThis oOice is an equal-opportunity employer committed to developing an organization that\nis reﬂective of the district that we serve. The oOice does not discriminate on the basis of\nrace, sex, color, age, religion, national origin, sexual orientation, gender identity, or\ndisability.\nKey Responsibilities:\n• Develop and implement the oOice’s digital and social media strategy; create and\nmaintain a consistent stream of digital content for member’s social media\nplatforms and website; includes rapid response\n• Assist with drafting newsletters, press releases, talking points, scripts, opeds/letters to the editor, newsletters, and other written materials\n• Film and edit videos for social media, including Instagram, Facebook, YouTube, etc.\n• Develop and update website content\n• Create/maintain press lists\n• Clip TV appearances, ﬂoor speeches, and other video content for social media.\n• Other tasks as needed\n\n\nSalary range is $60,000-70,000.\nCandidates should submit a resume, cover letter, 2-3 digital samples, mail\nto:OR3Resumes@gmail.com. and with the subject line “Digital/Press Assistant - [Your\nName]” to OR3Resumes@gmail.com. $"
    },
    {
        "Post_ID": "MEM-062-25",
        "Posting_Author": "Congresswoman Kim Schrier",
        "Congress_Number": null,
        "1 if Democrat": 1,
        "1 if woman": 1,
        "DW-NOMINATE": null,
        "LES": null,
        "Date_Posted": "2025-02-24",
        "State_District": "WA-08",
        "Job_Function": "Staff/Press",
        "Title_Parsed": "Assistant",
        "Office_Type": "Member",
        "Committee_Affiliation": null,
        "Spanish_Language": null,
        "Salary_Min": null,
        "Salary_Max": null,
        "Years_Experience": null,
        "Skills_Mentioned": [
            "public service",
            "attention to detail",
            "teamwork",
            "writing",
            "customer service",
            "social media"
        ],
        "Cleaned_Text": "The Office of Congresswoman Kim Schrier seeks a Staff/Press Assistant for her Washington, D.C. office. This position will support office operations as well as assist the Communications Director.\nResponsibilities include: answering phone calls, running the front office and greeting visitors, processing mail, managing the intern program, overseeing tour and flag requests, drafting newsletters and press releases, assisting with social media, updating the webpage, tracking office metrics, and general administrative support.\nApplicants should demonstrate a strong commitment to public service, attention to detail, ability to work as part of a team in a fast-paced environment, excellent writing skills, and a sense of humor. The ideal candidate is highly organized, solution-oriented, and has customer service experience. Prior Hill/Federal government experience and/or communications experience are a plus. Ties to Washington State, and the 8th Congressional District specifically, are preferred but not required. The office is an equal opportunity employer.\nTo be considered, please submit a cover letter, resume, and references as a single PDF to WA08Resumes@gmail.com with “Staff/Press Assistant” in the subject line. In the body of the email please give your favorite fact about Washington State. No phone calls or dropins, please. The deadline to apply is Monday, February 24, 2025."
    },
    {
        "Post_ID": "MEM-054-25",
        "Posting_Author": "Congresswoman Melanie Stansbury",
        "Congress_Number": null,
        "1 if Democrat": 1,
        "1 if woman": 1,
        "DW-NOMINATE": null,
        "LES": null,
        "Date_Posted": "2025-02-24",
        "State_District": "NM-01",
        "Job_Function": "Communications",
        "Title_Parsed": "Advisor",
        "Office_Type": "Member",
        "Committee_Affiliation": "DOGE Subcommittee of the House Oversight Committee",
        "Spanish_Language": null,
        "Salary_Min": null,
        "Salary_Max": null,
        "Years_Experience": null,
        "Skills_Mentioned": [
            "strategic planning",
            "writing",
            "researching",
            "organizational",
            "time-management",
            "project management",
            "coordination"
        ],
        "Cleaned_Text": "MEM-054-25\nCommunications Advisor\nLocation: Washington, D.C.\nCongresswoman Melanie Stansbury (NM-01) is hiring a strategic Communications Advisor\nto support her OOice’s work on the DOGE Subcommittee of the House Oversight\nCommittee and on behalf of New Mexico’s First Congressional District.\nThis is not an entry level position. Previous experience on Capitol Hill and/or high-level\npolitical communications experience is required, along with a solid understanding of\nCongress and the legislative process.\nStrong preference for New Mexico ties, where possible. This Communications Advisor will\nbe joining a dedicated, hard-working, and upbeat team working to defend our democracy\nand serving the state of New Mexico. This role will require strong coordination and writing\nskills.\nThis Communications Advisor will report to the Communications Director and work closely\nwith the Congresswoman’s Leadership, Legislative and District OOice teams to develop\nand execute a coordinated communications plan to keep the public and constituents\ninformed on critical matters before Congress and aOecting the state.\nJob responsibilities will include strategic planning, drafting speeches, written remarks,\npress statements, and more:\nThe ideal candidate will also possess the following:\n• Exceptional writing and researching skills.\n• Ability to work long hours (including weekends and evenings as needed), under pressure,\nwhile remaining collaborative and eOective.\n• Thoroughness and attention to detail.\n• Discretion and sound judgment.\n• An independent self-starter and team-player.\n• Strong organizational, time-management, and project management skills with the ability\nto juggle multiple priorities simultaneously.\n• Self-starting, high dependability, adaptability, and organization skills.\nThis oOice is an equal opportunity employer and does not discriminate on the basis of race,\nsex (including marital or parental status), color, age, religion, national origin, sexual\norientation, gender identity, or disability.\nInterested candidates must submit a resume to repstansburyresumes@mail.house.gov by\nMarch 7 with the following subject line: “Last Name – Communications Advisor.” Interviews\nwill be conducted on a rolling basis.\n\n\nOut of fairness to all candidates, those who do not submit their materials to this email will\nnot be considered. Qualiﬁed candidates should submit a single PDF saved with\nLastName.FirstName.CommunicationsAdvisor to include:\n1. Cover letter\n2. Resume\n3. Two writing samples"
    },
    {
        "Post_ID": "MEM-053-25",
        "Posting_Author": null,
        "Congress_Number": null,
        "1 if Democrat": null,
        "1 if woman": null,
        "DW-NOMINATE": null,
        "LES": null,
        "Date_Posted": "2025-02-24",
        "State_District": null,
        "Job_Function": "Legal",
        "Title_Parsed": "Counsel to the Subcommittee on Capital Markets",
        "Office_Type": "Committee",
        "Committee_Affiliation": "Financial Services",
        "Spanish_Language": null,
        "Salary_Min": null,
        "Salary_Max": null,
        "Years_Experience": 5,
        "Skills_Mentioned": [
            "legal research",
            "legislation drafting",
            "policy analysis",
            "communication",
            "analytical",
            "writing",
            "interpersonal",
            "congressional procedures",
            "legislative process"
        ],
        "Cleaned_Text": "the house committee on financial services is seeking an experienced securities attorney to serve as counsel to the subcommittee on capital markets of the house committee on financial services. position overview: the counsel will play a vital role in advancing the subcommittee's work on capital formation and sec institutional reforms, among other issue areas. the counsel will work closely with committee leadership and stao to develop legislation and policy initiatives. key responsibilities: - conduct comprehensive legal research and analysis to support the subcommittee's initiatives - draft and review legislation within the subcommittee's jurisdiction - represent the subcommittee in meetings with members of congress, interest groups, government agencies, and other stakeholders - analyze complex documents, legislation, and regulatory materials to prepare briefng materials for committee members and stao - provide legal counsel to the chairman - develop briefng papers and policy documents - prepare and support committee hearings and markups - contribute to additional projects based on expertise and interests qualifcations required: - juris doctor (jd) degree from an accredited law school - active membership in good standing with a state bar - minimum 5 years of experience - strong understanding of federal securities laws and regulations - excellent analytical, research, and writing skills - outstanding interpersonal and communication abilities - demonstrated ability to manage multiple complex projects simultaneously - experience in analyzing and drafting legislation  preferred: - prior experience at the securities and exchange commission (sec) - background in capital markets regulation and policy - legislative or government aoairs experience - knowledge of congressional procedures and legislative process additional information: this position oOers signifcant opportunity for professional growth and the ability to shape the role based on expertise and interest. work is conducted collaboratively as part of a dynamic team environment, with shared responsibilities and opportunities for crossfunctional engagement. how to apply: please email zach.gates@mail.house.gov to apply with a resume and cover letter."
    },
    {
        "Post_ID": "MEM-051-25",
        "Posting_Author": "Representative Greg Landsman",
        "Congress_Number": null,
        "1 if Democrat": null,
        "1 if woman": null,
        "DW-NOMINATE": null,
        "LES": null,
        "Date_Posted": "2025-02-24",
        "State_District": "OH-01",
        "Job_Function": "Communications and Office Logistics",
        "Title_Parsed": "District Staff Assistant",
        "Office_Type": "District",
        "Committee_Affiliation": null,
        "Spanish_Language": null,
        "Salary_Min": 45000,
        "Salary_Max": 55000,
        "Years_Experience": null,
        "Skills_Mentioned": [
            "graphic design",
            "video production",
            "photography",
            "social media",
            "writing",
            "communication",
            "customer service",
            "time management",
            "organizational skills",
            "driving"
        ],
        "Cleaned_Text": "MEM-051-25\nDISTRICT STAFF ASSISTANT - Communications and OOice Logistics\nThe OOice of U.S. Representative Greg Landsman (OH-01) seeks an organized and\nproactive professional to serve as a StaO Assistant in our Cincinnati and Lebanon, OH\noOices.\nThis position is responsible for driving the Congressman to and from the airport on ﬂy-in\nand ﬂy-out days and to and from district events. Additionally, the role serves as a critical\npart of the communications team, capturing photos; videos and writing copy for the\nCongressman’s social media and public communications. Lastly, this role will support\ndistrict oOice operations by serving as the point of contact for oOice logistics, including\nmanaging equipment, shipping and receiving supplies, and essential IT support, such as\nhelping with onboarding and oOboarding new hires and interns.\nCandidates for this role should have an exceptional driving record, a car, and car insurance.\nThey should also have a background in graphic design, video production, photography, or\nsocial media. The ideal candidate should also possess strong writing and communication\nskills, exceptional customer service; time management and organizational skills, paying\nclose attention to detail. The ability to prioritize and follow through on multiple competing\npriorities in a fast-paced environment is foundational to working in the oOice.\nA valid U.S. driver’s license and consistent access to a vehicle are required for the position.\nCandidates of diverse backgrounds are encouraged to apply. The oOice is an equalopportunity employer and does not discriminate based on race, color, religion, sex, sexual\norientation, gender identity, national origin, disability, military status, age, marital status, or\nparental status.\n\n\nSalary range is $45,000-$55,000, commensurate with experience.\nApplications will be accepted on a rolling basis. To apply, please email\nreginald.harris@mail.house.gov with “StaO Assistant” in the subject line and the following\napplication materials attached as one combined PDF:\n• Cover letter\n• Résumé\n• Two references including name, current title and organization, phone number,\nemail, and a one-sentence description of your relationship to the reference (we will\nnot contact these references without reaching out to you for your approval)\n• An attachment or link to any video editing, photography, and/or social media\ncontent entirely produced by the applicant\nNo phone calls or drop bys, please. $"
    },
    {
        "Post_ID": "MEM-047-25",
        "Posting_Author": "Scott Abrams",
        "Congress_Number": null,
        "1 if Democrat": null,
        "1 if woman": null,
        "DW-NOMINATE": null,
        "LES": null,
        "Date_Posted": "2025-02-24",
        "State_District": "CA-32",
        "Job_Function": "Casework",
        "Title_Parsed": "Caseworker",
        "Office_Type": "District",
        "Committee_Affiliation": null,
        "Spanish_Language": null,
        "Salary_Min": 45000,
        "Salary_Max": null,
        "Years_Experience": null,
        "Skills_Mentioned": [
            "writing",
            "typing",
            "interpersonal skills",
            "Microsoft Office",
            "database software"
        ],
        "Cleaned_Text": "The OOice of Congressman Brad Sherman (CA-32) is seeking to ﬁll a job opening for a\nCaseworker position in the (Sherman Oaks) district oOice.\nCaseworker responsibilities include: Interact with constituents via phone, email and inoOice meetings; Assist senior staO with administrative responsibilities; Input, ﬁle and\nreview constituent inquiries; Contact federal agencies on behalf of constituents.\nApplicant should be organized, professional, highly motivated and must possess strong\nwriting, typing and interpersonal skills. Must be able to work in a fast-paced environment\nand meet deadlines. Proﬁciency with Microsoft OOice and database software preferred.\nPosition is entry-level, but past experience in a social work or government ﬁeld is preferred.\nCandidate should have graduated from an accredited four-year college or university with a\nbachelor's degree.\nSalary starts at $45,000 annually, with additional considerations made for relevant\nexperience. We oOer a generous student loan reimbursement package.\nPlease submit cover letter and resume attn: Scott Abrams to\nscott.abrams@mail.house.gov . No calls please"
    },
    {
        "Post_ID": "MEM-046-25",
        "Posting_Author": "The House Committee on Homeland Security Republican StaO",
        "Congress_Number": null,
        "1 if Democrat": null,
        "1 if woman": null,
        "DW-NOMINATE": null,
        "LES": null,
        "Date_Posted": "2025-02-24",
        "State_District": null,
        "Job_Function": "Counsel",
        "Title_Parsed": "Counsel or Professional StaT Member",
        "Office_Type": "Committee",
        "Committee_Affiliation": "Homeland Security",
        "Spanish_Language": null,
        "Salary_Min": null,
        "Salary_Max": null,
        "Years_Experience": 2,
        "Skills_Mentioned": [
            "congressional oversight",
            "investigations",
            "drafting",
            "correspondence",
            "depositions",
            "transcribed interviews",
            "legislation",
            "research",
            "written communication",
            "oral communication"
        ],
        "Cleaned_Text": "The House Committee on Homeland Security Republican StaO is hiring for a Counsel (JD required) or Professional StaT Member supporting the Director of Investigations and the Subcommittee on Oversight, Investigations, and Accountability.\nThe ideal candidate will have at least two years of experience with a background or strong interest in congressional oversight and investigations. Experience in homeland security issues is a plus.\nResponsibilities include, but are not limited to, staOing Subcommittee and some Full Committee congressional hearings, drafting Subcommittee and some Full Committee correspondence to and from the Executive Branch as well as with outside organizations, conducting depositions/ transcribed interviews, reviewing document productions, legislation, research, managing external sources of information, and interacting with various congressional committee and personal oOices.\nCandidates must possess a strong work ethic, superior attention to detail, be selfmotivated, work well under pressure, and possess excellent written and oral communication skills. The ability to work both independently and as part of a team are critical. Prior Hill experience preferred. Interested candidates should send a resume and cover letter to Resumes.CHS@mail.house.gov with the subject line “OIA Counsel <Applicant First and Last Name> - OIA Counsel” or “OIA PSM - <Applicant First and Last Name>.”"
    },
    {
        "Post_ID": "MEM-043-25",
        "Posting_Author": "Office of General Counsel",
        "Congress_Number": null,
        "1 if Democrat": null,
        "1 if woman": null,
        "DW-NOMINATE": null,
        "LES": null,
        "Date_Posted": "2025-02-24",
        "State_District": null,
        "Job_Function": "General Counsel",
        "Title_Parsed": "Associate/Assistant General Counsel",
        "Office_Type": "Member",
        "Committee_Affiliation": null,
        "Spanish_Language": null,
        "Salary_Min": 176000,
        "Salary_Max": 204500,
        "Years_Experience": 3,
        "Skills_Mentioned": [
            "drafting",
            "litigation",
            "legal research",
            "analytical",
            "writing",
            "people skills",
            "counseling"
        ],
        "Cleaned_Text": "MEM-043-25\nPositions Available: Associate General Counsel/Assistant General Counsel\nSalary Level/Range: $176,000-$204,500\nThe Office of General Counsel (“OGC”), which provides legal advice and representation to\nMembers, committees, officers, and employees of the House on matters related to their\nofficial duties without regard to political affiliation, is accepting applications for the\nposition of Associate General Counsel/Assistant General Counsel.\nCore responsibilities include: drafting district court pleadings and appellate briefs;\nappearing in court in litigation matters in which the House or individual Members, officers,\nor employees have an official interest; analyzing legal problems presented by House\nMembers, committees, officers, and employees, and formulating recommended\nsolutions; advising and counseling House Members, committees, officers, and employees\non a wide range of legal issues; gathering facts necessary to permit OGC to provide sound\nlegal advice; interacting with House leadership, committees, and other House offices;\ninteracting with opposing counsel (both government and private); representing witnesses\nin connection with investigative proceedings; performing legal research on issues of\nconstitutional, statutory, and common law; and working closely with other OGC attorneys\nand support staff in performing these functions.\nQualifications:\nMinimum Requirements: (1) excellent academic credentials; (2) at least three years’\nexperience as a practicing attorney, including any judicial clerkships; (3) excellent writing,\n\n\nanalytical, and people skills; (4) excellent judgment; (5) ability to work with, and to provide\nhigh quality legal advice and representation to, House Members, committees, officers, and\nemployees, without regard to political affiliation; and (6) appreciation of—or at least the\ndesire to learn about and understand—the role and functioning of the Legislative Branch.\nPreferred Qualifications: (1) judicial clerkship or other government experience; (2)\nexperience drafting dispositive motions in federal district courts and/or briefs in federal\ncourts of appeals; and (3) understanding of structure and operations of the Federal\nGovernment, particularly the House of Representatives and the Department of Justice.\nInformation about OGC is available at https://ogc.house.gov\nPlease email your application consisting of: cover letter, resume, law school transcript, list\nof references, and writing sample to OGC.Employment@mail.house.gov. Application\ndeadline, Wednesday, February 26, 2025.\nApplications will be considered on a rolling basis between now and the deadline. Please\ninclude in the email subject line “Associate General Counsel/Assistant General Counsel\nVacancy.” $"
    },
    {
        "Post_ID": "MEM-042-25",
        "Posting_Author": "Congressman Gabe Vasquez",
        "Congress_Number": 118,
        "1 if Democrat": 1,
        "1 if woman": 0,
        "DW-NOMINATE": null,
        "LES": null,
        "Date_Posted": "2025-02-24",
        "State_District": "NM-02",
        "Job_Function": "Scheduler",
        "Title_Parsed": "Scheduler",
        "Office_Type": "DC",
        "Committee_Affiliation": null,
        "Spanish_Language": 1,
        "Salary_Min": null,
        "Salary_Max": null,
        "Years_Experience": null,
        "Skills_Mentioned": [
            "organizational",
            "prioritizing",
            "managing multiple tasks",
            "travel coordination"
        ],
        "Cleaned_Text": "The OOice of Congressman Gabe Vasquez (NM-02) seeks an experienced, highly organized, and detail-oriented Scheduler to be based in his Washington, DC oOice. This is not an entry-level position. Candidates must have exceptional organizational skills, meticulous attention to detail, expertise prioritizing and managing multiple tasks under tight deadlines, and the ability to work under pressure in a fast-paced environment for a battleground Member.\nThe Scheduler serves as a key player of the team by managing the Member’s time. This role reports to and works closely with the Chief of StaO but is expected to be a leader and team player in coordinating closely with the full team regarding the Member’s schedule.\nCore Responsibilities\n•\n•\n\n•\nEvaluating, organizing, and responding to all incoming meeting and event requests in coordination with the Chief of StaO in a timely manner.\nMaintains the Member’s daily and long-term schedule, coordinates travel, and acts as a liaison for the Member with other congressional oOices, constituents, and stakeholders.\nBriefs the Member weekly on upcoming events, meetings, and other scheduling matters in Washington, DC and New Mexico.\n\n\n•\nCollaborates with the Member and Senior StaO to determine and ﬁnalize the Member’s daily and long-term schedules, and collect brieﬁng materials (e.g., memos, talking points, and speeches).\n•\nManages Member and oOice operations in Washington, D.C. including coordination of Member movements, meetings, and oO-campus events.\n•\nWorks closely with ﬁnancial administrator for travel and oOicial expenses.\n•\nReports directly to the Chief of StaO and Member.\nQualiﬁcations: The ideal candidate will have congressional work experience and prior scheduling experience. New Mexico ties and Spanish-language proﬁciency are a plus.\nTo apply, please send a cover letter and resume as a single document to\nNM02applications@mail.house.gov with “Scheduler: [Your Name]” as the subject line.\nThis office is an equal opportunity employer; the office does not discriminate on the basis of race, color, religion, national origin, sex, gender identity or expression, sexual orientation, age, disability, or military status, or any other characteristic protected by applicable law."
    },
    {
        "Post_ID": "MEM-040-25",
        "Posting_Author": "Congressman Rob Wittman",
        "Congress_Number": null,
        "1 if Democrat": null,
        "1 if woman": null,
        "DW-NOMINATE": null,
        "LES": null,
        "Date_Posted": "2025-02-24",
        "State_District": "VA-01",
        "Job_Function": "Legislative",
        "Title_Parsed": "Director",
        "Office_Type": "DC",
        "Committee_Affiliation": "Natural Resources",
        "Spanish_Language": null,
        "Salary_Min": null,
        "Salary_Max": null,
        "Years_Experience": 5,
        "Skills_Mentioned": [
            "legislative strategy",
            "policy papers",
            "research",
            "communication",
            "writing",
            "drafting legislation",
            "relationship building"
        ],
        "Cleaned_Text": "MEM-040-25\nOverview: Congressman Rob Wittman is seeking a highly motivated and experienced\nLegislative Director to lead his legislative agenda and coordinate policy initiatives in his\nWashington, D.C. oOice. The Legislative Director would handle the Congressman’s Natural\nResources Committee assignment, as well as Energy, Environment and Chesapeake Bay,\nTax, Telecom/Broadband, Transportation & Infrastructure, Appropriations and the Budget,\nImmigration, Labor/Workforce/Federal Employees. In addition, the Legislative Director will\nhave a close working relationship with the Chief of StaO in building and maintaining\nrelationships with other lawmakers, committee staO, and advocacy groups.\nThe Legislative Director should be knowledgeable about issues relating to Virginia and VA01, and work closely with the District Director and district stakeholders, including local\nleaders, businesses, and community organizations, to understand their needs and\nincorporate their perspectives into legislative eOorts. Most importantly, the Legislative\nDirector should have a genuine commitment to public service and advocating for the best\ninterests of Virginia’s First District.\nKey Responsibilities:\n• Develop and implement a comprehensive legislative strategy aligned with the\nCongressman’s priorities and constituents' needs.\n• Manage and mentor a legislative team, provide guidance, and foster collaboration\namong staO members.\n• Build and maintain relationships with other lawmakers, committee staO, advocacy\ngroups, and stakeholders to advance the Congressman’s legislative goals.\n\n\n•\n•\n•\n•\n•\n•\n•\n\nEngage with district stakeholders, including local leaders, businesses, and\ncommunity organizations, to understand their needs and incorporate their\nperspectives into legislative eOorts.\nUnderstand the political landscape and anticipate the implications of legislative\nactions as it relates to VA-01.\nDraft legislation, amendments, and policy papers, ensuring clarity and adherence to\ncongressional procedures.\nMaints up-to-date tracking reports on all legislative items including Sponsored\nand Cosponsored legislation and letters, provisions in larger bills, and district wins.\nReview responses to all constituent mail, and review content produced by the\ncommunications team.\nRepresent the Congressman in meetings with constituents, interest groups, and\nother legislative oOices.\nMonitor legislative developments and provide timely updates to the Congressman\nand his staO.\n\nQualiﬁcations:\n• Minimum of 5 years of experience in legislative aOairs, public policy, or a related\nﬁeld, preferably in a congressional oOice.\n• Strong understanding of the legislative process and federal government operations.\n• Excellent writing, research, and communication skills.\n• Proven ability to work collaboratively in a fast-paced environment and manage\nmultiple priorities.\n• Commitment to public service and the values of Congressman Wittman.\n• Virginia ties Preferred\nInterested candidates should send a resume, cover letter, and references to\nCarolyn.King@mail.house.gov with the subject line “Legislative Director Application.” $"
    },
    {
        "Post_ID": "MEM-036-25",
        "Posting_Author": "A conservative Midwest Member of Congress",
        "Congress_Number": null,
        "1 if Democrat": null,
        "1 if woman": null,
        "DW-NOMINATE": null,
        "LES": null,
        "Date_Posted": "2025-02-24",
        "State_District": null,
        "Job_Function": "Legislative",
        "Title_Parsed": "Director",
        "Office_Type": "Member",
        "Committee_Affiliation": null,
        "Spanish_Language": null,
        "Salary_Min": null,
        "Salary_Max": null,
        "Years_Experience": null,
        "Skills_Mentioned": [
            "moving legislation",
            "Capitol Hill experience",
            "writing",
            "management",
            "Microsoft suite",
            "detail oriented",
            "multitasker"
        ],
        "Cleaned_Text": "MEM-036-25\nLegislative Director Job Listing\nDescription\nA conservative Midwest Member of Congress has an immediate need to hire an\nexperienced full-time Legislative Director in the Washington, D.C. oOice. Interested\ncandidates are encouraged to email their resume, cover letter, and references to\nConservativeRep@mail.house.gov. Please use ‘Legislative Director’ as the subject line, and\nin the body of the email, please indicate where you found this job description.\nResponsibilities\nThis Legislative Director plays an essential leadership role in the oOice. This position works\nclosely with the Chief of StaO in assisting with the formulation of the Member’s policy and\nlegislative strategy and moving the Member’s legislation. The Legislative Director will also\nwork with the Communications Director to ensure that the Member’s legislative strategy is\nincorporated into the oOice’s communications plan. Additionally, the Legislative Director\nmay also manage and oversee the performance of the legislative team.\nPreferred Qualiﬁcations (not a comprehensive list)\n• Prior Legislative Director Experience\n• Proﬁcient at moving legislation\n• Capitol Hill experience\n• Great writer\n• Management Experience\n• Proﬁcient at Microsoft suite\n• Detail oriented\n• Multitasker"
    },
    {
        "Post_ID": "MEM-035-25",
        "Posting_Author": "House Committee on Veterans’ AOairs",
        "Congress_Number": null,
        "1 if Democrat": null,
        "1 if woman": null,
        "DW-NOMINATE": null,
        "LES": null,
        "Date_Posted": "2025-02-24",
        "State_District": null,
        "Job_Function": "Health",
        "Title_Parsed": "Professional StaT Member",
        "Office_Type": "Committee",
        "Committee_Affiliation": "Veterans’ AOairs (Majority), Subcommittee on Health",
        "Spanish_Language": null,
        "Salary_Min": null,
        "Salary_Max": null,
        "Years_Experience": null,
        "Skills_Mentioned": [
            "research",
            "drafting legislation",
            "communication skills",
            "problem solving"
        ],
        "Cleaned_Text": "MEM-035-25\nHouse Committee on Veterans’ AOairs (Majority)\nSubcommittee on Health\nProfessional StaT Member\nThe Majority staO of the House Committee on Veterans' AOairs is seeking a Professional\nStaO Member for the Subcommittee on Health. This position will support the\nSubcommittee StaO Director in conducting oversight of and drafting legislation related to\nthe Department of Veterans AOairs’ (VA) including its Veterans Health Administration (VHA),\nthe largest integrated health care system in the United States, providing care at 1,380\nhealth care facilities. The role involves research, drafting legislation, leading oversight\nincluding trips to VA facilities, leading engagements with outside stakeholders, and other\nduties as assigned. Candidates with healthcare experience or prior medical experience are\n\n\nstrongly preferred. Veterans are strongly encouraged to apply. This is a full-time, on-site\nposition in Washington, DC. Some domestic travel is required.\nCore Responsibilities:\n• Leading oversight including organizing and participating in meetings, drafting memos,\nreading documents, limited domestic travel, and other oversight duties as assigned.\n• Conducting research to support oversight and legislative activities.\n• Leading legislation drafting eOorts.\n• Representing the Committee including meeting with other congressional staO, veteran\nservice organizations, and external healthcare stakeholders.\n• Perform other duties as assigned by the Subcommittee StaO Director, Committee StaO\nDirector, or Committee Deputy StaO Director.\nQualiﬁcations:\n• Undergraduate degree\n• Veterans are strongly encouraged to apply\n• Post-graduate-level writing skills\n• Excellent oral communication skills\n• Thoroughness and attention to detail\n• Problem solving skills\n• Ability to work long hours, under pressure, while remaining cooperative and courteous\n• Work independently as well as in teams\n• This is a full-time, on-site position in Washington, DC.\n• Some domestic travel is required.\nBeneﬁts (as eligible):\n• Sick and Annual Leave\n• Federal Employees Health Beneﬁts Program\n• Thrift Savings Plan\n• Federal Employees' Group Life Insurance Program\n• Federal Long-Term Care Insurance\n• Flexible Spending Accounts (FSAFEDS)\n• Dental & Vision Insurance Program (FEDVIP)\n• Student Loan Repayment Program\nOther Information:\nEmployment with the U.S. House of Representatives is at-will. The U.S. House of\nRepresentatives is an equal opportunity employer. All applicants will be considered\nwithout regard to race, color, national origin, religion, sex (including marital or parental\nstatus), disability, or age. Transportation and all related travel expenses associated with the\ninterview and hiring process must be paid by the applicant.\n\n\nHow to Apply:\nQualiﬁed candidates should send their resume to VAR.Resumes@mail.house.gov with\n“Health PSM” in the subject line. Please include a short description of why you are\ninterested in the position in the body of the email. Writing and editing tests, and references\nmay be requested. No calls or walk-ins, please.\nWhat to Expect Next:\nYour resume will be reviewed to determine if you are among the top candidates. If you are\none of the top candidates, you will be contacted for an interview. "
    },
    {
        "Post_ID": "MEM-034-25",
        "Posting_Author": "House Committee on Veterans’ Affairs (Majority)",
        "Congress_Number": null,
        "1 if Democrat": null,
        "1 if woman": null,
        "DW-NOMINATE": null,
        "LES": null,
        "Date_Posted": "2025-02-24",
        "State_District": null,
        "Job_Function": "Contracts",
        "Title_Parsed": "Investigator",
        "Office_Type": "Committee",
        "Committee_Affiliation": "Veterans’ Affairs",
        "Spanish_Language": null,
        "Salary_Min": null,
        "Salary_Max": null,
        "Years_Experience": null,
        "Skills_Mentioned": [
            "government procurement",
            "contracting",
            "acquisition",
            "Federal Acquisition Regulation",
            "writing",
            "editing",
            "proofreading",
            "oral communication",
            "policy"
        ],
        "Cleaned_Text": "MEM-034-25\nHouse Committee on Veterans’ ATairs (Majority) Contracts Investigator\nThe House Committee on Veterans’ AOairs Majority staO seeks a subject matter expert on\ngovernment procurement, contracting, and acquisition.\nCore Responsibilities:\n•\n\n•\n\n•\n•\n•\n\nUnder the supervision of the General Counsel for the Committee, the individual will\nconduct oversight and develop policies relating to Department of Veterans AOairs\n(VA) procurement, contracting, and acquisition.\nThe responsibilities encompass the entire VA, which includes the Veterans Beneﬁts\nAdministration, Veterans Health Administration, National Cemetery Administration,\nand VA Central OOice organizations. This also covers a wide range of activities such\nas small-dollar procurement, contracting by negotiation, major acquisition, Federal\nSupply Schedules, category management, construction, leasing, information\ntechnology, health care, research and development, and small business.\nCollect technical information and translate it into brieﬁngs, memoranda, hearing\nmaterials, and policy recommendations for a general audience.\nMeet with congressional staO, veteran service organizations, industry organizations,\nand internal and external stakeholders.\nPerform other duties as assigned by the General Counsel, Committee Deputy StaO\nDirector, and Committee StaO Director.\n\nQualiﬁcations:\n•\n•\n•\n•\n•\n\nUndergraduate degree\nWork experience in procurement operations, preferably as a contract specialist or\ncontracting oOicer in a federal agency\nCommand of the Federal Acquisition Regulation and familiarity with major\nprocurement laws\nExcellent writing, editing, and proofreading skills\nExcellent oral communication skills\n\n\n\n•\n•\n•\n•\n•\n•\n\nThoroughness and attention to detail\nDiscretion and sound judgment in formulating and recommending policy positions\nAbility to work long hours, under pressure, while remaining cooperative and\ncourteous\nWork independently as well as in teams\nThis is a full-time, on-site position in Washington, DC.\nSome domestic travel is required.\n\nBeneﬁts:\n•\n•\n•\n•\n•\n•\n•\n•\n•\n\nSick and Annual Leave\nFederal Employees Health Beneﬁts Program\nThrift Savings Plan\nFederal Employees Group Life Insurance Program\nFederal Long-Term Care Insurance\nFlexible Spending Accounts (FSAFEDS)\nDental & Vision Insurance Program (FEDVIP)\nFederal Transit Beneﬁt or parking\nStudent Loan Repayment Program\n\nOther Information:\nEmployment with the U.S. House of Representatives is at-will. The U.S. House of\nRepresentatives is an equal opportunity employer. All applicants will be considered\nwithout regard to race, color, national origin, religion, sex (including marital or parental\nstatus), disability, or age. Veterans are strongly encouraged to apply. Transportation and all\nrelated travel expenses associated with the interview and hiring process must be paid by\nthe applicant.\nHow to Apply:\nInterested candidates should send their cover letter and resume\nto VAR.Resumes@mail.house.gov with “Contracts Investigator “in the subject line. Writing\nsamples and references may be requested. No calls or walk-ins, please."
    },
    {
        "Post_ID": "MEM-033-25",
        "Posting_Author": "Congresswoman Alma S. Adams (NC12)",
        "Congress_Number": null,
        "1 if Democrat": 1,
        "1 if woman": 1,
        "DW-NOMINATE": null,
        "LES": null,
        "Date_Posted": "2025-02-24",
        "State_District": "NC12",
        "Job_Function": "Scheduler",
        "Title_Parsed": "Scheduler",
        "Office_Type": "Member",
        "Committee_Affiliation": null,
        "Spanish_Language": null,
        "Salary_Min": null,
        "Salary_Max": null,
        "Years_Experience": null,
        "Skills_Mentioned": [
            "time management",
            "prioritize",
            "manage competing demands",
            "communication",
            "organization",
            "scheduling",
            "travel arrangements",
            "briefing",
            "administrative support"
        ],
        "Cleaned_Text": "the office of congresswoman alma s. adams (nc12) seeks an experienced, highly organized, and detail-oriented scheduler for her washington, dc office. this is not an entry-level position. the ideal candidate will possess exceptional time management skills, the ability to prioritize and manage competing demands, and the capacity to perform well under pressure in a fast-paced environment. the scheduler is responsible for managing the congresswoman’s complex schedule, organizing official travel, and acting as a liaison with various stakeholders, including constituents, fellow members of congress, distinguished guests, and leaders from public, private, and nonprofit sectors. the scheduler will work closely with the member, chief of staff, and deputy chief of staff/district director to ensure the smooth coordination of the member's day-to-day activities and long-term commitments. key responsibilities: 1. scheduling & coordination: o manage and maintain the congresswoman’s daily and long-term schedule, ensuring all appointments, meetings, events, and travel are accounted for. o receive, prioritize, and organize incoming scheduling requests from internal and external stakeholders. o communicate with external organizations, constituents, and other congressional offices to coordinate scheduling requests, events, and meetings. o maintain flexibility to accommodate changes to the schedule throughout the day and ensure the congresswoman is briefed on updates in real time. o ensure that all meetings, events, and activities are properly logged and tracked. 2. travel & logistics: o coordinate all travel arrangements for the congresswoman, including transportation, lodging, and related logistics. o work with the chief of staff and deputy chief of staff to coordinate travel schedules and ensure seamless transitions between office duties and travel commitments. o manage travel-related expenses, including collecting receipts and submitting for reconciliation with the financial administrator. 3. briefing & preparation: o work with the member and relevant staff to prepare daily briefing materials, including key meeting objectives, background information, and travel logistics. o provide daily and weekly briefings to the congresswoman on upcoming events, meetings, and other scheduling matters. 4. liaison & communication: o serve as the primary point of contact for coordinating scheduling with key stakeholders, including members of congress, congressional staff, government officials, donors, advocates, and other influential partners. o ensure timely and professional communication with constituents, including responding to scheduling inquiries and arranging meetings or office visits as appropriate. o collaborate with other congressional offices, leadership staff, and external organizations to ensure seamless scheduling and minimize conflicts. 5. administrative support: o track and manage the congresswoman’s messages, telephone calls, and emails as requested, ensuring timely follow-up, follow-through and prioritization. o assist with administrative tasks as needed, including drafting correspondence, managing schedules, and other office support functions. salary & benefits: • salary: commensurate with experience. • benefits: eligible for transit benefits, student loan repayment assistance, and other standard congressional office benefits. additional benefits to be discussed during the interview process. application process: qualified candidates should submit a cover letter, a resume, and three references to nc12.resume@mail.house.gov with “[name] –scheduler” in the subject line."
    },
    {
        "Post_ID": "MEM-032-25",
        "Posting_Author": "Congresswoman Janelle Bynum",
        "Congress_Number": null,
        "1 if Democrat": null,
        "1 if woman": 1,
        "DW-NOMINATE": null,
        "LES": null,
        "Date_Posted": "2025-02-24",
        "State_District": "OR-5",
        "Job_Function": "Legislative",
        "Title_Parsed": "Assistant",
        "Office_Type": "Member",
        "Committee_Affiliation": null,
        "Spanish_Language": null,
        "Salary_Min": null,
        "Salary_Max": null,
        "Years_Experience": null,
        "Skills_Mentioned": [
            "legislative initiatives",
            "communications",
            "monitor legislative developments",
            "briefing materials",
            "appropriations process",
            "customer service",
            "entrepreneurial skills"
        ],
        "Cleaned_Text": "MEM-032-25\nCongresswoman Janelle Bynum (OR-5) seeks a Legislative Assistant to join her\nWashington, D.C. office. The position will primarily be responsible for managing an active\npolicy portfolio based on both the office’s needs and the selected candidate’s interests.\nThe Congresswoman’s priorities include advocating for family-first policies, lowering the\ncost of living, promoting economic growth, and making government work better for all\nAmericans. This position will not handle the House Financial Services Committee portfolio.\nResponsibilities\n• Develop legislative initiatives and collaborate closely with the legislative and\ncommunications teams to advance the Congresswoman’s priorities.\n• Monitor legislative developments in Congress and the Administration and provide vote\nrecommendations.\n• Meet with constituents and advocacy groups, draft briefing materials, and prepare talking\npoints.\n• Staff the Congresswoman at relevant meetings and events.\n• Other tasks as assigned\nThis is not an entry-level position and previous relevant policy and/or Capitol Hill\nexperience is required. Oregon-ties are a plus.\nPreference will be given to candidates who understand the appropriations process, have a\ncustomer service-first attitude, and can anticipate the evolving needs of a battleground\nmember. Successful candidates are those who have a constant appetite to learn about\n\n\nlegislative processes, possess entrepreneurial skills, and demonstrate the ability to adapt\nto the fast-paced environment of a new member office.\nOur office is committed to diversity and does not discriminate based on race, color,\nreligion, sex, sexual orientation, gender identity, disability, age, or national origin. We\nencourage candidates from diverse backgrounds to apply.\nTo apply, please send in a single PDF: cover letter, resume, and contact information for\nthree professional references to BynumOregonJobs@gmail.com with the subject line\n“Legislative Assistant – [Your Name].” The office will contact the most qualified candidates\nto begin the interview process on a rolling basis."
    },
    {
        "Post_ID": "MEM-026-25",
        "Posting_Author": "Congressman Greg Steube",
        "Congress_Number": null,
        "1 if Democrat": null,
        "1 if woman": null,
        "DW-NOMINATE": null,
        "LES": null,
        "Date_Posted": "2025-02-24",
        "State_District": null,
        "Job_Function": "Communications",
        "Title_Parsed": "Director",
        "Office_Type": null,
        "Committee_Affiliation": null,
        "Spanish_Language": null,
        "Salary_Min": null,
        "Salary_Max": null,
        "Years_Experience": null,
        "Skills_Mentioned": [
            "media relations",
            "content creation",
            "digital strategy",
            "writing",
            "strategic thinking",
            "management",
            "social media",
            "digital advertising",
            "video content creation",
            "budget management"
        ],
        "Cleaned_Text": "communications director congressman greg steube is seeking an experienced, highly motivated communications director to spearhead the office’s strategic communications efforts. this individual will manage all aspects of media relations, content creation, and digital strategy. the ideal candidate will be an exceptional writer, a strong strategic thinker, and a skilled manager who thrives in a fast-paced environment. key responsibilities: • pitch and book local and national media regularly to ensure strong and consistent coverage. • develop and maintain strong relationships with local and national press to amplify the congressman’s message. • create daily social media content (including graphic design) and write compelling statements, press releases, media advisories, op-eds, radio ad scripts, and the weekly newsletter. • draft talking points, speeches, and key messaging for public appearances and interviews. • oversee and manage a large communications budget, covering areas such as mass mailers, digital ads, radio ads, text messages, surveys, and email campaigns. • produce, edit, and clip video content for use on social media and other platforms. the communications director will also manage a deputy communications director to help execute these tasks and ensure smooth operations across all communications initiatives. qualifications & skills: • proven experience in strategic communications, public relations, and/or media relations—ideally in a political, public affairs, or government context.  • strong writing, editing, and verbal communication skills, with the ability to craft concise, persuasive messaging under tight deadlines. • solid understanding of social media platforms, digital advertising, and video content creation. • strong organizational, time-management, and project management skills with the ability to juggle multiple priorities simultaneously. • experience managing budgets and working with vendors, including for advertising and media buys. • a self-starter who can work independently and as part of a dynamic team. preferred qualifications: • experience working in a congressional office or political campaign. • familiarity with video production tools (adobe premiere, final cut pro, etc.). • knowledge of local and national political landscape, with a particular understanding of congressman steube’s policy priorities and messaging. interested applicants should send resume and cover letter to: floridarepublicanjob@gmail.com"
    },
    {
        "Post_ID": "MEM-025-25",
        "Posting_Author": "Rep. French Hill (AR02)",
        "Congress_Number": null,
        "1 if Democrat": null,
        "1 if woman": null,
        "DW-NOMINATE": null,
        "LES": null,
        "Date_Posted": "2025-02-24",
        "State_District": "AR02",
        "Job_Function": "Communications",
        "Title_Parsed": "Press Secretary",
        "Office_Type": "Member",
        "Committee_Affiliation": null,
        "Spanish_Language": null,
        "Salary_Min": null,
        "Salary_Max": null,
        "Years_Experience": 3,
        "Skills_Mentioned": [
            "verbal communication",
            "written communication",
            "media relations",
            "communications technologies",
            "press releases",
            "op-eds",
            "talking points",
            "newsletters",
            "speeches",
            "social media"
        ],
        "Cleaned_Text": "MEM-025-25\nPRESS SECRETARY\nThe Office of Rep. French Hill (AR02) seeks to fill the position of Press\nSecretary. Candidates should have at least three years of prior relevant experience in\ncommunications and / or press roles.\nThe Press Secretary is responsible for driving an established press strategy that combines\nboth local and national press goals. Responsibilities include overseeing the preparation of\nall communications materials and preparation of all digital, audio and print content,\nincluding graphics. Responsibilities also include managing media relations and developing\ncontacts with members of the media and community leaders. Where necessary, the Press\nSecretary acts as the formal spokesperson and media liaison for the Congressman.\nExcellent verbal and written communications skills are required, as are proficiency and\nflexibility with communications technologies. This role requires the production of\nnumerous types of communications products including press releases, op-eds, talking\npoints, newsletters, speeches, and social media posts. Having an established network of\nmedia contacts is a plus as is prior management experience.\nDesired attributes include the ability to thrive in a fast-paced environment and an\nopenness to learning new technologies and communications tools. The Press Secretary is\na member of the Senior Staff team.\n\nInterested candidates should send a resume and cover letter to\nar02.applications@mail.house.gov."
    },
    {
        "Post_ID": "MEM-024-25",
        "Posting_Author": "Senior Democratic Member of Congress",
        "Congress_Number": null,
        "1 if Democrat": 1,
        "1 if woman": null,
        "DW-NOMINATE": null,
        "LES": null,
        "Date_Posted": "2025-02-24",
        "State_District": "CA04",
        "Job_Function": "Field",
        "Title_Parsed": "Representative",
        "Office_Type": "Member",
        "Committee_Affiliation": null,
        "Spanish_Language": true,
        "Salary_Min": 59540,
        "Salary_Max": 68093,
        "Years_Experience": null,
        "Skills_Mentioned": [
            "self-starter",
            "hard-working",
            "dependable",
            "adaptable",
            "organized",
            "oral communication",
            "written communication",
            "customer service",
            "interpersonal skills",
            "coalition building",
            "teamwork"
        ],
        "Cleaned_Text": "MEM -024-25\nFIELD REPRESENTATIVE\nSenior Democratic Member of Congress seeks Field Representative for office in Santa\nRosa, California, to cover the town of Sonoma. The Field Representative serves as the\nMember's community representative for issues and programs within their assigned areas,\nincluding monitoring and updating the Member and their colleagues on important local\nissues, emerging trends, and critical developments. They also represent the Member at\ncommunity events and meetings, schedule the Member while in the district, prepare and\nattend meetings and events with the Member, answer casework correspondence and\nverbal communications with constituents, act as liaison with federal, district, and local\nagencies for the Member and constituents, and other duties important to serving the\npeople of the congressional district.\nJob Duties:\n• Coordinates with the Member and colleagues to ensure outreach efforts align with the\nMember’s strategic vision, goals, and priorities\n• Collaborates with district and D.C. colleague to ensure district priorities are aligned and\ninform the Member’s legislative strategy\n• Serves as a liaison with federal government entities for individual constituent concerns,\nincluding the handling of constituent casework\n• Collaborates with colleagues to schedule the Member while in their assigned areas in the\ndistrict\n• Assesses casework trends and identifies issues requiring legislative action and/or\nadditional Congressional oversight\n• Informs the Member and colleagues on any important developments and current events\nimpacting the district\n• Builds and maintains positive relationships with constituents, key community leaders,\nand other stakeholders\n• Tracks news stories and social media posts for the Member and colleagues, including the\ncommunications team\n• Acts as a liaison to local, state, and federal officials and stakeholders to form effective\nrelationships for the Member\n• Attends events to serve as a representative for the Member, as determined by their\nsupervisor\n• Handles various community issues in accordance with office policies and procedures.\n\n• Support Office in executing public meetings and annual Congressional activities such as\nthe Congressional Art Competition, Congressional App Competition, and other similar\nevents.\n• Organizes workload to prioritize tasks in accordance with varying deadlines and ensure\nwork is completed in an efficient and effective manner\n• Understands differing perspectives and opinions to navigate conflicts and develop\nsolutions effectively\nFeatured Skills: Candidates must be a self-starter, hard-working, highly dependable,\nadaptable, and organized as well as possess strong oral and written communication skills\nand the ability to work quickly under pressure. Good judgment, strong customer service\nand interpersonal skills, ability to develop and collaborate with coalitions, works well in a\nteam environment, a passion for public service, and availability to work evenings and\nweekends are required. Driver’s license and access to vehicle is required. Bachelor's\ndegree or equivalent combination of education and experience preferred. Prior experience\ndeveloping a community relations strategy for a Member of Congress, elected official, or\nFederal agency is preferred. Familiarity with Member's district, especially Rohnert Park,\nCotati, and Penngrove, is preferred. Ability to communicate in multiple languages,\nespecially Spanish, is highly desirable.\nSalary Level/Range: $59,540 - $68,093\nApplicant Instructions: Qualified candidates should submit a cover letter, resume, two\nwriting samples and three references to ca04districtstaff@gmail.com with the Subject\nLine: Field Representative Vacancy. All applicants will be considered without regard to\nrace, color, religion, sex (including marital or parental status), sexual orientation, gender\nidentity, disability, age, or national origin."
    },
    {
        "Post_ID": "MEM-022-25",
        "Posting_Author": "Congresswoman Madeleine Dean",
        "Congress_Number": 119,
        "1 if Democrat": 1,
        "1 if woman": 1,
        "DW-NOMINATE": null,
        "LES": null,
        "Date_Posted": "2025-02-24",
        "State_District": "PA-04",
        "Job_Function": "Constituent Services",
        "Title_Parsed": "District Caseworker",
        "Office_Type": "District",
        "Committee_Affiliation": null,
        "Spanish_Language": null,
        "Salary_Min": null,
        "Salary_Max": null,
        "Years_Experience": null,
        "Skills_Mentioned": [
            "oral communication skills",
            "written communication skills",
            "legislative process",
            "organization",
            "follow-up",
            "telephone manner",
            "customer relationship management (CRM)",
            "word processing",
            "scanner",
            "copier",
            "printer",
            "desktop computer"
        ],
        "Cleaned_Text": "MEM-022-25\nDISTRICT CASEWORKER (Social Security and Medicare)\nSUMMARY: Congresswoman Madeleine Dean (PA-04) seeks a mo9vated and organized\nindividual to join her team as a Congressional Caseworker based in Glenside, PA. This posi9on\nserves as a liaison to federal, district, and local agencies on behalf of the Member and her\ncons9tuents. The Caseworker will handle a porHolio of issue areas while serving as the lead on\nall Social Security and Medicare concerns through casework correspondence and verbal\ncommunica9on with cons9tuents.\nESSENTIAL JOB FUNCTIONS REQUIRED:\n• Acts as the representa9ve for the Member in the realm of Social Security and Medicare\nincluding answering casework correspondence, mee9ng with cons9tuents, verbal\n\n\n•\n•\n•\n•\n•\n•\n•\n•\n•\n•\n•\n•\n\ncommunica9ons with cons9tuents, and serving as a liaison with other federal, district,\nand local agencies.\nInforms the Member and District Director of all happenings in his or her assigned issue\nareas.\nHandles and priori9zes casework assignments while assis9ng with general intake,\ncons9tuent services requests, and communica9on in an oﬃce environment.\nAssesses casework inquiries for problems requiring legisla9ve ac9on and makes\nrecommenda9ons to the District Director and Chief of Staﬀ.\nScreens and refers cases, when appropriate, to other district oﬃces.\nLogs all incoming and outgoing mail and telephone calls rela9ng to casework in\nCustomer Rela9onship Management (CRM) system.\nPrepares periodic reports for the Casework Manager on pending cases and district\nac9vi9es in his or her assigned issue areas.\nCon9nually screens ac9ve cases and acts as liaison with cons9tuents to ensure that their\ncases are handled in a responsive manner.\nMaintains up-to-date ﬁles on all cases and issues of importance to the oﬃce.\nMaintains a good working rela9onship with the Member, staﬀ, and cons9tuents.\nAccepts performance-based cri9cism and direc9ons.\nWorks well under pressure and handles stress.\nPerforms other du9es as assigned.\nWorks Monday – Friday 8:30am – 4:30pm, with occasional nights and weekends for\ntown hall mee9ngs and other special events.\n\nSKILLS AND KNOWEDGE REQUIRED:\n• Strong oral and wriYen communica9on skills.\n• Knowledge of legisla9ve process and of House organiza9on and procedures.\n• Knowledge of local, state, and federal agencies and departments—especially regarding\nSocial Security and Medicare programming.\n• Professional telephone manner.\n• Strong organiza9on and follow-up skills.\n• Temperament to communicate with a variety of personali9es in a tacHul, pleasant, and\nprofessional manner.\n• Ability to work coopera9vely and courteously with others.\n• Thoroughness and careful aYen9on to detail.\n• Ability to exercise discre9on and independent judgment in fulﬁllment of casework\nresponsibili9es.\n• Knowledge of oﬃce policies, prac9ces, and procedures.\n• Knowledge of oﬃce computer applica9ons.\n• Proﬁciency in word processing as well as with oﬃce equipment: scanner, copier, printer,\ndesktop computer.\n\nTO APPLY:\nAll interested candidates should email a resume and cover leYer directly to\nmdeanhiring@gmail.com with the subject line “Caseworker – [Applicant’s Last Name]\nThe oﬃce is an equal opportunity employer; we do not discriminate on the basis of race, color,\nreligion, sex, sexual orienta<on, gender iden<ty and expression, na<onal origin, disability,\nmilitary status, age, marital status, or parental status. $"
    },
    {
        "Post_ID": "MEM-021-25",
        "Posting_Author": "House Committee on Veterans’ Affairs Democratic StaO",
        "Congress_Number": 119,
        "1 if Democrat": 1,
        "1 if woman": null,
        "DW-NOMINATE": null,
        "LES": null,
        "Date_Posted": "2025-02-24",
        "State_District": null,
        "Job_Function": "Communications",
        "Title_Parsed": "Director",
        "Office_Type": "Committee",
        "Committee_Affiliation": "Veterans’ Affairs",
        "Spanish_Language": null,
        "Salary_Min": 90000,
        "Salary_Max": 110000,
        "Years_Experience": 3,
        "Skills_Mentioned": [
            "writing",
            "editing",
            "oral communications",
            "digital media",
            "fast-paced environment",
            "prioritize tasks",
            "adapt"
        ],
        "Cleaned_Text": "MEM-021-25\nHOUSE COMMITTEE ON VETERANS’ AFFAIRS\nTITLE: Communications Director, House Committee on Veterans’ AOairs Democratic StaO\nSUMMARY: The Democratic StaO of the House Committee on Veterans’ AOairs seeks a\nCommunications Director to implement the Ranking Member’s Committee\ncommunications strategy.\nCORE RESPONSIBILITIES FOR COMMUNICATIONS DIRECTOR ROLE\n• Serve as primary communications advisor for the Ranking Member and Democratic\nCommittee StaO\n• Manage the execution of the communications strategy\n• Oversee day-to-day press activities, including responding to media inquiries,\nbooking interviews, and pitching news stories to media outlets\n• Work with policy leads to develop core messaging and talking points\n• Produce press releases, speeches, op-eds, and materials that are at or near\nﬁnished product\n• Supervise other press staO\n• Assist with the development of talking points, remarks, statements, press releases,\nadvisories, and caucus messaging guides\n• Assist with the coordination, preparation, and execution of media interviews,\nspeaking engagements, and press conferences\n• Monitor and track media appearances, manage media relationships, and work with\npolicy subject matter experts to identify opportunities for media engagement\n• Assist with rapid response eOorts\n• Coordinate with Committee Member oOices on any press related needs\n• StaO Ranking Member at press events\nMINIMUM QUALIFICATIONS\n• Superior writing, editing, and oral communications skills\n• Creative thinker with innovative approaches and an understanding of digital media\n• Ability to work cooperatively and courteously with others\n\n\n•\n•\n•\n\nAbility to work in a fast-paced environment, prioritize tasks, and adapt quickly and\neasily for rapid response\nThoroughness and careful attention to detail.\nAvailability to work non-traditional hours\n\nEXCEPTIONAL QUALIFICATIONS\n• Capitol Hill or political experience or a demonstrated knowledge of Congress and\nthe legislative process\n• 3-4 years of experience, with on the record experience as a press secretary or other\ncommunications role\n• Experience working with stakeholders on messaging opportunities and priorities\n• Demonstrated understanding or experience with veterans issues\nCandidates will be evaluated on experience, skills, character and ﬁtness, and how well\nthey meet the qualiﬁcations and requirements above. To build a diverse and more inclusive\nwork environment, veterans, minorities, women, people with disabilities, and LGBTQ+\ncandidates are encouraged to apply. Salary range $90K-$110K, commensurate with\nexperience.\nAll candidates are required to complete an online application at https://democratsveterans.house.gov/opportunities to be considered for this position. There you can upload\nyour resume, cover letter, and two professional writing samples. $"
    },
    {
        "Post_ID": "MEM-016-25",
        "Posting_Author": "Congresswoman Pramila Jayapal",
        "Congress_Number": 119,
        "1 if Democrat": 1,
        "1 if woman": 1,
        "DW-NOMINATE": null,
        "LES": null,
        "Date_Posted": "2025-02-24",
        "State_District": "WA-07",
        "Job_Function": "Legislative",
        "Title_Parsed": "Senior Legislative Assistant",
        "Office_Type": "Member",
        "Committee_Affiliation": null,
        "Spanish_Language": null,
        "Salary_Min": null,
        "Salary_Max": null,
        "Years_Experience": "4-6",
        "Skills_Mentioned": [
            "policy development",
            "policy analysis",
            "issue advocacy",
            "strategic planning",
            "writing",
            "time management",
            "research"
        ],
        "Cleaned_Text": "The OOice of Congresswoman Pramila Jayapal (WA-07) is seeking an experienced Senior Legislative Assistant to handle a comprehensive portfolio that could include the following issues: education, childcare, tax, ﬁnancial services, housing, healthcare, labor, transportation, commerce and small business. The issue set will depend on the candidate’s experience and interests. We encourage individuals with legislative, research and writing experience to apply and we will discuss the issue set more in depth through the interview process.\nThis position requires the ability to advance Congresswoman Jayapal's legislative priorities in their issue portfolio. The ideal candidate will come with previous legislative experience, including the knowledge and abilities to drive issues with traditional legislative tools (i.e. committee work, bill introductions) as well as organizing tools (i.e. events with partners, in district town halls).\nResponsibilities include but are not limited to:\n• Driving current and new legislative initiatives including idea generation, legislative drafting and producing accompanying materials, such as speeches, policy memos, and factsheets;\n• Preparing and staOing the Congresswoman for relevant committee hearing and markups; drafting hearing remarks and questions;\n• Representing the Congresswoman’s priorities with external stakeholders;\n• Building and maintaining relationships with external and internal\n• stakeholders including advocacy organizations; academics; fellow\n• Congressional and Committee oOices; and\n• Carrying out additional duties as required.\n•\nJob Requirements:\n\n\n•\n•\n•\n•\n•\n•\n\n4 -6 years of relevant experience including policy development and analysis; issue advocacy; and strategic planning;\nPassionate about public service and committed to progressive values;\nExcellent writing and time management skills;\nAbility to digest new content with a political and ideological lens that is appropriate for the oOice;\nPoised, level-headed, ﬂexible, collaborative, team oriented; and\nEager to learn, grow, and thrive in a dynamic and high-paced environment.\n\nThe OOice of Congresswoman Pramila Jayapal is an equal opportunity employer. Women,\npeople of color, LGBTQ+ individuals, new Americans, people with disabilities, and\nmembers of other underrepresented communities are strongly encouraged to apply. State\nand/or district ties are a plus. Prior Hill experience is strongly preferred.\nCandidates should submit their resume, cover letter, two writing samples, and references\nin PDF format to jobs.pramila@mail.house.gov with “Legislative Assistant: [Applicant’s\nFirst and Last Name]” in the subject line. No calls or drop-ins please."
    },
    {
        "Post_ID": "MEM-013-25",
        "Posting_Author": "Congresswoman Sarah McBride",
        "Congress_Number": null,
        "1 if Democrat": 1,
        "1 if woman": 1,
        "DW-NOMINATE": null,
        "LES": null,
        "Date_Posted": "2025-02-24",
        "State_District": "DE-AL",
        "Job_Function": "Legislative",
        "Title_Parsed": "Assistant",
        "Office_Type": "DC",
        "Committee_Affiliation": "Science, Space, and Technology",
        "Spanish_Language": null,
        "Salary_Min": null,
        "Salary_Max": null,
        "Years_Experience": null,
        "Skills_Mentioned": [
            "writing",
            "research",
            "communication",
            "legislative updates"
        ],
        "Cleaned_Text": "MEM-013-25\nPosition Overview:\nCongresswoman Sarah McBride (DE-AL) is seeking a Legislative Assistant for her\nWashington, D.C. oOice. This position will focus on a diverse legislative portfolio, including\nthe Congresswoman's work on the Science, Space, and Technology Committee.\nThe ideal candidate will be a self-starter with strong writing, research, and communication\nskills, capable of producing high-quality work in a fast-paced environment. This is not an\nentry-level position. Previous legislative experience in a congressional oOice is required. A\npositive attitude, attention to detail, the ability to thrive in a collaborative team\nenvironment, and a good sense of humor are essential.\nKey Responsibilities:\n•\tCollaborate with the Congresswoman, Legislative Director, additional staO, other\nhill oOices, and stakeholders to develop and advance legislative initiatives within\nthe assigned diverse legislative portfolio.\n•\tStaO the Congresswoman for her work on the Science, Space, and Technology\nCommittee, including writing remarks, managing relationships, and advancing\nlegislation.\n•\tResearch and track legislation, coordinate bill co-sponsorships, and monitor\nrelevant committee and ﬂoor activities.\n•\tDraft policy memos and brieﬁng materials for the Congresswoman and senior staO.\n•\tBrief the Congresswoman on legislative matters and assist in preparing her for\nhearings, markups, and meetings.\n\n\n•\tRepresent the Congresswoman in meetings with constituents, advocacy\norganizations, and industry stakeholders.\n•\tSupport state oOice staO by providing relevant legislative updates and assisting with\nlocal initiatives.\n•\tPerform additional responsibilities as assigned.\n\nQualiﬁcations:\n•\tLegislative experience in a congressional oOice.\n•\tStrong written and verbal communication skills.\n•\tAbility to exercise sound judgment, make decisions under pressure, and navigate\nchallenging situations.\n•\tExcellent organizational and time management skills to manage multiple projects\nsimultaneously.\nPreferred:\n•\tFamiliarity with issues related to the Science, Space, and Technology Committee or\na demonstrated interest in science and technology policy.\nApplication Instructions:\nApplicants should email their resume and a cover letter to\nDEResumes@sarahmcbride.com with \"Legislative Assistant\" in the subject line.\nEqual Opportunity Employer:\nThe oOice of Congresswoman Sarah McBride is an equal opportunity employer and does\nnot discriminate on the basis of race, color, religion, sex, sexual orientation, gender identity\nand expression, national origin, disability, military status, age, marital status, or parental\nstatus."
    },
    {
        "Post_ID": "MEM-012-25",
        "Posting_Author": "Congresswoman Shontel M. Brown",
        "Congress_Number": null,
        "1 if Democrat": 1,
        "1 if woman": 1,
        "DW-NOMINATE": null,
        "LES": null,
        "Date_Posted": "2025-02-24",
        "State_District": "OH-11",
        "Job_Function": "Operations/Legislative",
        "Title_Parsed": "Assistant/Legislative Correspondent",
        "Office_Type": "D.C.",
        "Committee_Affiliation": null,
        "Spanish_Language": null,
        "Salary_Min": null,
        "Salary_Max": null,
        "Years_Experience": null,
        "Skills_Mentioned": [
            "writing",
            "proofreading",
            "organizational",
            "time management",
            "attention to detail"
        ],
        "Cleaned_Text": "Congresswoman Shontel M. Brown (OH-11) is seeking a full-time Operations\nAssistant/Legislative Correspondent in her Washington, D.C. oOice. The position reports\nto the Administrative Director and Legislative Director. Responsibilities include logging\nphone calls, greeting visitors, managing front oOice operations, handling tour and ﬂag\nrequests, assisting with drafting constituent correspondence and managing the mail\nprogram, overseeing the intern program, providing administrative support to the team, and\nadditional duties as assigned. A successful candidate will have excellent writing and\nproofreading ability, outstanding organizational and time management capacity, strong\nattention to detail, and the ability to work independently. Ohio ties are a plus.\nTO APPLY: All interested candidates are encouraged to submit a cover letter, resume, and\nwriting sample to Ohio11resumes@mail.house.gov with the subject \"Operations\nAssistant/Legislative Correspondent: Last Name, First Name\". Our oOice is an equal\nopportunity employer and does not discriminate on the basis of race, sex, color, religion,\nnational origin, age, gender identity, sexual orientation, marital or parental status, or\ndisability. Candidates of diverse backgrounds are encouraged to apply."
    },
    {
        "Post_ID": "MEM-530-24",
        "Posting_Author": "Majority Staff",
        "Congress_Number": null,
        "1 if Democrat": null,
        "1 if woman": null,
        "DW-NOMINATE": null,
        "LES": null,
        "Date_Posted": "2025-02-24",
        "State_District": null,
        "Job_Function": "Research",
        "Title_Parsed": "Assistant, Subcommittee on Disability Assistance and Memorial Affairs",
        "Office_Type": "Committee",
        "Committee_Affiliation": "Veterans’ Affairs",
        "Spanish_Language": null,
        "Salary_Min": null,
        "Salary_Max": null,
        "Years_Experience": null,
        "Skills_Mentioned": [
            "research",
            "writing",
            "editing",
            "Microsoft Office",
            "Word",
            "Excel",
            "organizational",
            "verbal communication",
            "attention to detail",
            "listening",
            "problem solving",
            "analytical"
        ],
        "Cleaned_Text": "MEM-530-24\nTITLE: Research Assistant, Subcommittee on Disability Assistance and Memorial AOairs,\nHouse Committee on Veterans’ AOairs, Majority StaO\nREPORTS TO: Majority StaO Director, Subcommittee on Disability Assistance and Memorial\nAOairs\nCORE RESPONSIBILITIES:\n• Provide administrative and research support to Subcommittee staO and assists with\nduties as assigned.\nDUTIES:\n• Maintain Subcommittee archives of activities, including Member and stakeholder\nengagements.\n• Travel and conduct oversight visits at agency locations.\n• Draft trip reports, requests to agencies for information (including tracking deadlines),\nhearing recaps, and other work product relevant to the Subcommittee’s jurisdiction.\n• Subcommittee casework as assigned.\n• Answer telephone and respond to caller inquiries.\n• Keep abreast of emails, including Member inquiries and agency notiﬁcations.\n• Organize and maintain Subcommittee electronic records, including meeting notes,\nagency reports, other documents.\n• Participate in staO-level discussions on legislation being considered; draft policy\nmemoranda as assigned.\n• Assist with due diligence being performed as part of the Subcommittee’s oversight duties,\nincluding requesting information from agencies on matters within the Subcommittee\njurisdiction.\n• Assist with hearing preparation and coordination of hearings, including drafting\nmemoranda and remarks for Chairman.\n• Attend meetings with agencies, veteran service organizations, and other parties, and\nmaintain notes on such meetings.\n• Assist with the drafting of memoranda for the full Committee and Subcommittee\nChairman on matters within the jurisdiction of the Subcommittee.\n• Review the Congressional Record, Federal Register, House Calendar, and other\npublications for matters of interest to Subcommittee Members and staO.\n• Assist with developing policy recommendations and serve as a resource for Members\nboth on and oO Committee.\n\n\n• Responsible for all other duties assigned by the full Committee Chairman, Subcommittee\nChairman, full Committee StaO Director or Deputy StaO Director, and Subcommittee StaO\nDirector, and assisting other Committee staO, as needed.\n• This is a full-time, on-site position in Washington, DC.\nMINIMUM QUALIFICATIONS:\n•Bachelor of Arts or Science.\nREQUIRED SKILLS:\n• Strong research skills. Legal research skills (e.g., LexisNexis) is a plus.\n• Strong writing and editing skills.\n•Strong Microsoft OOice proﬁciency, including expertise in Word and the ability to use\nExcel.\n•Strong organizational skills.\n•Strong verbal communication.\n•Excellent attention to detail.\n•Excellent listening skills.\n•Strong ability to manage ﬂuctuating workloads and juggle and prioritize tasks, including\nmanaging short-, medium-, and long-term tasks.\n•Team oriented.\n•Excellent ability to work well under pressure and time constraints.\n•Problem solving and analytical skills are a plus.\n•Potential to work independently.\nBENEFITS: Employees may be eligible for the following beneﬁts:\n•Sick and Annual Leave\n•Student Loan Repayment Program\n•Federal Employees Health Beneﬁts Program\n•Thrift Savings Plan\n•Federal Employees' Group Life Insurance Program\n•Federal Long-Term Care (LTC) Insurance\n•Flexible Spending Accounts (FSAFEDS)\n•Dental & Vision Insurance Program (FEDVIP)\n•Metro or Parking Beneﬁts\n•Many other supportive services and beneﬁts oOered by the U.S. House of Representatives.\nOther Information: Employment with the U.S. House of Representatives is at-will. The U.S.\nHouse of Representatives is an equal opportunity employer. All applicants will be\nconsidered without regard to race, color, national origin, religion, sex (including marital or\nparental status), disability, or age. Transportation and all related travel expenses\nassociated with the interview and hiring process must be paid by the applicant.\n\n\nHow to Apply: Qualiﬁed candidates please send their cover letter, resume, and one (1)\nwriting sample to the following e-mail address: VAR.Resumes@mail.house.gov with “DAMA\nRepublican Research Assistant” in the subject line. No calls or walk-ins, please."
    },
    {
        "Post_ID": "MEM-523-24",
        "Posting_Author": "Ranking Member Brendan F. Boyle (PA-02)",
        "Congress_Number": null,
        "1 if Democrat": 1,
        "1 if woman": null,
        "DW-NOMINATE": null,
        "LES": null,
        "Date_Posted": "2025-02-24",
        "State_District": "PA-02",
        "Job_Function": "Digital",
        "Title_Parsed": "Assistant",
        "Office_Type": "Committee",
        "Committee_Affiliation": "Budget",
        "Spanish_Language": null,
        "Salary_Min": null,
        "Salary_Max": null,
        "Years_Experience": "1-3",
        "Skills_Mentioned": [
            "digital communications",
            "social media management",
            "Adobe Creative Suite",
            "Canva",
            "writing",
            "editing",
            "social media analytics",
            "website content management systems"
        ],
        "Cleaned_Text": "The Democratic Staff of the House Budget Committee and Ranking Member Brendan F. Boyle (PA-02) seek a creative and detail-oriented Digital Assistant to support digital communications and public engagement efforts. This position will be split between the committee office and personal office and will be based out of Washington D.C.\nThis position involves creating and scheduling content for social media platforms, maintaining the committee’s website, producing multimedia materials (graphics, videos, and infographics), and monitoring digital analytics to optimize outreach. The ideal candidate will have 1-3 years of experience in digital communications, social media management, or a similar role (Hill or campaign experience preferred), proficiency with design and editing tools (e.g., Adobe Creative Suite, Canva), strong writing and editing skills, and a passion for progressive policymaking.\nCandidates should be highly organized, comfortable working under tight deadlines, and familiar with social media analytics and website content management systems. A bachelor’s degree in communications, political science, or a related field is preferred.\nSalary is commensurate with experience, and the position includes a competitive benefits package.\nThis office is an equal opportunity employer with a team that highly values mentorship and professional development; we do not discriminate on the basis of race, color, religion, national origin or citizenship status, sex, gender identity or expression, pregnancy, sexual orientation, age, disability, or military status. Candidates with diverse backgrounds, women, people of color, and LGBTQIA+ candidates are strongly encouraged to apply.\nTo apply, email a cover letter, resume, three examples of digital content, and contact information for three references to budget-democrat.jobs@mail.house.gov with the subject line: \"[Name] – Digital Assistant Application.\" Applications will be reviewed on a rolling basis."
    },
    {
        "Post_ID": "MEM-522-24",
        "Posting_Author": "Congressman Pat Ryan (NY-18)",
        "Congress_Number": null,
        "1 if Democrat": null,
        "1 if woman": null,
        "DW-NOMINATE": null,
        "LES": null,
        "Date_Posted": "2025-02-24",
        "State_District": "NY-18",
        "Job_Function": "Press",
        "Title_Parsed": "Secretary",
        "Office_Type": "Personal",
        "Committee_Affiliation": null,
        "Spanish_Language": null,
        "Salary_Min": "60000",
        "Salary_Max": "80000",
        "Years_Experience": null,
        "Skills_Mentioned": [
            "writing",
            "editing"
        ],
        "Cleaned_Text": "The Office of Congressman Pat Ryan (NY-18) seeks a Press Secretary based in the Washington DC office. Applicants should be prepared to join a highly-collaborative, highachieving team and possess an eagerness to grow and learn within the office. Ties to New York’s 18th District are a plus.\n\n\nThe ideal candidate should demonstrate excellent writing and editing skills in addition to a strong work ethic, good sense of humor, and keen attention to detail. The position will require working non-traditional hours.\nResponsibilities include:\n•\n•\n•\n•\n•\n•\n•\n\nWriting press releases, statements and media advisories\nDrafting talking points and op-eds\nStaffing the Congressman for interviews and media events\nPlanning press conferences and in-district events\nResponding to press inquiries\nMaintaining relationships and booking interviews with local press outlets\nOther tasks as assigned\n\nThe Press Secretary will report to the Communications Director, and work closely with the Chief of Staff, the District Director, the Digital Director, the Legislative Director, and other legislative and district staff in creating, coordinating and executing the digital and written content strategy to promote the Congressman’s legislative and district priorities. The salary range for this position is $60,000 - $80,000, commensurate with experience.\nThe office is an equal opportunity employer; we do not discriminate on the basis of race, color, religion, sex, national origin, age, disability, gender identity or expression, or sexual orientation. Candidates of diverse backgrounds are strongly encouraged to apply.\nCandidates should submit a cover letter, resume, two writing samples, and three references in a single PDF to ny18resumes@mail.house.gov with the job title and your full name in the subject line (e.g.: “Press Secretary - Bryson Daily). No phone calls, faxes or drop-ins, please. Applications will be considered on a rolling basis."
    },
    {
        "Post_ID": "MEM-517-24",
        "Posting_Author": "Congresswoman Susie Lee",
        "Congress_Number": null,
        "1 if Democrat": 1,
        "1 if woman": 1,
        "DW-NOMINATE": null,
        "LES": null,
        "Date_Posted": "2025-02-24",
        "State_District": "NV-03",
        "Job_Function": "DC Scheduler",
        "Title_Parsed": "Scheduler",
        "Office_Type": "Member",
        "Committee_Affiliation": null,
        "Spanish_Language": null,
        "Salary_Min": null,
        "Salary_Max": null,
        "Years_Experience": null,
        "Skills_Mentioned": [
            "organized",
            "scheduling",
            "logistics",
            "tracking",
            "evaluating",
            "responding",
            "travel coordination",
            "briefing materials",
            "office operations",
            "event coordination",
            "onboarding",
            "training",
            "administrative duties",
            "problem solving",
            "attention to detail",
            "communication",
            "multi-tasking"
        ],
        "Cleaned_Text": "Congresswoman Susie Lee (D-NV) seeks a highly organized, good-humored, hard-working\nDC Scheduler to develop, coordinate, and manage all aspects of the Member’s daily and\nlong-term schedule and logistics in DC. The DC Scheduler will report to the Chief of Staff\nand work closely with the Member, DC staff, and District staff, including a District-based\nscheduler responsible for in-district scheduling. This is not an entry-level role; prior\nscheduling experience is preferred, and salary will be commensurate with experience.\nResponsibilities also include tracking, evaluating, and responding to all invitations and\nscheduling requests, coordinating travel for the Member, compiling the Congresswoman’s\nnightly briefing materials, and managing office operations, including but not limited to\nfacilitating Member meetings and calls, coordinating internal and external events,\nassisting with onboarding and training for staff and interns, and other administrative\nduties. Responsibilities will also include providing staffing support, including driving the\nCongresswoman as needed. Strong candidates will be creative problem solvers, have\nexcellent attention to detail, communicate succinctly and effectively, and thrive in a fastpaced work environment. The position requires the ability to multi-task, work well under\npressure, and the flexibility to be responsive to urgent scheduling needs on nights and\nweekends.\nCandidates of diverse backgrounds are encouraged to apply. The office is an equal\nopportunity employer and does not discriminate on the basis of race, color, religion, sex,\nsexual orientation, gender identity and expression, national origin, disability, military\nstatus, age, marital status, or parental status.\nCandidates should submit in PDF format a resume, cover letter, and three references\n(including name, title and organization, phone number, email, and relationship to the\ncandidate) to nv03resumes@gmail.com with the following subject line: “Full Name – DC\nScheduler.”"
    },
    {
        "Post_ID": "MEM-476-24",
        "Posting_Author": "Congressman Dan Crenshaw",
        "Congress_Number": null,
        "1 if Democrat": "0",
        "1 if woman": "0",
        "DW-NOMINATE": null,
        "LES": null,
        "Date_Posted": "2025-02-24",
        "State_District": "TX-02",
        "Job_Function": "Legislative",
        "Title_Parsed": "Assistant",
        "Office_Type": "DC",
        "Committee_Affiliation": null,
        "Spanish_Language": null,
        "Salary_Min": null,
        "Salary_Max": null,
        "Years_Experience": null,
        "Skills_Mentioned": [
            "written communication",
            "oral communication",
            "detail-oriented",
            "organized",
            "creative",
            "drafting",
            "fast-paced environment",
            "manage competing priorities",
            "teamwork"
        ],
        "Cleaned_Text": "Congressman Dan Crenshaw (R-TX-02) seeks a highly motivated, hard-working Legislative\nAssistant (LA), based in our Washington, D.C. oOice. This position reports to the Legislative\nDirector. The LA will handle an economic facing portfolio, including Budget and\nAppropriations, Financial Services, and Tax, with other issues to follow.\nKey duties include:\n• Communicating clearly and consistently with the Member, Legislative Director, and\nlegislative, communications, and district teams on legislative updates\n• Preparing and staOing the Member for meetings, and assisting in the drafting of remarks,\nas needed\n• Meeting with constituents, stakeholders, and advocacy groups within the portfolio of\nissue areas Working with external stakeholders, Congressional Research Service (CRS),\nLegislative Counsel, and committee staO to draft legislation based on the Member’s\npriorities\n• Ideal candidates will have strong written and oral communications skills and be detailoriented, organized, and creative. They must be able to quickly learn the member’s voice\nand think in a proactive, communications-focused manner.\nOther key qualities include:\n• Commitment to a collaborative work environment\n• Ability to work in a fast-paced environment and manage competing priorities\n• Ability to communicate up and down within the team\n• Ability to learn the Congressman’s voice and legislative priorities\n• Interest in identifying and pursuing new opportunities and the ability to anticipate and\nadapt to challenges\nHill experience is required. Compensation is competitive and commensurate with level of\nexperience. Qualiﬁed applicants should submit a resume and writing sample (no more\nthan 3 pages) as one combined PDF to Kenneth.Depew@mail.house.gov. Include\n“Legislative Assistant – [Full Name]” in the subject line. Applications will be considered on\na rolling basis as received. No phone calls or drop-ins please."
    }
]