[
    {
        "Post_ID": "MEM-168-24",
        "Posting_Author": "Congressman Glenn Ivey",
        "Congress_Number": null,
        "1 if Democrat": 1,
        "1 if woman": null,
        "DW-NOMINATE": null,
        "LES": null,
        "Date_Posted": "2024-04-15",
        "State_District": "MD-04",
        "Job_Function": "Legislative",
        "Title_Parsed": "Assistant / Counsel",
        "Office_Type": "Member",
        "Committee_Affiliation": [
            "Homeland Security",
            "Judiciary",
            "Appropriations"
        ],
        "Spanish_Language": null,
        "Salary_Min": null,
        "Salary_Max": null,
        "Years_Experience": 2,
        "Skills_Mentioned": [
            "legislative strategy",
            "committee hearings",
            "markups",
            "policy portfolio",
            "drafting bills",
            "amendments",
            "letters",
            "policy statements",
            "talking points",
            "floor speeches",
            "op-eds",
            "memos",
            "reports",
            "stakeholder management",
            "coalition building"
        ],
        "Cleaned_Text": "Congressman Glenn Ivey (MD-04) seeks an experienced legislative staffer for the Member’s D.C. office who has a background in matters before the House Homeland Security, Judiciary, and Appropriations Committees. Candidates with a J.D. or another advanced degree are strongly encouraged to apply, and experience working as a legislative assistant, legislative aide, or similar permanent staffer for a minimum of two years is required.\nThe ideal candidate is a well-informed student of politics and government who possesses a working knowledge of current events and a diverse array of issues. We seek a strong writer with a track record of successfully developing and implementing legislative strategy, preparing, and staffing the principal for committee hearings and markups, and managing a broad policy portfolio. Ideally, the candidate would also have a successful track record of project management related to a Member’s legislative and in-district priorities.\nResponsibilities include preparing the Member for committee hearings, markups, briefings, stakeholder meetings, and other engagements; developing and drafting bills, amendments, letters, policy statements, talking points, floor speeches, opeds, memos, and reports; planning and organizing briefings and other events; managing relationships with local, state, and national stakeholders and institutions; tracking legislation relevant to the Member’s District or policy priorities; preparing vote recommendations; building coalitions of diverse, bipartisan stakeholders to advance legislative priorities; and assisting organizations and constituents in the District with regard to federal matters.\nThe successful candidate’s title, including the possibility of senior legislative assistant / counsel, and pay will be commensurate with work experience.\nWorking for this freshman office represents an opportunity to build something dynamic and lasting from the ground up, particularly for a Member of Congress who is a great communicator and cares deeply about the well-being and professional development of his staff.\nPlease submit a cover letter; a resume, including two to three references; and a writing sample to md04resumes@gmail.com with the subject line: “Full Name – Legislative Assistant” We will accept applications until the position is filled.\nCandidates of diverse backgrounds are encouraged to apply, and this office is an equal-opportunity employer that does not discriminate on the basis of race, color, religion, sex, sexual orientation, gender identity and expression, national origin, disability, military status, age, marital status, or parental status."
    },
    {
        "Post_ID": "MEM-165-24",
        "Posting_Author": "Rep. Jimmy Gomez",
        "Congress_Number": null,
        "1 if Democrat": 1,
        "1 if woman": 0,
        "DW-NOMINATE": null,
        "LES": null,
        "Date_Posted": "2024-04-15",
        "State_District": "CA-34",
        "Job_Function": "Digital",
        "Title_Parsed": "Director",
        "Office_Type": "Member",
        "Committee_Affiliation": "Ways and Means Committee",
        "Spanish_Language": null,
        "Salary_Min": 55000,
        "Salary_Max": 65000,
        "Years_Experience": null,
        "Skills_Mentioned": [
            "digital and social media",
            "video editing",
            "content creation",
            "copyediting",
            "writing",
            "editing",
            "time management",
            "social media"
        ],
        "Cleaned_Text": "Digital Director – The office of Rep. Jimmy Gomez (CA-34), a member of the Ways and Means Committee, seeks a driven individual with experience in digital and social media, video editing, content creation and impeccable copyediting skills to join a fast-paced team as the Digital Director.\nCandidates must possess strong writing, editing and time management abilities, and must be able to draft daily social media posts and create a long-term digital content plan. The Digital Director will manage multiple social media accounts for the member, and will be key in working with the member and under the Communications Director to create timely, relevant, well-produced content.\nThis is not an entry-level position. Prospective candidates should e-mail a cover letter, resume and two writing/digital samples in PDF format\nto Gomez.Jobs@mail.house.gov with the subject line “LASTNAME_Digital.”\nNo calls or drop-ins please.\nThe office is an equal opportunity employer and does not discriminate on the basis of race, color, religion, sex, sexual orientation, gender identity and\nexpression, national origin, disability, military status, age, marital status or\nparental status.\nDeadline for submissions is April 23, 2024. Salary range is $55,000-65,000\nannually, commensurate with experience."
    },
    {
        "Post_ID": "MEM-163-24",
        "Posting_Author": "Representative Jason Crow",
        "Congress_Number": null,
        "1 if Democrat": 1,
        "1 if woman": 0,
        "DW-NOMINATE": null,
        "LES": null,
        "Date_Posted": "2024-04-15",
        "State_District": "CO-06",
        "Job_Function": "Staff Assistant/Legislative Correspondent",
        "Title_Parsed": "Staff Assistant/Legislative Correspondent",
        "Office_Type": "Member",
        "Committee_Affiliation": null,
        "Spanish_Language": 0,
        "Salary_Min": 55000,
        "Salary_Max": 55000,
        "Years_Experience": null,
        "Skills_Mentioned": [
            "writing",
            "organization",
            "time management"
        ],
        "Cleaned_Text": "Representative Jason Crow (CO-06) seeks a Staff Assistant/Legislative Correspondent for his Washington, DC office.\nResponsibilities include greeting visitors, answering phones, sorting and tracking incoming correspondence, drafting constituent correspondence, managing the intern program, and driving the Congressman, among other duties as assigned.\nIdeal candidates will be strong writers with excellent organization and time management skills. Colorado ties are a plus but not required.\nThe office is an equal opportunity employer. The salary for this position is $55,000 per year.\nInterested candidates are encouraged to submit their resume and cover letter to co06.resumes@mail.house.gov. No phone calls or drop-ins please."
    },
    {
        "Post_ID": "MEM-162-24",
        "Posting_Author": "Congressman Jamie Raskin",
        "Congress_Number": null,
        "1 if Democrat": 1,
        "1 if woman": 0,
        "DW-NOMINATE": null,
        "LES": null,
        "Date_Posted": "2024-04-15",
        "State_District": "MD-08",
        "Job_Function": "Communications",
        "Title_Parsed": "Digital Manager/Press Secretary",
        "Office_Type": "DC",
        "Committee_Affiliation": null,
        "Spanish_Language": 1,
        "Salary_Min": null,
        "Salary_Max": null,
        "Years_Experience": "1-3",
        "Skills_Mentioned": [
            "writing",
            "communications",
            "video editing",
            "Adobe Premiere Pro",
            "Adobe Creative Suite",
            "graphic design",
            "social media management"
        ],
        "Cleaned_Text": "Congressman Jamie Raskin (MD-08) seeks a full-time Digital Manager/Press Secretary in his Washington, DC office. The Digital Manager/Press Secretary will support digital and traditional communications in a fast-paced and high-visibility congressional office. The individual will be responsible for drafting press releases, quotes and statements, creating digital content (including written copy, graphics and video), helping manage the Congressman’s official social media accounts, fielding press requests and inquiries, and executing other duties as assigned. The Digital Manager/Press Secretary will work closely with the Communications Director, who will be the direct supervisor, as well as the Chief of Staff, the District Chief, the Legislative Director, and other legislative and district staff in creating, coordinating and executing digital and written content strategy promoting the Congressman’s legislative and district priorities. The Digital Manager/Press Secretary must be an excellent writer with exceptional communications skills. The successful candidate is a motivated self-starter and team player who demonstrates intellectual engagement, creative thinking, hard work, scrupulous attention to detail, effective time management and a professional and discreet approach. Relevant skills include: video editing (Adobe Premiere Pro and Adobe Creative Suite experience preferred), graphic design and social media management (i.e. experience and familiarity with major platforms). 1-3 years prior experience in political communications is required. Ties to Maryland’s Eighth District, Spanish fluency and facility with other languages are a plus. Candidates from diverse backgrounds and underrepresented communities are strongly encouraged to apply. The U.S. House of Representatives is an equal opportunity employer and does not discriminate on the basis of race, color, religion, sex, national origin, age, disability, military status, gender identity and expression, marital status, parental status, or sexual orientation or any other characteristic protected by applicable law, in any of its activities or operations. To apply, please email MD08.Resumes@mail.house.gov by April 23, 2024 with “Digital Manager/Press Secretary: Last Name” in the subject line and the following application materials attached as one combined PDF: ·Résumé ·Cover letter ·Two writing samples ·One piece of original digital media content (graphic design or video—if video, please link to a Google Drive file) ·Three references–for each reference, please include name, current title, phone number, email address and your relationship to the reference"
    },
    {
        "Post_ID": "MEM-161-24",
        "Posting_Author": "Democratic Staff on the House Judiciary Committee",
        "Congress_Number": null,
        "1 if Democrat": 1,
        "1 if woman": null,
        "DW-NOMINATE": null,
        "LES": null,
        "Date_Posted": "2024-04-15",
        "State_District": null,
        "Job_Function": "Legal",
        "Title_Parsed": "Subcommittee Counsel",
        "Office_Type": "Committee",
        "Committee_Affiliation": "Judiciary",
        "Spanish_Language": null,
        "Salary_Min": null,
        "Salary_Max": null,
        "Years_Experience": 5,
        "Skills_Mentioned": [
            "legal research",
            "writing",
            "drafting legislation",
            "preparing hearings",
            "constitutional law",
            "civil rights law",
            "bankruptcy law",
            "antitrust",
            "competition matters"
        ],
        "Cleaned_Text": "The Democratic Staff on the House Judiciary Committee’s Subcommittee on Administrative State, Regulatory Reform, and Antitrust, seeks a dedicated and hard-working lawyer with a minimum of 5 years of professional legal experience to serve as a subcommittee counsel.\nResponsibilities include: serving as a resource for Democratic Members of the Committee on matters of law and policy within the Subcommittee’s jurisdiction; drafting legislation; preparing hearings; drafting statements, memos, and briefing materials; and providing guidance to Democratic House offices on matters of constitutional and civil rights law. The counsel will be responsible for handling assignments in a range of issue areas, including administrative law, bankruptcy law, and antitrust and competition matters.\nThe successful candidate must demonstrate exceptional writing and legal research skills, a strong work ethic, a professional temperament, and the ability to work on novel and complex matters under time and other pressures. Such a candidate must also be able to work collaboratively with a broad range of personalities. In addition, sound political judgment, prior legislative or policy experience, a substantive background in civil rights or constitutional law, and a demonstrated commitment to public service are strongly preferred. A sense of humor is a plus.\nThe Committee strives to ensure that our staff represents the diversity of the country’s population. The Committee strongly encourages women and members of historically disadvantaged minority groups to apply. The Committee does not discriminate on the basis of race, color, religion, sex (including marital or parental status, sexual orientation, and gender identity), disability, age, or national origin.\nQualified candidates should submit a resume, cover letter, and writing sample to JDEM.Job@mail.house.gov. Please include “Antitrust Counsel” in the subject line."
    },
    {
        "Post_ID": "MEM-159-24",
        "Posting_Author": "Committee on Ethics",
        "Congress_Number": null,
        "1 if Democrat": null,
        "1 if woman": null,
        "DW-NOMINATE": null,
        "LES": null,
        "Date_Posted": "2024-04-15",
        "State_District": null,
        "Job_Function": "Investigative",
        "Title_Parsed": "Counsel",
        "Office_Type": "Committee",
        "Committee_Affiliation": "Ethics",
        "Spanish_Language": null,
        "Salary_Min": 136780,
        "Salary_Max": 145604,
        "Years_Experience": null,
        "Skills_Mentioned": [
            "analytical",
            "written",
            "oral communications",
            "government ethics",
            "campaign finance",
            "criminal law",
            "employment law",
            "sexual harassment",
            "civil litigation",
            "administrative investigations",
            "adjudications",
            "depositions",
            "financial accounting"
        ],
        "Cleaned_Text": "investigative counsel washington dc the committee on ethics seeks an attorney for an investigative counsel position the committees investigative counsels are responsible for conducting investigations and adjudicatory and disciplinary proceedings regarding members and staff of the us house of representatives this is a nonpartisan position which requires the ability to conduct impartial investigations and refrain from political or partisan activity candidates must possess outstanding analytical and writtenoral communications skills as well as the sound judgment necessary to evaluate the sensitive matters that arise before the committee experience in one or more of the following areas is desirable government ethics campaign finance criminal law employment law including the laws governing sexual harassment in the workplace civil litigation administrative investigations and adjudications depositions and financial accounting the salary range for this position is 136780 and 145604 please email resume cover letter and short writing sample to ethicsjobsmailhousegov please include the phrase investigative counsel in the subject line page 5 of 23"
    },
    {
        "Post_ID": "MEM-158-24",
        "Posting_Author": "Congressman Tom Suozzi",
        "Congress_Number": null,
        "1 if Democrat": null,
        "1 if woman": null,
        "DW-NOMINATE": null,
        "LES": null,
        "Date_Posted": "2024-04-15",
        "State_District": "NY-03",
        "Job_Function": "Communications",
        "Title_Parsed": "Press Secretary/Communications Director",
        "Office_Type": "Personal",
        "Committee_Affiliation": null,
        "Spanish_Language": null,
        "Salary_Min": null,
        "Salary_Max": null,
        "Years_Experience": null,
        "Skills_Mentioned": [
            "writing",
            "social media",
            "digital tools",
            "press releases",
            "statements",
            "media advisories",
            "social media content",
            "graphics",
            "videos",
            "talking points",
            "op-eds",
            "franked communications",
            "e-newsletters",
            "mailers",
            "telephone townhalls"
        ],
        "Cleaned_Text": "Congressman Tom Suozzi seeks a Press Secretary or Communications Director to serve in his Washington, D.C. office. Successful candidates will have very strong writing skills, a close eye to detail, fluency with social media platforms and digital tools, and experience working with national and local press.\nResponsibilities include writing press releases, statements and media advisories; creating and managing social media content, including graphics and videos; drafting talking points and op-eds; and creating franked communications, including e-newsletters, mailers and telephone townhalls.\nAll applicants will be considered without regard to race, color, religion, sex (including marital or parental status), sexual orientation, gender identity, disability, age, or national origin. Qualified individuals should submit a resume, cover letter and relevant portfolio to NY03.jobs@mail.house.gov. No calls or walk-ins please."
    },
    {
        "Post_ID": "MEM-157-24",
        "Posting_Author": "Katie Mikulka",
        "Congress_Number": null,
        "1 if Democrat": null,
        "1 if woman": null,
        "DW-NOMINATE": null,
        "LES": null,
        "Date_Posted": "2024-04-15",
        "State_District": null,
        "Job_Function": "Legal Research",
        "Title_Parsed": "Analyst",
        "Office_Type": "Committee",
        "Committee_Affiliation": "Joint Committee on Taxation",
        "Spanish_Language": null,
        "Salary_Min": null,
        "Salary_Max": null,
        "Years_Experience": null,
        "Skills_Mentioned": [
            "Collaboration",
            "Organizational skills",
            "Research",
            "Prioritization",
            "Communication",
            "Writing",
            "Policy Analysis",
            "Legislative Database Knowledge",
            "Legal Database Knowledge"
        ],
        "Cleaned_Text": "Position: Legal Research Analyst (full-time)\nEmployer: Joint Committee on Taxation, United States Congress\nPosition Overview: The Joint Committee on Taxation seeks a highly motivated\nprofessional to join its nonpartisan staff as a Legal Research Analyst to assist in\nthe organization and management of its print and electronic library collections\nand to support legal and legislative research. The Legal Research Analyst will\nwork closely with (under the direct supervision of) the Joint Committee’s Legal\nResearch and Reference:\nLibrarian and with committee attorneys, economists, accountants, and\nadministrative staff on projects involving a wide range of tax subject areas,\nincluding individual, business, international, tax-exempt organization,\nbenefits, and pension taxation.\nNecessary skills include:\n*Willingness to collaborate with professional and administrative staff, both\nwithin the Joint Committee and with other information institutions, such as the\nLibraries of the House and the Senate, the Office of the Historian and the Clerk of\nthe House's Office of Art and Archives, Congressional Research Service, Library\nof Congress, and the Law Library of Congress.\n*Attention to detail and strong organizational skills.\n*Sense of curiosity and resourcefulness when conducting research across\nmultiple subscriptions and platforms.\n*Ability to manage and reprioritize simultaneous projects and deadlines.\n*Ability to anticipate and proactively compile resources and conduct research.\n*An interest in both research and administrative responsibilities.\nDuties include, but are not limited to, the following:\n*Conduct, organize, and curate legal, legislative, and historical research on tax,\neconomic, and financial policy matters.\n*Manage a comprehensive collection of compiled legislative histories on\ntaxation.\n*Inventory and catalog Joint Committee library resources, including treaties,\nperiodicals, and congressional documents.\n*Monitor, summarize, and report on current legislation, congressional hearings,\ncourt cases, and seminars from a wide variety of sources.\n*Negotiate with vendors to secure subscriptions to print and electronic resources,\nwhile maintaining the overall library budget, in collaboration with the\nAdministrative Director.\n*Post, describe, and maintain both current and historical publications on the Joint\nCommittee’s website, in collaboration with the Computer Team.\n*Archive work product – both print and digital – in accordance with established\nguidelines and policies.\nRequirements: A bachelor’s degree in political science, information studies, legal\nstudies, economics or related fields and an interest and understanding of the\nAmerican legislative process – including prior congressional\nexperience – sufficient to understand complex policy issues. Strong writing,\ncommunication, and research skills, including knowledge of specialized legal and\nlegislative databases, and research experience are required. A Master of Library\nand Information Science (MLIS) degree is preferred, however not required.\nSalary and benefits: Salary is commensurate with skills and experience.\nTo apply: Please submit a cover letter and resume to Katie Mikulka by email\nat JCTCareers@jct.gov. Please include “Legal Research Analyst” in the subject\nline."
    },
    {
        "Post_ID": "MEM-156-24",
        "Posting_Author": null,
        "Congress_Number": null,
        "1 if Democrat": null,
        "1 if woman": null,
        "DW-NOMINATE": null,
        "LES": null,
        "Date_Posted": "2024-04-15",
        "State_District": null,
        "Job_Function": "Counsel",
        "Title_Parsed": "Counsel",
        "Office_Type": "Committee",
        "Committee_Affiliation": "House Administration",
        "Spanish_Language": null,
        "Salary_Min": null,
        "Salary_Max": null,
        "Years_Experience": null,
        "Skills_Mentioned": [
            "legislative research",
            "drafting reports",
            "memoranda",
            "elections issues",
            "oversight"
        ],
        "Cleaned_Text": "Counsel\nThis position performs a key role in the development and execution of the\nCommittee on House Administration Republican Office’s strategy, especially\nwith respect to elections issues, as well as ensuring that the committee’s\nlegislative and oversight activities are operated in conformance with applicable\nstatutes, House Rules, and Committee Rules.\nThe incumbent is also responsible for handling additional responsibilities and\nspecial projects as assigned. Major duties include: in coordination with the\nGeneral Counsel, assists in the development and execution of the Committee’s\noversight & legislative agenda; serves on elections coalitions development in the\nelection integrity and voter confidence arenas, with a particular focus on\ngrassroots organizations and other elections stakeholders; prepares for committee\nmarkups, hearings, and business meetings in cooperation with the Committee\nClerk and relevant committee attorneys and staff; conducts thorough and accurate\nlegislative research and drafts reports and memoranda; and more.\nTo apply, please send a resume and writing sample\nto thomas.lane@mail.house.gov"
    },
    {
        "Post_ID": "MEM-155-24",
        "Posting_Author": "Rep. Tokuda (HI-02)",
        "Congress_Number": null,
        "1 if Democrat": null,
        "1 if woman": null,
        "DW-NOMINATE": null,
        "LES": null,
        "Date_Posted": "2024-04-15",
        "State_District": "HI-02",
        "Job_Function": "Communications",
        "Title_Parsed": "Digital Director or Press Secretary",
        "Office_Type": "Member",
        "Committee_Affiliation": null,
        "Spanish_Language": null,
        "Salary_Min": null,
        "Salary_Max": null,
        "Years_Experience": null,
        "Skills_Mentioned": [
            "writing",
            "editing",
            "graphic production",
            "digital media",
            "video editing",
            "social media"
        ],
        "Cleaned_Text": "DIGITAL DIRECTOR OR PRESS SECRETARY\nRep. Tokuda (HI-02) seeks an energetic person to join her communications team\nin her Washington, D.C. office. This individual will work closely with the\nCommunications Director who works in Honolulu. Candidates must have\nexperience in digital media and video editing and will be responsible for\nmanaging multiple digital media accounts. This position will also assist with\npress releases and inquiries, speeches, and mass communications.\nEssential Skills Include:\n•Strong writing and editing skills with attention to detail\n•Creative graphic production\n•Ability to multi-task and work quickly under pressure\n•Patience, flexibility, and a sense of humor\nCandidate must also be able to work occasionally on weekends and evenings.\nInterested parties should email a cover letter, resume, writing sample, sample\nsocial media posts, and two references to Hawaii02jobs@gmail.com"
    },
    {
        "Post_ID": "MEM-154-24",
        "Posting_Author": "Congressman John Sarbanes",
        "Congress_Number": null,
        "1 if Democrat": 1,
        "1 if woman": null,
        "DW-NOMINATE": null,
        "LES": null,
        "Date_Posted": "2024-04-15",
        "State_District": "MD-03",
        "Job_Function": "Communications",
        "Title_Parsed": "Press Secretary/Communications Director",
        "Office_Type": "Member",
        "Committee_Affiliation": null,
        "Spanish_Language": null,
        "Salary_Min": null,
        "Salary_Max": null,
        "Years_Experience": null,
        "Skills_Mentioned": [
            "writing",
            "social media",
            "digital tools",
            "press releases",
            "statements",
            "media advisories",
            "social media content",
            "graphics",
            "videos",
            "talking points",
            "op-eds",
            "e-newsletters",
            "mailers",
            "telephone townhalls"
        ],
        "Cleaned_Text": "Congressman John Sarbanes seeks a Press Secretary or Communications Director to serve in his Washington, D.C. office. Successful candidates will have very strong writing skills, a close eye to detail, fluency with social media platforms and digital tools, and experience working with national and local press. Responsibilities include writing press releases, statements and media advisories; creating and managing social media content, including graphics and videos; drafting talking points and op-eds; and creating franked communications, including e-newsletters, mailers and telephone townhalls. This office is an equal opportunity employer committed to building and maintaining an inclusive and diverse work environment. Diverse candidates are strongly encouraged to apply. Qualified individuals should submit a resume, cover letter and writing portfolio to employment@mail.house.gov. No calls or walk-ins please."
    },
    {
        "Post_ID": "MEM-152-24",
        "Posting_Author": "Rep. Joe Courtney",
        "Congress_Number": null,
        "1 if Democrat": 1,
        "1 if woman": 0,
        "DW-NOMINATE": null,
        "LES": null,
        "Date_Posted": "2024-04-15",
        "State_District": "CT-02",
        "Job_Function": "Legislative",
        "Title_Parsed": "Assistant",
        "Office_Type": "Member",
        "Committee_Affiliation": null,
        "Spanish_Language": null,
        "Salary_Min": null,
        "Salary_Max": null,
        "Years_Experience": 3,
        "Skills_Mentioned": [
            "legislative process",
            "oral communication",
            "written communication",
            "project management",
            "prioritization",
            "synthesizing information",
            "decision-making",
            "policy"
        ],
        "Cleaned_Text": "Rep. Joe Courtney (D-CT-02) seeks qualified candidates for a Legislative\nAssistant position to join his Washington, DC office team.\nThe Legislative Assistant will:\n1.Develop, plan, and execute legislative initiatives within assigned issue areas\n2.Monitor developments in legislation on the floor and within certain House\nCommittees\n3.Staff the member at Committee events as appropriate within assigned policy\nportfolio\n4.Meet with constituents on behalf of the member\n5.Prepare briefing notes and talking points for the Member\n6.Collaborate with District staff to advocate for federal projects and initiatives at\nthe local level\nQualified candidates will have approximately 3 years of legislative experience\nworking on Capitol Hill, thorough knowledge of the legislative process, excellent\noral and written communication skills, strong project management and\nprioritization skills, the ability to quickly synthesize information and make sound\ndecisions, and the ability to exercise independent judgement in the formulation\nand recommendation of policy positions for the Member.\nPolicy portfolio will be based on office needs but will include domestic policy\nissues. Ties to Connecticut or New England are a plus. This office is an equal\nopportunity employer. Candidates with diverse backgrounds are encouraged to\napply. Interested applicants should send a resume, cover letter, and writing\nsample to CT02JOB@mail.house.gov"
    },
    {
        "Post_ID": "MEM-151-24",
        "Posting_Author": "Senior House Democrat",
        "Congress_Number": null,
        "1 if Democrat": 1,
        "1 if woman": null,
        "DW-NOMINATE": null,
        "LES": null,
        "Date_Posted": "2024-04-15",
        "State_District": null,
        "Job_Function": "Legislative",
        "Title_Parsed": "Assistant",
        "Office_Type": "Personal",
        "Committee_Affiliation": null,
        "Spanish_Language": null,
        "Salary_Min": null,
        "Salary_Max": null,
        "Years_Experience": "1-2",
        "Skills_Mentioned": [
            "written communication",
            "oral communication",
            "drafting legislation",
            "briefing materials"
        ],
        "Cleaned_Text": "Senior House Democrat seeks a Legislative Assistant for the Member’s personal office to staff a portfolio of domestic legislative issues. Portfolio is flexible depending upon the candidate’s background and interests. A successful candidate will be a self-starter that works well in a fast-paced environment, possess excellent oral and written communication skills, and have a proven ability to work effectively with a collaborative legislative team. Responsibilities include:\n•drafting and introducing legislation, and drafting oversight letters;\n•monitoring pending legislation and current events;\n•staffing the Member at events and meetings;\n•preparing briefing materials and talking points for the Member;\n•reviewing requests to cosign letters and cosponsor legislation, and making recommendations to the Member;\n•representing the Member in meetings and briefings;\n•collaborating with constituent organizations; and\n•other tasks and assignments as needed.\nThe office is an equal opportunity employer and encourages people of all backgrounds to apply. The ideal candidate will have at least 1-2 years legislative experience in a congressional office or similar experience off the Hill.\nSalary commensurate with experience. Applicants should send a resume, cover letter, and two writing samples to housedemlajob@gmail.com"
    },
    {
        "Post_ID": "MEM-150-24",
        "Posting_Author": null,
        "Congress_Number": null,
        "1 if Democrat": null,
        "1 if woman": null,
        "DW-NOMINATE": null,
        "LES": null,
        "Date_Posted": "2024-04-15",
        "State_District": null,
        "Job_Function": "Health",
        "Title_Parsed": "Staff Director, Subcommittee on Health",
        "Office_Type": "Committee",
        "Committee_Affiliation": "Veterans’ Affairs",
        "Spanish_Language": null,
        "Salary_Min": null,
        "Salary_Max": null,
        "Years_Experience": "5-7",
        "Skills_Mentioned": [
            "Lead",
            "Mentor",
            "Team oriented",
            "Establish working relationships",
            "Writing",
            "Editing",
            "Problem solving",
            "Verbal communication",
            "Work well under pressure",
            "Attention to detail"
        ],
        "Cleaned_Text": "Staff Director, Subcommittee on Health, House Committee on Veterans’ Affairs\nCore Responsibilities:\n•Serve as the principal advisor to the full Committee Chairman, subcommittee\nChairman, and Republican Members for issues under the jurisdiction of the\nSubcommittee.\n•Provide in-depth policy analysis and political strategy for issues that fall under\nthe jurisdiction of the Subcommittee.\n•Lead and supervise the implementation of the Subcommittee’s legislative\ninitiatives including the formulation, drafting, introduction, passage, negotiation,\nand enactment of all legislation under the jurisdiction of the Subcommittee.\n•Supervise the Subcommittee staff in the organization of, and preparation for,\nhearings, to include determination of the agenda, briefing of witnesses and\nMembers, and drafting remarks and questions for the Chairman.\n•Conduct informational and oversight meetings with Administration officials, VA\nand other agencies, Veteran Service Organizations, non-profit organizations,\nindustry experts, and veterans on all issues under the jurisdiction of the\nSubcommittee.\n•Plan and supervise implementation of the Subcommittee’s oversight agenda of\nissues within its jurisdiction, including sending requests for information, writing\noversight letters, conducting oversight visits, reviewing document productions,\ncultivating sources of information, determining the veracity of information\nreceived, and other oversight measures, as needed.\n•Build relationships with internal and external partners, including Veteran Service\nOrganizations, member offices, industry, and contacts within the Department of\nVeterans Affairs and other government agencies to promote and enact the\nlegislative and oversight agenda of the Subcommittee, and that of the full\nCommittee Chairman.\n•Represent and discuss the full Committee or Subcommittee Chairman’s views at\nvarious conferences and speaking events.\n•Responsible for all other duties assigned by the full Committee Chairman, Staff\nDirector, or Deputy Staff Director; as needed.\nMinimum Qualifications:\n•Bachelor of Arts or Science\n•At least five to seven years of relevant policy or legislative experience.\nExperience on Capitol Hill desired but other experience will be considered.\nRequired Skills:\n•Ability to lead and mentor Subcommittee staff\n•Team oriented\n•Ability to establish working relationships\n•Strong writing and editing skills\n•Problem solving\n•Strong verbal communication\n•Ability to work well under pressure\n•Attention to detail\nEmployees may be eligible for the following benefits:\n•Sick and Annual Leave\n•Student Loan Repayment Program\n•Federal Employees Health Benefits Program\n•Thrift Savings Plan\n•Federal Employees' Group Life Insurance Program\n•Federal Long-Term Care (LTC) Insurance\n•Flexible Spending Accounts (FSAFEDS)\n•Dental & Vision Insurance Program (FEDVIP)\n•Metro or Parking Benefits\nOther Information:\nEmployment with the U.S. House of Representatives is at-will. The U.S. House\nof Representatives is an equal opportunity employer. All applicants will be\nconsidered without regard to race, color, national origin, religion, sex (including\nmarital or parental status), disability, or age. Transportation and all related travel\nexpenses associated with the interview and hiring process must be paid by the\napplicant.\nHow to Apply:\nInterested candidates should send their cover letter, resume, three professional\nreferences to VAR.Resumes@mail.house.gov with “HEALTH Staff Director” in\nthe subject line. In your cover letter please indicate what you believe are the three\nmost pressing challenges facing the Veterans Health Administration. No calls or\nwalk-ins, please."
    },
    {
        "Post_ID": "MEM-147-24",
        "Posting_Author": "Rep. Raul Ruiz, M.D.",
        "Congress_Number": null,
        "1 if Democrat": 1,
        "1 if woman": null,
        "DW-NOMINATE": null,
        "LES": null,
        "Date_Posted": "2024-04-15",
        "State_District": null,
        "Job_Function": "Communications",
        "Title_Parsed": "Press Secretary and Speechwriter",
        "Office_Type": "Select Subcommittee",
        "Committee_Affiliation": "Select Subcommittee on the Coronavirus Pandemic",
        "Spanish_Language": null,
        "Salary_Min": 90000,
        "Salary_Max": 95000,
        "Years_Experience": "2-3",
        "Skills_Mentioned": [
            "pitching",
            "working with reporters",
            "preparing remarks",
            "writing press releases",
            "writing quotes",
            "writing talking points",
            "writing op-eds",
            "communications",
            "Capitol Hill",
            "writing"
        ],
        "Cleaned_Text": "Rep. Raul Ruiz, M.D., the Ranking Member of the House Select Subcommittee on the Coronavirus Pandemic, is seeking a Press Secretary and Speechwriter to join the Democratic staff of the Select Subcommittee.\nResponsibilities include pitching and working directly with reporters, including in an on-the-record capacity; preparing remarks for delivery by the Ranking Member and other Select Subcommittee Democratic Members for hearings and press events; writing press releases, quotes, talking points, op-eds, and additional communications materials; and staffing the Ranking Member for interviews and public appearances.\nApplicants should have 2-3 years of relevant communications experience. Capitol Hill experience is a plus, but not required. Ideal candidates will be proactive and resourceful, with an enthusiasm for writing and strong attention to detail, particularly under tight deadlines. The salary range for this position is $90,000$95,000.\nThis office is an equal opportunity employer and does not discriminate on the basis of race, sex, color, age, religion, disability, national origin, uniformed status, sexual orientation, or gender identity. Women, LGBTQI+ people, people of color, and candidates from diverse backgrounds are strongly encouraged to apply.\nTo apply, please submit a resume, cover letter, and short writing sample (2-3 pages) as PDFs to SSCPJobs@mail.house.gov, with “Press Secretary and Speechwriter” in the email subject line.\nThe Select Subcommittee on the Coronavirus Pandemic is authorized to investigate a broad range of matters pertaining to the coronavirus pandemic under H. Res. 5. The Select Subcommittee was established within the Committee on Oversight and Accountability, which is the primary investigative committee of the United States House of Representatives, with jurisdiction to investigate “any matter” at “any time” under House Rule X."
    },
    {
        "Post_ID": "MEM-146-24",
        "Posting_Author": "OFFICE OF REP. ADRIANO ESPAILLAT",
        "Congress_Number": null,
        "1 if Democrat": null,
        "1 if woman": null,
        "DW-NOMINATE": null,
        "LES": null,
        "Date_Posted": "2024-04-15",
        "State_District": null,
        "Job_Function": "Community",
        "Title_Parsed": "Liaison, Harlem",
        "Office_Type": "Member",
        "Committee_Affiliation": null,
        "Spanish_Language": null,
        "Salary_Min": 65000,
        "Salary_Max": null,
        "Years_Experience": null,
        "Skills_Mentioned": [
            "Adaptability",
            "Attention to Detail",
            "Constituent /Stakeholder Service",
            "Initiative",
            "Planning",
            "Coordination",
            "Research",
            "Analysis",
            "Interpersonal Skills",
            "Teamwork",
            "Verbal Communication",
            "Written Communication",
            "Coalition Building"
        ],
        "Cleaned_Text": "MEM-146-24\n\nCommunity Liaison, Harlem\nOFFICE OF REP. ADRIANO ESPAILLAT\nJob Description & Summary\nThe Harlem Community Liaison for the Office of Congressman Adriano Espaillat\nserves as the Member's community representative for issues and programs within\ntheir assigned portfolio, including monitoring and updating the Member and\nDistrict Director on important local issues, emerging trends, and critical\ndevelopments. This position acts as a liaison to the federal, state, and local\ngovernments, as well as agencies on behalf of the Member.\nThe Harlem Community Liaison works with constituent services and will report\ndirectly to the Harlem Office Director while working with the broader team to\nensure effective communication with agencies and constituents on behalf of the\nMember.\nEssential Duties\n•Coordinates with the Harlem Director and Member to ensure outreach efforts\nalign with the Member’s strategic vision, goals, and priorities.\n•Collaborates with the Harlem Director and D.C. staff to ensure district priorities\nare aligned and inform the Member’s legislative strategy.\n•Assesses casework trends and identifies issues requiring legislative action and/or\nPage 12 of 23\n\n\nadditional Congressional oversight.\n•Informs the Harlem Director and Member of important developments and\ncurrent events impacting the district.\n•Builds and maintains positive relationships with constituents, key community\nleaders, and other stakeholders.\n•Acts as a liaison to local, state, and federal officials and stakeholders to form\neffective relationships for the Member.\n•Attends events to serve as a representative for the Member, as determined by the\nHarlem Director and Chief of Staff.\n•Handles various community issues in accordance with office policies and\nprocedures.\n•Organizes workload to prioritize tasks in accordance with varying deadlines and\nensure work is completed in an efficient and effective manner.\n•Understands differing perspectives and opinions to navigate conflicts and\ndevelop solutions effectively.\n•Required to staff the Member and/or attend community events, including on\noccasional weekends.\nProfessional and Social Skills\n·Adaptability\n·Attention to Detail\n·Constituent /Stakeholder Service\n·Initiative\n·Planning and Coordination\n·Research and Analysis\n·Interpersonal Skills\n·Teamwork\n·Verbal Communication\n·Written Communication\n·Coalition Building\nPreferred Education and Experience\n·Bachelor's degree or equivalent combination of education and experience\n·Experience developing a community relations strategy for an elected official\n·Familiarity with the Member's district and/or New York state\nPhysical Requirements and Work Environment\nThis position is in an office setting that is adequately heated, lighted, and\nventilated. Normal safety precautions apply. The work involves carrying light\nitems such as books, papers, and small office equipment. The incumbent must be\nable to meet minimum physical requirements (e.g., lifting, bending, crouching,\nstanding, etc.). Physical Requirements and work environment are subject to\nreasonable accommodations.\n\nPage 13 of 23\n\n\nOur office is an equal opportunity employer and does not discriminate on the\nbasis of race, color, religion, sex, sexual orientation, gender identity and\nexpression, national origin, disability, military status, age, marital status, or\nparental status. People of color and people from underrepresented groups are\nstrongly encouraged to apply.\nSalary: The salary for this position is $65,000 per year, depending on experience.\nHow to Apply:\nPlease submit your resume to espaillat_jobs@mail.house.gov with the subject\nline “Community Liaison, Harlem”. $"
    },
    {
        "Post_ID": "MEM-145-24",
        "Posting_Author": "Representative Peltola",
        "Congress_Number": null,
        "1 if Democrat": null,
        "1 if woman": null,
        "DW-NOMINATE": null,
        "LES": null,
        "Date_Posted": "2024-04-15",
        "State_District": null,
        "Job_Function": "Legislative",
        "Title_Parsed": "Legislative Aide and Special Assistant",
        "Office_Type": "DC",
        "Committee_Affiliation": null,
        "Spanish_Language": null,
        "Salary_Min": null,
        "Salary_Max": null,
        "Years_Experience": null,
        "Skills_Mentioned": [
            "scheduling",
            "travel arrangements",
            "memo preparation",
            "email management"
        ],
        "Cleaned_Text": "Representative Peltola seeks someone who will be a Legislative Aide and Special Assistant in her DC Office.\nResponsibilities include covering a limited number of issue areas for which they are expected to maintain a level of expertise and keep the Member up to date on constituent issues or policies that pertain to those subject areas, as well as scheduling meetings and arranging travel for the Chief of Staff, accompanying the Chief of Staff on their travels, preparing memos, and managing their schedule. Maintaining the Chief of Staff's email inbox and assisting the Legislative Assistants as needed are also a crucial part of the role.\nThe Office is an equal opportunity employer in accordance with the requirements of House Rules, regulations and applicable federal laws. The Office does not discriminate on the basis of an individual’s race, color, religion, sex, national origin, age, disability, genetic information, uniformed service, sexual orientation, gender identity or any other factors prohibited by applicable federal law.\nTo apply, please submit a resume to akresumes@mail.house.gov"
    },
    {
        "Post_ID": "MEM-144-24",
        "Posting_Author": "Texas GOP Member of Congress",
        "Congress_Number": null,
        "1 if Democrat": 0,
        "1 if woman": 0,
        "DW-NOMINATE": null,
        "LES": null,
        "Date_Posted": "2024-04-15",
        "State_District": null,
        "Job_Function": "Communications",
        "Title_Parsed": "Press Assistant/Digital Director",
        "Office_Type": "Member",
        "Committee_Affiliation": null,
        "Spanish_Language": 0,
        "Salary_Min": null,
        "Salary_Max": null,
        "Years_Experience": 1,
        "Skills_Mentioned": [
            "writing",
            "graphics",
            "social media",
            "video"
        ],
        "Cleaned_Text": "Texas GOP Member of Congress seeks a Press Assistant/Digital Director who is eager to join a robust communications operation. This is not an entry-level position-- at least six months to one year of relevant communications experience is required. Required Skills •Excellent writing ability and attention to detail. •Experience with creating graphics and social media branding. Duties •Develop and assist with press releases, talking points, op-eds, and other materials as assigned. •Assist with maintaining the office’s website and social media accounts. •Create and edit videos and other digital material. •Monitor the Member's presence and interactions on social media. •Take photos/video at events and meeting. Page 14 of 23 •Compile daily press clips. •Other duties as assigned. To apply, please send resumes to housegopemployment@gmail.com with position noted in subject line."
    },
    {
        "Post_ID": "MEM-141-24",
        "Posting_Author": "U.S. Rep. Rick Larsen",
        "Congress_Number": null,
        "1 if Democrat": null,
        "1 if woman": null,
        "DW-NOMINATE": null,
        "LES": null,
        "Date_Posted": "2024-04-15",
        "State_District": null,
        "Job_Function": "Community Liaison",
        "Title_Parsed": "Island County",
        "Office_Type": "district",
        "Committee_Affiliation": null,
        "Spanish_Language": true,
        "Salary_Min": 55000,
        "Salary_Max": 65000,
        "Years_Experience": null,
        "Skills_Mentioned": [
            "outreach",
            "writing",
            "public speaking",
            "interpersonal",
            "multi-tasking",
            "teamwork"
        ],
        "Cleaned_Text": "Community Liaison – Island County\nU.S. Rep. Rick Larsen\nEverett Office\nSummary:\nThe Island County Community Liaison serves as Rep. Larsen’s representative to\nWhidbey and Camano islands.\nAs part of our district outreach team, the primary role of this position is to\ncoordinate issues involving the federal government with officials from federal,\nstate and local governments, as well as constituents, businesses, organized labor\nand other organizations. The Outreach Assistant – North Counties staffer is\nexpected to develop relationships with our district stakeholders to learn the\ndetails of projects and policy concerns and to respond to their interests in federal\npolicy development.\nIn addition to the geographic responsibility for communities in Island County,\nthis position also covers military and veterans affairs and engagement with the\nU.S. Coast Guard.\nThe Island County Community Liaison is based in Rep. Larsen’s Everett, WA\noffice and reports directly to the District Director. Together, the district staff\nworks in harmony with the staff in Washington, D.C., and all staff members\nreport to the Chief of Staff.\nEssential job functions include:\n•Serve as an official representative for Rep. Larsen at meetings, forums and\npublic events\n•Build and maintain relationships with constituents, businesses, labor, non-profit\norganizations, federal agencies, local government, and other stakeholders in\nIsland County\n•Travel regularly throughout the district to monitor local issues, projects and\nactivities\n•Work with Washington D.C.-based staff on federal policy development and\ninterpretation for local stakeholders\n•Event planning, including Rep. Larsen’s district schedule\nRequired skills and knowledge:\n•Strong understanding of Island County and experience with outreach activities\nworking with government, cultural communities, the business community,\norganized labor and local stakeholder groups\n•Ability to exercise discretion and independent thinking while working as part of\na team on sensitive projects and issues\n•Strong writing ability\n•Flexibility to work nights and weekends\n•Valid driver’s license and vehicle\n•Comfort discussing issues with groups both small and large, including public\nspeaking\nThis position provides an opportunity to be part of a hard-working, cohesive, and\ndynamic team with a common mission of making a difference in the lives of\nothers. The ideal candidate is a bilingual English and Spanish speaker, selfmotivated, great at multi-tasking, has great interpersonal skills with a teamworkoriented attitude, and a strong desire to help people.\nThis is a full-time position with federal benefits such as health care, the Federal\nEmployees Retirement System, Student Loan Repayment Program,\nvacation/annual leave, paid sick and parental leave, and others.\nThe annual salary for this position depends on relevant experience and ranges\nfrom $55,000 - $65,000.\nThis office is an equal opportunity employer and does not discriminate on the\nbasis of race, sex, color, age, religion, national origin, sexual orientation, gender\nidentity, or disability. We are committed to building and maintaining an\norganization that reflects the needs and diverse community we serve.\nApplication Process:\nInterested candidates should send a resume and cover letter\nto ryan.casey@mail.house.gov or:\nOffice of U.S. Rep. Rick Larsen\nC/O Ryan Casey\nDistrict Director\n2930 Wetmore Avenue, Ste. 9F\nEverett, WA 9820"
    },
    {
        "Post_ID": "MEM-136-24",
        "Posting_Author": "House GOP Appropriator",
        "Congress_Number": null,
        "1 if Democrat": null,
        "1 if woman": null,
        "DW-NOMINATE": null,
        "LES": null,
        "Date_Posted": "2024-04-15",
        "State_District": null,
        "Job_Function": "Legislative",
        "Title_Parsed": "Military Legislative Assistant",
        "Office_Type": "House",
        "Committee_Affiliation": "Appropriations",
        "Spanish_Language": null,
        "Salary_Min": null,
        "Salary_Max": null,
        "Years_Experience": "1-3",
        "Skills_Mentioned": [
            "national security",
            "foreign affairs",
            "defense",
            "veterans issues"
        ],
        "Cleaned_Text": "House GOP Appropriator seeks an experienced military legislative assistant with 1-3 years of Capitol Hill experience. Members serves on the Military Construction Subcommittee and has many military equities in-district. Portfolio would include national security, foreign affairs, defense and veterans issues. Resumes can be sent to housegopemployment@gmail.com"
    },
    {
        "Post_ID": "MEM-135-24",
        "Posting_Author": "Congresswoman Joyce Beatty",
        "Congress_Number": null,
        "1 if Democrat": 1,
        "1 if woman": 1,
        "DW-NOMINATE": null,
        "LES": null,
        "Date_Posted": "2024-04-15",
        "State_District": "OH-03",
        "Job_Function": "Communications",
        "Title_Parsed": "Press Secretary",
        "Office_Type": "Member",
        "Committee_Affiliation": null,
        "Spanish_Language": null,
        "Salary_Min": null,
        "Salary_Max": null,
        "Years_Experience": null,
        "Skills_Mentioned": [
            "media relations",
            "press opportunities",
            "messaging",
            "media requests",
            "press releases",
            "statements",
            "media advisories",
            "op-eds",
            "social media",
            "risk management"
        ],
        "Cleaned_Text": "PRESS SECRETARY- The Office of Congresswoman Joyce Beatty (OH-03)\nseeks an experienced Press Secretary for her Washington, D.C. office. Candidates\nmust be able to manage media relations, press opportunities, and messaging for a\nsenior member of Congress. This role reports to the Communications Director.\nThis is not an entry-level position. Candidates with established, active\nrelationships with top-tier national media outlets and on-the-record experience\nwill receive preferred consideration. Ohio ties are preferred, but not required.\nPRIMARY RESPONSIBILITIES:\n•Serve as the primary contact for media requests, pitching and securing media\nopportunities in top-tier national outlets, coordinating necessary preparations,\nmessaging, and risk management.\n•Advance press events and staff the Member as needed for media engagements.\n•Establish and maintain relationships with Ohio media, and activate current\nrelationships with national, and D.C.-based media.\n•Draft and distribute media materials including press releases, statements, media\nadvisories, and op-eds.\n•Assist with developing social media content creation, including rapid response.\n•Complete special projects.\n•Develop and execute media strategy as part of the office’s larger\ncommunications strategy.\nSalary is competitive and commensurate with experience.\nThe Office of Congresswoman Beatty is an Equal Opportunity Employer who\ndoes not discriminate in employment based on race, color, religion, sex\n(including pregnancy and gender identity), national origin, sexual orientation,\nmarital status, disability, genetic information, age, membership in an employee\norganization, retaliation, parental status, military service, or other non-merit\nfactor. LGBTQ+, and minority candidates as well as candidates from\nunderrepresented groups are encouraged to apply.\nPlease submit your resume and cover letter to oh3.jobs@mail.house.gov using the\nfollowing subject header: PRESS SECRETARY: First name, Last name."
    },
    {
        "Post_ID": "MEM-133-24",
        "Posting_Author": "Rep. Pence",
        "Congress_Number": null,
        "1 if Democrat": null,
        "1 if woman": null,
        "DW-NOMINATE": null,
        "LES": null,
        "Date_Posted": "2024-04-15",
        "State_District": "IN-06",
        "Job_Function": "Administration",
        "Title_Parsed": "Scheduler",
        "Office_Type": "Member",
        "Committee_Affiliation": null,
        "Spanish_Language": null,
        "Salary_Min": null,
        "Salary_Max": null,
        "Years_Experience": null,
        "Skills_Mentioned": [
            "organizational",
            "interpersonal",
            "planning",
            "financial forms",
            "office expenses"
        ],
        "Cleaned_Text": "The Office of Rep. Pence (IN-06) is seeking a well-organized, personable\nScheduler in his Washington D.C office. This role is responsible for the\nCongressman’s schedule and travel plans, coordinating and responding to\nscheduling requests, and supervising the office’s Staff Assistant and interns to\nensure the office is managed effectively.\nFurther responsibilities include filing financial forms and overseeing routine\noffice expenses. This role also serves as the Office Emergency Coordinator. A\nstrong applicant would exhibit strong organizational and interpersonal skills, the\nability to plan effectively and adjust as needed, as well as an ability to work\ncollaboratively with other staff in the office.\nA candidate who is hired for this position will work under the current Director of\nPage 17 of 23\n\nOperations until his departure at the end of June, after which they will take over\nall of his former responsibilities.\nPlease submit a resume and references to gopjobonthehill@gmail.com"
    },
    {
        "Post_ID": "MEM-131-24",
        "Posting_Author": "For Country Caucus",
        "Congress_Number": null,
        "1 if Democrat": null,
        "1 if woman": null,
        "DW-NOMINATE": null,
        "LES": null,
        "Date_Posted": "2024-04-15",
        "State_District": null,
        "Job_Function": "Executive",
        "Title_Parsed": "Director",
        "Office_Type": "Member",
        "Committee_Affiliation": null,
        "Spanish_Language": null,
        "Salary_Min": 90000,
        "Salary_Max": 110000,
        "Years_Experience": 4,
        "Skills_Mentioned": [
            "policy",
            "communications",
            "government affairs",
            "bipartisan respect",
            "civility",
            "government cooperation",
            "entrepreneurial",
            "House legislative process",
            "National Defense Authorization Act",
            "organizational skills",
            "written communication skills",
            "verbal communication skills"
        ],
        "Cleaned_Text": "Established in 2019, the For Country Caucus of 30 veterans in the U.S. House is\none of the most productive bipartisan caucuses in Congress, having helped pass\nmore than 100 laws with a focus on national security, national service, and\nveterans affairs. The caucus works alongside a group of bipartisan senators and\nothers to pass bicameral legislation for the nation. The For Country Caucus is\nseeking an Executive Director to help lead the caucus in its next chapter of\ngrowth.\nResponsibilities:\n•Lead the For Country Caucus staff, which includes a communications director.\n•Work with the bipartisan For Country Caucus leadership to shape the caucus\nstrategy.\n•Manage and help develop relationships for the For Country Caucus with other\nstakeholders in Congress.\n•Manage and help develop relationships for the For Country Caucus with external\nstakeholders that can assist with advancing bipartisan legislation, including\nveteran service organizations.\n•Plan and execute For Country Caucus bi-monthly meetings for Members of\nCongress and staff.\n•Help identify and coordinate high-profile guest speakers.\n•Plan and execute For Country Caucus semi-annual service events and bipartisan\nCongressional Delegations.\n•Manage the For Country Caucus budget.\n•Advance For Country Caucus legislative priorities, to include shaping and\nexecuting internal and external communications.\n•Represent the For Country Caucus in meetings with House leadership,\nCommittee staff, Senate staff, and external organizations and stakeholders.\nRequired Qualifications:\n•At least four years of work experience in policy, communications, or\ngovernment affairs.\n•Dedication to promoting bipartisan respect, civility, and government\ncooperation.\n•Entrepreneurial spirit and a demonstrated ability to work independently.\n•Strong understanding of the House legislative process and the National Defense\nAuthorization Act.\n•Comfort working in a fast-paced, dynamic environment within a collaborative\nteam setting\n•Excellent organizational, written, and verbal communication skills.\n•Exceptional judgment.\nIf you are passionate about fighting polarization in Congress through principled\nveteran leadership and have the requisite skills and experience, we invite you to\napply for this pivotal role in advancing the Caucus's goals and priorities. Salary is\ncommensurate with experience and ranges from $90,000-110,000.\nPlease submit your resume and a cover letter detailing your relevant experience\nand interest in the position to ForCountryCaucus@mail.house.gov"
    },
    {
        "Post_ID": "MEM-126-24",
        "Posting_Author": "Office of Congresswoman Hillary Scholten",
        "Congress_Number": null,
        "1 if Democrat": 1,
        "1 if woman": 1,
        "DW-NOMINATE": null,
        "LES": null,
        "Date_Posted": "2024-04-15",
        "State_District": null,
        "Job_Function": "District",
        "Title_Parsed": "Representative/Constituent Caseworker",
        "Office_Type": "Member",
        "Committee_Affiliation": null,
        "Spanish_Language": null,
        "Salary_Min": 50000,
        "Salary_Max": 60000,
        "Years_Experience": "1-2",
        "Skills_Mentioned": [
            "customer service",
            "administrative",
            "office experience",
            "verbal communication",
            "written communication",
            "organizational abilities",
            "attention to detail",
            "prioritize",
            "multi-task",
            "Microsoft Office Suite",
            "database management"
        ],
        "Cleaned_Text": "The Office of Congresswoman Hillary Scholten is seeking a highly organized and motivated District Representative/Constituent Caseworker to serve as a link between the Congresswoman’s office and her constituents.\nDistrict Representative responsibilities include helping constituents to resolve issues with federal agencies, meeting with constituents, and serving as a liaison to locate, state, and federal officials or groups to form effective relationships for the Congresswoman.\nKey Responsibilities:\n•Manage a high volume of incoming constituent correspondence via phone, email, and mail.\n•Conduct research to fully understand constituent inquiries and resolve cases in a timely manner.\n•Liaise with federal agencies to inquire about the status of cases and resolve bureaucratic issues.\n•Maintain detailed records and case files using a database.\n•Attend community outreach events and build relationships with local stakeholders.\nQualifications:\n•1-2 years of customer service, administrative, or office experience.\n•Strong verbal and written communication skills.\n•Excellent organizational abilities and attention to detail.\n•Ability to prioritize, multi-task and meet deadlines.\n•Proficiency with Microsoft Office Suite and database management.\n•Knowledge of federal agencies and programs a plus.\n•Commitment to providing exceptional constituent service.\nApplicant Instructions:\nAll interested candidates are encouraged to submit a cover letter, resume and three (3) references to District Director Khristian Silvis at Khristian.Silvis@mail.house.gov.\nSalary Level/Range: $50,000 to $60,000 - Commensurate on experience\nNotice:\nAll applicants will be considered without regard to race, color, religion, sex (including marital or parental status), sexual orientation, gender identity, disability, age, or national origin."
    },
    {
        "Post_ID": "MEM-546-23",
        "Posting_Author": "Congressional Black Caucus (CBC)",
        "Congress_Number": null,
        "1 if Democrat": null,
        "1 if woman": null,
        "DW-NOMINATE": null,
        "LES": null,
        "Date_Posted": "2024-04-15",
        "State_District": null,
        "Job_Function": "Member Services",
        "Title_Parsed": "Director",
        "Office_Type": "Member",
        "Committee_Affiliation": null,
        "Spanish_Language": null,
        "Salary_Min": null,
        "Salary_Max": null,
        "Years_Experience": null,
        "Skills_Mentioned": [
            "motivated",
            "dynamic",
            "strategic",
            "detail-oriented",
            "relationship building",
            "communication",
            "writing",
            "political judgment",
            "multi-tasking",
            "team player",
            "legislative processes",
            "outreach",
            "drafting",
            "database maintenance"
        ],
        "Cleaned_Text": "Member Services Director, Congressional Black Caucus (CBC)\nThe Congressional Black Caucus (CBC) seeks a Member Services Director who\nis exceptionally motivated, dynamic, strategic, and detail-oriented to engage with\nCBC Member offices and outside partners to advance a robust member services\nportfolio.\nThe Member Services Director will be expected to proactively build strong\nrelationships across CBC Member offices and develop strategic opportunities for\nMember engagement advancing shared priorities. The individual will also be\nexpected to coordinate with CBC staff to field and respond to inquiries and\nrequests for support from Member offices and respond to and share external\nopportunities for Member engagement as they arise.\nThe Member Services Director is also responsible for assisting in overseeing all\naspects of caucus operations, logistics, designated administrative responsibilities\nand to support caucus leadership.\nThe Member Services Director responsibilities will include:\n•Conducting regular outreach to Member offices to build relationships with staff,\nshare opportunities for Member or staff participation in events, messaging, and\nother efforts, and identify new ideas for collaboration with Member offices\n•Sharing resources with Member offices and working with CBC, congressional,\nand external staff to develop high-quality materials for Member office use\n•Drafting regular newsletters for Member offices with relevant updates and\nopportunities, as well as for external audiences to uplift Member engagement on\nCBC issues\n•Developing a network of external partners working on issues relevant to the\nCBC and Member offices\n•Maintaining staff contact information and distribution lists\n•Provides orientation and training for new staff;\n•Assists departing employees with necessary administrative procedures (i.e.,\nreturning keys, House I.D. cards, and other office property; obtaining forwarding\naddresses, work files, and records);\n•Supervises the mail operations and the administrative files and personnel\nrecords;\n•Assists staff in scheduling House or Capitol rooms for outside group functions;\n•Organize and facilitate meetings and other strategic convenings to support\ninstitutional\n•change, policies, and programmatic work;\n•Oversees operations for CBC including organizing weekly meetings and events\n•Provides logistical support for all programming\n•Works with the CBC personal office staffs and coordinates with the CBC\nSchedulers to implement the Caucus’ priorities\n•Builds and maintains databases of internal and external stakeholders\nQualified candidates must have an understanding of CBC policy priorities and\nfamiliarity working with the African American community. Outstanding writing\nand communication skills, sound political judgment, and the ability to work\nclosely and collaboratively with multiple Member offices and key stakeholders\nare essential. Top candidates should also be detail-oriented and possess the ability\nto multi-task, work well in a fast-paced setting, and act as a team player.\nCandidates should have a demonstrated understanding of House and Senate\nlegislative processes.\nTo apply, please send a cover letter, resume to vincent.evans@mail.house.gov.\nNo walk-ins or calls please."
    },
    {
        "Post_ID": "MEM-451-23",
        "Posting_Author": "Rep. Maxine Waters",
        "Congress_Number": null,
        "1 if Democrat": 1,
        "1 if woman": 1,
        "DW-NOMINATE": null,
        "LES": null,
        "Date_Posted": "2024-04-15",
        "State_District": "CA-43",
        "Job_Function": "Legislative",
        "Title_Parsed": "Director/Counsel",
        "Office_Type": "Member",
        "Committee_Affiliation": "House Committee on Financial Services",
        "Spanish_Language": null,
        "Salary_Min": null,
        "Salary_Max": null,
        "Years_Experience": 3,
        "Skills_Mentioned": [
            "policy",
            "legislative",
            "strategic legislative vision",
            "leadership",
            "organizational",
            "time management",
            "oral communication",
            "written communication",
            "civil rights",
            "women’s rights",
            "gun policy",
            "constitutional law",
            "foreign affairs",
            "management",
            "policy positions",
            "legislative solutions",
            "strategic planning",
            "monitoring",
            "legislative memos",
            "vote recommendations"
        ],
        "Cleaned_Text": "The Office of the Rep. Maxine Waters (D-CA-43) the Ranking Member of the House Committee on Financial Services (FSC), has an immediate need for an experienced policy professional and manager to be the Member’s Legislative Director/Counsel.\nThe Legislative Director will focus on the Member’s non-FSC policy priorities including civil rights issues. Working closely with the Chief of Staff and Communications Director the Legislative Director will aim to ensure the Member’s strategic legislative vision is implemented. This is not an entry-level position. The ideal candidate will have significant previous experience working in legislative roles on Capitol Hill.\nCORE RESPONSIBILITIES AND DUTIES:\n•Ensures legislative staff focuses on Member’s policy goals.\n•Proposes policy positions and formulate legislative solutions.\n•Recommends strategies and tactics on advancing Member’s legislative priorities.\n•Handles short-term and long-term legislative planning for the Member.\n•Manages direction of legislative team.\n•Monitors and reports floor action to the Member and the Chief of Staff.\n•Writes and reviews legislative memos.\n•Works with legislative team to develop vote recommendations.\n•Coordinates responses to legislative mail.\n•Communicates and strategizes with the District Director and/or district office staff on policy initiatives targeted towards constituents.\n•Maintains up-to-date status reports on all legislation affecting the district, legislation sponsored by the Member, legislation on which the Member is an original, lead cosponsor, and legislation on which the Member is a cosponsor.\n•Oversees activities in the office in the absence of the Chief of Staff.\n•Performs other duties as assigned.\nQUALIFICATIONS\n•Juris Doctor degree required.\n•Ability to work in face-paced environment with high-profile Member.\n•Prior experience as a Legislative Director or Senior Legislative Assistant strongly preferred.\n•3 – 6 years of Capitol Hill experience strongly preferred.\n•At least 2 years of management experience.\n•Thorough understanding of the legislative process\n•Expertise and/or experience in judiciary related issues, e.g., civil rights, women’s rights, gun policy, constitutional law, etc., and foreign affairs strongly preferred.\n•Strong leadership and organizational skills.\n•Strong time management skills.\n•Excellent oral and written communication skills.\n•Managing complex, multi-stakeholder initiatives and driving collaborative processes.\n•Availability to work long hours.\n•Flexible and adaptable to a variety of personalities and situations.\n•Familiarity with California and/or district 43 preferred but not required.\nSALARY\nCommensurate with experience.\nApplicant Instructions:\nInterested candidates should submit a resume, cover letter and at least 2 references to stephanie.moore@mail.house.gov with “Legislative Director/Counsel” in the subject line. This position will remain open until filled.\nIncomplete applications may not be considered.\nThis office is an equal opportunity employer and will consider all applicants without regard to race, color, religion, sex, marital or parental status, sexual orientation, gender identity, national origin, disability or national origin."
    }
]