[
    {
        "Post_ID": "MEM-149-21",
        "Posting_Author": "Chairman Nadler",
        "Congress_Number": null,
        "1 if Democrat": 1,
        "1 if woman": null,
        "DW-NOMINATE": null,
        "LES": null,
        "Date_Posted": "2021-05-10",
        "State_District": null,
        "Job_Function": "Communications",
        "Title_Parsed": "Director",
        "Office_Type": "Committee",
        "Committee_Affiliation": "Judiciary",
        "Spanish_Language": null,
        "Salary_Min": null,
        "Salary_Max": null,
        "Years_Experience": null,
        "Skills_Mentioned": [
            "spokesperson",
            "media relations",
            "writing",
            "press releases",
            "op-eds",
            "talking points",
            "briefing materials",
            "interview preparation",
            "stakeholder engagement",
            "press conferences",
            "team management",
            "communications",
            "political judgment"
        ],
        "Cleaned_Text": "Democratic staff of the House Judiciary Committee seeks experienced, hardworking, and creative Communications Director to lead the press operation for both the Committee and Chairman Nadler’s personal office.\nCore responsibilities include serving as an on-the-record spokesperson; working with national and local media to highlight committee activities and advance the committee’s agenda; writing press releases, op-eds, talking points, and briefing materials; booking and preparing the Chairman for interviews; engaging key stakeholders; organizing press conferences; and managing a team of digital and press staff.\nThis is a senior position in a fast-paced office that requires a strong work ethic and close attention to detail. Candidates must be proactive and have the vision to develop a long-term communications blueprint that advances key objectives. On-therecord experience, exceptional writing skills, sound political judgment, and the ability to work independently and collaboratively, are essential. An understanding of key policy areas, including constitutional, immigration, surveillance, and criminal justice issues is desired. The ideal candidate will have Congressional communications experience and NY ties. This is not an entry level position.\nThe Committee strives to ensure that our staff represents the diversity of the country’s population; candidates from minority backgrounds are strongly encouraged to apply. The Committee does not discriminate on the basis of race, color, religion, sex (including marital or parental status, sexual orientation, and gender identity), disability, age, or national origin.\nQualified candidates should submit a resume, cover letter, and two writing samples to JDEM.Job@mail.house.gov."
    },
    {
        "Post_ID": "MEM-148-21",
        "Posting_Author": "Congresswoman Jahana Hayes",
        "Congress_Number": null,
        "1 if Democrat": 1,
        "1 if woman": 1,
        "DW-NOMINATE": null,
        "LES": null,
        "Date_Posted": "2021-05-10",
        "State_District": "CT-05",
        "Job_Function": "Casework",
        "Title_Parsed": "Caseworker",
        "Office_Type": "Member",
        "Committee_Affiliation": null,
        "Spanish_Language": null,
        "Salary_Min": null,
        "Salary_Max": null,
        "Years_Experience": null,
        "Skills_Mentioned": [
            "federal agencies",
            "written communication",
            "verbal communication",
            "organizational",
            "time management"
        ],
        "Cleaned_Text": "Congresswoman Jahana Hayes (CT-05) seeks a Caseworker to join her team in\nWaterbury, CT. Ideal candidates will have prior knowledge of federal agencies;\nexcellent written and verbal communication skills; strong organizational and time\nmanagement skills; a positive attitude; and an ability to work under pressure and\nmeet deadlines in an fast-paced work environment. Bilingual applicants are\npreferred.\nDuties include:\n*Acting as the representative for the Congresswoman within their area of\nresponsibility including answering casework correspondence, meeting with\nconstituents, verbal communications with constituents, and serving as a liaison\nwith federal, district, and local agencies, persons or groups for effective\nrelationships for the Congresswoman;\n*Informing the Congresswoman and the District Director of all happenings in\ntheir assigned issue areas by screening district media sources and interacting with\nconstituents;\n*Handling casework assignments and assesses casework for problems requiring\nlegislative action and makes recommendations to the District Director and Chief\nof Staff;\n*Monitor scheduled district meetings for the Congresswoman with constituents;\n*Logging incoming and outgoing mail and incoming telephone calls relating to\ncasework;\n*Preparing periodic reports for the Congresswoman and District Director on\npending cases and district activities in his or her assigned issue areas;\n*Continually screening active cases and acts as liaison with constituents to ensure\nthat their cases are handled in a responsive manner;\n*Maintaining up-to-date files on all cases and categories of information of\nimportance to the office; and\n*Performs other duties as assigned.\nWomen and minority candidates are strongly encouraged to apply. Interested\nparties should e-mail a concise cover letter including salary requirements and\nresume to CT05jobs@mail.house.gov with the following subject line: First Name\nLast Name - Caseworker. No phone calls or walk-ins, please."
    },
    {
        "Post_ID": "MEM-146-21",
        "Posting_Author": "House Judiciary Committee",
        "Congress_Number": null,
        "1 if Democrat": 1,
        "1 if woman": null,
        "DW-NOMINATE": null,
        "LES": null,
        "Date_Posted": "2021-05-10",
        "State_District": null,
        "Job_Function": "Staff",
        "Title_Parsed": "Assistant",
        "Office_Type": "Committee",
        "Committee_Affiliation": "Judiciary",
        "Spanish_Language": null,
        "Salary_Min": null,
        "Salary_Max": null,
        "Years_Experience": null,
        "Skills_Mentioned": [
            "organizational",
            "research",
            "writing",
            "communication",
            "administrative",
            "calendar management",
            "intern program management"
        ],
        "Cleaned_Text": "The Democratic staff of the House Judiciary Committee seeks a Staff Assistant.\nCandidates should have excellent organizational skills and strong research,\nwriting, and communication skills.\nResponsibilities include overseeing Committee hearing and markup logistics -which often include being physically present; serving as assistant clerk during\nmarkups; providing administrative and research support to the Chief of Staff and\nStaff Director/Chief Counsel; coordinating the Chief of Staff, Staff\nDirector/Chief Counsel, and the Committee’s calendars; co-managing the intern\nprogram; and managing Committee administrative needs.\nThe Committee strives to ensure that our staff reflects the diversity of the\ncountry’s population; candidates from minority backgrounds are strongly\nencouraged to apply. The Committee does not discriminate on the basis of race,\ncolor, religion, sex (including marital or parental status, sexual orientation, and\ngender identity), disability, age, or national origin.\nPlease send a resume and cover letter to JDEM.job@mail.house.gov and include\n“Staff Assistant” in the subject line."
    },
    {
        "Post_ID": "MEM-145-21",
        "Posting_Author": "Congressman Chip Roy",
        "Congress_Number": null,
        "1 if Democrat": null,
        "1 if woman": null,
        "DW-NOMINATE": null,
        "LES": null,
        "Date_Posted": "2021-05-10",
        "State_District": "TX",
        "Job_Function": "Legislative",
        "Title_Parsed": "Assistant",
        "Office_Type": "DC",
        "Committee_Affiliation": null,
        "Spanish_Language": null,
        "Salary_Min": null,
        "Salary_Max": null,
        "Years_Experience": "2-5",
        "Skills_Mentioned": [
            "budget",
            "spending",
            "tax",
            "energy",
            "environment",
            "transportation",
            "infrastructure",
            "briefing materials",
            "legislation",
            "memos",
            "letters"
        ],
        "Cleaned_Text": "The Office of Congressman Chip Roy is seeking a Legislative Assistant in the DC office. Issue areas may include but are not limited to budget/spending, tax, energy, environment, transportation, and infrastructure.\nResponsibilities include preparing briefing materials for meetings, advising the Congressman on all legislative areas within their portfolio, preparing vote recommendations, meeting with constituents and stakeholders on policy matters within their portfolio, and drafting legislation, memos, and letters.\n2-5 years of years of Hill experience is preferred. Texas ties are a plus.\nInterested candidates should send resume, cover letter, and two references as a single PDF with the file name “LA.LastName.FirstName”\nto txgopofficejobs21@gmail.com."
    },
    {
        "Post_ID": "MEM-144-21",
        "Posting_Author": "Education and Labor Committee (Minority)",
        "Congress_Number": null,
        "1 if Democrat": null,
        "1 if woman": null,
        "DW-NOMINATE": null,
        "LES": null,
        "Date_Posted": "2021-05-10",
        "State_District": null,
        "Job_Function": "Communications",
        "Title_Parsed": "Speechwriter",
        "Office_Type": "Committee",
        "Committee_Affiliation": "Education and Labor",
        "Spanish_Language": null,
        "Salary_Min": null,
        "Salary_Max": null,
        "Years_Experience": 1,
        "Skills_Mentioned": [
            "writing",
            "grammar",
            "media relations",
            "social media"
        ],
        "Cleaned_Text": "The Education and Labor Committee (Minority) seeks an experienced communications staffer to serve as speechwriter.\nA successful applicant will be self-starting, reliable, organized, creative and professional with superb writing and grammar skills and attention to detail. The speechwriter is responsible for drafting hearing, markup, and floor remarks for senior committee members along with op-eds, blog posts, press releases, and speeches to stakeholder groups.\nAssistance with other communication duties include, but are not limited to: media relations, social media, and engagement with member offices. Successful candidate will have a minimum of 1 years of Capitol Hill or press experience with competitive compensation commensurate with experience.\nEmail resume, cover letter, references and communications writing samples to cyrus.artz@mail.house.gov."
    },
    {
        "Post_ID": "MEM-143-21",
        "Posting_Author": "Midwest conservative Republican",
        "Congress_Number": null,
        "1 if Democrat": null,
        "1 if woman": null,
        "DW-NOMINATE": null,
        "LES": null,
        "Date_Posted": "2021-05-10",
        "State_District": null,
        "Job_Function": "Communications",
        "Title_Parsed": "Director",
        "Office_Type": "Member",
        "Committee_Affiliation": null,
        "Spanish_Language": null,
        "Salary_Min": null,
        "Salary_Max": null,
        "Years_Experience": "4-6",
        "Skills_Mentioned": [
            "writing",
            "editing",
            "proofreading",
            "oral communication",
            "legislative process",
            "social media",
            "graphics",
            "videos"
        ],
        "Cleaned_Text": "communications director - midwest conservative republican seeks a motivated and experienced communications professional to lead development and execution of all official messaging. qualifications: •minimum of 4-6 years of congressional experience; •strong writing, editing, and proofreading skills; •strong oral communication skills; •understanding of print and broadcast media; existing media relationships a plus. •thorough knowledge of legislative process; •knowledge of current issues and events in which the member is involved; •ability to exercise discretion and independent judgment in the representation of the member's positions on policy issues; •availability to work long hours; •ability to work collaboratively with district office. duties: •responsibilities include writing press releases, media advisories, and newsletters, crafting content for social media channels, developing graphics and videos, assisting with media monitoring and pitching press, overseeing clips collection and distribution, and working with the communications team to identify new ways to engage with press and digital audiences •acts as the formal spokesperson and media liaison for the member; •develops and implements media and communications strategy for the member; •remains abreast of current legislative and non-legislative issues about which the member may be questioned; •evaluates current events and media reports in the district and the nation for their impact on the member; •provides ideas and advice on the effect in the media of the member's actions and legislative activities; •writes speeches for the member; and •performs other duties as assigned. interested candidates should email an resume, cover letter and writing sample to: indianagopjobs@gmail.com"
    },
    {
        "Post_ID": "MEM-141-21",
        "Posting_Author": "Senior Democrat",
        "Congress_Number": null,
        "1 if Democrat": 1,
        "1 if woman": null,
        "DW-NOMINATE": null,
        "LES": null,
        "Date_Posted": "2021-05-10",
        "State_District": null,
        "Job_Function": "Legislative",
        "Title_Parsed": "Legislative Assistant",
        "Office_Type": "Member",
        "Committee_Affiliation": null,
        "Spanish_Language": null,
        "Salary_Min": null,
        "Salary_Max": null,
        "Years_Experience": null,
        "Skills_Mentioned": [
            "legal",
            "writing",
            "interpersonal",
            "research",
            "problem solving"
        ],
        "Cleaned_Text": "Legislative Assistant – Senior Democrat is seeking a highly energetic, motivated and organized lawyer with strong interpersonal, legal and writing skills. The ideal candidate will be able to manage multiple tasks and work well under pressure. The Legislative Assistant works with the Chief Counsel/Legislative Director and with the Chief of Staff to develop and implement the Member’s legislative strategy in his/her issue areas; prepares materials for hearings; drafts legislation, amendments, and congressional record statements; and conducts research. The ability to write well under tight deadlines is essential. Candidate must be able to handle multiple tasks and issues effectively while meeting deadlines. A successful candidate will be a results-oriented, problem solving lawyer and motivated self-starter who can think outside the box. Prior Hill, law firm or similar experience is preferred but not always required. Candidate must possess a law degree and be, or be willing to become, a resident of the District of Columbia. Salary based on skill and experience level. Interested applicants should send a cover letter, resume, references and two writing samples to DC00.NortonResume@mail.house.gov"
    },
    {
        "Post_ID": "MEM-140-21",
        "Posting_Author": "Rep. Peter Welch",
        "Congress_Number": null,
        "1 if Democrat": null,
        "1 if woman": null,
        "DW-NOMINATE": null,
        "LES": null,
        "Date_Posted": "2021-05-10",
        "State_District": null,
        "Job_Function": "Communications",
        "Title_Parsed": "Director",
        "Office_Type": null,
        "Committee_Affiliation": [
            "Energy and Commerce",
            "Intelligence",
            "Oversight"
        ],
        "Spanish_Language": null,
        "Salary_Min": null,
        "Salary_Max": null,
        "Years_Experience": null,
        "Skills_Mentioned": [
            "writing",
            "pitching Capitol Hill reporters",
            "local reporters",
            "booking national news hits",
            "organized",
            "social media"
        ],
        "Cleaned_Text": "Rep. Peter Welch is hiring a communications director to manage a busy press shop. Successful candidates will be excellent writers, highly creative, skilled at pitching Capitol Hill and local reporters, experienced with booking national news hits, highly organized, and able to prioritize and publicize Rep. Welch’s strategic goals across social media platforms. A successful candidate will join a tight-knit team, so a collaborative mindset is essential and a sharp sense of humor is appreciated.\nRep. Welch is a busy Member, so you will be too. In addition to being a chief deputy whip, he is a Member of three very active, high profile committees: Energy and Commerce, Intelligence, and Oversight.\nCapitol Hill relationships and Vermont ties are pluses. The office is an equal opportunity employer, and applications by members of underrepresented groups are strongly encouraged. Interested and qualified candidates should submit their resume, cover letter, and two writing samples to vermontcommsjob@gmail.com.\nBonus points if you know how to pronounce the Vermont towns of Charlotte, Calais and Vergennes."
    },
    {
        "Post_ID": "MEM-139-21",
        "Posting_Author": "Senior House Appropriator",
        "Congress_Number": null,
        "1 if Democrat": null,
        "1 if woman": null,
        "DW-NOMINATE": null,
        "LES": null,
        "Date_Posted": "2021-05-10",
        "State_District": null,
        "Job_Function": "Communications",
        "Title_Parsed": "Communications Director/Press Secretary",
        "Office_Type": "House",
        "Committee_Affiliation": null,
        "Spanish_Language": null,
        "Salary_Min": null,
        "Salary_Max": null,
        "Years_Experience": null,
        "Skills_Mentioned": [
            "writing",
            "communications planning",
            "press strategy",
            "drafting press materials",
            "remarks",
            "talking points",
            "statements",
            "op-eds",
            "press releases",
            "media advisories",
            "social media",
            "interview preparation",
            "fielding media inquiries"
        ],
        "Cleaned_Text": "Senior House Appropriator is seeking a Communications Director/Press Secretary for the Washington, D.C. office. Responsibilities include communications planning and press strategy for D.C. and the district; drafting press materials including: remarks, talking points, statements, op-eds, press releases, and media advisories; assisting with the management of the Congressman’s social media accounts; interview preparation; and fielding media inquiries.\nThe ideal candidate is a strong writer, politically savvy, detail-oriented, flexible, creative, and a self-starter. Interested candidates should send a cover letter, resume, and two writing samples to GA02.Resume@mail.house.gov."
    },
    {
        "Post_ID": "MEM-138-21",
        "Posting_Author": "New York Democrat",
        "Congress_Number": null,
        "1 if Democrat": 1,
        "1 if woman": null,
        "DW-NOMINATE": null,
        "LES": null,
        "Date_Posted": "2021-05-10",
        "State_District": "NY",
        "Job_Function": "Constituent Services",
        "Title_Parsed": "Liaison/District Representative",
        "Office_Type": "Member",
        "Committee_Affiliation": null,
        "Spanish_Language": null,
        "Salary_Min": null,
        "Salary_Max": null,
        "Years_Experience": 3,
        "Skills_Mentioned": [
            "casework",
            "verbal communications",
            "liaison",
            "community organizations"
        ],
        "Cleaned_Text": "U.S. Member of Congress in New York seeking Constituent Services\nLiaison/District Representative\nNew York Democrat seeks Fast-paced, high profile New York City\nCongressional Member office seeks Constituent Services Liaison/District\nRepresentative to manage the Constituent Services activities. Responsibility\nincluding answering casework correspondence, meeting with constituents, verbal\ncommunications with constituents and serving as a liaison with federal, district,\nand local agencies and community organizations.\nThis is a permanent, full-time position. and mid-entry-level position in a fastpaced office that frequently requires non-traditional work hours, Fluency in other\nlanguage other than English (Creole, Arabic, Russian) highly preferred.\nQualified applicants should send a cover letter, and resume\nto ResumeNY@mail.house.gov\nTies to Brooklyn, a proven record, and a minimum of three years of related\nexperience are required. This position is based in the local Brooklyn, NY office\nPlease place Constituent Services/District Representative in the subject line.\nNO WALK-INS OR PHONE CALLS."
    },
    {
        "Post_ID": "MEM-136-21",
        "Posting_Author": "New York Democrat",
        "Congress_Number": null,
        "1 if Democrat": 1,
        "1 if woman": null,
        "DW-NOMINATE": null,
        "LES": null,
        "Date_Posted": "2021-05-10",
        "State_District": "NY",
        "Job_Function": "Outreach and Community Engagement",
        "Title_Parsed": "Director",
        "Office_Type": "District",
        "Committee_Affiliation": null,
        "Spanish_Language": null,
        "Salary_Min": null,
        "Salary_Max": null,
        "Years_Experience": 3,
        "Skills_Mentioned": [
            "organization",
            "leadership",
            "teamwork",
            "management",
            "verbal communication",
            "written communication"
        ],
        "Cleaned_Text": "New York Democrat seeks a Director of Outreach and Community\nEngagement for their district office. Responsibilities include building strategic\nrelationships with community leaders and constituent groups, executing various\noutreach activities, and recruiting volunteers for events and outreach programs in\nthe district.\nDuties also include coordinating initiatives designed to promote the office and\nservices to the community, managing an outreach and organizing plan for the\nteam, and any other assigned duties. Candidates should possess excellent\norganization, leadership, teamwork, and management skills, as well as verbal and\nwritten communication skills.\nThe Director of Outreach and Community Engagement will report to the District\nDirector. Ties to Brooklyn, a proven management record, and a minimum of\nthree years of related experience are required. This position is based in the local\nBrooklyn, NY office. This is a permanent, full-time position and a senior-level\nposition in a fast-paced office that frequently requires non-traditional work hours.\nFluency in other language other than English (Creole, Arabic, Russian) highly\npreferred.\nQualified applicants should send a cover letter, and resume\nto ResumeNY@mail.house.gov.\nPlease place DIRECTOR OF OUTREACH AND COMMUNITY\nENGAGEMENT in the subject line.\nNO WALK-INS OR PHONE CALLS."
    },
    {
        "Post_ID": "MEM-132-21",
        "Posting_Author": "Congressman Tom McClintock",
        "Congress_Number": null,
        "1 if Democrat": 0,
        "1 if woman": 0,
        "DW-NOMINATE": null,
        "LES": null,
        "Date_Posted": "2021-05-10",
        "State_District": "CA",
        "Job_Function": "Legal",
        "Title_Parsed": "Senior Advisor/Counsel",
        "Office_Type": "Member",
        "Committee_Affiliation": null,
        "Spanish_Language": 0,
        "Salary_Min": null,
        "Salary_Max": null,
        "Years_Experience": null,
        "Skills_Mentioned": [
            "writing",
            "research",
            "attention to detail",
            "legislation",
            "drafting",
            "Capitol Hill"
        ],
        "Cleaned_Text": "The Office of Congressman Tom McClintock (R-CA) seeks applications for a\nSenior Advisor/Counsel to handle the Judiciary portfolio with an emphasis on\nimmigration in the Washington, D.C. office.\nResponsibilities include advising the Member on all legislative areas within their\nportfolio, prepare and staff the Member in committee hearings and markups, draft\nand advance legislation, and represent the Member in meetings with constituents\nand stakeholders concerning policy matters in their portfolio.\nApplicants should possess strong conservative credentials, effective writing and\nresearch skills, strong attention to detail, and the ability to manage multiple tasks\nat once. Previous Capitol Hill experience and JD preferred. To apply, please\nemail resume and cover letter to gopwestcoastjobs@gmail.com\nTo apply, please email resume and cover letter\nto gopwestcoastjobs@gmail.com with Subject: Senior\nAdvisor/Counsel_LastName.FirstName"
    },
    {
        "Post_ID": "MEM-122-21",
        "Posting_Author": "Congresswoman Nanette Diaz Barragán",
        "Congress_Number": null,
        "1 if Democrat": null,
        "1 if woman": 1,
        "DW-NOMINATE": null,
        "LES": null,
        "Date_Posted": "2021-05-10",
        "State_District": "CA-44",
        "Job_Function": "District",
        "Title_Parsed": "Director",
        "Office_Type": "Member",
        "Committee_Affiliation": null,
        "Spanish_Language": true,
        "Salary_Min": 100000,
        "Salary_Max": 120000,
        "Years_Experience": null,
        "Skills_Mentioned": [
            "management",
            "communications skills",
            "strategic planning",
            "self-motivation",
            "outreach",
            "multi-task",
            "work under pressure",
            "flexibility"
        ],
        "Cleaned_Text": "District Director | Congresswoman Nanette Diaz Barragán (CA-44)\nLocation: San Pedro, CA – Los Angeles County\nSalary Range: $100,000 – 120,000\nCongresswoman Nanette Diaz Barragán (CA-44) seeks a District Director to\noversee all operations of the district office. The District Director will oversee\nmanagement and operation of the District Office, serve as liaison to local\norganizations and elected officials, manage a team of 5-8 in the District including\ninterns, and develop and implement long-term strategic plans, including but not\nlimited to outreach, casework, and grants programs.\nThis position is responsible for recruiting, hiring, training, and managing district\nstaff and ensures that district staff complies with office policies, practices, and\nprocedures; represents the Member assigns appropriate staff to do so at events or\nfunctions through the district as needed and will serve as the primary liaison\nbetween the Congresswoman, constituents, and entities in the district.\nThe District Director will also be responsible for strategizing, developing, and\nimplementing constituent outreach plans, managing casework, and managing\ntheir own fieldwork book of business. The District Director will also work with\nthe office’s scheduling team to implement an aggressive schedule of community\nevents and outreach. Further, the District Director acts as an advisor for the\nCongresswoman on local issues and concerns, politics, and other developments\nthroughout the district, the Los Angeles metropolitan area, Southern California,\nand the state.\nQualified candidates will demonstrate significant management experience\n(federal, state, or local government management experience are a plus), strong\noral and written communications skills, strategic planning abilities, selfmotivation, and outreach experience to local and state organizations. An ability to\nwork collaboratively with district office staff as well as D.C.-based legislative\nand communications staff is required.\nExcellent oral and written communication skills are critical to the success of the\ncandidate, as well as knowledge of the local, county, and statewide processes.\nThe ideal candidate is energetic, detail-oriented, able to multi-task, politically\nastute, and willing to work including evenings and weekends as needed in a fastpaced and results-oriented setting.\n\nThe position requires the ability to multi-task, work well under pressure and the\nflexibility to work long hours, including nights and weekends.\nCandidates from diverse backgrounds encouraged to apply.\nSpanish fluency and Los Angeles ties are a plus.\nCandidates should send a cover letter, resume, appropriate writing samples, and\nthree references with “CA44 District Director” in the subject line\nto CA44Resumes@mail.house.gov.\nThe office is an equal opportunity employer and does not discriminate on the\nbasis of race, color, religion, sex, sexual orientation, gender identity and\nexpression, national origin, disability, military status, age, marital status, or\nparental status."
    },
    {
        "Post_ID": "MEM-119-21",
        "Posting_Author": "Committee on Ethics",
        "Congress_Number": null,
        "1 if Democrat": null,
        "1 if woman": null,
        "DW-NOMINATE": null,
        "LES": null,
        "Date_Posted": "2021-05-10",
        "State_District": null,
        "Job_Function": "Legal",
        "Title_Parsed": "Financial Disclosure Counsel",
        "Office_Type": "Committee",
        "Committee_Affiliation": "Ethics",
        "Spanish_Language": null,
        "Salary_Min": null,
        "Salary_Max": null,
        "Years_Experience": null,
        "Skills_Mentioned": [
            "analytical",
            "written communication",
            "oral communication",
            "government ethics",
            "ethics counseling",
            "accounting",
            "auditing",
            "investment management",
            "taxation",
            "corporate finance",
            "securities law"
        ],
        "Cleaned_Text": "Financial Disclosure Counsel (Washington, DC) -- The Committee on Ethics\nseeks an attorney for the position of counsel in the Financial Disclosure office.\nThe Committee’s financial disclosure counsel are responsible for reviewing\nfinancial statements and providing legal advice on a high volume of financial\ndisclosure issues, education and training to Members of Congress and their staff\nthrough frequent telephone calls, in-person meetings, and written work product.\nThis is a non-partisan position which requires the ability to serve all Members of\nCongress equally and refrain from political or partisan activity. Candidates must\npossess outstanding analytical and written and oral communication skills, as well\nas the sound judgment necessary to evaluate the sensitive matters that arise before\nthe Committee.\nExperience in one or more of the following areas is desirable: government ethics,\nethics counseling, accounting, auditing, investment management, taxation,\ncorporate finance, and securities law. Salary commensurate with experience.\nPlease email resume, cover letter, and short writing sample\nto ethicsjobs@mail.house.gov. Please include the phrase “FD Counsel” in the\nsubject line."
    },
    {
        "Post_ID": "MEM-118-21",
        "Posting_Author": "Committee on Ethics",
        "Congress_Number": null,
        "1 if Democrat": null,
        "1 if woman": null,
        "DW-NOMINATE": null,
        "LES": null,
        "Date_Posted": "2021-05-10",
        "State_District": null,
        "Job_Function": "Advice and Education",
        "Title_Parsed": "Counsel",
        "Office_Type": "Committee",
        "Committee_Affiliation": "Ethics",
        "Spanish_Language": null,
        "Salary_Min": null,
        "Salary_Max": null,
        "Years_Experience": null,
        "Skills_Mentioned": [
            "analytical",
            "written communication",
            "oral communication",
            "government ethics",
            "ethics counseling",
            "ethics training",
            "criminal law"
        ],
        "Cleaned_Text": "advice and education counsel washington dc the committee on ethics seeks an attorney for the position of counsel in the office of advice and education the committees advice and education counsels are responsible for providing a high volume of ethics advice education and training to members of congress and their staff through frequent telephone calls in person meetings and written work product this is a non partisan position which requires the ability to serve all members of congress equally and refrain from political or partisan activity candidates must possess outstanding analytical and written and oral communication skills as well as the sound judgment necessary to evaluate the sensitive matters that arise before the committee experience in one or more of the following areas is desirable government ethics ethics counseling and training and criminal law salary commensurate with experience please email resume cover letter and short writing sample to ethicsjobsmailhousegov please include the phrase ae counsel in the subject line"
    },
    {
        "Post_ID": "MEM-115-21",
        "Posting_Author": "Congresswoman Linda Sánchez",
        "Congress_Number": null,
        "1 if Democrat": null,
        "1 if woman": 1,
        "DW-NOMINATE": null,
        "LES": null,
        "Date_Posted": "2021-05-10",
        "State_District": "CA-38",
        "Job_Function": "District",
        "Title_Parsed": "Caseworker",
        "Office_Type": "District",
        "Committee_Affiliation": null,
        "Spanish_Language": null,
        "Salary_Min": null,
        "Salary_Max": null,
        "Years_Experience": null,
        "Skills_Mentioned": [
            "customer service",
            "written communication",
            "communication",
            "analytical",
            "organizational",
            "public speaking",
            "microsoft word",
            "excel",
            "outlook",
            "publisher",
            "power point"
        ],
        "Cleaned_Text": "The District office of Congresswoman Linda Sánchez seeks an attentive,\ncommunity focused, self-starter to serve as a Caseworker based in Norwalk, CA.\nSummary: This position primarily entails constituent casework. Other\nresponsibilities include answering phones, greeting constituents and visitors,\nwriting correspondence, and assisting the District Office staff with additional\ntasks.\nPosition Description\nCaseworker: Casework responsibilities involve assisting constituents of the 38th\nCongressional District resolve problems with federal agencies or find the\nappropriate state or local contact for non-federal issues. The candidate should be\npersistent and detail-orientated, and put a priority on facilitating resolutions and\nexpediting priority requests. Knowledge of federal and California state\ngovernment agencies and experience in customer service will be highly regarded.\nMinimum Qualifications/Education Required\n*Bachelor’s Degree from an accredited four-year college or university.\n*Thorough understanding or experience with government agencies (county, state,\nand federal), community and grassroots organizing.\n*Strong written, communication, analytical, and organizational skills; an ability\nto relate well with individuals of diverse backgrounds; impeccable customer\nservice manners; and superior public speaking skills.\n*Skilled in Microsoft Word, Excel, Outlook, Publisher and Power Point.\n*Able to work efficiently and effectively as a member of a team, be able to meet\nstrict deadlines, balance multiple projects simultaneously, and work under\npressure.\n*Positive attitude, commitment to excellence, upbeat demeanor, flexibility, and\nsense of humor.\n*Enjoy working with the public and constituents.\nSalary will depend on the experience of the applicant. Employees will receive\nhealth care insurance, 401(k)-style retirement benefits, and other federal\nemployee benefits.\nTo Apply\nInterested applicants should submit a resume, cover letter, writing sample, and\nreferences by email to: CA38Jobs@mail.house.gov. Please indicate the title of\nthe position in the subject line.\nThe Office of the Honorable Linda Sánchez is an equal opportunity employer. All\napplicants will be considered without regard to race, color, national origin,\nreligion, sex (including marital or parental status), military status, disability, or\nage. Pursuant to current appropriations law, to be employed by a House office in\na paid position in the continental United States an individual must: (a) be a U.S.\ncitizen; (b) be lawfully admitted for permanent residence and seeking citizenship\nas outlined in 8 U.S.C. § 1324b(a)(3)(B); (c) be admitted as a refugee under 8\nU.S.C. § 1157 or granted asylum under 8 U.S.C. § 1158, and have filed a\ndeclaration of intention to become a lawful permanent resident and then a citizen\nwhen eligible; or\n(d) owe allegiance to the U.S. (i.e., qualify as a non-citizen U.S. national under\nfederal law). Employment is at-will."
    }
]