[
    {
        "Post_ID": "MEM-003-18",
        "Posting_Author": "Congressman Ted Lieu",
        "Congress_Number": null,
        "1 if Democrat": 1,
        "1 if woman": 0,
        "DW-NOMINATE": null,
        "LES": null,
        "Date_Posted": "2018-03-01",
        "State_District": "CA-33",
        "Job_Function": "Casework",
        "Title_Parsed": "Caseworker",
        "Office_Type": "District Office",
        "Committee_Affiliation": null,
        "Spanish_Language": true,
        "Salary_Min": null,
        "Salary_Max": null,
        "Years_Experience": 1,
        "Skills_Mentioned": [
            "federal casework",
            "writing",
            "verbal communication",
            "community outreach"
        ],
        "Cleaned_Text": "Congressman Ted Lieu has an immediate opening for a Caseworker in his Los Angeles District Office. Primary responsibilities include assisting constituents with federal casework, assisting the Casework Supervisor with casework outreach, intake and processing. The Caseworker would also attend community events and conduct casework outreach directly with constituents. Caseworkers meet frequently with constituents and liaise with federal agencies, and help organize outreach events for the Congressman’s office. The successful applicant should have experience working on federal casework, must have a positive attitude and the ability to work and set priorities in a fast-paced and challenging environment. Strong writing and verbal communications skills are essential. At least one year of experience working for an elected official or community-based organization is strongly preferred. A valid California Driver License and automobile are required. Bilingual skills are a plus. The position is full-time with federal benefits. Congressman Lieu’s primary district office is located in Central Los Angeles. If interested, please send a resume, cover letter, and two short writing samples no later than January 15, 2018 to: NICOLAS RODRIQUEZ District Director Congressman Ted Lieu (CA-33) 5055 Wilshire Blvd., Suite 310 Los Angeles, CA 90036 Lieu.Staff@mail.house.gov"
    },
    {
        "Post_ID": "MEM-001-18",
        "Posting_Author": "Texas Democrat",
        "Congress_Number": null,
        "1 if Democrat": 1,
        "1 if woman": null,
        "DW-NOMINATE": null,
        "LES": null,
        "Date_Posted": "2018-03-01",
        "State_District": "TX",
        "Job_Function": "Communications",
        "Title_Parsed": "Director",
        "Office_Type": "Member",
        "Committee_Affiliation": null,
        "Spanish_Language": null,
        "Salary_Min": null,
        "Salary_Max": null,
        "Years_Experience": null,
        "Skills_Mentioned": [
            "writing",
            "social media",
            "media",
            "community outreach"
        ],
        "Cleaned_Text": "Texas Democrat is seeking an experienced Communications Director to plan and execute a proactive and aggressive media and community outreach strategy. Candidates should have excellent writing skills and work well in a fast-paced collaborative environment. Applicant should also have an extensive social media background. Texas ties and knowledge of TX media and political landscape are a plus and management experience is preferred. This is not an entry-level position. Qualified applicants should submit a resume, cover letter, and two writing samples, including a press release to TXResumeInbox@mail.house.gov."
    },
    {
        "Post_ID": "MEM-512-17",
        "Posting_Author": "Senior Democratic House member and Committee Ranking Member",
        "Congress_Number": null,
        "1 if Democrat": 1,
        "1 if woman": null,
        "DW-NOMINATE": null,
        "LES": null,
        "Date_Posted": "2018-03-01",
        "State_District": null,
        "Job_Function": "Legislative",
        "Title_Parsed": "Legislative Director",
        "Office_Type": "House",
        "Committee_Affiliation": null,
        "Spanish_Language": null,
        "Salary_Min": null,
        "Salary_Max": null,
        "Years_Experience": null,
        "Skills_Mentioned": [
            "policy development",
            "legislative initiatives",
            "legislative planning",
            "communication skills",
            "time-management skills",
            "analyze",
            "summarize",
            "health policy"
        ],
        "Cleaned_Text": "Senior Democratic House member and Committee Ranking Member seeks\nLegislative Director. Primary responsibilities include developing policy and\nlegislative initiatives and advising Member on all legislative issues. Position\nwill manage long-term and short-term legislative planning; monitor legislative\nactivity on the House floor; supervise all legislative staff in the personal\noffice; ensure effective coordination between the personal office and\ncommittee office; and assist with hearing preparation as needed. Position will\nalso manage health policy portfolio. The successful candidate will be a\nresults-oriented problem solver and have a proven track record of developing\nand advancing legislation. Excellent oral and written communication skills,\ntime-management skills, and the ability to quickly analyze and summarize\ncomplex legislative details are essential. Advanced degree and extensive\nexperience on Capitol Hill are required. To apply, please e-mail a cover letter\nand resume with the words “Legislative Director” in the subject line to\njob_09@live.com. Please paste the cover letter and resume directly in the\nbody of the email."
    },
    {
        "Post_ID": "MEM-511-17",
        "Posting_Author": "Committee on Natural Resources’ Subcommittee on Oversight and Investigations",
        "Congress_Number": null,
        "1 if Democrat": null,
        "1 if woman": null,
        "DW-NOMINATE": null,
        "LES": null,
        "Date_Posted": "2018-03-01",
        "State_District": null,
        "Job_Function": "Clerk",
        "Title_Parsed": "Clerk",
        "Office_Type": "Committee",
        "Committee_Affiliation": "Natural Resources",
        "Spanish_Language": null,
        "Salary_Min": null,
        "Salary_Max": null,
        "Years_Experience": null,
        "Skills_Mentioned": [
            "investigations",
            "natural resources",
            "administrative",
            "oversight"
        ],
        "Cleaned_Text": "The Committee on Natural Resources’ Subcommittee on Oversight and Investigations is seeking to fill a Clerk position on the majority staff. The ideal candidate should have a strong interest in investigations and natural resources issues. Some responsibilities include staffing Subcommittee hearings as well as some Full Committee hearings, sending and receiving Subcommittee correspondence to and from the Executive Branch as well as with outside organizations, and managing the Subcommittee’s administrative needs. Candidates must possess a strong work ethic, attention to detail, desire to learn how to conduct congressional oversight and investigations, and be self-motivated. Prior Hill experience preferred, but not required. Interested candidates should send a resume and cover letter to NaturalResources.Jobs@mail.house.gov, with “O&I Clerk” in the subject line."
    },
    {
        "Post_ID": "MEM-508-17",
        "Posting_Author": "U.S. Rep. Lloyd Doggett",
        "Congress_Number": null,
        "1 if Democrat": 1,
        "1 if woman": null,
        "DW-NOMINATE": null,
        "LES": null,
        "Date_Posted": "2018-03-02",
        "State_District": "Texas",
        "Job_Function": "Office Staff",
        "Title_Parsed": "Staff Assistant",
        "Office_Type": "Personal",
        "Committee_Affiliation": null,
        "Spanish_Language": true,
        "Salary_Min": null,
        "Salary_Max": null,
        "Years_Experience": null,
        "Skills_Mentioned": [
            "written communication",
            "oral communication"
        ],
        "Cleaned_Text": "U.S. Rep. Lloyd Doggett (D-Texas) seeks a staff assistant for his\nWashington office. Excellent written and oral communication skills\nrequired. Texas connection and Spanish ability a plus. Send resume, brief\nwriting sample, and three references to DoggettJobs@mail.house.gov. Use\ntitle on your email: Staff Assistant Application. No drop-ins please."
    },
    {
        "Post_ID": "MEM-507-17",
        "Posting_Author": "U.S. Rep. Lloyd Doggett",
        "Congress_Number": null,
        "1 if Democrat": 1,
        "1 if woman": 0,
        "DW-NOMINATE": null,
        "LES": null,
        "Date_Posted": "2018-03-02",
        "State_District": "Texas",
        "Job_Function": "Legislative",
        "Title_Parsed": "Senior Legislative Aide",
        "Office_Type": "Member",
        "Committee_Affiliation": null,
        "Spanish_Language": 1,
        "Salary_Min": null,
        "Salary_Max": null,
        "Years_Experience": 3,
        "Skills_Mentioned": [
            "written communication",
            "oral communication"
        ],
        "Cleaned_Text": "U.S. Rep. Lloyd Doggett (D-Texas) seeks a senior legislative aide with a minimum of three years of Hill experience. This is not an entry level position. Excellent written and oral communication skills required. Advanced degree a plus. Spanish ability a plus. Send resume, brief writing sample, and three references to DoggettJobs@mail.house.gov. Use title on your email: Senior LA Position. No drop-ins please."
    },
    {
        "Post_ID": "MEM-490-17",
        "Posting_Author": "Committee on Ethics",
        "Congress_Number": null,
        "1 if Democrat": null,
        "1 if woman": null,
        "DW-NOMINATE": null,
        "LES": null,
        "Date_Posted": "2018-03-01",
        "State_District": null,
        "Job_Function": "Legal",
        "Title_Parsed": "Investigative Counsel",
        "Office_Type": "Committee",
        "Committee_Affiliation": "Ethics",
        "Spanish_Language": null,
        "Salary_Min": null,
        "Salary_Max": null,
        "Years_Experience": null,
        "Skills_Mentioned": [
            "analytical",
            "written communication",
            "oral communication",
            "government ethics",
            "criminal law",
            "employment law",
            "sexual harassment",
            "civil litigation",
            "administrative investigations",
            "adjudications",
            "depositions",
            "financial accounting"
        ],
        "Cleaned_Text": "Investigative Counsel (Washington, DC) -- The Committee on Ethics seeks\nan attorney for an investigative counsel position. The Committee’s\ninvestigative counsels are responsible for conducting investigations and\nadjudicatory and disciplinary proceedings regarding Members and staff of the\nU.S. House of Representatives. This is a nonpartisan position which requires\nthe ability to conduct impartial investigations and refrain from political or\npartisan activity. Candidates must possess outstanding analytical and\nwritten/oral communications skills, as well as the sound judgment necessary\nto evaluate the sensitive matters that arise before the Committee. Experience\nin one or more of the following areas is desirable: government ethics; criminal\nlaw; employment law, including the laws governing sexual harassment in the\nworkplace; civil litigation; administrative investigations and adjudications;\ndepositions; and financial accounting. Salary commensurate with experience.\nPage 3 of 5\n\nPlease email resume, cover letter, and short writing sample to\nethicsjobs@mail.house.gov. Please include the phrase “Investigative\nCounsel” in the subject line."
    },
    {
        "Post_ID": "MEM-489-17",
        "Posting_Author": null,
        "Congress_Number": null,
        "1 if Democrat": null,
        "1 if woman": null,
        "DW-NOMINATE": null,
        "LES": null,
        "Date_Posted": "2018-03-01",
        "State_District": null,
        "Job_Function": "Legislative",
        "Title_Parsed": "Legislative Assistant",
        "Office_Type": "Member",
        "Committee_Affiliation": "Appropriations",
        "Spanish_Language": null,
        "Salary_Min": null,
        "Salary_Max": null,
        "Years_Experience": null,
        "Skills_Mentioned": [
            "appropriations",
            "budget",
            "tax policy"
        ],
        "Cleaned_Text": "senior active member of appropriations committee seeks hard working and experienced legislative assistant to handle health issues including appropriations budget and tax policy experience working on the hill is essential and related policy experience is preferred please send cover letter resume writing sample and salary requirements to ct03laopening@gmailcom"
    },
    {
        "Post_ID": "MEM-479-17",
        "Posting_Author": "Virginia Republican House member",
        "Congress_Number": null,
        "1 if Democrat": 0,
        "1 if woman": 0,
        "DW-NOMINATE": null,
        "LES": null,
        "Date_Posted": "2018-03-01",
        "State_District": "VA-null",
        "Job_Function": "Legislative",
        "Title_Parsed": "Assistant",
        "Office_Type": "House",
        "Committee_Affiliation": null,
        "Spanish_Language": null,
        "Salary_Min": null,
        "Salary_Max": null,
        "Years_Experience": 2,
        "Skills_Mentioned": [
            "writing",
            "editing",
            "policy",
            "legislation"
        ],
        "Cleaned_Text": "Virginia Republican House member is seeking an experienced Legislative\nAssistant to handle a diverse issue portfolio, including committee work.\nSuccessful applicants will be a creative thinker with exceptional writing and\nediting skills, and a willingness working in a fast-moving team environment.\nDuties include tracking bills and legislative developments; developing policy\nrecommendations on legislation and creative ideas for new legislation;\npreparing the Congressman for hearings, floor activities, and events in the\ndistrict; tracking regulatory changes and advising the communications team\non policy for messaging; and reviewing constituent correspondence. This\nposition requires regular interface with Federal agencies, issue advocates, and\nconstituents.\nQualifications: Minimum two years experience in a legislative role in a\nHouse/Senate office, Bachelor’s degree. Salary is commensurate with\nexperience. EOE. No calls or drop-in applications will be accepted.\nTo Apply: Interested applicants should send a resume, cover letter, and 3\nwriting samples in .pdf format to: VirginiaLegislativeAssistant@gmail.com."
    },
    {
        "Post_ID": "MEM-316-17",
        "Posting_Author": "Ranking Member Elijah Cummings",
        "Congress_Number": null,
        "1 if Democrat": 1,
        "1 if woman": null,
        "DW-NOMINATE": null,
        "LES": null,
        "Date_Posted": "2018-03-01",
        "State_District": null,
        "Job_Function": "Legal",
        "Title_Parsed": "Counsel",
        "Office_Type": "Committee",
        "Committee_Affiliation": "Oversight and Government Reform",
        "Spanish_Language": null,
        "Salary_Min": null,
        "Salary_Max": null,
        "Years_Experience": 5,
        "Skills_Mentioned": [
            "investigations",
            "depositions",
            "transcribed interviews",
            "briefings",
            "congressional hearings",
            "attention to detail",
            "written communication skills",
            "oral communication skills"
        ],
        "Cleaned_Text": "The Committee on Oversight and Government Reform is the principal investigative body for the U.S. House of Representatives, and Ranking Member Elijah Cummings seeks to fill a Counsel position on the Democratic staff. The ideal candidate will be a junior attorney (fewer than five years of experience) with a background or strong interest in investigations. Responsibilities include depositions, transcribed interviews, briefings, and congressional hearings. Candidates with diverse backgrounds and experiences are strongly encouraged to apply. Candidates must have superior attention to detail, work well under pressure, be self-motivated, and possess excellent written and oral communication skills. Please send a resume and cover letter to oversightjobs@mail.house.gov, with “Counsel” in the subject line."
    }
]