[
    {
        "Post_ID": "MEM-197-15",
        "Posting_Author": "Rep. Keith Ellison",
        "Congress_Number": null,
        "1 if Democrat": 1,
        "1 if woman": 0,
        "DW-NOMINATE": null,
        "LES": null,
        "Date_Posted": "2015-07-27",
        "State_District": "MN-05",
        "Job_Function": "Executive Assistant/Office Manager",
        "Title_Parsed": "Executive Assistant/Office Manager",
        "Office_Type": "Member",
        "Committee_Affiliation": null,
        "Spanish_Language": 0,
        "Salary_Min": null,
        "Salary_Max": null,
        "Years_Experience": null,
        "Skills_Mentioned": [
            "administrative",
            "written communication",
            "oral communication",
            "organizational",
            "attention to detail"
        ],
        "Cleaned_Text": "Rep. Keith Ellison (MN-05) is accepting applications for an Executive\nAssistant/Office Manager position. The Executive Assistant/Office\nManager will manage and prepare the Member’s schedule, respond to all\nscheduling requests, arrange the Member’s travel, and provide and assist with\nlocal travel. The Executive Assistant/Office Manager will order and maintain\noffice supplies, will maintain office personnel files, and will work closely\nwith the staff assistant and interns. This position requires candidates with\nproven experience in administrative roles, knowledge of the Congressional\nwork setting, and comfort working one-on-one with the Member and his\nChief of Staff. Strong written and oral communication skills, superior\norganizational skills, attention to detail, ability to work in an extremely fast\npaced office, and flexibility to work late hours on short notice\nare necessary for the position. Owning or having consistent access to a car is\nrequired. This is not an entry level position. Minnesota ties a plus.\nPlease send resume, cover letter, and writing sample\nto mn05position@mail.house.gov. Please include references."
    },
    {
        "Post_ID": "MEM-192-15",
        "Posting_Author": null,
        "Congress_Number": null,
        "1 if Democrat": null,
        "1 if woman": null,
        "DW-NOMINATE": null,
        "LES": null,
        "Date_Posted": "2015-07-27",
        "State_District": null,
        "Job_Function": "Staff",
        "Title_Parsed": "Assistant",
        "Office_Type": "House",
        "Committee_Affiliation": null,
        "Spanish_Language": null,
        "Salary_Min": null,
        "Salary_Max": null,
        "Years_Experience": null,
        "Skills_Mentioned": [
            "administrative",
            "well-organized",
            "detail-oriented",
            "team player",
            "scheduling",
            "legislative tracking",
            "proof reading",
            "writing",
            "computer skills"
        ],
        "Cleaned_Text": "Republican Committee in the House of Representatives seeks Staff Assistant with strong administrative skills and interest in workforce policy. Must be well-organized, detail-oriented, and a team player. Responsibilities include office administration, scheduling, legislative tracking, and other administrative projects as assigned. Excellent proof reading, writing, and computer skills required. Please send resumes to edandlresumes@mail.house.gov."
    },
    {
        "Post_ID": "MEM-191-15",
        "Posting_Author": null,
        "Congress_Number": null,
        "1 if Democrat": null,
        "1 if woman": null,
        "DW-NOMINATE": null,
        "LES": null,
        "Date_Posted": "2015-07-27",
        "State_District": null,
        "Job_Function": "Legal",
        "Title_Parsed": "Professional Staff Member",
        "Office_Type": "House",
        "Committee_Affiliation": null,
        "Spanish_Language": null,
        "Salary_Min": null,
        "Salary_Max": null,
        "Years_Experience": null,
        "Skills_Mentioned": [
            "writing",
            "research"
        ],
        "Cleaned_Text": "Republican Committee in the House of Representatives seeks Professional\nStaff Member with background in workplace and employment law, with\nparticular emphasis on traditional labor law, including the National Labor\nRelations Act. Law degree and congressional experience desired. Good\nwriting and research skills necessary.\nPlease send resumes to edandlresumes@mail.house.gov."
    },
    {
        "Post_ID": "MEM-188-15",
        "Posting_Author": "Committee on Ethics",
        "Congress_Number": null,
        "1 if Democrat": null,
        "1 if woman": null,
        "DW-NOMINATE": null,
        "LES": null,
        "Date_Posted": "2015-07-27",
        "State_District": null,
        "Job_Function": "Administrative",
        "Title_Parsed": "Staff Assistant",
        "Office_Type": "Committee",
        "Committee_Affiliation": "Ethics",
        "Spanish_Language": null,
        "Salary_Min": null,
        "Salary_Max": null,
        "Years_Experience": null,
        "Skills_Mentioned": [
            "organizational skills",
            "computer skills",
            "Microsoft Word",
            "Excel",
            "data entry",
            "telephone manner"
        ],
        "Cleaned_Text": "Committee on Ethics has an opening for a Staff Assistant. Duties include: answering telephones; assisting with the tracking and processing of committee correspondence; providing administrative support in setting up committee meetings; and entering data and navigating databases with accuracy. This is a non-partisan position which requires the ability to serve all Members of Congress equally and refrain from political or partisan activity. Applicants must have excellent organizational skills and a professional telephone manner; good computer skills; proficiency in Microsoft Word and Excel; ability to work cooperatively and courteously with others; ability to use good judgment in responding to inquiries and requests; and flexibility in assisting with daily tasks and projects. Please email cover letter and resume with “Staff Assistant” in the subject line to ethicsjobs@mail.house.gov. NO PHONE CALLS PLEASE."
    },
    {
        "Post_ID": "MEM-172-15",
        "Posting_Author": "Active Democrat House Members",
        "Congress_Number": null,
        "1 if Democrat": 1,
        "1 if woman": null,
        "DW-NOMINATE": null,
        "LES": null,
        "Date_Posted": "2015-07-27",
        "State_District": null,
        "Job_Function": "Communications",
        "Title_Parsed": "Director",
        "Office_Type": "House",
        "Committee_Affiliation": null,
        "Spanish_Language": null,
        "Salary_Min": null,
        "Salary_Max": null,
        "Years_Experience": null,
        "Skills_Mentioned": [
            "media",
            "press operations",
            "communication strategy",
            "press releases",
            "op-eds",
            "talking points",
            "media events",
            "writing",
            "outreach",
            "reporting"
        ],
        "Cleaned_Text": "Active Democrat House Members seeks experienced, media savvy Communications Director to run aggressive press operation in fast-paced office. Duties include: managing day-to-day press operations in D.C. and the district, developing communication strategy, drafting press releases, op-eds, talking points and other content, overseeing and planning media events, preparing member, developing relationships with local and national reporters, and working in conjunction with outreach director and district staff. Ideal candidate will have on-the-record experience and excellent writing skills. Hill or other political experience/California ties a plus. Please send resume, cover letter, and two writing samples to jo.th@mail.house.gov. Please, no walk-ins or phone calls."
    },
    {
        "Post_ID": "MEM-165-15",
        "Posting_Author": "Congressman Xavier Becerra",
        "Congress_Number": null,
        "1 if Democrat": 1,
        "1 if woman": 0,
        "DW-NOMINATE": null,
        "LES": null,
        "Date_Posted": "2015-07-27",
        "State_District": null,
        "Job_Function": "Field",
        "Title_Parsed": "Deputy",
        "Office_Type": "District",
        "Committee_Affiliation": null,
        "Spanish_Language": null,
        "Salary_Min": null,
        "Salary_Max": null,
        "Years_Experience": 2,
        "Skills_Mentioned": [
            "written communication",
            "analytical",
            "organization",
            "customer service",
            "public speaking",
            "computer skills",
            "Microsoft Word",
            "Excel",
            "Outlook",
            "Publisher",
            "Power Point",
            "teamwork",
            "meet deadlines",
            "balance multiple projects",
            "attention to detail"
        ],
        "Cleaned_Text": "MEM-165-15\n\nCongressman Xavier Becerra is seeking to immediately fill a full-time job\nopening for a Field Deputy position in his district office. The Field Deputy\nserves as the congressman’s liaison with the community, local organizations\nand government agencies; staff and/or represent the congressman at events;\nadvise the congressman about local issues; help organize community based\nmeetings and events; implement proactive constituent outreach program;\nprepare Member for speeches and meetings; draft correspondence. This\nposition requires work hours beyond the normal 8-hour work day and will\ninclude work on weekends and holidays.\nQualifications:\nStrong written, communication, analytical, and organization skills; an ability\nto relate well with individuals of diverse backgrounds; impeccable customer\nservice manners; and superior public speaking skills.\nMinimum two (2) years of experience working directly with the community at\nlarge. Knowledge of the Asian Pacific Islander communities a plus.\nGood computer skills, including proficiency and experience with Microsoft\nWord, Excel, Outlook, Publisher and Power Point.\nBachelor’s degree required.\nCandidate must have a thorough understanding of government agencies and\nstructure (local, county, state and federal).\nMust be able to work efficiently and effectively as a member of a team, be\nable to meet strict deadlines, balance multiple projects simultaneously and\nwork under pressure. Attention to detail and accuracy is essential.\nCandidate should demonstrate a positive attitude, commitment to excellence,\n\nPage 3 of 8\n\n\nupbeat demeanor and flexibility.\nCandidate should expect weekend, some holidays, and after-hours\nassignments.\nSalary will depend on the experience of the applicant.\nBilingual skills a plus.\nTo apply: All interested individuals should email a cover letter, resume and\nsalary history to Resume.California@mail.house.gov. No phone calls please."
    },
    {
        "Post_ID": "MEM-155-15",
        "Posting_Author": "California Republican",
        "Congress_Number": null,
        "1 if Democrat": null,
        "1 if woman": null,
        "DW-NOMINATE": null,
        "LES": null,
        "Date_Posted": "2015-07-27",
        "State_District": "CA",
        "Job_Function": "Legislative",
        "Title_Parsed": "Assistant",
        "Office_Type": "Member",
        "Committee_Affiliation": null,
        "Spanish_Language": null,
        "Salary_Min": null,
        "Salary_Max": null,
        "Years_Experience": null,
        "Skills_Mentioned": [
            "writing",
            "communication"
        ],
        "Cleaned_Text": "California Republican seeks Legislative Assistant to handle a diverse portfolio of issues. Duties will include tracking legislation and other developments to brief the Member on floor votes and pending legislative matters, developing and implementing policy initiatives in line with office goals, meeting with constituents and other interest groups, and coordinating with DC and district staff regarding legislation, messaging, and events. Qualified candidates must be proactive and hard working with exceptional writing and communication skills and the ability to work effectively in a fast paced environment. Legislative experience required. Knowledge of the Appropriations process and California ties are a plus. Please email resume and cover letter to carepublicanjobs@gmail.com."
    },
    {
        "Post_ID": "MEM-153-15",
        "Posting_Author": "Established Member of Congress",
        "Congress_Number": null,
        "1 if Democrat": null,
        "1 if woman": null,
        "DW-NOMINATE": null,
        "LES": null,
        "Date_Posted": "2015-07-27",
        "State_District": "southeastern US",
        "Job_Function": "Legislative",
        "Title_Parsed": "Director",
        "Office_Type": "Member",
        "Committee_Affiliation": null,
        "Spanish_Language": null,
        "Salary_Min": null,
        "Salary_Max": null,
        "Years_Experience": null,
        "Skills_Mentioned": [
            "House procedures",
            "policy matters",
            "team-oriented",
            "attention to detail"
        ],
        "Cleaned_Text": "Established Member of Congress from the southeastern US seeks an experienced staffer for a Legislative Director position. Only current/previous Legislative Directors or Senior Legislative Assistants with experience will be considered. LD will be responsible for driving member legislative initiatives, briefing the member on all policy matters, meeting with relevant public interest groups and constituents, providing real time vote recommendations, and assisting the Chief of Staff on policy matters. Position requires a comprehensive knowledge of House procedures as well as a working knowledge of all current issues debated in the House. Teamoriented skill, outgoing personality, and attention to detail are requirements and staff members with ties to the southeast will be given special consideration. Please send a cover letter, resume, and salary requirements to USHouseStaffJob@gmail.com."
    },
    {
        "Post_ID": "MEM-151-15",
        "Posting_Author": "House Democrat",
        "Congress_Number": null,
        "1 if Democrat": 1,
        "1 if woman": null,
        "DW-NOMINATE": null,
        "LES": null,
        "Date_Posted": "2015-07-27",
        "State_District": null,
        "Job_Function": "Legislative",
        "Title_Parsed": "Assistant",
        "Office_Type": "House",
        "Committee_Affiliation": "Transportation and Infrastructure",
        "Spanish_Language": null,
        "Salary_Min": null,
        "Salary_Max": null,
        "Years_Experience": null,
        "Skills_Mentioned": [
            "legislative initiatives",
            "briefing materials",
            "constituent correspondence",
            "floor statements",
            "communication",
            "stakeholder relationships",
            "writing",
            "verbal communication",
            "judgment",
            "proactive",
            "resourceful"
        ],
        "Cleaned_Text": "House Democrat seeks Legislative Assistant to handle a diverse portfolio of policy issues with a primary focus on legislation before the Transportation and Infrastructure Committee. Responsibilities include developing and advancing legislative initiatives, preparing briefing materials, drafting constituent correspondence and floor statements, coordinating with the communications team and district staff on messaging and events, as well as building and maintaining stakeholder relationships. Candidate must be a strong and effective writer with excellent verbal communication skills. Good judgment and the ability to be proactive, resourceful and thrive in a fast-paced environment are essential. Previous congressional experience is required. This is not an entry level position. Candidates should have a demonstrable background in transportation policy. Email resume and cover letter to hire@mail.house.gov. No calls or walk-ins, please."
    },
    {
        "Post_ID": "MEM-147-15",
        "Posting_Author": "A North Carolina Democrat",
        "Congress_Number": null,
        "1 if Democrat": 1,
        "1 if woman": 1,
        "DW-NOMINATE": null,
        "LES": null,
        "Date_Posted": "2015-07-27",
        "State_District": "NC",
        "Job_Function": "Administrative",
        "Title_Parsed": "Scheduler",
        "Office_Type": "Member",
        "Committee_Affiliation": null,
        "Spanish_Language": null,
        "Salary_Min": null,
        "Salary_Max": null,
        "Years_Experience": null,
        "Skills_Mentioned": [
            "organized",
            "detail oriented",
            "self-motivated",
            "adaptable",
            "problem solving",
            "multitasking",
            "calendar management",
            "travel arrangements"
        ],
        "Cleaned_Text": "A North Carolina Democrat seeks a scheduler to serve in her Washington, D.C. office. Responsibilities include but are not limited to managing the Member’s D.C. calendar, District calendar, coordinating logistics and travel arrangements, and overseeing administrative work for the Member. Must be highly organized, detail oriented, self-motivated, have the ability to adapt to changing circumstances, creatively solve problems and be comfortable multitasking in a fast-paced environment while displaying a friendly, professional attitude. North Carolina ties are preferred but not required. Women and minorities are encouraged to apply. Please send a resume and cover letter to nchousejobs@gmail.com. No calls or drop-ins please."
    },
    {
        "Post_ID": "MEM-146-15",
        "Posting_Author": null,
        "Congress_Number": null,
        "1 if Democrat": null,
        "1 if woman": null,
        "DW-NOMINATE": null,
        "LES": null,
        "Date_Posted": "2015-07-27",
        "State_District": "CA02",
        "Job_Function": "District Office",
        "Title_Parsed": "Field Representative/Caseworker",
        "Office_Type": "District",
        "Committee_Affiliation": null,
        "Spanish_Language": null,
        "Salary_Min": null,
        "Salary_Max": null,
        "Years_Experience": null,
        "Skills_Mentioned": [
            "communication skills",
            "knowledge of local, state and federal agencies",
            "ability to work cooperatively",
            "tactful",
            "attention to detail",
            "discretion",
            "independent judgment",
            "knowledge of office policies",
            "practices",
            "procedures",
            "computer applications"
        ],
        "Cleaned_Text": "The District Office Field Representative/Caseworker monitors and updates\nthe Congressman and District Director on district and local issues. This\nposition acts as a liaison to federal, district, and local agencies for the\nCongressman and constituents and answers casework correspondence and\nverbal communications with constituents.\nESSENTIAL JOB FUNCTIONS:\nActs as the representative for the Congressman within his or her area of\nresponsibility including answering casework correspondence, meeting with\nconstituents, verbal communications with constituents, and serving as a\nliaison with federal, district, and local agencies;\nInforms the Congressman and the District Director of all happenings in his or\nher assigned issue areas by screening district media sources and interacting\nwith constituents;\nHandles casework assignments;\nActs as a liaison to local, state and federal officials and other persons or\ngroups to form effective relationships for the Congressman;\nAssesses casework for problems requiring legislative action and makes\nrecommendations to the District Director and Scheduler;\nMonitors scheduled district meetings for the Congressman with constituents;\nWorks well under pressure and handles stress;\nWorks a flexible schedule including long hours, nights and weekends; and\nPerforms other duties as assigned.\nEDUCATION (OR EQUIVALENT EXPERIENCE):\nFull-time experience preferred; strong academic credentials required;\nextensive community relationships desired.\nSKILLS AND KNOWLEDGE REQUIRED:\nStrong oral and written communication skills;\nThorough knowledge of local, state and federal agencies and departments;\nKnowledge of all issues and events in the district in which the Congressman\nis involved;\nAbility to work cooperatively and courteously with others;\nTemperament to communicate with a variety of personalities in a tactful,\npleasant, and professional manner;\nThoroughness and careful attention to detail;\nAbility to exercise discretion and independent judgment in fulfillment of\ncasework responsibilities;\nKnowledge of office policies, practices, procedures, and computer\napplications.\nWORKING CONDITIONS:\nWork is mainly performed in an office environment, but the Field\nRepresentative will often need to attend and participate in meetings and\npublic functions out of the office including evenings and weekend events.\nPage 6 of 8\n\n\nNoise levels are usually moderate; and\nAbility to work in a small work station without an expectation of privacy.\nE-mail a resume and cover letter to CA02.Requests@mail.house.gov with the\nsubject line “CA02 Field Representative/Caseworker.”"
    },
    {
        "Post_ID": "MEM-143-15",
        "Posting_Author": "Senior California Democrat",
        "Congress_Number": null,
        "1 if Democrat": 1,
        "1 if woman": null,
        "DW-NOMINATE": null,
        "LES": null,
        "Date_Posted": "2015-07-27",
        "State_District": "CA",
        "Job_Function": "Legislative",
        "Title_Parsed": "Assistant",
        "Office_Type": "Member",
        "Committee_Affiliation": "Financial Services",
        "Spanish_Language": null,
        "Salary_Min": null,
        "Salary_Max": null,
        "Years_Experience": null,
        "Skills_Mentioned": [
            "writing",
            "oral communication",
            "legislative process"
        ],
        "Cleaned_Text": "senior california democrat seeks legislative assistant, or senior legislative assistant depending on qualifications, to handle work on the financial services committee. candidates should have substantial experience with financial services issues and substantial congressional experience. the successful applicant will possess strong writing and oral communication skills, work well with others, be comfortable in a fast-paced environment, and understand the legislative process. to apply, please e-mail a cover letter, resume, and three writing samples to housefinancialservicesla@gmail.com. no phone calls or drop-ins please."
    },
    {
        "Post_ID": "MEM-141-15",
        "Posting_Author": "Republican Member",
        "Congress_Number": null,
        "1 if Democrat": null,
        "1 if woman": null,
        "DW-NOMINATE": null,
        "LES": null,
        "Date_Posted": "2015-07-27",
        "State_District": "TN",
        "Job_Function": "Legislative",
        "Title_Parsed": "Assistant",
        "Office_Type": "Member",
        "Committee_Affiliation": null,
        "Spanish_Language": null,
        "Salary_Min": null,
        "Salary_Max": null,
        "Years_Experience": null,
        "Skills_Mentioned": [
            "writing",
            "organizational",
            "healthcare",
            "education",
            "veterans’ affairs",
            "IQ"
        ],
        "Cleaned_Text": "Republican Member seeks a Legislative Assistant with strong Tennessee ties. Legislative duties will include briefing the Member on floor votes and other pending legislation. Preference will be given to those with expertise on issues involving healthcare, education and veterans’ affairs. Successful candidates must demonstrate exceptional writing ability, attention to detail, and organizational skills. Hill experience and familiarity with IQ are a plus. Send resume and cover letter to TNHousejob@gmail.com."
    },
    {
        "Post_ID": "MEM-140-15",
        "Posting_Author": "Congressman Juan Vargas",
        "Congress_Number": null,
        "1 if Democrat": null,
        "1 if woman": null,
        "DW-NOMINATE": null,
        "LES": null,
        "Date_Posted": "2015-07-27",
        "State_District": null,
        "Job_Function": "Field Representative/Caseworker",
        "Title_Parsed": "Field Representative/Caseworker",
        "Office_Type": "Member",
        "Committee_Affiliation": null,
        "Spanish_Language": true,
        "Salary_Min": null,
        "Salary_Max": null,
        "Years_Experience": null,
        "Skills_Mentioned": [
            "organized",
            "detail oriented",
            "communication skills",
            "interpersonal communication skills",
            "legislative",
            "written",
            "problem solving"
        ],
        "Cleaned_Text": "MEM-140-15\n\nThe Office of Congressman Juan Vargas is seeking a high energy, highlyorganized, and detail oriented Field Representative/Caseworker for his\nDistrict Office.\nPRIMARY RESPONSIBILITIES:\n• Serve as an official representative for the Member throughout communities\nin the District.\n• Act as liaison with federal, district, and local government agencies, political\nofficials, and other community organizations to form effective relationships\nfor the Member.\n• Monitor and update the Member and District Director on district and local\nissues of importance.\n• Staff and provide logistical support for scheduled district meetings and\nevents for the Member.\n• Assess local and casework related issues for problems requiring possible\nlegislative action; make recommendations to the District Director and Chief\nof Staff.\n• Answer casework correspondence and verbal communications with\nconstituents.\n• Provide casework assistance to constituents in a timely and efficient manner;\nproactively follow up on all open cases until a resolution is reached.\nPage 7 of 8\n\n\nQUALIFICATIONS:\n• A candidate with a background in and/or understanding of military/veteran\nissues.\n• Veterans, reservists, women, and minorities are strongly encouraged to\napply.\n• Ability to work non-traditional hours, including nights and weekends, if\nneeded.\n• Excellent written (English and Spanish) and interpersonal communication\nskills.\n• Ability to work with staff at all levels, work well under pressure and be\ndetail oriented.\n• Possess an understanding of the federal legislative process.\n• Ability to quickly learn about key issues and events in the district for which\nthe Member is involved.\n• A qualified applicant must be a U.S. Citizen, possess a valid California\ndriver’s license with the ability to travel as needed.\nTo apply, please email a resume and cover letter to CAJobs@mail.house.gov. "
    }
]